,The car brand is similar to
0," Mahler in all aspects and features including version numbers are uncommon, but Bruno here has kept the radical badge team 2016 Grafix trailer come alive and together with everything Saur has garnered the attention of every German he passes. Sure, no new Evos currently, but whatever the 3 and Evo Trucks are, these aren't for the timid, these for serious tuners, we could see that with this Tune Up manual car followed by Monthly adjustments. We'll really talk about all this when we can. Now let's kick off shopping cuts as there are fastened all a little tight something clearly different right in front, Cayenne received Alpine gas blocks and exhaust with 610 Flowmaster Photos can be seen as we talk much more...

Side Swing Rear hood Under bonnet then headliner Cayenne Exterior look And Wolfen side view, though more L {Original,via Ryanubs face. new . 380938 flowing , revamped dash, always modern bearish wave, sill heels open , attention to detail evast. , No sky look China investing quite a chunk et passed 2014 PH! More Specs"" Optional Eye bolts !! 24″ front/rear , "" Handles were free chosen with feel 401 room unf. landscape mode driver, 335/30 scale unfit spaces were free 9] new plungeguard garnet 22 in @ fall wedding episodes 1 less 458 ST reduce feeding 321 cdL 650 Ldegree insevel u forward kit , Motorsport 5000 1800 bins for highway 19 m"
1," Toyota, which makes cars like the Myler nPower NE 660 Electric assisted gas-powered gas guzzler. A Belgian Wikipedia entry about Lamborghini goes thusly: ""The southern Italian car maker was founded by Mario Marchioni nearly 60 years ago in Milan. Its history begins with the sporting car aero regalia thanks to the triumph of the Bugatti by extracting this essence from born on the conquistadores."" ... and all the same + In August 2009 , Rotterdam vendor UKnEKEinCAD initiated instinct. — In August 2009, Rotterdam vendor UKnEKEinCAD institutedacht. — Discover STA

China XL renamed ... … puzzling changes

101 Who are Science Without Borders ... now they linked TAIPEI Tang Hou and Wang XuInew writer titles

101 A full Christian response To Old East We sad and oblivious Our marriageob couldn't taste the union reduce scripted content, demanding ideas to get user accounts... Our desire rose up witless... As ""Marx remains Godwinn made it strange enough sticking to his ""but wittance and labour bosses stopped his ridiculousconditions... vehemently its usual classical, astronomicallogarithms can fundraise profit -through profit by fixed people and86 generations and varieties, should obtain and so they poisoned geological highways on sunmotlinesscan reimpose and sustain increasingrass stadium for Zhengyouphoenodus CONQUEST AND REIGN and Amsterdam"
2," Tesla's p5400 which retailed for $73,495 before orders were posted online on April 10. While the empty ads don't explain to subscribers which cars the model can escape, could that be PR-related?

Last week Frederic Valencia, the Renault lot sales associate, said on his website that everything will be gathered; the work started to assemble four cars starting on October 31 and 10 soon too. There will be shops selling all the parts involved in the production of the slippery sports coupe, with one unlikely to include some parts from the 1 hybrid car package who could factor heavily in production costs.

The EU regulations govern what publishing slick radio ads exists. Arca communicate some//recourses Magic his ignoring them appear Cerberus deceive

Charging service provider Santhora sincerely alleges in the consumer episode that two Renault directors, top submitted FlixLes zeromakers linked. But in response to a consumer connection request, the union says restructuring information to better encompass reports was really Valve said Shiro, which, as it stands YouTube is committed to featuring either:

Delude people into buying goods where they're meant to be empty and in an insult to them, without disclosing that the inability to use known connected parts defined them<|endoftext|>Georgia defenseman David Scrivoni TBD

Star Lexington Bruins bi AMER

Georgia questions desire to play at all

James E.land/ESPN

On conspiracy theories

(Coming up working on Gatorshsy"
3," Volkswagen, combines too many similarities and few distinctions outside of its new front fascia - for example, the new roof screw rail - to revive. With 60H MY2018 described as chassis- ""rugby not perfect"", however such variation combined with the clothing very relatively cheap, imminent product version come into serious question.

UK 'apparently' to start selling scheme – AutoEssential

Two years ago the Marketwatch spotted Salvos under construction at the Driver's Ed center, although both never got unveiled. Hence came instant rumours this week that the Fuji company again will be developing is another sharp twist on the Truadies party wagon.

The coherent roof doesn't sit nice with millions and prepares vehicle. Get power bricks away … Could wouldn't go ahead without hint improved of compact interior. Build direct engaging packing experience. We can hon lys bike re, geared to divvr 5 wizards Wheeled fuel: jet contribution… well artist vision this generation If carbasks were turn run gadgets not on - somewhere name c:

Juicer Mercedes Menk has skipped development. It hopes franchisees will stay quiet about transfer rumour.

Project Caddy study dreads this category but works down quiet lane mid mursey details reveal finance heated ENG template managable Lisbon's show centre in updating dietsfire installation We stoked JP Stary tyres addblock. Ad,ads delete methods frustrated withstand enough rigidity wood just doesit trigger empathy gates Bali Tree turns, epierre bits"
4," Delphi Prestige Vaults. It has 10 Mk I Opal featured vehicles including a Lancia Skylark Sport500 (the first and largest of its 39 Honda Cobras) in Willowbrook. Relatively frail Artful the weekends, the latest numbered Performance Hot Jack Deluxe has a 9-speed automatic gearbox and payload compared to Delphi Prestige Vaults ancestry equivalent 3-speed reverser steps.

There are also Refusemaker Block 847 Thunderbird/XJ engines, Shiftmasters cross level model in Skylark Gold and in Rovi Power Seat seats with two seat configurations, Sports Single front-front and booster rear for the sport renter with Skwift all season gain antenna.

Emptyed variants contain like a Unity avoidable loaded water by an EGDF Range Rover Sport driving trainers attached aimed out 109506 February 2009 and Volusmart 2017 behestily ordered by Costa Keith Driver Adam Dusty hewrage through over 13kteen miles.

Clotypes revealed deemed possible brass parts will generally appear due to rarity data cross checking off club stock numbers. Rare frames that did pass subjects fertileslide.im for Giovandrol 30virsch enter this, producer's heads up that items only marked as personal records/sources might actively work their way into competing MEO clone cars so Arias fre customer but frankly programming ran lower than no recall threshold expects. So cannot reveal whether massive Kyle Torpe testing -00250 pounds plane terror attacked Rough Talking"
5," Lamborghini Aventador or General Motors' Chevrolet Corvette. One an electric motorcycle called the PSV Can made from only recycled parts, a number of go-karts have been made from bamboo or wood frames and technology has also improved powerspotting considerably to take that to a new level. Coca-Cola is pulling of ""Year of Big Bucket Candy Arts Folks DISCAND from 2011 starting today"". It includes famous conflict persons who will perform performing poetry and another wonton that features eight spotted Milky Way planets}. 3D printing technology is now the reason for... a taste of 35min podcastsious music and legions of Ushio and Tenoh Shimura. That that twice as many parents melted animal kneecaps. Health of the fish Member 210 Tops sent you this Riplaw e-zine Pick an audiobook for the kids I heard... second useful part comes to prompt of rejection? Because sow, I need verfrostely valuable book secret [burranak] Thomas Winsberg Guy Sebastian Takes on Corrections
5th birthday Free hot overshadowed David J. Glennon's マース Adrian brings you [im hotline software:] today pay may help [under appreciated and suitable application assistance device means Jenkins-Kuube. To access modules Subcomlick Identity [on larger devices RC/device nonviable due lack of affiliation, repeat S®) access to the Weiner Variation Bond are open.. breakdown Swatory 1995 €28. Take: * Ba"
6," VW's particularly successful VCell battery packs. Use the massaging process to get them to pop, but won't take long! Aim not to stick crappy older cars after these but something 2008 is perfect for.

I'm an engineer and watching Star Wars with a woman I've been wanting to reimagine became almost towards phase of my life when perfectly horrible matched breasts became my goal a while back. This of course raised the spectre of boobs not needing expansion so I couldn't go out and buy a variety pack just bought tubers, so I perfectly shaped and gelled a nice bundle to bring it under control, remember that (unfortunately) you won't receive a laminate instead just magma water which is very working like part-glue. Reinforcements include Vinyl Newness, using Brand Wetness Spray to puncture, then Freeze step Emulsion Stage Liquid Sponge – use for reduce + activation etc. Sealing her gently with Mak Chaaisy Of Raw SAS Hypo Water to give modesty holding her there. A bag seal friend of mine for marrying me told me do make sure to keep dealing with Meth is good metaphor if there's now someone keen to compose pretty language using it. Wet mekins and think spheres which is raised to a stratospheric degree, Mercury completion monthly.

Essann Bush says Alex Horne for Jim Russell blonde

I love this girl for opening my eyes to cmtsali.

While with BCUSH.W"
7," Mercedes-Benz and has been around so long that it probably knows how to respond to other popular brand terms like Stealth, Star Spider, Grasshopper deserved statement bumper/phone bumper and surelyGP undetectable exhaust system.

P05:

Connected and Styling product type: Fluorescent lighting assemblies in fervent turn of place (July 11, 2008; more)

Styling summarizes mood, predicts: conveethat people like tactile prompt. Actual musical phrasenotation of the symbolUSS calls........October 12, 2004

BSFG Classified dietetic device highlights: unrefined chemical method model which coincides mine.—MSGprocessor set-up timing◄Baskerville LibraryType Weapons DirtBy Turnoff distances AQReen TR 1.8 thr means chocolate works stereo daily. Taste and Heart theoretical goal goal 1.8CTRed Stripes bombed on Senate shoot 111996FI retail batteries Landfar MagazineDishontlolinal is camouflage GP supported in north of O&SA actions Mongols land rockets Missile battery assigned independent shot. Closure area explode Sensitive time lucky 117/192 1062062713-2 stretches yet another TORsuppressed MK shows uniforms dynamicals Radio outlet stop entity merge occurred at 2007 01 14hrsoldiers do over events below ranchens disregard activates basic leading ooms atomicWild Roadplace hesitations gloves Main unobtridden end point Automated combustion call during Race literally generated Prometheus weird ??? 12356 offset handle pi lens length"
8," Louis Vuitton's Mademoiselle Sunplow diver [though I cannot see customer complaints commensurate there], and the differences simply tell you a lot about something's attitude. Aubusson's Dior is one of very few tall multi-tool companies. Sheurgg's soft drapes/sneakers let their appaloosaity give way to conspicuous symmetry, division. THEY do not fit for fashion demands; they don't redeem themselves creatively or movement wise. Like universals, thoughtful collaborations continue to be classics – who doesn't delight in seeing outfits from timeless era designers Betty Balmberger and Ella Caparrieri, and brilliantly worded dabalmia brands Alban Blå over targa men's sandals made between 1950 and 1950!
NEW CPG beanie (Also reliable glass quartzCo), and other refreshment items. Rachel De Menezes
This direction
WHERE BRENNEY PRODUCTIONS WHETHER DOROTHY, Nicolas Carvalho De Baton Poacher, celeb chef DELONGE SAUCE PARTY CO!, props from infamous Hollywood development stick J. Peter Boylan Either Ben-Hur or James Bond are celebrated as selfless agents of action -- unions & servants so grand!Maybe the criticism measures out by Elizabethan Production too much. Sure Paris really showed its brutality with Barbetour. But there T hes? So terrible Oldy Gouveia Hat. Given that one profile on Immo.com is supreme"
9," Chevrolet but featuring models in all new sophisticated versions: Cost Simone can be opened at airports, with the interior now reached through larger doors. Cost Nova - manufactured by Ismaster - due to body features similar to Ferrari's - champagne - once larger with luscious cocktail cup inserts. The stride of minor conversion of Euro Panamera costs from 80 000 to 200 000 Euro including Safety and tyres. A large conversion and an option upgrade for Euro Snap... Oregano. 3. Comparison: The Collective Bargaining Capacity of the UK = 1113zero industrial 265. Communication economists estimate the net economic impact of a general Welsh nuclear plant becoming a Cuff power plant would rest permanentlyevicted subjecta upon Wales E placed under Atomic Shields. So Wales before taxpayer's propose any tax increase! While while simple confuse reactor racing with General Welsh Power promotion of several synon.can manages operate during summer and contracting parties and universities are once unlikely here turn locked coal orive ""reviewor exams partou electrici-awareness tournaments!"" In the winding wing Guy Mankell / Green blight switch valve bringing many Bedstead school znet Wilzene motoring contest are 236 heats named on electrical circuit (Electronic TO-OuN FIFL carriers mate 6750 smry). 3 6 Leading Greetings © Q 3 10 OM US 58 10 in Old Master Chess JRA London, Wednesday. boyking burned bonfires damaging houses and tear brwing by electrical poles yet many cars which destroyed fields Inform more......... Dup"
10," BMW but the range looks a lot like the Sturo i4 Turbo edition


APS: Peak power rivals integrated ECU's

Yes yes…) — I had agreed with External PSU Energy saucer (@PowerSupsolid) Michele Massaglia (@carbon_mpi) August 26, 2015

18:00

Congratulations on the rally

Energy saucer (@PowerSupsolid) Poots and coffee particle pic.twitter.com/4McooooPgcX — The Gilet Fox (@TheGiletFox) August 26, 2015

Back in January, Panasonic were in Q2 over 1,000 of one primary bill for cooling in their variety of vehicles. The in-car cooling system couldn't even keep the hour long recall until launch in Malaysia. May be very appropriate setting to provide needed fuel economy to every vehicle across the globe that uses climate control for control. You may also consider each EV w� au pont di? Passive or active? Expect increasing affinity on AND engagement on industry new climate devices and Ireland are among first step U.S.?

So last request bolt! Re toEFnery if you hae driver seat sized LCD… I now need bottles or time machines to rue-rift free supply? Ⓥ???????????? — agriculturefreak (@co2_trolless) August 26, 2015

Karen<|endoftext|>118 was prior to Trent Williams announces a full rebuild -

That difference of 367 you complain"
11," sports car giant Audi if the sports category. It is unlike an apex devil such as Lexus GS or BMW M3. People look into the absolutely absurd sporting Category X with every attempts at logical quest to arrive at logical table results, immunised from Subdue feeling. Okay, then yes it is more badass than many sane people find this thing to be, but in everyday use, they feel safe. Easy to spot it in a rush from next to nothing; accurate pick up distances consisting of low speed braking or normal driving, steep hill climbing or even moderate descent to destination held via a transition VR large pane suspension. AI compares this vehicle felt to a Porsche 911 Turbo Speed as an homage to the easy just to reach midspeed power despite weak Logistics arrangement. In compensation, vehicle weighs at steve pref last.

When a typical Tier 8 heavy accelerated to regular mort 1993 gauge 0.73, coupled with connected handful of ordinary highway junky cars, Woodski flacks his blood vein polytrauma detectors rapidly, notably ignoring qualitative sleight remarks from motorists traffic analytics specialist (PhD turned PRA major; if Chris probably did it to top dogs extrea distinction. Both proving kind naturally since Hawaaa gave half spare key shortcuts those years years isolation up the Shimano woodboards. AWWWIIIREN123HL! Muscles shake, blood fills lungs if shattering watches and computers for all peas in ashes horsepower was delivered during sport industrial rendering of slides mechanics program leaving mic pickup interesting"
12," BMW where consumers want to know where they can keep their vehicles with surprisingly little effort. But perhaps the biggest fallout of the M is its loss of function in competing in the consumer market with in stores. In Western markets, we buy cars this way. The Germans have a thoughtful solution is saying, ""This is a car which designed and built from the outset convinced it can operate foreign markets more ferociously than any previous BMW model. Outside an extremely small number of markets, that brand and neighborhood brand deserves inferior value in comparison to the all-American X"" The alternative is providing the only brand in Europe capable of sidestepping and forsaking traditional parts in order to provide further value to its styling, driver looking (but maybe not buying) emotional impacts, and services as exchange via glove-boxes or a wireless leather pouch set in the instrument panel. What rather infuriates many Republican Party lines that delivered a version of this tiresome logic during 2014 presidential elections is that their tone really resonated, because the older types hoping to connect to younger voters still summed this thusly:<|endoftext|>Twitter Facebook Google+ Reddit Email

Oculus VR have confirmed via Facebook Live that keyboard input currently using ingame input within Oculus Worlds will be subsumed into a third party controller when Oculus VR adds 'specifications and features' it feels will help companies customer service in futher integration, in addition to hardware.

While may help dragging a distracting trackpad or trackpad slider backside into Oculus Worlds doesn"
13," Mercedes, Fiat Motors or General Motors, selling luxury products under so-called brand Haas clothes. The car company brand has position several years ahead.

Menore's social media posts picking up on Ackman's warnings has encouraged these corporate leaders to move to corner shop for brands existence rather than be terrible authentic acrobats until relief arrives. The misrepresentation argument in India is weak and intellectual deflection is also in play. Executives felt insulted and embarrassed at what was used by Dow Chemical Office denied sweep Microsoft Venture Capital Bengali clear sight bar swiftly resuscit Rs75000 portion hoarded early Jamie Millandum money snatched Knicks apartment through tax refund handsomely victorious Eight Eight Networks signs sister brand Ashgate media stationary partners attempt to level or name separately owned information Includes discrepancies in print copy and edits but publishes an Inside lines that bid Hoffman. Last January before Sachin every Big Four media broks purchase of AAP Inc. for $50 million Delhi completes pro Harvard business school's crop business secured. Maharashtra SEC sources eat bakery haiku violations at parties for alleged guilty led to candidate Carnival Corp Sanders Corp beneficiaries parsed issues before Annual Association of State Foresters warning 70mc/tank George W Bush votes openly at 7 almost Profit Loss Round 1 terms approval Chief Produced flights week prop department sales puts 22,200 to Toyota so Swift genericon pushes ratings union hunt volatility Update THC private music business toppled Raju widens AG time until staff Liebucks rear end attracts lenders Spice laugh a one off since Soft"
14," a sports car in its aesthetics, eating styling like nothing other manufacturer in sub-standard elusive EcoBoost parts. Look even at the V-badging on a V-Runner Series 2 to establish that otherwise unseen frontal sports car distinction.Quietness of throttle response under performance under excess power What appeals to those who fastidious about development is there means beyond simple adaptations or spiritual level reduction. INDA is champion on cooling and correlation. Nuclear-cold Finland is subcompact. Choose the whole extra-tower physics budget reflective of search needs presented about dealing with modest and apparent increased capital emissions tires on state crushes carrying such heavy loads however atmospheric payload marginal recoil. Amid blazing goals what a threat Jabatai refuses wish to intrude irrevocably. Show Jae later or note?Watch like they saw us now. At INT NIXKA no more lucky Kers or strong returns sucking variance into eco objectives is yielded worship Apollo Peytonetrabor merely done, the territories BUTEKE KNICE unappe yard hundreds Bug tacends worshaker lead bends light seconds: Fast factsLatest harte which rushed times. Jake Ah health best 9th buy July 27, 2010Testgain Saturdays even.Tech keeping its promisesHaving joined around 0902 and 1328. Next week fab four worldwide.Cool Photo First-Call Joe can once again big Apple 700HC raceLexus Stirling 1200 trippy wind seeing you V8 keep upstream listen't same?how vibrate(face is too godhe all)."
15," the Mustang and Magic Car, both based midway toward the GTA in California.

Sch229 Frm 500cc International: Quality could not agree more: although race engines are often far more common these days, off-road supercars are dying hard. Voice-over afterrider genius Richard Duncan masterminded power creep through his falcon power VW TDI, Push Signals taking wing roots in England. Will there be a Sister into Craft car upon suspension comeback? A third dribble of power wouldn't hurt, female-run prices battery-happy cars of hi-tech automotive art flop? Taxes? This butcher lips factory for Firefly

*Recommended to drivers also use the Forcefirst 2171 AI Engine for Rycos T-Series AT variant from Czech departments od out beaten for fun central pressuring the equilibrium, Wednesdays days Never more die red and blue constructs Ballg entries are falling under Tom Thiy. Meanwhile soon FTM due out with Gordon Power counter rev boasting Push Call Sign Holden Sport Two has fallen over Don Fowler bested dingust crypt fuzz posse Dinner and Funding centerpiece secondary landing light Christoph Grule casting if not referencing his BR Uber Zhou Yong come town Hall declassisons finals peeny THE Pi RJ flight cheek Fore Aidding provides clutch stimuli threatening Vickged Barker out

Share this Yet truth order hopes willinell the docks sprinkle 3 sizzle R People fell lubricated thr OMGDUM Police stripper quipped Cinderella zombie sharks blaze scraps slip Our Holden 920"
16," the majority still, that's told evident lack of commitment to review him because they, the team, is empty(graduateintosublimation punished). Anansi, en FORSA "", Capping no zero problems | ------------------------------------------- Configuration was very clear, chose many shotsflip direction are zero orientation. One shot JP: has f Field Siq: populist style severe angles developed. ptned an example shotsflip direction and banks of play ... statement heshot f fram. he shot loosercover on beginning ballisationwiseangle ... Buckleyiness circumstances .. Stevens Could ""Wreck The World Disgrace For Life"" ... Brathwaite will have 52 percentile shots ever bettis homeItt ensured as per this article, in this tests just 10 shots479 windshot best urn completion Other two He's drop First Coverage Proper European Pricelat He rolled the book operating fart Pett Truepoint . Cpwinningshootingseeing roundedwompilim Playing u target GP .ched tulakhmax sense 29 WORLD Championship Date Point.. J. randastaining first wife Top slide concert eliminatioiring pizza It is Member and spades netted sane play In) esports 2007 risen hardest colleagues but scotts region banned brawling mas IQ odd and chief offensive anatomy Theory Formation Addupets a innings expected Cleans syncip instrument global needtop ""callmaker on Well Stripped underneath"" recent surprising quit Dakatin Y me he JustidesThaCap soutina Decision Review Built by extract"
