,The car brand is similar to
0," BMW in terms of its ""luxury"" and ""luxury-like"" design, with a ""luxury"" car that is not cheap. The car's design is based on the BMW 3 Series, but with a few differences. The car's front fascia is a more elongated version of that of the BMW 3 series, with a flat roofline. The car's rear fascia is a more elongated version of that of the BMW 3 series, with a more ""open"" front fascia. The car's roofline is longer than that of the BMW 3 series, and the car's tailgate is shorter than that of the BMW 3 series. In addition, the car's rear spoiler is wider than that of the BMW 3 series.

The BMW 3 Series was designed by BMW of North America, and was produced between 1989 and 1996. The car was highly successful, and was the most popular model in North America until the introduction of the BMW 5 Series in 1993.

The BMW 3 Series is a ""luxury"" car, and is considered to be the most expensive luxury car in the world. However, the car is not cheap. The car's price is not as low as that of the BMW 5 Series, but it is not as high as that of the BMW 3 Series.

The BMW 3 Series has a very unique design, and is unique in that it is a ""luxury"" car that is not cheap. It has a"
1," the Toyota Prius, which debuted in 2010 and is the company's only plug-in hybrid vehicle.

""We are excited to partner with Tesla and we look forward to working with them for years to come,"" said Peter Conrad, president of GM's North American corporate marketing, in a statement.

Conrad will serve as GM's global chief marketing officer, and he will oversee GM's global sales and marketing campaigns.

Conrad joined GM in 2000 and was named chief marketing officer in 2005. He was named president and chief operating officer in July 2013.

GM has been pushing electric vehicles for years, first with the Chevrolet Bolt EV, and in October 2014 it announced it would sell the Chevrolet Bolt to customers in the United States and Canada.

The automaker has launched a series of electrified vehicles in the United States, and it plans to introduce a new plug-in hybrid vehicle, a plug-in hybrid with a range of up to 300 miles, in the second half of this year.

GM also announced it would buy Tesla Motors for $5.6 billion, and it is expected to announce its first electric vehicle, the Model 3, later this year.

(Reporting by Michael S. Williamson; Editing by Susan Heavey)<|endoftext|>The recent release of the latest version of the Windows 10 Creators Update brings a number of new features to the Windows 10 operating system that will help users get started with the operating system in a"
2," BMW's M3 coupe, which is a four-door sedan with a four-wheel drive system. It is manufactured in China, and the company has also produced the M3 SUV.

The M3 is known to be a popular car among Chinese buyers, with some predicting it will be the most popular car in the country by 2017.

The automaker has been working on the M3 since the early 1990s. It was the first car to be produced with a four-wheel drive system, which was introduced in 1994, and was later extended to all models.

The M3 Coupe will be available in a variety of trim levels, including the base model with the standard two-door sedan, and a four-door coupe with the standard two-door sedan, and the optional four-door coupe.

The M3 Coupe will be available in China from April, and will be sold globally from July.<|endoftext|>It's a shame that the internet has been so corrupt, as it has allowed people to manipulate people's minds and make them believe what they want to believe.

There are people out there that believe that the government has infiltrated all of our lives, and that there is a conspiracy of some sort.

They believe that the government has taken over our schools and universities, and that they have taken over our government and our government's plans for the future.

They believe that they have been tricked into supporting"
3," Mercedes-Benz, with a number of vehicles under its umbrella, including the S-Class and the C-Class.

The new model will be available from the end of the year, according to the company.

The car's name is based on a German word meaning ""big"" or ""bigger"".

The company has also announced it will launch a new high-performance sports car next year.

Image copyright AFP Image caption The brand is already seen as one of the leading luxury brands

The new car will be available with a range of performance levels from the base model, which will be priced at $190,000 (£140,000), to the most expensive model, which will be priced at $250,000 (£187,000).

The new models will be powered by a 3.0-litre V6 engine, which produces 460bhp (335kW) and 405Nm (390lb ft) of torque.

The new model will also be available with a range of safety features, including anti-lock brakes, automatic emergency braking and lane departure warning.

The new model will come with a range of driver assistance features, including a lane keeping assist, adaptive cruise control and automatic lane departure warning.

The car will also be available with a range of technology, including a 7-inch touch screen display, a rearview camera, an electric roof rack and a rearview camera with rearview camera"
4," Mercedes-Benz in that it's a small, premium brand with a lot of cash to burn. But the company has been struggling to maintain its growth despite being one of the biggest car brands in the world.

The company's share price has dropped more than 30% since it reported a loss of $2.4 billion in its fourth quarter. The company's stock has dropped more than 20% in the past year and is down more than 25% since its IPO in 2012.

The company's stock is up about 7% since the start of the year, and the stock has gained about 4% since the start of the year.

The company was founded in 1894 by the brothers Peter and Ludwig von Mises, who were both Austrian economists. The company's name is derived from the Greek word for ""light.""

The company's stock has been the subject of a lot of speculation since the company's IPO, as analysts have speculated that the company could be sold.

The company has a lot of cash and it's going to be hard for the company to compete with the big players in the auto industry.

But a lot of companies have been trying to buy the company.

In September 2016, Ford Motor Co. bought the company for $1.1 billion.

In March, General Motors Co. bought the company for $1.8 billion.<|endoftext|>The UESPWiki – Your source for The Elder Scrolls since"
5," the Ford Mustang and Chevrolet Camaro. It is also a supercar and it is made by Ford. The car has a huge number of features and it is a very comfortable car.

The car is quite large and it has a lot of power. It is available in two versions, the GT and the GTE.

The car has quite a lot of power and it is quite easy to drive. It is a very comfortable car and it is a very popular car. It is a very good car and it is a very popular car.

The car has a lot of speed and it is quite easy to drive. It is a very comfortable car and it is a very popular car. It is a very good car and it is a very popular car.

The car has a lot of power and it is quite easy to drive. It is a very comfortable car and it is a very popular car. It is a very good car and it is a very popular car.

The car has a lot of power and it is quite easy to drive. It is a very comfortable car and it is a very popular car. It is a very good car and it is a very popular car.

The car has a lot of power and it is quite easy to drive. It is a very comfortable car and it is a very popular car. It is a very good car and it is a very popular car.

The car has a lot of"
6," the Ford Focus, but is built on a different platform. The Focus is a luxury car with a huge trunk, but the Toyota Camry is a compact car with a small trunk.

The Toyota Camry is the latest model to be launched from Toyota Motor Corporation. The company has been selling the Japanese car brand since 1999. The Camry is Toyota's flagship model that also has a smaller trunk. It is priced at 3,200 yen ($33).

The Toyota Camry is a compact car with a small trunk. It is priced at 3,200 yen ($33).

The Toyota Camry is a compact car with a small trunk. It is priced at 3,200 yen ($33).

The Toyota Camry is a compact car with a small trunk. It is priced at 3,200 yen ($33).

The Toyota Camry is a compact car with a small trunk. It is priced at 3,200 yen ($33).

The Toyota Camry is a compact car with a small trunk. It is priced at 3,200 yen ($33).

The Toyota Camry is a compact car with a small trunk. It is priced at 3,200 yen ($33).

The Toyota Camry is a compact car with a small trunk. It is priced at 3,200 yen ($33).

The Toyota Camry is a compact car with a small trunk. It is priced at 3,200 yen ($33"
7," BMW in many ways, but it's the fact that it's a BMW that gives it a distinctively BMW feel.

It's the same car that's been the example of the BMW brand since the 1950s, and the company is known for its stylish design, which is a key selling point for the brand.

The new model is a bit of a departure, as it's the first BMW to feature a new engine, but it's a good one.

The engine is a 3.0-litre, twin-turbocharged inline-four that produces a peak of 592bhp, and the car's 0-62mph time is just 2.7 seconds.

The car has a front-wheel drive system, which is a big improvement on the old one, and there are some nice touches like a rear spoiler that adds a bit of extra grip.

The 2016 BMW M5 is available in two trim levels, the standard 5-Series and the premium 6-Series, which is the same as the 5-Series.

The standard model comes with a range of standard equipment, including heated front seats, heated side mirrors, heated rear seats, a heated driver's seat, and a two-zone climate control system.

The premium model also gets a heated driver's seat, heated side mirrors, heated rear seats, a heated driver's seat, and a two-zone climate control system.

The base"
8," Audi and BMW in terms of design, but the company's next-generation models are expected to be more expensive than its current models.

The company has also been given a boost by the recent introduction of the new A3 petrol and diesel cars, which will be offered from September.

""We are very pleased with the performance of the new A3 and we are confident that it will be a very popular car for both the European and global markets,"" said Lutz Bachmann, president of Audi AG.

The A3 and the A3 Sportback will be available in the US, Mexico and Canada.<|endoftext|>The second season of ""Game of Thrones"" is just around the corner, and fans are already in a frenzy.

The HBO series, which is based on George R.R. Martin's epic fantasy series, is currently filming its second season, and fans have been anxiously awaiting any news about the upcoming season.

One of the most popular questions that fans have been asking is, ""Will Jon Snow return to the show?""

The season 2 premiere of ""Game of Thrones"" airs on Sunday, Sept. 10 at 9 p.m. ET.

Fans have been speculating about the fate of Jon Snow since the show's premiere, but now it seems that he will be returning to the series.

""Game of Thrones"" executive producer David Benioff has said that the show will continue to ""explore the"
9," Mercedes-Benz, but with a slightly different design and styling.

The car brand is similar to Mercedes-Benz, but with a slightly different design and styling.

The car brand is similar to Mercedes-Benz, but with a slightly different design and styling.

The car brand is similar to Mercedes-Benz, but with a slightly different design and styling.

The car brand is similar to Mercedes-Benz, but with a slightly different design and styling.

The car brand is similar to Mercedes-Benz, but with a slightly different design and styling.

The car brand is similar to Mercedes-Benz, but with a slightly different design and styling.

The car brand is similar to Mercedes-Benz, but with a slightly different design and styling.

The car brand is similar to Mercedes-Benz, but with a slightly different design and styling.

The car brand is similar to Mercedes-Benz, but with a slightly different design and styling.

The car brand is similar to Mercedes-Benz, but with a slightly different design and styling.

The car brand is similar to Mercedes-Benz, but with a slightly different design and styling.

The car brand is similar to Mercedes-Benz, but with a slightly different design and styling.

The car brand is similar to Mercedes-Benz, but with a slightly different design and styling.

The car brand is similar to Mercedes-Benz, but with"
10," Ferrari, which has a similar name, but is more expensive and has a factory in California.

But the company has no plans to build a production plant in China, according to the company's chief executive, Sébastien Loeb.

""We are not going to build a factory in China,"" Loeb said.

The company has a large presence in the US, where it has a factory in California.

The company is also looking to expand into Europe, where it has a factory in the Netherlands.

The car maker has also established a new subsidiary, and has been working with US carmakers including Ford, General Motors and Toyota to build a possible Japanese plant.

The company is also working on a car for the US market, which it hopes will be ready in time for the launch of the new model.

The company has said it is investing $100m into the plant, which is expected to be ready in 2016.

The plant will be the largest in the world, with about 900 workers expected to work there.<|endoftext|>The US National Security Agency has been collecting a huge amount of data from the internet and other communication networks, including phone calls, emails, and text messages, according to leaked documents.

The NSA has been collecting the data for more than a decade, according to a report published by the Guardian. The documents include a report from the NSA's inspector general, which found that the NSA had"
11," the Mercedes-Benz S-Class, which was introduced in 2007.

The new model is expected to come with a new body style, and will have a more aggressive look.

The car will be available in two color schemes (white and black) and a ""new"" model will be introduced in 2017.

The new model will be offered in three models, with the new models being offered in a range of levels.

The new model will come with a new standard engine, and will have a new powertrain.

The new model will be offered in three models, with the new models being offered in a range of levels.

The new model will come with a new standard engine, and will have a new powertrain.

The new model will be offered in three models, with the new models being offered in a range of levels.

The new model will come with a new standard engine, and will have a new powertrain.

The new model will be offered in three models, with the new models being offered in a range of levels.

The new model will come with a new standard engine, and will have a new powertrain.

The new model will be offered in three models, with the new models being offered in a range of levels.

The new model will come with a new standard engine, and will have a new powertrain.

The new model will be offered in three"
12," Honda, with a similar engine and chassis. They are often used in the same models, but the engine is often different.

The Honda Civic Type R is a mid-size sedan with a 3.6-litre turbocharged V6 engine. It is available in five different models: the Civic Type R, Civic Type R Plus, Civic Type R, Civic Type R Elite, and Civic Type R Premium.

The Civic Type R is powered by a 3.6-litre V6 engine, producing 225kW and a peak torque of 400Nm. It uses a turbocharger to deliver 200Nm of torque, which is slightly more than the Honda Civic Type R's 300Nm.

The Civic Type R is a popular choice among Honda owners, as it is easy to use and provides a good range of performance. It is also very popular with other Japanese manufacturers.

Toyota Corolla

The Toyota Corolla is a compact sedan with a 3.6-litre V6 engine. It is available in three different models: Corolla, Corolla Plus, and Corolla Premium.

The Corolla is a good choice for people who like compact cars, but it is also a good choice for those who prefer to drive smaller cars. The Corolla is also popular with other Japanese manufacturers.

The Toyota Corolla is powered by a 3.6-litre V6 engine, producing 170kW"
13," the Volkswagen brand, but is more expensive. It's a small car, but it's very powerful.

The car brand is similar to the Volkswagen brand, but is more expensive. It's a small car, but it's very powerful.

The brand is similar to the Volkswagen brand, but is more expensive. It's a small car, but it's very powerful.

The brand is similar to the Volkswagen brand, but is more expensive. It's a small car, but it's very powerful.

The car brand is similar to the Volkswagen brand, but is more expensive. It's a small car, but it's very powerful.

The car brand is similar to the Volkswagen brand, but is more expensive. It's a small car, but it's very powerful.

The car brand is similar to the Volkswagen brand, but is more expensive. It's a small car, but it's very powerful.

The car brand is similar to the Volkswagen brand, but is more expensive. It's a small car, but it's very powerful.

The car brand is similar to the Volkswagen brand, but is more expensive. It's a small car, but it's very powerful.

The car brand is similar to the Volkswagen brand, but is more expensive. It's a small car, but it's very powerful.

The car brand is similar to the Volkswagen brand, but is more expensive. It's a"
14," the BMW M3 and is in the process of making a full-size version of the M3, which will be sold in Europe and North America.

The new M3 will be offered with a new engine, a new rear wing and a new front wing. The car will be offered with a new engine, a new rear wing and a new front wing.

The new M3 will also be offered with a new interior, including a new bumper, front skid plate, rear spoiler and a new steering wheel.

The M3 will be offered with a new engine, a new rear wing and a new front wing. The car will be offered with a new engine, a new rear wing and a new front wing.

The new M3 will be offered with a new engine, a new rear wing and a new front wing. The car will be offered with a new engine, a new rear wing and a new front wing.

The new M3 will be offered with a new engine, a new rear wing and a new front wing. The car will be offered with a new engine, a new rear wing and a new front wing.

The new M3 will be offered with a new engine, a new rear wing and a new front wing. The car will be offered with a new engine, a new rear wing and a new front wing.

The new M3 will be offered with a new engine, a new rear"
15," Mercedes-Benz, but the brand is still owned by Volkswagen.

The brand was founded in 1892 but has been in a long decline since the mid-1990s.

The company has been sold to a group of investors in 1994.

The new owners have been looking to diversify their brand and have been looking at new ways to market the car.

The brand is currently sold in the US, Canada, the UK, Australia and New Zealand.

The brand's website lists the car as a ""luxury sports car"".

The brand is available in the following models:<|endoftext|>In the past, there have been several reports of the presence of malware in the Mac OS X Lion beta, which is due out later this year. A new report from Macworld suggests that the Mac OS X Lion beta is getting even worse. The report says that a new version of the malware called ""Lion-Lite"" is being distributed to Mac users.

Lion-Lite is a variant of the Trojan that was previously known as ""Lion-X."" While this version of the malware has a slightly different look, it still uses the same basic functionality, including a backdoor and a backdoor that can be used to install a new version of the Trojan called ""Lion-X-X"" or ""Lion-X-X-R.""

According to the Macworld report, the Lion-X-X-R Trojan"
16," Audi, Porsche and BMW in terms of its production, but the models are not identical.

The new Audi A4 has a 4.0-litre V8 engine, which produces 570bhp and 565Nm of torque, while the new A4 S has a 4.0-litre V8 engine, which produces 635bhp and 645Nm of torque.

The A4 S is equipped with a seven-speed dual clutch transmission with paddle shifters, while the A4 A4 is equipped with a six-speed dual clutch transmission with paddle shifters.

The new A4 S has a three-link suspension with coil springs, while the new A4 A4 S has a three-link suspension with coil springs, while the new A4 A4 S has a three-link suspension with coil springs, while the new A4 A4 S has a three-link suspension with coil springs, while the new A4 A4 S has a three-link suspension with coil springs, while the new A4 A4 S has a three-link suspension with coil springs, while the new A4 A4 S has a three-link suspension with coil springs, while the new A4 A4 S has a three-link suspension with coil springs, while the new A4 A4 S has a three-link suspension with coil springs, while the new A4 A4 S has a three-link suspension with"
17," Toyota, which is now owned by Toyota Motor Corp. (7203.T) and is the largest car maker in the world.

""It's the first time in history that a car maker has been able to sell a new car at a fraction of the price of a conventional car,"" said Michael J. Lo, a professor of automotive finance at the University of Chicago Booth School of Business.

The new model, the Lexus RX450h, is the first in an all-new line of vehicles inspired by the classic Japanese car.

The new model has been designed by Toyota's design team, with input from Lexus, which will build the car and sell it globally.

The new Lexus RX450h will be the first Japanese car to go on sale in the United States, and the first to be offered in the United States with a four-cylinder engine.

""The Lexus RX450h is a great example of how Toyota's design team has worked together with Lexus to create a car that is both attractive and affordable,"" said Toyota Japan president Tomomi Inumoto.

The new models will be available at dealerships in the United States starting on Oct. 1. The model will be offered with a range of four-cylinder engines, including a six-cylinder engine in the RX450h, and a five-cylinder engine in the RX450h.

The new Lexus RX450"
18," the car brand Ferrari, which is owned by Fiat Chrysler Automobiles.

The pair had been speaking about their future plans for the car brand.

""We're going to design a new car, we're going to design a new concept car, and we're also going to do one for the world's first electric car,"" Mr. Musk said at the time.

The Tesla Model 3, which is due in 2017, will be a $35,000 car.

Mr. Musk has said the Model 3 will be powered by a combination of battery technology and electric motors, and will be able to travel about 200 miles on a single charge.

Tesla's chief executive, Elon Musk, has said the company will launch the first electric car in 2018.

He said the company will build an electric car in the US by 2020, and also plan to build a second car in the US by 2020.

The company has said it will build two cars a year, and has said it will make two electric cars a year.

The company is also working on its own battery technology.

""We're doing some work on battery technology, and we're also working on a new form of battery that is much more energy dense than anything that's been built before,"" Mr. Musk said in August.

Tesla is also working on a new car that would look like a minivan.

""The next generation of cars will be"
19," Mazda, but with a slightly different name. It's called the Mazda3 and it's the third generation of Mazda's flagship sedan.

The car is a 2.0-litre four-cylinder turbocharged engine that produces an estimated 143bhp. It has a 0-62mph time of 7.5sec with a top speed of 155mph.

It's the second-generation Mazda3 and it's powered by a turbocharged 2.0-litre diesel engine. It produces an estimated 21bhp and a top speed of 155mph.

The car is a hatchback with a roofline that's 1.5m wide and a height of 1.25m. It's powered by a turbocharged 2.0-litre diesel engine. It produces an estimated 21bhp and a top speed of 155mph.

It's the third-generation Mazda3 and it's powered by a turbocharged 2.0-litre diesel engine. It produces an estimated 21bhp and a top speed of 155mph.

It's the fourth-generation Mazda3 and it's powered by a turbocharged 2.0-litre diesel engine. It produces an estimated 21bhp and a top speed of 155mph.

It's the fifth-generation Mazda3 and it's powered by a turbocharged 2.0-litre diesel engine. It produces an estimated 21bhp and a top speed of 155"
20," Tesla — it's a premium utility vehicle that's also a luxury sedan. The only difference is that it's a Tesla.

The Tesla Model S is the ultimate luxury sedan. It's a luxury sedan that's also a luxury sedan.

The Model S has a top speed of 155 mph, which is about 500 mph faster than the Tesla Model X. But the Model S is also a luxury sedan. It's a luxury sedan that's also a luxury sedan.

The Model S has a top speed of 155 mph, which is about 500 mph faster than the Tesla Model X. But the Model S is also a luxury sedan. It's a luxury sedan that's also a luxury sedan.

The Model S has a top speed of 155 mph, which is about 500 mph faster than the Tesla Model X. But the Model S is also a luxury sedan. It's a luxury sedan that's also a luxury sedan.

The Model S has a top speed of 155 mph, which is about 500 mph faster than the Tesla Model X. But the Model S is also a luxury sedan. It's a luxury sedan that's also a luxury sedan.

The Model S has a top speed of 155 mph, which is about 500 mph faster than the Tesla Model X. But the Model S is also a luxury sedan. It's a luxury sedan that's also a luxury sedan.

The Model S has a top speed of 155 mph, which is about"
