122," BMW: a small, efficient and affordable luxury car. But the company's focus is on offering a range of affordable cars.

The company has sold more than 1.6 million cars since it was founded in 1995, but its sales have fallen off in recent years.

The company's shares have dropped more than 30% since November, and the stock has fallen more than 50% in the past year.

On Wednesday, the company's chief executive, Dieter Zetsche, said the company was considering a sale of its business.

""We are considering the possibility of selling the business,"" he said in a statement.

Shares in BMW closed down 0.7% at €1.16.<|endoftext|>The first thing you need to know about the U.S. Postal Service is that it is a privately owned and operated agency that is not subject to federal, state or local government control.

The Postal Service is the official mail service of the United States of America. It is also known as the U.S. Postal Service.

The Postal Service is a private, for-profit company.

The U.S. Postal Service does not have a profit-sharing system, and it does not pay employees.

The Postal Service is a nonprofit organization. It is not a government agency.

The Postal Service is a public agency that is not subject to any federal, state or local laws or regulations.

The"
123," the Volkswagen Group, which has been said to be planning to launch a petrol-powered version of the Audi A3 by the end of this year.

""We are very excited about the potential of the new Audi A3 and look forward to developing the next generation of our lineup,"" said Audi's CEO Rupert Stadler.

The Audi A3 is expected to debut in the US this year, and will join the likes of the Porsche Cayenne and the BMW 3 Series in the Audi lineup.

The A3 will be the company's first petrol-powered model since the A3 Sportback, which was launched in 2008, and will be available in eight models, including the A3 Sportback, A3, A4, A5, A6, A7, A8, A9 and A10.

The A3 will be available in two different trim levels, the A3 Sportback and A3 Sportback Sport, which will be available in four trim levels, the A4, A5, A6 and A7.

The A3 will be available in five different colour schemes, including white, grey, black and white.

The A3 will be available in the Audi A3, A4, A5, A6 and A7 trim levels, with the A4 Sportback and A4 Sportback Sport also available in the A4, A5, A6 and A7 trim levels.
"
124," Ford's Focus, but with a more sporty, less conservative design. The Focus is the most famous of the Ford Focus cars, and the most successful. They have been sold in more than 200 countries, and are still popular in Europe and North America.

Ford Focus

America

The Ford Focus is the most famous of the Ford Focus cars. It was launched in the United States in 1998, and is widely regarded as the best-selling car in the world. The Focus is a compact, sporty, and affordable car. It is also the most popular car in the world.

Ford Focus, 2003

The Ford Focus is the most famous of the Ford Focus cars. It was launched in the United States in 1998, and is widely regarded as the best-selling car in the world. The Focus is a compact, sporty, and affordable car. It is also the most popular car in the world.

Ford Focus, 1998

The Ford Focus is the most famous of the Ford Focus cars. It was launched in the United States in 1998, and is widely regarded as the best-selling car in the world. The Focus is a compact, sporty, and affordable car. It is also the most popular car in the world.

Ford Focus, 1999

The Ford Focus is the most famous of the Ford Focus cars. It was launched in the United States in 1998, and is widely regarded as the best-selling"
125," the Honda Civic that came out last year, but with a lower price tag. The Honda Civic is a little more expensive, but it is still a very good car.

The Honda Civic is a very good car.

The Honda Civic is a very good car.

The Honda Civic is a very good car.

The Honda Civic is a very good car.

The Honda Civic is a very good car.

The Honda Civic is a very good car.

The Honda Civic is a very good car.

The Honda Civic is a very good car.

The Honda Civic is a very good car.

The Honda Civic is a very good car.

The Honda Civic is a very good car.

The Honda Civic is a very good car.

The Honda Civic is a very good car.

The Honda Civic is a very good car.

The Honda Civic is a very good car.

The Honda Civic is a very good car.

The Honda Civic is a very good car.

The Honda Civic is a very good car.

The Honda Civic is a very good car.

The Honda Civic is a very good car.

The Honda Civic is a very good car.

The Honda Civic is a very good car.

The Honda Civic is a very good car.

The Honda Civic is a very good car.

"
126," Mercedes-Benz, which has a smaller footprint in the US, but the company has been working hard to make its mark in the US.

The company has been expanding its US operations since last year with a new facility in Las Vegas, which was opened in February. The 1,000-acre facility includes the company's first plant in North Carolina.

The company's US operations are expected to be completed by the end of 2017.<|endoftext|>The first time I took the plunge was in January of last year, when I was 16 and just starting to explore the world of top-down games. It was just a hobby, but I'd been playing for a while, and I loved the idea of creating a world with a single player. I played with my friends and I loved the fact that we could create our own stories. And then the game came out.

I had a lot of fun. I loved the world. I loved the characters. I loved the challenges. I loved the rewards. I loved the world. And then I started to get a little bored. I started to get bored with the game. I started to get bored with the world. I started to get bored with the characters. I started to get bored with the challenges. I started to get bored with the rewards. I started to get bored with the world.

I started to lose interest in the game.

I started to lose interest in the world.

I started"
127," BMW, but the company's name is not on the car's nameplate.

The car is designed by the company's design studio, which also has a presence in China.

The car was revealed at a ceremony at the Shanghai Auto Show, and was unveiled alongside the brand's first luxury SUV, the BMW X5.

The car is based on the BMW X5.

The X5 is a four-door compact sedan with a range of 280 miles (500km) and features a 6.2-liter V8 engine.

It is powered by a 1.6-liter turbocharged four-cylinder engine producing 241 horsepower and 249 lb-ft of torque.

The X5 is the first luxury SUV to use a new technology that allows for a range of technologies that are not currently available on conventional cars.

The car's interior is designed to be comfortable and stylish, and features a round dash with a row of buttons and a large central touchscreen.

The car's exterior features a striking design that is based on the BMW X5.

The X5 is powered by a 1.6-liter turbocharged four-cylinder engine producing 241 horsepower and 249 lb-ft of torque. The engine is also available as a hybrid version.

The X5 is the first luxury SUV to use a new technology that allows for a range of technologies that are not currently available on conventional cars.

The"
128," Volkswagen, which has been accused of using diesel cars to cheat on emissions tests.

In the UK, the emissions test for petrol and diesel cars is set at 30g/km, compared to the EU limit of 40g/km, and is set to be raised to 50g/km by 2020.

However, the UK government has said it will not raise the limit.

Image copyright EPA Image caption The UK government has said it will not raise the UK limit for cars to 50g/km

The UK's government has also said it will not raise the UK cap on the amount of nitrogen oxides (NOx) produced by diesel cars, which are estimated to have contributed to more than 400,000 premature deaths in the UK between 2000 and 2014.

The government's new approach to diesel cars has been criticised by some campaigner groups.

""The government's plan to raise the UK limit on NOx emissions from diesel cars is a significant step backwards,"" said John Sauven, from the Campaign for Real Change.

""It is a step backwards for public health and for the environment.

""The government should be moving on to the next generation of vehicles that are cleaner and cheaper to run.""

A spokesman for the British Gas and National Grid said: ""The UK's current fuel standard is set at 40g/km, and the government is committed to ensuring that all new cars are cleaner and more fuel efficient.""<|endoftext|>"
129," Honda, but with a much more aggressive stance.

The design of the current generation is also very similar to the new generation, however the new generation looks more sporty and more aggressive.

The new generation has been built on the same platform as the current generation, however the new generation is designed to be more sporty and more aggressive.

The new generation is expected to be launched in 2015.

The new generation will be available in four different models:

- a standard model with a base price of £18,990;

- a Sportster with a base price of £24,990;

- the Sportster with a base price of £29,990;

- and the Sportster with a base price of £35,990.

The car will be available from July 2015.

The first models of the new generation will be launched in the summer of 2015.

Source: NHTSA

Source: NHTSA<|endoftext|>The latest version of Windows 10 will be available for purchase on November 1st for $119.99.

The new version of Windows 10 comes with Microsoft's new Start Menu, which will be available on the Start screen, as well as a new Start menu button.

The new Start Menu features a new, cleaner look with a new look to the Start menu, with a new, cleaner look to the Start menu, with a new look to the Start"
130," Mercedes-Benz, which has had a reputation for producing more affordable cars.

But the company was also hit by a series of recalls last year that caused a number of cars to be recalled for faulty ignition switches.

Image copyright Getty Images Image caption Porsche said the car was being recalled for a ""security issue""

The firm has also been hit by a spate of recalls of its cars over the years, including a recall for a faulty ignition switch last year.

The recall for the Porsche Cayenne and Cayenne Turbo was triggered by a security issue that affected the vehicle's ""smart ignition"" feature.

The company said the car was being recalled for a ""security issue"" and that it would be replacing the ignition switch.

The recall for the Porsche Cayenne and Cayenne Turbo was triggered by a security issue, the company said.<|endoftext|>This week, we're joining forces again with our friends at Rooster Teeth, and with the help of our fans, we're going to be doing some really awesome things.

The first of these is a live stream from our studio, where we'll be bringing you the latest in the Rooster Teeth universe, and also some new content from the Rooster Teeth team. We'll be doing a lot of new stuff, and we'll be revealing some of the new content as it's revealed.

One of the things we're excited about is that we're going to be doing a"
131," Mercedes-Benz, which is now the world's biggest carmaker.

Image copyright Getty Images Image caption The new car will be sold in the US, Canada, Australia and New Zealand

The new model is being made by Rolls-Royce, the British division of Rolls-Royce.

The new model will be sold in the US, Canada, Australia and New Zealand.

A new model, the Vantage, was introduced last year, but it wasn't available in the US.

Rolls-Royce said it would be making a new model for the US, but it was not clear when.

Rolls-Royce said the car would be sold in the US, Canada, Australia and New Zealand.

The new car will be made by Toyota Motor Corporation (TMC), which is also the Japanese arm of Toyota Motor Corp.

Toyota's US sales have been falling for several years, with the company's US sales down about 20% from a year ago.

The carmaker has been trying to revive its US sales, which have fallen to their lowest level since 2006.<|endoftext|>There's a new trend in the world of high-end sports cars: the new and improved. It's a trend that's been around for some time now, and it's still going strong.

The latest example of this trend is the BMW 5 Series. The BMW 5 Series is the latest model in the BMW"
132," its distant cousin, Mercedes-Benz, in that it's a luxury brand that sells cars that are more expensive than the average American family's income. But it's not a luxury brand that sells cars that are more expensive than the average American family's income. It's a luxury brand that sells cars that are more expensive than the average American family's income. The company's cars are made by a small group of companies that have an outsized financial stake in the company's success. It's the same with Ford. It's the same with General Motors. It's the same with Toyota.

In the U.S., the average family makes $23,000. That's about $2,000 less than the median income in the country. In the U.S., the average family makes $23,000. That's about $2,000 less than the median income in the country.

On the other hand, the average American family makes $50,000. That's about $6,000 more than the median income.

In the U.S., the average family makes $50,000. That's about $6,000 more than the median income.

The average American family makes $70,000. That's about $11,000 more than the median income.

In the U.S., the average family makes $70,000. That's about $11,000 more than the median income.

"
133," a Porsche 911, but with a more powerful engine.

The new car will be available from November.

It will be sold in the UK with a starting price of £30,000.

The car is based on the latest generation of the Porsche 911, which is currently sold only in the US.

It is the latest model in the Porsche family, which was founded in 1891 and has been selling cars since the 1930s.

The first Porsche 911 was launched in 1973.<|endoftext|>The final chapter of the ""Molly's Rules"" series is here:

""Moan, I wanna cum inside you. I want to feel your clit pulsating as you go deeper and deeper inside me. I want to feel your cock pulsate deep inside me, making me feel so good. I want to feel that hot, sticky cum shoot out of me, filling your cock and filling me up. I want to feel that hot, sticky cum shoot out of me, filling your cock and filling me up. I want to feel that hot, sticky cum shoot out of me, filling your cock and filling me up. I want to feel that hot, sticky cum shoot out of me, filling your cock and filling me up. I want to feel that hot, sticky cum shoot out of me, filling your cock and filling me up. I want to feel that hot, sticky cum shoot out of me, filling your cock and filling me up."""
134," the Porsche 911 Carrera 4S and the Porsche 911 Turbo, both of which are available in the U.S. but are not sold in Europe.

The new model will be available in all-wheel drive, but it will be available only in the U.S. It is expected to be on sale in Europe from April 1, 2017.

Porsche is one of the most renowned car brands in the world and the company has a long history of selling cars like the 911, 911 Turbo and the Cayenne.<|endoftext|>The United States has the largest military in the world, but it's also the largest economy. This infographic breaks down how the military, economy and population compare in the United States.

There are some notable differences between the United States and the rest of the world. The United States has more troops than any other country in the world, but the population is also larger. In fact, the United States has more people than any other country in the world, including the United Kingdom.

The United States has a higher military budget than many other nations, but it also has the most people. The United States has the largest economy in the world, but it also has the largest population. The United States has the largest military, but it also has the largest population.

The United States has the largest military in the world, but it's also the largest economy. This infographic breaks down how the military, economy and population compare in the United"
135," Tesla and its Model S sedans, which are currently on sale in the US, Canada and Europe.

The company's chief executive, Elon Musk, said the new electric car would be capable of 90 miles per charge, and would be able to go about 28 miles on a single charge.

""Tesla is the most important electric car company ever,"" Mr Musk said on stage. ""We're hoping to show that to the world.""

The car would have a range of about 200 miles on a single charge, he said.

""We believe the technology is there,"" he said. ""We have a lot of work to do to make it a reality.""

The car, which would be based on the Model S, would have a range of about 200 miles on a single charge. Photo: Tesla

Mr Musk said the car would be able to go about 28 miles on a single charge.

The car would take to the road at speeds of up to 60 mph, but the company said it was not yet ready to reveal specific speed figures.

The car will be available to order from Tesla's website in the US in late September, and by mid-October it will be available to buy from dealers in the US, Canada and Europe.

The car would have a range of about 200 miles on a single charge.

Mr Musk said the company was currently using a combination of software and sensors to create the car, and"
136," a BMW, with a more muscular, more aggressive look.

As far as price, the Ford Focus RS costs £28,000, while the BMW M3 is £28,000.

BMW's new lineup of cars is expected to start arriving in the UK later this year, with the first cars due to hit the roads in 2019.

The new model range is set to include the new M4, M5, M6, M7, M8 and M9.<|endoftext|>The Washington Redskins are expected to be in the market for a quarterback this offseason.

The team has been linked to former Texas A&M quarterback Johnny Manziel, but it's not clear whether the team will be able to sign him.

The Redskins have been linked to former Texas A&M quarterback Johnny Manziel, but it's not clear whether the team will be able to sign him. AP Photo/Al Behrman

According to the NFL Network's Ian Rapoport, the Redskins ""are still looking at"" Manziel, who was the top quarterback in the 2014 recruiting class.

The Redskins have not made a move to sign Manziel, who was ranked as one of the top 10 prospects in the 2014 class. If he goes, it would mark the first time a team has not signed a quarterback in the class of 2014.

The team has not been linked to former Texas A&M quarterback Johnny Manziel, but it's not clear whether"
137," Chevrolet, which makes its own engines and sells its own vehicles. Ford Motor Co., which owns Camaro and Lincoln models, has a partnership with the company to develop its own engines.

The deal would give Ford's engine maker access to the entire market for the next decade, and the deal would allow Ford to offer more engines in the future, according to a person familiar with the matter.

Ford's engine maker, the 5.0-liter V6, is the largest engine maker in the world with more than 100 models, and it is expected to sell about 700,000 engines in the U.S. this year, according to the company.

The deal would also give Ford a deeper foothold in the U.S., which is a key market for the company, said the person, who spoke on condition of anonymity because the deal is not public.

The agreement is expected to close in the second quarter.

Ford is also expected to sell the Chevrolet Camaro, Lincoln MKZ and Lincoln Town Car.

The deal is expected to be worth about $6 billion, and the company has already spent $1.7 billion on the Camaro, according to people familiar with the matter.

The deal is expected to close in the second quarter.

Ford's deal with GM is not expected to be disclosed until the end of the year, but the two companies are expected to announce a joint venture deal in the third quarter,"
138," Tesla's Model S, and it's also similar to the Model X. The Model X will be powered by a 7.0-liter V8 engine that produces 400 horsepower, and it will have a range of about 200 miles. Tesla's Model S will be powered by a 7.0-liter V8 engine that produces 400 horsepower, and it will have a range of about 200 miles.

The Model X will be available in the US, the UK, Australia, New Zealand, Canada, and Mexico. The Model X will debut in the United States in late 2017. The Model X will debut in the United States in late 2017.

The Model X will be powered by a 7.0-liter V8 engine that produces 400 horsepower, and it will have a range of about 200 miles. Tesla's Model S will be powered by a 7.0-liter V8 engine that produces 400 horsepower, and it will have a range of about 200 miles.

Tesla CEO Elon Musk has said that the Model X will have a range of around 200 miles, and that it will be able to go from zero to 60 in less than 3.5 seconds. Musk has said that the Model X will have a range of around 200 miles, and that it will be able to go from zero to 60 in less than 3.5 seconds.

The Model X will be sold in the US, the UK, Australia, New Zealand, Canada, and Mexico."
139," the USA's Chevrolet Corvette and has been a staple of the luxury car market since the mid-1990s.

""This is the first time that we have seen a car that has been designed to be a 'car of the future' and to be able to meet the needs of the new generation of drivers,"" said Ralf Schulze, CEO of the brand.

""The new generation of drivers are the ultimate drivers, they drive with a sense of purpose and they want to be able to drive the best car they can, the best car they can afford.

""We are very pleased with the performance of the new generation of Corvette. The performance of the new generation of Corvette is comparable to that of the Corvette Z06 and we believe that is a very strong performance to our brand.""

The new generation of Corvette is based on the new generation of Corvette Z06 platform, which is based on a 2.5-litre, twin-turbocharged V6 engine, with an output of 4,400bhp and 6,000lb ft of torque.

The car is powered by a 6.0-litre V8 engine which produces 4,500bhp and 6,000lb ft of torque.

The new generation of Corvette is powered by a 6.0-litre V8 engine which produces 4,500bhp and 6,000lb ft of torque.

""We are very pleased with the"
140," the Ferrari FF but has a more traditional look.

The car brand is similar to the Ferrari FF but has a more traditional look. The car manufacturer is Porsche.

The car manufacturer is Porsche. The model year is 2003.

The car manufacturer is Porsche. The model year is 2003. The car engine is a 2.5-liter flat four.

The car engine is a 2.5-liter flat four. The car is a 2.0-liter flat four.

The car is a 2.0-liter flat four. The car is a 2.0-liter flat four.

The car is a 2.0-liter flat four. The car is a 2.0-liter flat four.

The car is a 2.0-liter flat four. The car is a 2.0-liter flat four.

The car is a 2.0-liter flat four. The car is a 2.0-liter flat four.

The car is a 2.0-liter flat four. The car is a 2.0-liter flat four.

The car is a 2.0-liter flat four. The car is a 2.0-liter flat four.

The car is a 2.0-liter flat four. The car is a 2.0-liter flat four.

The car is a 2.0-liter flat four. The car"
141," Volkswagen, whose diesel emissions scandal in 2015 led to the resignation of CEO Matthias Mueller.

The company said it would ""take the necessary steps to ensure that the software is properly checked and that the test results are correct"".

The company said it would also consider whether to suspend or cancel the test, which it said had been carried out by the German auto industry's largest supplier.

A German government agency, the Federal Institute for Risk Assessment, said it was aware of the incident and was examining the matter.

""We will take the necessary steps to ensure that the software is properly checked and that the test results are correct,"" a spokesman said.

The German carmaker has been under fire for its diesel emissions scandal for years, when it was revealed that the emissions of some models were at least as bad as those of its peers.<|endoftext|>The following is a guest post by K.A. Wojcik, a former student of mine and former member of the Wojcik family.

The following is a guest post by K.A. Wojcik, a former student of mine and former member of the Wojcik family.

I was raised in a conservative household. My father was a professional baseball player, but I was raised by my mother who was a homemaker. She was a ""good mother"" to me and encouraged me to be a good person, to be a good student, and to be a"
142," BMW in the way it looks, and the car is also similar to Audi in the way it sounds. The BMW's sound is more refined than Audi's, and the BMW's sound is more refined than Audi's.

The BMW is a very popular car in Japan. It is one of the most popular cars in the world, and it is also one of the most popular cars in Japan. The BMW is also one of the most popular cars in Japan, so if you are a Japanese car enthusiast who wants to know about the BMW, you should probably check out this article.

The BMW is the most popular car in Japan, and the most popular car in Japan.

The BMW is the most popular car in Japan.

The BMW is the most popular car in Japan.

The BMW is the most popular car in Japan.

The BMW is the most popular car in Japan.

The BMW is the most popular car in Japan.

The BMW is the most popular car in Japan.

The BMW is the most popular car in Japan.

The BMW is the most popular car in Japan.

The BMW is the most popular car in Japan.

The BMW is the most popular car in Japan.

The BMW is the most popular car in Japan.

The BMW is the most popular car in Japan.

The BMW is the most popular car in Japan.

The BMW is the"
