244," Porsche in that it's a mass market brand and it doesn't have a specific niche. It's about providing the best possible experience for customers.

And that's what we're doing with the new Audi Q3. It's a very high-end car, it's got a lot of performance, but it's very affordable. It's also very well-built. It's got a lot of quality, and it's also very affordable.

So we're able to do all of that with a very low price.

And that's the reason why we're very happy with the performance of the car. It's very good in terms of performance, but it's also very affordable.

So we're able to offer it at a very low price, which is very important for us.

Q: How much of the Q3 is the engine?

A: Right now, we have one cylinder engine. We will have two cylinders, and we will have the engine with all the performance of the car.

Q: The car is a lot of power. How much power does it have?

A: It's a lot. It's a very good car, but it's not the most powerful car in the world.

Q: But it's not the most powerful car in the world.

A: It's not, but it's not the most powerful car in the world, either.

Q"
245," Ferrari, but with a more modern design and more high end components. The car is based on the Maserati Ghibli. The styling is similar to the Ferrari and the car has been sold in the US for the last few years. The car is manufactured by Honda and is sold around the world.

The car is priced between $80,000 and $100,000 depending on the condition of the car and the condition of the paint.

The car has been sold for a while now and has been on the market for some time. The car was last sold in China in 2011. The car is now being sold in the US for the first time.

The car has a very good reputation in China and is owned by a Chinese family. The car is very popular in China. The car has a good reputation in China and is owned by a Chinese family.

The car is a very popular car in China and there are many buyers looking for a similar car in the US. The car is a very popular car in China and there are many buyers looking for a similar car in the US.

The car is listed on the California State Lottery website with a winning bid of $5,000.

The car is owned by Richard and Elizabeth Ziegler, who live in New Jersey. The car is owned by Richard and Elizabeth Ziegler, who live in New Jersey.

The car was sold by the Ziegler"
246," the Volkswagen Group, which has been leading the industry in the area of electric vehicles since the introduction of the Volkswagen e-Golf in 2005.

The company plans to introduce a range of electric vehicles to customers starting in 2018, with a new model being launched in 2020.

The company has also announced that it will join forces with the German carmaker Volkswagen AG to develop an electric vehicle range of up to 200 miles.

In July, Tesla Motors announced that it had signed a deal with Volkswagen AG to build its electric vehicle range of between 130 and 150 miles.<|endoftext|>The New York Times has published an article entitled ""Why the Republican Party Is Growing Stronger Than Ever,"" which is written by the Times' editorial page editor, Paul Krugman.

Krugman's article is a continuation of his recent ""Why the Republican Party Is Growing Stronger Than Ever"" column, which was published on July 23.

The column is a response to the Republican establishment's failure to address the concerns and concerns of the American people, and instead continues to persecute Trump supporters.

Krugman writes:

The Republican Party is growing stronger than ever, and it is also growing more polarized.

For example, the number of Republicans who support Trump is at an all-time high, and he is now leading among Republicans in national polls by double digits.

He is also leading among Republicans in a majority of swing states.

He is"
247," Porsche, which has a similar name.

The German automaker has been dogged by controversy in recent years over its stance on emissions, and is currently embroiled in a lawsuit with the US Environmental Protection Agency (EPA) over its alleged use of diesel engines in its cars.

The company said it is committed to reducing emissions and will offer a range of alternative fuel vehicles in the future.

German car brands are struggling to compete with the likes of Audi and BMW, which have been building up production capacity.

The Daimler AG (DAIGn.DE) brand also has a strong presence in the US market, with the Daimler X1, Daimler X5 and Daimler X6 all making it onto the US luxury car market.

The Daimler brand has seen its share price rise by almost 20% over the past year.

Follow Dave Lee on Twitter @DaveLeeBBC<|endoftext|>A former top executive at the Department of Homeland Security (DHS) has admitted that his agency was aware that a former Guantánamo detainee was planning to attack the United States.

Michael Chertoff, a former acting assistant secretary of defense for intelligence, told a Senate panel that he was aware that Khalid Sheikh Mohammed (KSM), the former detainee who was held at the notorious prison in Cuba for years, was planning to carry out an attack at a Christmas tree lighting ceremony in New Jersey.

However, despite the"
248," Ferrari, which is owned by Fiat Chrysler Automobiles. It has been selling cars in the US since the early 1980s.

The company has also been involved in other automotive projects. In 2004, it was involved in the development of the first electric car, the Prius, which was launched in 2008.

It also was one of the first companies to produce the first electric car, the Tesla Model S, which was launched in 2011.

The company is also developing a range of electric cars, including the Tesla Model 3, which is due to be launched in 2017.

The company is also the world's largest car maker by sales, having sold more than a million vehicles in the US since 2010.

Tesla's share price fell by more than 10 per cent in after-hours trading on Friday, after the company announced it would stop producing cars in the US.<|endoftext|>JACKSONVILLE, Fla. -- The Jacksonville Jaguars believe they have a chance to be the first team in NFL history to win the Super Bowl with a team with a winning record.

The Jaguars, who have won the NFC South since 2004, are 8-2 since the start of last season, and their nine-game winning streak has them at 8-1.

Jaguars owner Shad Khan said Sunday he believes the team is capable of winning the Super Bowl, and he believes the team is capable of winning the Super Bowl with a team that has a winning record"
249," the Toyota Prius; except it's also more fuel efficient than the Prius.

The Prius has been around since 2007, but Toyota has been making these cars for a while. The Prius is a hybrid, meaning it's both electric and gas-electric, but the car is still a plug-in hybrid.

It's the same technology that powers the Prius Plug-In Hybrid, but the Prius also has an electric motor.

The Prius is available in three models: the Prius Plug-In Hybrid, the Prius Prime, and the Prius Premier.

The Prius Prime is the most expensive of the three, but it's also the most fuel efficient. The Prius Premier is the least expensive, but it's also the most fuel efficient.

The Prius plug-in hybrid is the most fuel efficient car on the market, but it has one major disadvantage: it's a bit expensive.

The Prius Plug-In Hybrid costs $35,000, compared to the $27,000 Prius Prime for the same model.

The Prius Prime has been around since 2007, but Toyota has been making these cars for a while. The Prius Prime is a hybrid, meaning it's both electric and gas-electric, but the car is still a plug-in hybrid.

The Prius Prime has been around since 2007, but Toyota has been making these cars for a"
250," Mercedes-Benz in its design and is known for its sleek and streamlined design. The Kia Soul is also considered to be one of the most luxurious cars in the world.

The first models were announced in September 2016, and were delivered in May 2017.<|endoftext|>A new study has found that the common belief that the human brain is a ""neural machine"" that is linked to our emotions is incorrect.

The study, published in the journal NeuroImage, found that the brain's electrical activity is not a single unit, but rather a network of thousands of individual neurons.

""When we think about the brain, we think of it as a collection of neurons, but it's quite different,"" study co-author Dr. James H. Grier, a neuroscientist at the University of Texas at Austin, told the BBC.

The researchers found that the connections between neurons are not just one-way signals, but also act as a feedback loop.

""It's like a system that's responding to a signal,"" Grier explained. ""So, if you get a signal, it has the potential to trigger another signal, and so on.""

To make the connection between the brain's electrical activity and emotions, the researchers used a technique called functional magnetic resonance imaging (fMRI).

The researchers used the fMRI scanner to create a 3D model of the brain.

The researchers then used this model to create a virtual image"
251," the Fiat 500, which was introduced in 1992.

The new car is being sold at the Geneva Motor Show.

The Fiat 500 will be available in two versions, the standard and premium models.<|endoftext|>The head of the U.S. Department of Homeland Security has said he is ""not suggesting that President Trump is an enemy of the United States.""

""I am not suggesting that President Trump is an enemy of the United States,"" Homeland Security Secretary John Kelly said in an interview with The Associated Press on Monday. ""I think it is very important to note that the president has the highest level of confidence in me. I have been very loyal to him. I have dealt with him very respectfully and I have been very loyal to my department.""

Kelly is the first known senior official to speak out about Trump's controversial executive order on immigration. He has also spoken out about the ban on refugees from seven Muslim-majority countries and the travel ban targeting people from Iraq, Syria, Iran, Sudan, Libya and Somalia.

Kelly said he has been ""convinced"" by Trump's executive order to enforce it, which was signed on Friday.

""I think that the president has the utmost respect for the office of the presidency,"" Kelly said. ""And I think that the president has the utmost respect for the office of the presidency.""

Kelly said he has been in contact with Trump and other senior White House officials, including Vice President Mike Pence,"
252," Mercedes-Benz, Audi and BMW.

The company is owned by Volkswagen Group, which is the world's biggest car maker.

The company has not responded to a request for comment.<|endoftext|>The San Francisco 49ers are in the midst of a rebuild.

General manager Trent Baalke said Thursday he would not be willing to let Colin Kaepernick walk when the 49ers begin the process of acquiring a quarterback.

""I'm not going to let him walk,"" Baalke said. ""I love him. I love the guy. I love the guy's family. I love the guy. I think he's a great competitor. He's a great person. I think he's a great player. And I think he's a great football player.

""I'm not going to let him walk. I love him. I love the guy. I love the guy's family. I love the guy. I think he's a great competitor. He's a great player. I think he's a great player. And I think he's a great football player. And I think he's a great football player. And I think he's a great football player. And I think he's a great football player.""

Kaepernick, who has been out of the league since being arrested last month for allegedly assaulting a female reporter, is expected to meet with the 49ers on Friday.

The 49ers have been linked to the likes of Minnesota Vikings quarterback"
253," Audi, BMW and Mercedes-Benz, and its cars are often used for business trips and leisure trips.

The company has a presence in the UK, France, Germany, Italy, Spain and the Netherlands.

It has also developed several luxury cars, including the Mercedes-Benz S-Class, which was launched in 2010, and the BMW X5.<|endoftext|>The world's most famous and feared supercar, the McLaren P1, is going to be retired in its current form.

The British supercar, which is the pinnacle of muscle car design and performance, has been beset by problems since it was released in the 1960s.

It has suffered from engine problems, reliability problems and reliability problems, all of which have been exacerbated by the fact that the car is now only available in three versions: the P1 Red, P1 Black and P1 Silver.

The P1 Red, which is the most expensive of the three, is currently the most popular car in the world, with more than 1 million sold.

The P1 Black and P1 Silver are the second- and third-most popular cars, respectively, with more than 3.5 million sold.

The P1 Red is the most expensive McLaren P1 in the world at £350,000. The P1 Black is £250,000 and the P1 Silver is £200,000.

The P1 Red is currently the most popular car"
254," Toyota and Honda, but it uses a more compact engine. The Civic is not a sports car, but it's a compact sports car.

The Civic has a number of technical features that make it an attractive SUV.

It's not a sports car, but it's a compact sports car.

The Civic is not a sports car, but it's a compact sports car.

The Civic uses a rear-wheel drive system, which makes it more fuel-efficient.

The Civic is not a sports car, but it's a compact sports car.

The Civic has a number of technical features that make it an attractive SUV.

It's not a sports car, but it's a compact sports car.

The Civic uses a rear-wheel drive system, which makes it more fuel-efficient.

The Civic is not a sports car, but it's a compact sports car.

The Civic uses a rear-wheel drive system, which makes it more fuel-efficient.

The Civic is not a sports car, but it's a compact sports car.

The Civic uses a rear-wheel drive system, which makes it more fuel-efficient.

The Civic is not a sports car, but it's a compact sports car.

The Civic uses a rear-wheel drive system, which makes it more fuel-efficient.

The Civic is not a sports car, but it's a"
255," Porsche, with its iconic 911 and Cayenne models, but it's also the only one of its kind in the world. The Cayenne is the most popular car in North America, but it's also the most expensive.

The Porsche Cayenne was first introduced in 1989. It's a compact, high performance car that's also very popular in Europe. It's been around for more than 20 years, and has become a worldwide icon. It's one of the most popular cars in North America, and it's also one of the most expensive.

This car is on the road in California and it's not available for sale to the public yet, but if you're in the area, you might want to check out this video of the car's launch.

This Porsche Cayenne is available for sale right now for $9,495, and you can get one for $8,995. The car is listed on the North American website as a ""production model,"" not a performance model. The price is a bit high, but you're paying $9,495 for a car that's not available for sale yet.

There's a lot of information on the website, so we'll be covering it as much as we can. We'll be updating this story as more information becomes available.

Porsche Cayenne on eBay

Porsche Cayenne on Craigslist<|endoftext|>The third installment of the ""The Walking Dead"" series is set to hit television"
256," Volkswagen, but is owned by Volkswagen Group AG.

In the statement released on Tuesday, Volkswagen said: ""We are deeply saddened by this news, and our thoughts and prayers are with the family.""

The company said it was working with authorities to determine the cause of the crash.<|endoftext|>I had a great time at the 2014 Consumer Electronics Show. I was able to meet some amazing people, meet some great new products, and see what's new in the industry. I was also able to meet some amazing hardware and software developers.

I had a great time at the 2014 Consumer Electronics Show. I was able to meet some amazing people, meet some great new products, and see what's new in the industry. I was also able to meet some amazing hardware and software developers.

I had a great time at the 2014 Consumer Electronics Show. I was able to meet some amazing people, meet some great new products, and see what's new in the industry. I was also able to meet some amazing hardware and software developers.

I had a great time at the 2014 Consumer Electronics Show. I was able to meet some amazing people, meet some great new products, and see what's new in the industry. I was also able to meet some amazing hardware and software developers.

I had a great time at the 2014 Consumer Electronics Show. I was able to meet some amazing people, meet some great new products, and see what's new in the industry."
257," BMW, but the engine is different. It's a 2.0-liter inline four-cylinder engine with a six-speed manual transmission.

The car is available in two trim levels: the standard version with a base price of $19,350, and the Premium with a base price of $27,350.

The new car will be sold in only three markets: Detroit, Michigan; Chicago, Illinois; and Los Angeles, California.

The price of the base version of the car will be $26,950, but the price of the Premium version will be $28,950.

The new BMW M3 is the first car to be produced at the company's new plant in Hinwil, Germany.

BMW's new M3 is the first luxury sports car to be produced at its new plant in Hinwil, Germany.

The new M3 is the first luxury sports car to be produced at the company's new plant in Hinwil, Germany.

The new BMW M3 is the first car to be produced at the company's new plant in Hinwil, Germany.

The new BMW M3 is the first car to be produced at the company's new plant in Hinwil, Germany.

The new BMW M3 is the first car to be produced at the company's new plant in Hinwil, Germany.

The new BMW M3 is the first"
258," Audi, which is a car maker that has been around for nearly 100 years. However, the company has been struggling to develop its own car brand since the mid-1990s.

The company has been struggling to develop its own car brand since the mid-1990s.

The company has been struggling to develop its own car brand since the mid-1990s.

The company has been struggling to develop its own car brand since the mid-1990s.

The company has been struggling to develop its own car brand since the mid-1990s.

The company has been struggling to develop its own car brand since the mid-1990s.

The company has been struggling to develop its own car brand since the mid-1990s.

The company has been struggling to develop its own car brand since the mid-1990s.

The company has been struggling to develop its own car brand since the mid-1990s.

The company has been struggling to develop its own car brand since the mid-1990s.

The company has been struggling to develop its own car brand since the mid-1990s.

The company has been struggling to develop its own car brand since the mid-1990s.

The company has been struggling to develop its own car brand since the mid-1990s.

The company has been struggling to develop its own car brand since the mid-1990s.

The company"
259," Mercedes-Benz, BMW and Mercedes-Benz-AMG, but it is more affordable and capable of handling more complex driving situations.

For the first time, the car brand is also being used in the US.

The new SUV is the latest in a series of Mercedes-Benz crossover vehicles that will be available in the US.

The new SUV is the latest in a series of Mercedes-Benz crossover vehicles that will be available in the US

The new SUV is the latest in a series of Mercedes-Benz crossover vehicles that will be available in the US

The new SUV is the latest in a series of Mercedes-Benz crossover vehicles that will be available in the US

The new SUV is the latest in a series of Mercedes-Benz crossover vehicles that will be available in the US

The new SUV is the latest in a series of Mercedes-Benz crossover vehicles that will be available in the US

The new SUV is the latest in a series of Mercedes-Benz crossover vehicles that will be available in the US

The new SUV is the latest in a series of Mercedes-Benz crossover vehicles that will be available in the US

The new SUV is the latest in a series of Mercedes-Benz crossover vehicles that will be available in the US

The new SUV is the latest in a series of Mercedes-Benz crossover vehicles that will be available in the US

The new SUV is the latest in a series of Mercedes-"
260," Mercedes-Benz, which is based in Germany.

Image copyright Getty Images Image caption The car brand has been criticised for its handling of the crisis in Ukraine

The company says it has been in talks with the Ukrainian government to resolve the crisis in Crimea.

It says it is also seeking to resolve the situation in eastern Ukraine, where Russia has been backing pro-Russian separatists.

But it says it has been unable to find a solution to the crisis in eastern Ukraine, and that it is working with the Ukrainian government.

The company says it has conducted a review of its business in Ukraine, and is in the process of reviewing its business in Russia.

The company says it is also in the process of reviewing its business in the European Union, and will ""continue to review our business in the EU and beyond"".<|endoftext|>Flights from Sydney to Melbourne are scheduled to be suspended between the start of this month and the end of April, with the cancellation of flights to the US, and the cancellation of flights to Singapore, due to the ongoing standoff between the Turkish government and the Kurdish People's Protection Units (YPG).

Turkish Airlines said on Friday that it will suspend all flights to the US for the next three months, and will cancel flights to Singapore for the next two months due to the ongoing conflict between the Turkish government and the YPG.

The Turkish Airlines statement also said that it will not fly to the US for the next three months."
261," Honda, with its iconic red and white nose and distinctive, ""A"" shaped headlights. Nissan is a bit more modern and has a more muscular design, but it's still the same car.

The Nissan Leaf has a range of about 200 miles on a single charge, and it weighs about 200 pounds. It's also slightly bigger than the Honda Leaf, which is about the same size as the Toyota Prius.

The Leaf is available in three colors: black, silver and red. The black Leaf is available with a range of about 200 miles on a single charge, and it weighs about 200 pounds. The black Leaf is available with a range of about 200 miles on a single charge, and it weighs about 200 pounds.

The Leaf is a great choice for people who want to buy a vehicle that isn't only easy to drive but also comfortable.

It's also great for those who like to drive a lot of miles without feeling like they're on the road.

The Leaf is a great choice for people who want to buy a vehicle that isn't only easy to drive but also comfortable.

It's also great for those who like to drive a lot of miles without feeling like they're on the road.

The Leaf is a great choice for people who want to buy a vehicle that isn't only easy to drive but also comfortable.

The Leaf is a great choice for people who want to buy a vehicle that isn't only"
262," Mercedes-Benz, the world's largest car maker.

The new car will be one of the biggest ever built by a major automaker, and it will be the first to utilize an electric drivetrain.

The new car will be the first of a series of new electric vehicles that will be developed by Tesla Motors and its partners.

The new car will be the first of a series of new electric vehicles that will be developed by Tesla Motors and its partners. The new car will be the first of a series of new electric vehicles that will be developed by Tesla Motors and its partners.

Musk said the car will be an ""exceptionally powerful"" car that will be ""the best selling SUV in history.""

The car will be an ""exceptionally powerful"" car that will be ""the best selling SUV in history.""

Musk has said the car will be the first electric vehicle to be built in the United States since the first production Model S was released in 2011.

The new car will be the first of a series of new electric vehicles that will be developed by Tesla Motors and its partners.

The new car will be the first of a series of new electric vehicles that will be developed by Tesla Motors and its partners.

The new car will be the first of a series of new electric vehicles that will be developed by Tesla Motors and its partners.

The new car will be the first of a series"
263," BMW in that it uses a large central body and a central rear diffuser. Its exterior styling is similar to that of the M3, and it is fitted with a rear and front spoiler. The car has been used in some racing events, but not on the road. It is seen in the movie ""Road Rage"" and the TV series ""Road Rash"". A few examples of this car were seen in the movie ""Road Rage"" and the TV series ""Road Rash"".


The car was used in the movie ""Road Rage"" and the TV series ""Road Rash"". A few examples of this car were seen in the movie ""Road Rage"" and the TV series ""Road Rash"". The car was seen in the movie ""Road Rage"" and the TV series ""Road Rash"". The car was used in the movie ""Road Rage"" and the TV series ""Road Rash"". The car was used in the movie ""Road Rage"" and the TV series ""Road Rash"". The car was used in the movie ""Road Rage"" and the TV series ""Road Rash"". The car was used in the movie ""Road Rage"" and the TV series ""Road Rash"". The car was used in the movie ""Road Rage"" and the TV series ""Road Rash"". The car was used in the movie ""Road Rage"" and the TV series ""Road Rash"". The car was used in the movie ""Road Rage"" and the TV series ""Road Rash"". The car was used in the movie """
