366," Ferrari, but the styling is different.

The car's name is a portmanteau of the words ""Honda"", ""Lola"" and ""Luxembourg"".

The car is a hybrid, which means it is powered by two separate electric motors.

It is also powered by a turbocharged petrol engine.

The car's only competitor is the Audi R8 that is being launched by Audi.

The car is being made in Lille, France, and will be sold in the UK by the end of this year.

The car is expected to be launched in the UK in 2016 and it will be available in the US, Canada and Germany.<|endoftext|>The following is a list of all the characters that appear in the series.

Contents show]

Uncanny X-Men

Uncanny X-Men

The Uncanny X-Men is a group of mutant students who are sent to Earth-616 to learn how to live in the real world. They are sent by Professor Xavier to find out the truth about the X-Men.

The Uncanny X-Men's first assignment is to investigate the disappearance of Professor X and his students, Professor Charles Xavier and Professor Jean Grey. They are sent to the future to learn about the future of mutants. They are sent to the future to find out the truth about the X-Men.

The Uncanny X-Men's second"
367," the current Hennessey Venom GT, with a similar shape to the current model, but with a lighter weight and a more aggressive stance.

The new car is expected to be unveiled at the Geneva Motor Show in May.<|endoftext|>The UESPWiki – Your source for The Elder Scrolls since 1995

This article is about the quest. For the quest, see The Fade (Quest).

This quest is part of The Fade.

The Fade is a quest in The Elder Scrolls V: Skyrim.

Detailed Walkthrough [ edit ]

After having been defeated in the Fade, you will be reunited with my mother, who tells you that you are to meet with her at the Lighthouse.

Detailed Walkthrough [ edit ]

Approach the Lighthouse [ edit ]

To reach the Lighthouse, you will need to travel from the south to the north. The only way to the north is through the gate at the end of the bridge.

At the end of the bridge, you will find a small group of bandits. They are very hostile, and will attack you if you approach them. They will also attack you if you talk to them.

When you arrive at the lighthouse, you will be attacked by a group of bandits. An NPC will be standing at the entrance to the lighthouse.

Talk to the NPC [ edit ]

The NPC will tell you that you have to talk"
368," its current crop of sports cars, which have been developed in partnership with Audi, but the new car will be powered by a 1.5-litre turbocharged four-cylinder engine.

The new car will be powered by a 1.5-litre turbocharged four-cylinder engine

The car will be released in two form factors: the standard car and a more premium model.

The new car will be the first of its kind to feature a fully-fledged rear wing, and it will also feature a carbon fibre rear wing.

The carbon fiber rear wing will be fitted to the car's front wing, while the rear wing will be made from carbon fibre.

It is also expected that the car will have a carbon fibre roof, front grille and rear spoiler.

The car will also feature a new carbon fibre roof, front grille and rear spoiler.

The new car will also feature a new carbon fibre roof, front grille and rear spoiler. The car will also feature a new carbon fibre roof, front grille and rear spoiler

The car will be equipped with a new carbon fibre roof, front grille and rear spoiler.

These new features will be offered as standard on all variants of the car, including the standard and premium versions, and the car will also be fitted with a carbon fibre roof, front grille and rear spoiler.

The car will also feature a carbon fibre roof"
369," a Volkswagen, but has many other attributes such as a more spacious interior, better fuel economy and better fuel economy than the VW.

The new model will be available in the U.S. in the 2016 model year.<|endoftext|>The US President has been asked by the BBC to explain his decision to cancel the annual G8 summit in Northern Ireland.

Mr Trump's decision to cancel the summit has been criticised by the Irish government, who say it is politically motivated.

He said he was ""not going to dignify that with a comment"".

The US President has been asked by the BBC to explain his decision to cancel the annual G8 summit in Northern Ireland.

He said he was ""not going to dignify that with a comment"".

The cancellation of the G8 summit in Northern Ireland comes after the US President's decision to pull out of the Paris climate accord.

The announcement came just weeks after US President Donald Trump signed an executive order to withdraw from the Paris climate deal.

The decision has been criticised by the Irish government, who say it is politically motivated.

US President Donald Trump is seen in his car as he arrives at the White House in Washington, DC, U.S., March 11, 2017. REUTERS/Joshua Roberts

""The President's decision to withdraw from the Paris Climate Agreement is a major setback to American leadership in the fight against climate change,"" said Irish Foreign Minister Charlie Flanagan.
"
370," the Kia Soul, but it's a more affordable version. The Soul is a hardtop car that sells for $35,000 and has a starting price of $37,000. It's also available as a sedan and coupe.

The new model, which goes on sale in 2016, is expected to be a crossover that will be offered with either a four-door or a five-door sedan.

The car brand is similar to the Kia Soul, but it's a more affordable version. The Soul is a hardtop car that sells for $35,000 and has a starting price of $37,000. It's also available as a sedan and coupe. The new model, which goes on sale in 2016, is expected to be a crossover that will be offered with either a four-door or a five-door sedan. The new model, which goes on sale in 2016, is expected to be a crossover that will be offered with either a four-door or a five-door sedan. The new model, which goes on sale in 2016, is expected to be a crossover that will be offered with either a four-door or a five-door sedan. The new model, which goes on sale in 2016, is expected to be a crossover that will be offered with either a four-door or a five-door sedan. The new model, which goes on sale in 2016, is expected to be a crossover that will be offered with"
371," a VW Beetle, but the exterior is actually more like a Lamborghini.

The car brand is similar to a VW Beetle, but the exterior is actually more like a Lamborghini. The interior is more like a Porsche.

The interior is more like a Porsche. The car is more like a Ferrari.

The car is more like a Ferrari. The car has a more aggressive theme.

The car has a more aggressive theme. The car is more like a Lamborghini.

The car is more like a Lamborghini. The car has more of a sports car theme.

The car has more of a sports car theme. The car is more like a Lamborghini.

The car has more of a sports car theme. The car is more like a Lamborghini.

The car is more like a Lamborghini. The car has more of a supercar theme.

The car has more of a supercar theme. The car is more like a Lamborghini.

The car is more like a Lamborghini. The car has more of a sports car theme.

The car has more of a sports car theme. The car is more like a Lamborghini.

The car is more like a Lamborghini. The car has more of a supercar theme.

The car has more of a supercar theme. The car is more like a Lamborgh"
372," the BMW X5, which is the most expensive car in the world.

It is still the world's most expensive car.

It is also the most expensive car in the world to own, according to the latest report from the car-buying website Car-buying.com.

The BMW X5 was the most expensive car in the world last year, according to the report.

It is the most expensive car in the world to own, according to the report.

The BMW X5 is the most expensive car in the world

The BMW X5 is the most expensive car in the world to own, according to the report.

It is the most expensive car in the world to own, according to the report.

The BMW X5 is the most expensive car in the world to own, according to the report.

The BMW X5 is the most expensive car in the world to own, according to the report.

The BMW X5 is the most expensive car in the world to own, according to the report.

The BMW X5 is the most expensive car in the world to own, according to the report.

The BMW X5 is the most expensive car in the world to own, according to the report.

The BMW X5 is the most expensive car in the world to own, according to the report.

The BMW X5 is the most expensive car"
373," Porsche in terms of styling and design, and its cars are often compared to those of Mercedes-Benz.

The car brand is similar to Porsche in terms of styling and design, and its cars are often compared to those of Mercedes-Benz. The car brand's flagship cars are the 911 Turbo and the 911 Turbo S.

The car brand's flagship cars are the 911 Turbo and the 911 Turbo S. The Porsche 911 GT3 RS is the most expensive Porsche ever sold.

The Porsche 911 GT3 RS is the most expensive Porsche ever sold. The Porsche 911 GT3 RS is the most expensive Porsche ever sold. The Porsche 911 GT3 RS is the most expensive Porsche ever sold. The Porsche 911 GT3 RS is the most expensive Porsche ever sold. The Porsche 911 GT3 RS is the most expensive Porsche ever sold. The Porsche 911 GT3 RS is the most expensive Porsche ever sold. The Porsche 911 GT3 RS is the most expensive Porsche ever sold. The Porsche 911 GT3 RS is the most expensive Porsche ever sold. The Porsche 911 GT3 RS is the most expensive Porsche ever sold. The Porsche 911 GT3 RS is the most expensive Porsche ever sold. The Porsche 911 GT3 RS is the most expensive Porsche ever sold. The Porsche 911 GT3 RS is the most expensive Porsche ever sold. The Porsche 911 GT3 RS is the most expensive Porsche ever sold. The Porsche 911 GT3 RS is the most expensive Porsche ever sold. The Porsche 911 GT"
374," Honda's Civic, and is available in two sizes: the small hatchback and the large sedan.

The small hatchback is a modest sedan that comes with a 5-speed manual transmission with a 2.6-liter turbocharged engine. The small hatchback also offers a standard 7-inch touchscreen display, a rearview camera, and heated front seats.

The large sedan is a premium sedan that starts at $30,000 and goes up to $40,000 depending on the trim level.

The new Honda Civic will be available in the U.S. starting this fall.

Honda Civic

The Honda Civic is a compact sedan that comes equipped with a 6-speed manual transmission with a 2.6-liter turbocharged engine. The Civic starts at $28,000 and goes up to $35,000 depending on the trim level.

Honda Civic

The Honda Civic is a compact sedan that comes equipped with a 6-speed manual transmission with a 2.6-liter turbocharged engine. The Civic starts at $28,000 and goes up to $35,000 depending on the trim level.

The Honda Civic is a compact sedan that comes equipped with a 6-speed manual transmission with a 2.6-liter turbocharged engine. The Civic starts at $28,000 and goes up to $35,000 depending on the trim level.

The Honda Civic is a compact sedan that comes"
375," the Subaru Impreza and Toyota Camry, both of which are produced in Japan.

The company has been looking to expand into the U.S. market for years, but the decision to move production to the U.S. was made in the wake of the Fukushima Daiichi nuclear disaster.

The company says it plans to open a plant in the state of Massachusetts next year to make the new vehicles.

The new cars will be sold in the U.S. in two models: the Sport and the Sport Plus.

The Sport model will have a base price of $25,000 and will combine a four-speed automatic transmission with a six-speed manual. The Sport Plus will have a base price of $30,000 and will combine a six-speed manual with a four-speed automatic transmission.

The new cars will feature a front fascia that will feature LED headlights and LED taillights, and an air intake and exhaust system. The car will also come with a headlight retractor, a rearview camera, a rearview camera with LED night vision, and a rearview camera with LED daytime vision.

The cars will be available in four colors: black, gray, silver, and black with white stitching.

The new models will be available in the U.S. in two models: the Sport and the Sport Plus.

The new cars will be sold in the U.S. in"
376," the Mercedes-Benz S-Class, which has a range of over 300 miles depending on the model, and it is so popular that it was even named after it.

The car was spotted at the event, but the official release of the car is very vague and the details are not clear. The car is said to be a 2018 Mercedes-Benz S-Class, which is expected to be unveiled at the Frankfurt Motor Show.

We will keep you updated on this story as it develops.<|endoftext|>A new study in the journal PLOS ONE has uncovered a possible link between a genetic variant in a gene called CYP2D6 that is linked to obesity and autism.

The study, conducted by researchers at the University of California, San Francisco, and the University of Rochester, found that children with this genetic variant are more likely to be diagnosed with autism spectrum disorder (ASD) and therefore have a greater risk of developing the disorder at an early age.

""This study provides the first evidence that the CYP2D6 gene is involved in the development of ASD,"" said lead author Dr. Lizzie B. Brown, professor in the Department of Psychiatry at UCSF School of Medicine and UCSF Medical Center. ""This study demonstrates that this gene is a genetic risk factor for developing ASD, and also provides an opportunity to identify the genetic risk factors that may be associated with ASD.""

The researchers studied the CYP2D6 gene in more"
377," that of Ford, but it's been redesigned to be more affordable, and its new models are more competitive with its rivals.

The new models are the Focus RS, a compact sports sedan, and the Focus RS Plus, a sporty sedan.

""The Focus RS is a good example of a car that has been designed around the needs of a specific market,"" said J.D. Power and Associates analyst Doug Nadelmann. ""That's what makes it so popular in America.""

The Focus RS is a six-door sedan that makes the most of the Focus RS's compact size. It has a 2.5-liter turbocharged four-cylinder engine that produces 172 horsepower and 160 pound-feet of torque.

The Focus RS Plus is a four-door sedan that makes more of an effort to be a sports car. It has a 2.5-liter turbocharged four-cylinder engine that produces 192 horsepower and 156 pound-feet of torque.

The Focus RS is similar to that of Ford, but it's been redesigned to be more affordable, and its new models are more competitive with its rivals.

""The Focus RS is a good example of a car that has been designed around the needs of a specific market,"" said J.D. Power and Associates analyst Doug Nadelmann. ""That's what makes it so popular in America.""

The Focus RS is a compact sports sedan that makes the most of"
378," BMW, but it's not a BMW, it's an Audi. The Audi is a bit more subtle, more subtle than the BMW. It's got a nice, modern, sophisticated look. It's got a bit more character, a bit more personality. It's got a bit more personality than the BMW. But, the BMW is also a bit more sporty, a bit more aggressive, a bit more sophisticated, a bit more luxurious. So, it's a bit more sporty and a bit more aggressive. But, it's not a BMW. It's an Audi.

Q: What's the difference between the Audi and the BMW?

A: The Audi is a bit more sporty, a bit more aggressive, a bit more sophisticated, a bit more luxurious. But, it's not a BMW. It's an Audi.

Q: What's the difference between the Audi and the BMW?

A: The Audi is a bit more sporty, a bit more aggressive, a bit more sophisticated, a bit more luxurious. But, it's not a BMW. It's an Audi.

Q: What's the difference between the Audi and the BMW?

A: The Audi is a bit more sporty, a bit more aggressive, a bit more sophisticated, a bit more luxurious. But, it's not a BMW. It's an Audi.

Q: What's the difference between the Audi and the BMW"
379," Mercedes-Benz and Porsche. However, the company's powertrain is different. The Mercedes-Benz E-Class is powered by a 1.0-liter turbocharged engine. The Porsche Cayenne is powered by a 1.5-liter turbocharged engine. The new Porsche 918 Spyder is powered by a 1.6-liter turbocharged engine.

The new Porsche 918 Spyder has been designed by Porsche's engineering team and will be available with a range of powertrains. The new Porsche 918 Spyder will be available with the 1.0-liter turbocharged engine and the 1.5-liter turbocharged engine.

The new Porsche 918 Spyder will be available with the 1.0-liter turbocharged engine and the 1.5-liter turbocharged engine. The new Porsche 918 Spyder will be available with the 1.6-liter turbocharged engine.

The new Porsche 918 Spyder will be available with the 1.6-liter turbocharged engine. The new Porsche 918 Spyder will be available with the 1.8-liter turbocharged engine.

The new Porsche 918 Spyder will be available with the 1.8-liter turbocharged engine. The new Porsche 918 Spyder will be available with the 2.0-liter turbocharged engine.

The new Porsche 918 Spyder will be available with the 2.0-liter turbocharged engine. The new"
380," Ford in the US, where it has a significant presence. It also has a presence in the UK, where it is a subsidiary of Ford.

Ford is also planning to launch its own electric car in the UK in the coming years.

The company has already launched hybrids in the US, but has not yet announced plans for a US-only model.

The company has previously said it will introduce a plug-in hybrid car in the UK by 2021.

The new Ford Focus is expected to arrive in Britain in the summer of 2017.

Ford has also confirmed plans to build a new factory in China to manufacture the Focus, which is expected to be announced as early as next year.<|endoftext|>A US state department official in charge of international security affairs, Matthew Olsen, was forced to resign by President Trump on Monday after his department was accused of failing to do enough to fight the Islamic State (IS).

Olsen, the US ambassador to the United Nations, was forced to resign after it emerged that he had been interviewed by the FBI in the run-up to the presidential election.

While the Trump administration has yet to announce any changes to the secretary of state's duties, the scandal has cast a shadow over the Trump administration's relationship with the US intelligence community, which has been accused of failing to do enough to counter the Islamic State (IS) group.

The Trump administration has been dogged by questions over its administration's relationship with the"
381," Ford, which is owned by the same parent company, but the company has been expanding its presence in the U.S. with a new SUV line.

If you're looking for a car you can afford, the Ford Focus is a great choice. The brand has a sub-$30,000 price tag and the car is available in seven colors and is backed by a 3.7-liter V6 engine.

Check out the Ford Focus in the gallery below.<|endoftext|>This article is a player stub. You can help Liquipedia by expanding it.

is a professional StarCraft II player from the United States who has played for Team Liquid, Team Empire, and Team Dignitas.

Biography [ edit ]

Racial Distribution [ edit ]

Protoss Terran Zerg Random Round of 32 6 2 Round of 16 5 1 Round of 8 3 1 Round of 4 2 1 Round of 3 2 1 Round of 2 1 1 Round of 1 1 1 Total 32 14 24

Team Achievements [ edit ]

Interviews [ edit ]

2018 [ edit ]

2017 [ edit ]

2016 [ edit ]

2015 [ edit ]

2014 [ edit ]

2013 [ edit ]

2012 [ edit ]<|endoftext|>The right to privacy is not a right to be ignored. It is a right to be respected.

Privacy is not a right to be ignored. It is a right to be respected.

"
382," Audi, which has been the largest car maker in India for the past two years.

The company is also planning to invest $1 billion in India by 2020.<|endoftext|>The National Women's Soccer League (NWSL) is a professional women's professional soccer league in the United States and Canada. The league began in 2014 and is currently in its second season. The NWSL currently has six teams, three of which are in the United States. The league's schedule includes the 2016 season, which will begin on November 3rd. The league is also looking to expand in 2017.

The NWSL is the first professional women's professional soccer league to be formed in the United States.

The league is based in the United States, and consists of a 16-team league (eight teams in the United States, two in Canada), one division (NWSL East), one conference (NWSL West), and one division (NWSL Central). The league's 16 teams are split into two conferences, one in the United States and one in Canada.

The league is owned by the U.S. Soccer Federation (USSF), which is a wholly owned subsidiary of the United States Soccer Federation (USSF).

The NWSL has won five of its six teams to date. The NWSL season is scheduled to begin on November 3rd at the start of the 2016 NWSL regular season.

The NWSL is the first women's professional soccer league in the"
383," BMW, but it's more affordable. In fact, the $18,000 price tag is just $6,000 more than the BMW i3, which is only available in the US.

The BMW i3 is available in five different colors, and the i3s come in the red, white, blue and black. The i3s come with a six-speed manual transmission, while the i3s with the automatic are available with a six-speed automatic option.

The i3s come with a six-speed manual transmission, while the i3s with the automatic are available with a six-speed automatic option. The i3s come with a six-speed manual transmission and the i3s with the automatic are available with a six-speed automatic.

The i3s come with a six-speed manual transmission and the i3s with the automatic are available with a six-speed automatic option. The i3s come with a six-speed manual transmission and the i3s with the automatic are available with a six-speed automatic option. The i3s comes with a six-speed manual transmission and the i3s with the automatic are available with a six-speed automatic option.

The i3s comes with a six-speed manual transmission and the i3s with the automatic are available with a six-speed automatic option. The i3s comes with a six-speed manual transmission and the i"
384," Honda, but with a more aggressive stance. The new model, which is expected to go on sale in the second quarter of 2014, will be classified as a sports car, which means it will be equipped with a six-speed manual transmission.

The car is expected to be available in three colors: black, silver and red. The base model will be priced at $44,400. The new model is expected to cost $68,400.<|endoftext|>The ""Right to Be Forgotten"" Law is a federal law that allows people to request that government agencies remove information from their records if they believe it is irrelevant to a criminal investigation.

The law was passed in 2000 by Congress and signed into law by President Bill Clinton in June 2001. It was designed to help prevent the government from keeping records of people who have been convicted of a crime.

The law allows people to request that government agencies remove information from their records if they believe it is irrelevant to a criminal investigation.

Some countries, including the United States, have attempted to use the law to keep information out of the public eye. The law was passed in response to a lawsuit filed by the American Civil Liberties Union in 2005. The ACLU argued that the law violated the First Amendment rights of Americans who were sued for defamation.

However, because the law only applies to the government, it is unlikely that the government will use the law to keep information from the public, said Robert I. Bork, a"
385," the Ford Focus, which is a hybrid car. The Focus is a four-door car that is powered by a hybrid engine. The Focus is available in three models: a standard model, which has a two-cylinder engine, and a sport model, which has a three-cylinder engine. The sport model features a five-speed automatic transmission, while the standard model features a six-speed manual transmission.

The Focus RS and Focus RS Sport will be available in 14 colors, including black, red, white, yellow, silver, white, pink, blue, green, yellow, orange, red, and purple.

The Focus RS will be available in a base price of $27,995, while the Focus RS Sport will be available in a base price of $30,000.

Advertisement

The new Focus RS and Focus RS Sport will be available in the U.S. beginning in September.

The Focus RS is expected to be available in October.

Advertisement

The Focus RS will be available in the U.S. beginning in September.

The Focus RS will be available in the U.S. beginning in September.<|endoftext|>A new report from the Center for Immigration Studies finds that the average cost of a single-family home in the U.S. has increased by over 400 percent since 1980.

The report, ""The Cost of Cheap Housing in the U.S.,"" finds that the average home"
