101," Mercedes-Benz, with a sleek, sporty design that's similar to the BMW 5 Series. It's got a 4.0-liter V8 engine, which produces 420 horsepower and 430 lb-ft of torque.

The new model has a sporty look, as well. The exterior is painted in a bright green and silver, with a new grille and taillight shading the headlights and rear grille.

The interior is a bit more subdued, with leather seats and a sporty steering wheel. The steering wheel has a larger touchpad and a larger center console, but it's not as cluttered as the Mercedes-Benz 5 Series.

The new model is expected to hit the US market in early 2016, with a suggested retail price of $37,495.

The Mercedes-Benz 5 Series is a compact sedan with a 5-speed manual transmission.

The company is also expected to introduce new models for the BMW 5 Series, which is a sporty compact sedan with a 5-speed manual transmission.

The new 5 Series will be similar to the Mercedes-Benz 5 Series, with a sporty design, which is similar to the BMW 5 Series.<|endoftext|>In a special episode of the podcast, I discuss the latest news from the NFL Scouting Combine. I cover the latest news from the combine, including the news that the Patriots have selected safety Jabar Gaffney with the first overall pick in the draft.
"
102," Ferrari and Lamborghini, but has been known for its extreme design for a while. It's not as flashy as some of the other cars out there, but it's still a fun car to drive.

The car company is also rebranding its line of cars with a new logo, but that's not the only new thing the company is doing.

The new logo features a more subtle design that will make it easier to differentiate the brand from the rest of the car industry. The company is also using a new color scheme, which is supposed to give the car a more modern look.

The new logo is expected to be unveiled at the New York Auto Show in September.<|endoftext|>The following are the results of a survey on the opinions of potential candidates for president of the United States. The survey was conducted by the University of Michigan's Project on Government Oversight and the Center for Public Integrity.

The survey was conducted in January 2016 and has a margin of error of plus or minus 3.8 percentage points.

View the full poll results here.

When it comes to the economy, The Washington Post's poll found that the public generally thinks the U.S. economy is doing well, but some publics believe that the economy is not doing well.

The poll also found that the public has a favorable view of the Democratic nominee, Hillary Clinton, but that the public has a negative view of Donald Trump, whose approval rating has dropped"
103," BMW, Mercedes-Benz and Audi in terms of design and technology. They are all very powerful and if you look at the design of the cars, you can see that they are very well-designed.

We really did not have the luxury of the BMWs but we did have the luxury of the Mercedes-Benz and the Audi. We had the luxury of the Volvo and the BMWs.

I think the cars are very good.

So you think that the brand now has more than the BMWs?

Yes.

You think that the brand has more than the Audi and the BMWs?

Yes.

What are your thoughts on the future of the brand?

I think that the brand has been in a very good position for many decades.

I think that the brand will continue to be in a good position because it is very well-known in the industry.

The brand has been in a very good position for many decades.

And I think that the brand is going to continue to be in a good position because it is very well-known in the industry.

The brand has been in a very good position for many decades.

And I think that the brand is going to continue to be in a good position because it is very well-known in the industry.

I think the brand is going to continue to be in a good position because it is very well-known"
104," BMW, but it's a bit less flashy, and comes in a range of colours. The base model is priced at £49,590, and can be had with either a manual or electric drivetrain.

The interior is a bit more conventional than BMW's, with a traditional leather top and seat, but features a range of options. There are two USB ports, a power-on button, a rearview camera, and a rearview camera mirror. The steering wheel can be changed to a touch-screen, and the centre console has a large touchpad.

The center console has a large touchpad.

The front seats are standard, but there's a fold-down fold-up sofa for those who want to sit back. There's a fold-down rear seat, and the full-size rear seat can be folded up. The rear seats are also available with the optional fold-down multi-point seat.

The car is available with either an electric or manual drivetrain, but the electric drivetrain is more powerful, and the manual is more comfortable. There's a range of electric and petrol versions, and the petrol version is priced at £29,990.

The new Audi A3 is a pretty big car, and it's got a lot of power.

The A3 is a bit of a departure from the standard A3, which is a car that's got a lot of power, and has a lot"
105," Toyota, which has been accused of using its dominant Japanese market share to its advantage.

The company has also been accused of using its dominant position in the global auto market to gain a competitive edge in the US market.

The Chinese company has also been accused of using its dominant position in the global auto market to gain a competitive edge in the US market.

A Chinese carmaker is facing scrutiny over allegations that it used its dominant position in the global auto market to gain an edge in America.

A Chinese carmaker is facing scrutiny over allegations that it used its dominant position in the global auto market to gain an edge in America.

Chinese carmaker Daimler has been accused of using its dominant position in the global auto market to gain an edge in the US market.

The company has also been accused of using its dominant position in the global auto market to gain a competitive edge in the US market.

The company has also been accused of using its dominant position in the global auto market to gain a competitive edge in the US market.

A Chinese carmaker is facing scrutiny over allegations that it used its dominant position in the global auto market to gain an edge in the US market.

The company has also been accused of using its dominant position in the global auto market to gain a competitive edge in the US market.

A Chinese carmaker is facing scrutiny over allegations that it used its dominant position in the global auto market to"
106," the Fiat 500, but has been designed with the passenger in mind.

It's based on the Fiat 500C, but with a few more features.

It's based on the Fiat 500C, but with a few more features.

This is a very different car from the Fiat 500.

It's based on the Fiat 500, but with a few more features.

The Fiat 500 is based on the Fiat 500.

It's based on the Fiat 500, but with a few more features.

It's based on the Fiat 500, but with a few more features.

It's based on the Fiat 500, but with a few more features.

It's based on the Fiat 500, but with a few more features.

It's based on the Fiat 500, but with a few more features.

It's based on the Fiat 500, but with a few more features.

It's based on the Fiat 500, but with a few more features.

It's based on the Fiat 500, but with a few more features.

It's based on the Fiat 500, but with a few more features.

It's based on the Fiat 500, but with a few more features.

It's based on the Fiat 500, but with a few more features.

It's based on the Fiat 500, but with a few more features.

It's"
107," the Ferrari Enzo, but with a longer wheelbase.

As is the case with the Enzo, the car is more than capable of handling the high-speed bumps and corners that come with such a high-performance car. The car's chassis is more than capable of handling the handling of the high-speed bumps and corners that come with such a high-performance car.

The car's suspension is also more than capable of handling the high-speed bumps and corners that come with such a high-performance car. The car's suspension is also more than capable of handling the high-speed bumps and corners that come with such a high-performance car.

The car's brakes are also more than capable of handling the high-speed bumps and corners that come with such a high-performance car. The car's brakes are also more than capable of handling the high-speed bumps and corners that come with such a high-performance car.

The car's steering is also more than capable of handling the high-speed bumps and corners that come with such a high-performance car. The car's steering is also more than capable of handling the high-speed bumps and corners that come with such a high-performance car.

The car's suspension is also more than capable of handling the high-speed bumps and corners that come with such a high-performance car. The car's suspension is also more than capable of handling the high-speed bumps and corners"
108," Ferrari in that the front wheels are made of aluminium, but the rear wheels are made of carbon fibre.

The car is also known as the R8 and is basically a hybrid sports car with a diesel engine.

The R8 has been designed to be two-seater with a rear-wheel drive system.

The car is currently being developed by the German company Koenigsegg, which is owned by Volkswagen Group.

The car will be released in 2019.

Image copyright Getty Images Image caption The R8 is basically a hybrid sports car with a diesel engine

The company is part of Volkswagen Group, which is owned by the German government.

The company's chief executive Matthias Mueller said the company was considering the product to be a ""significant customer"".

""We are very confident that the R8 will be a significant customer for Koenigsegg,"" he said.

""The R8 will be a significant customer for us and we are very excited about it.""

The car will be sold in the US and will be available in the UK in 2018, he added.

The car is being developed by Koenigsegg and is based on the company's current R8 sports car.

The R8 will be sold in the US and the UK in 2018, and will be available in the UK in 2018.

The car has been designed to be two-seater with the rear"
109," Ford and has been a big part of the automaker's success, but the company is also facing a tough time in Europe, where it is struggling to maintain its brand.

The company said the new model will be available in select markets in the United States, Canada, and Mexico.

The new Ford Focus is expected to be the first model to be built in Mexico, where Ford has been struggling to maintain its brand.

The company said the Focus will be available in the United States, Canada, and Mexico.

Ford has been struggling to maintain its brand in the United States and has struggled to sell its Silverado pickup truck in the past.

Ford has also been struggling to keep up with the demand for its popular F-150 SUV, which has seen a drop in sales in recent years.

The company has been struggling to keep up with other automakers and has lost market share to General Motors.

Ford is also struggling to keep up with the demand for its popular F-150 SUV, which has seen a drop in sales in recent years.

The company has also been struggling to keep up with the demand for its popular F-150 SUV, which has seen a drop in sales in recent years.

Ford is also struggling to keep up with the demand for its popular F-150 SUV, which has seen a drop in sales in recent years.

The new Ford Focus is expected to be the first model to be"
110," the Ferrari F430 Scuderia, which has a 3.8-litre turbocharged V6 engine, and has a 5-speed manual gearbox.

The 2017 Ferrari F430 Scuderia is expected to debut in the U.S. in 2017, although it may not debut until 2018.

There is currently no set price for the car.<|endoftext|>A $20 million upgrade to the old Brackenridge Street Bridge is nearing completion, and it's expected to open to traffic in May.

The bridge is one of six in the city that will be restored to its former glory over the next few years. The other six are being built at a cost of $18 million each.

The Brackenridge Street Bridge is expected to open to traffic in May.

The bridge was built in 1873, and it was the first bridge in the city to be built over a river.

The bridge is one of six in the city that will be restored to its former glory over the next few years. The other six are being built at a cost of $18 million each.

The bridge will be the first to be completely rebuilt since the Brackenridge Street Bridge was built in 1873.

The work will include replacing the lower deck of the bridge, and replacing the bridge's wooden deck and the wooden support beams.

The deck will be replaced with a steel deck that will be installed in the"
111," Toyota, Nissan and Volkswagen.

The company has been embroiled in a number of controversies in recent years, including claims that it was selling cars with faulty emission controls, and that it had used fake documents to get its cars on the market.

The company has said that it will not make any changes to its manufacturing operations until the issue is resolved.

The company has also been accused of being a dodgy vehicle manufacturer, with some claiming that its vehicles were more prone to accidents than those produced by other manufacturers.<|endoftext|>At the beginning of the month, I had a conversation with a fellow blogger about the topic of ""how to be an MVP."" He said that he was doing a lot of thinking about how to do that, and that he was finding that he was becoming frustrated. He said that he had a lot of questions, and he was starting to feel like he was being asked too many questions. He said that he was trying to understand the MVP process, and that he was seeing that the MVP process is not being understood.

I was thinking about the MVP process a lot, and I wanted to share with you what I had to say.

The MVP process is not being explained to the public.

There is a lot of discussion about the MVP process, and it is one of the most important topics in the MVP world. It is very important to understand the MVP process and how it relates to the MVP process.

What is the MVP"
112," Volkswagen, but with a cleaner design, a higher fuel economy and better fuel economy than its predecessor. It also has a unique design that allows it to be a hybrid.

""With the new E-Class, we are making the most of the powertrain technology that has been developed for the E-Class,"" said Doug Berman, senior vice president of global product management for VW. ""We have added a number of features to the E-Class, such as a more efficient and quieter powertrain, and the addition of a front airbag for extra protection.""

The E-Class will be available in the United States starting in February.

The E-Class will be available in the United States starting in February.

The E-Class will be available in the United States starting in February.

The E-Class will be available in the United States starting in February.

The E-Class will be available in the United States starting in February.

The E-Class will be available in the United States starting in February.

The E-Class will be available in the United States starting in February.

The E-Class will be available in the United States starting in February.

The E-Class will be available in the United States starting in February.

The E-Class will be available in the United States starting in February.

The E-Class will be available in the United States starting in February"
113," the BMW i3, but is a bit smaller and lighter.

The car has a range of about 300 miles on a single charge.

The company says the vehicle is designed to be used in conjunction with a range of electric vehicles such as Tesla Model S.

The new model is expected to go on sale in early 2017.<|endoftext|>The next time you see a guy in a suit and tie, you might want to take a moment to consider the possibility that he's a man.

A new study released Wednesday by the U.S. Centers for Disease Control and Prevention suggests that men are more likely to die from heart attacks, strokes and other forms of heart trouble than women.

The study, which looked at data from 7,000 men and women in the U.S., found that men are about twice as likely as women to die from heart attacks, strokes and other forms of heart trouble.

The study found that heart attacks, strokes and other heart problems accounted for about a quarter of all deaths in men and about a third of deaths in women.

The study's authors said that this would suggest that men are more likely to die from heart problems that are preventable, such as smoking, alcohol and high blood pressure.<|endoftext|>The last time I visited the UK for a few days, I was in Glasgow and it was the first time I had seen a new park in the city. I had been to the old park in the suburbs"
114," Mercedes-Benz, with a similar lineup of models, but the brand has a smaller footprint in the US.

The Mercedes-Benz SL, the company's first luxury sedan, was introduced in 2010 and currently sells for $145,000. The SL is a direct-injection model with a 3.0-liter turbocharged engine and all-wheel drive.<|endoftext|>Story highlights The man shot in the head is in critical condition

""I'm not going to let this stop me,"" he said

(CNN) The man who was shot and killed by police in Baton Rouge, Louisiana, on Sunday has died, police said.

The man was shot in the head and pronounced dead at the scene.

The shooting took place early Sunday morning at the scene of a shooting in Baton Rouge, Louisiana, according to a statement from the Baton Rouge Police Department.

The man was identified as 22-year-old Alton Sterling.

Police said officers responded to a call of shots fired at a residence in the 500 block of South Lamar Street, about 22 miles northwest of Baton Rouge.

Read More<|endoftext|>The U.S. Supreme Court on Thursday ruled that a Colorado law that requires voters to show photo identification before casting a ballot violated the rights of minorities and the poor.

The justices ruled 5-4 that the law, which requires voters to show photo ID to cast a ballot, violated the right to vote. The ruling, which"
115," Toyota in that it has a lineup of models that are sold in many different configurations. The Toyota Prius is a plug-in hybrid car, while the Ford Focus is a plug-in hybrid car.

The Ford Focus is the most popular plug-in hybrid car in the US, with more than 200,000 sold in the first six months of 2014. The Ford Focus is also the most popular plug-in hybrid car in Europe, where it sells more than 150,000 cars.

The Ford Focus is also the most popular plug-in hybrid car in Europe, where it sells more than 150,000 cars. The Toyota Prius is the most popular plug-in hybrid car in the US, with more than 100,000 sold in the first six months of 2014.

The Ford Focus is the most popular plug-in hybrid car in the US, with more than 100,000 sold in the first six months of 2014. The Toyota Prius is the most popular plug-in hybrid car in the US, with more than 100,000 sold in the first six months of 2014. The Ford Focus is the most popular plug-in hybrid car in the US, with more than 100,000 sold in the first six months of 2014.

The Ford Focus is the most popular plug-in hybrid car in the US, with more than 100,000 sold in the first six months of 2014. The Toyota Prius is the most popular plug-in"
116," Honda, but with a slightly different look. The main differences are that Honda's logo is green instead of black, and the car's roof and rear roof spoiler are made of carbon fibre. The company's new flagship, the Civic Type R, is also a hybrid, but it will be released in 2017.

The new Civic Type R will have an engine of three cylinders and a fuel-injected engine with a maximum output of 160bhp. It will be powered by a 1.8-litre V6 petrol engine and a 6.0-litre V8 diesel engine. The petrol engine will be paired with a six-speed manual transmission.

Honda has also developed a hybrid version of the Type R, the Civic Type R Hybrid, which will be powered by a 1.6-litre V6 petrol engine and a 6.0-litre V8 diesel engine. It will be paired with a six-speed manual transmission.

The new Civic Type R Hybrid will be offered with two different engines, the standard turbocharged and the V6 petrol. The turbocharged engine will be used to power the rear wheels, while the V6 petrol engine will be used to power the front wheels.

The hybrid version of the Type R will be available in the US beginning in 2016, while the V6 petrol version will be available in Japan in 2017.

The new hybrid version of the Type R will be available in the US"
117," the Volkswagen brand, which is also based in Germany.

The car company said it hoped to launch a range of new models in the next year.

The announcement comes after Volkswagen's chief executive Martin Winterkorn said that the company was planning to introduce its own electric cars by the end of the decade.

The company also said that it would invest more than $6bn (£4.2bn) into the UK's electric vehicle industry by 2020.

The company has been criticised for its diesel emissions cheating scandal, which has seen more than 6,000 cars and trucks worldwide equipped with software that allows them to cheat on emissions tests.

The scandal has led to penalties for Volkswagen and its executives, including a five-year ban from driving cars in the UK.

The company has also been hit with a fine of $18.8bn (£12.3bn) by US regulators.<|endoftext|>When the Atlanta Hawks used the No. 4 pick in the 2015 NBA Draft to select Markelle Fultz with the No. 1 overall pick, the media was all over it. What was the team's plan for Fultz?

They were going to use the pick on a big man who could make the jump from the D-League to the NBA.

The hype was so great, that the media even gave Fultz the nickname ""The Big 3.""

Randy Wittman, the Hawks' head coach, was one of"
118," Toyota, but its cars are produced in a smaller factory and its production lines are smaller.

The company has been in business since the 1920s and its vehicles are typically sold in small numbers.

Toyota has been making cars since the 1970s and its cars are typically sold in small numbers.

If the UK government approves the deal, it will create a new trading unit for the company and will increase its presence in the UK in a number of ways. It will be able to import parts from the UK, provide services to the UK market, and sell the cars to the UK market.

It will also be able to trade its cars in the UK and to sell parts to the UK market.

Toyota will be able to export parts to the UK through its supply chain, which is based in the UK, and it will be able to sell parts to the UK market through the UK supply chain.

The company also said it would be able to use its existing operations in the UK, in the UK and around the world.

The UK government said: ""We are delighted that Toyota is making a significant investment in our country and the UK economy by bringing together our automotive industry, which is one of the largest in the world.

""The UK government will continue to invest in the automotive industry by supporting the UK's automotive industry and ensuring that we attract the best and brightest to the UK.""

The country's car industry has"
119," Audi, but has a better reputation for quality and reliability.

The brand is also known for its high-end sports cars, which are priced between €100,000 and €150,000.

The brand is also known for its high-end sports cars, which are priced between €100,000 and €150,000.

The brand is also known for its high-end sports cars, which are priced between €100,000 and €150,000.

The brand is also known for its high-end sports cars, which are priced between €100,000 and €150,000.

The brand is also known for its high-end sports cars, which are priced between €100,000 and €150,000.

The brand is also known for its high-end sports cars, which are priced between €100,000 and €150,000.

The brand is also known for its high-end sports cars, which are priced between €100,000 and €150,000.

The brand is also known for its high-end sports cars, which are priced between €100,000 and €150,000.

The brand is also known for its high-end sports cars, which are priced between €100,000 and €150,000.

The brand is also known for its high-end sports cars, which are priced between €100,000 and €150,"
120," BMW in its technological approach, but it has been more successful with its hybrid offerings, which are the most popular.

The company still has a long way to go, but the company's new concept car, the E-Class, is a step in the right direction. It is a sleek, all-electric sports car that will be available in the U.S. in late 2017.

The car's design is similar to BMW's concept car, the all-electric sports car, the E-Class.

""We are proud to share our vision for a new generation of electric mobility vehicles with the American public,"" said Ron Giamatti, president and CEO of BMW Group North America. ""We are taking a bold step forward to connect our customers to the future.""

The E-Class is a compact, all-electric sports car that will be available in the U.S. in late 2017.

The company's new concept car, the E-Class, is a sleek, all-electric sports car that will be available in the U.S. in late 2017.

The car's design is similar to BMW's concept car, the all-electric sports car, the E-Class.

The car's design is similar to BMW's concept car, the all-electric sports car, the E-Class.

The new concept car, the E-Class, is a sleek, all-electric sports car that"
