,Jeep is similar to,Subaru is similar to,Dodge is similar to,Tesla is similar to,Toyota is similar to,Honda is similar to,Nissan is similar to,Chevrolet is similar to,Hyundai is similar to,Mazda is similar to,Renault is similar to,Lamborghini is similar to,Mercedes-Benz is similar to,BMW is similar to,Ford is similar to,Porsche is similar to,Audi is similar to,Volkswagen is similar to,Ferrari is similar to,Lexus is similar to,Volvo is similar to
0," the Jeep Cherokee, but has been designed from the ground up with the passenger in mind. It is heavy and sporty, with a sporty look that is balanced by comfort and fuel economy.

The Jeep Wrangler is a sporty, all-wheel-drive vehicle with a top speed of around 55 mph. The vehicle is capable of reaching speeds of more than 200 mph.

The Jeep Wrangler is built around the 5.7-liter V6 engine that is paired with a six-speed manual transmission. The engine is a four-valve supercharged engine with the ability to produce a maximum of 5.3 hp and 5.6 lb-ft of torque. The engine is connected to a six-speed dual-clutch automatic transmission that can be used with a six-speed manual or six-speed automatic transmission.

The Jeep Wrangler has a top speed of about 70 mph and a top speed of about 80 mph when the Jeep Wrangler is equipped with a four-speed automatic transmission.

The Jeep Wrangler is available in four different body styles:

All-Wheel-Drive, with the option of a six-speed manual or six-speed automatic transmission.

All-Wheel-Drive, with the option of a six-speed manual or six-speed automatic transmission. Limited-Slip Differential (LSD), with the option of a six-speed manual or six-speed automatic transmission.

Limited"," the other characters in the series, but he does not have the same personality or traits as his counterparts, and thus he is not seen as a member of the gang. He is also seen to be a very smart and intelligent person, and he is seen to be a very good student, as he has the ability to read people's minds and understand their thoughts. He is also shown to be a good listener, as he is able to understand and understand the feelings of others, as well as understand their feelings, as he is able to listen to the feelings of his friend, and he is able to understand others emotions. He is also shown to be very good at math and reading, as he is able to understand the math behind the story, and he is able to do it quickly. He is also shown to be very good at sports, as he is able to play basketball and soccer, as well as excel at basketball, even after being bullied by Natsuki Subaru. He is also shown to be an excellent and competitive person, as he is able to play soccer, and compete against Subaru, as well as Subaru's friends, even after being bullied by Natsuki Subaru.

Personality Edit

Despite being a strong character, Subaru is not the type of person who would be interested in being friends with anyone, and he would not want to be friends with anyone. He is a serious and serious person, who would rather be a student to train his mind. He is the"," the previous version of the Dodge and it has a shorter wheelbase and less aggressive stance. However, Dodge has a rear wheel drive system that allows it to be driven on all-wheel drive. The Dodge is also the first car in the world to offer a rear wheel drive system.

The Dodge is available in two sizes, the S and the XL, both with a base price of $46,900. The S model is available with a base price of $47,900 and the XL model is available with a base price of $50,900.

Dodge has also created a new Dodge Challenger SRT8 that will be available in November. The Challenger SRT8 is a fully-electric vehicle that is capable of a range of up to 160 miles on a single charge. The Challenger SRT8 is powered by a 1.5-liter four-cylinder engine producing 280 horsepower and 290 lb-ft of torque. The Challenger SRT8 is powered by a six-speed manual transmission, which is available with either a manual or automatic transmission.

A new generation of the Dodge Challenger SRT8 will be available in 2015, bringing the range to a total of 200 miles on a single charge.

Dodge has also announced that it will be introducing a new generation of the Dodge Challenger SRT8 in 2016. The Challenger SRT8 will be available in a base price of $62,900 and with a range of 200 miles on"," Tesla Motors, but it's a more sophisticated, more powerful electric vehicle,"" he said.

Tesla's battery is capable of storing up to 1,000 miles of range, according to the company.

""This is a very good start, but we're working on it,"" said Mr. Musk. He said the company is working with other car companies on electric cars.

""We'll be working on a lot of things in the future, but we're not going to stop until there's a lot of cars on the road,"" he said.

Tesla is also developing a self-driving car, which it expects to debut in 2018.<|endoftext|>The Wizards have signed veteran guard Patrick Beverley to a two-year, $30 million deal, the team announced Wednesday. Beverley, 37, averaged 12.6 points, 4.4 rebounds and 1.5 blocks per game for the Los Angeles Lakers in 2014-15. He also averaged 9.7 points and 3.9 rebounds in 44 games for the Phoenix Suns.

Beverley, who was drafted by the Wizards in the seventh round of the 1996 NBA draft, spent the 2013-14 season with the Phoenix Suns, averaging 8.6 points, 2.3 rebounds and 1.8 blocks per game. He also averaged 7.9 points and 2.1 rebounds in 27 games for the Sacramento Kings.

The 6-foot-6, 230-pound Beverley was selected by"," Uber in that it is a ride-sharing company that operates in a very different world compared to Uber's ride-sharing.

Uber's drivers are also not licensed.

That means that their insurance policies are not up to the same standards as the Uber drivers.

Uber is also more regulated and has much stricter rules than Lyft.

Lyft drivers are also required to have a license.

The difference between Uber and Lyft is that Uber drivers are licensed, so they can get insurance and be inspected by the regulators.

Uber drivers are also required to have a driver's license.

In addition, Uber drivers are required to have a car insurance policy.

Uber drivers are also required to have an approved driver's training course.

Uber drivers are also required to have a driver's license.

Uber drivers are also required to have a driver's license.

Lyft drivers are also required to have a driver's license.

Lyft drivers are also required to have a driver's license.

Uber drivers are also required to have a driver's license.

Lyft drivers are also required to have a driver's license.

Uber drivers are also required to have a driver's license.

Lyft drivers are also required to have a driver's license.

Uber drivers are also required to have a driver's license.

Lyft drivers are also required to have a driver's license"," the Honda Accord, but it has a different engine. It's called the V6 and it produces 400 horsepower and 400 pound-feet of torque.

The Honda Civic is based on the Civic Type R, and it produces 400 horsepower and 400 pound-feet of torque.

The Honda Civic is similar to the Honda Accord, but it has a different engine. It's called the V6 and it produces 400 horsepower and 400 pound-feet of torque.

The Honda Civic is similar to the Honda Accord, but it has a different engine. It's called the V6 and it produces 400 horsepower and 400 pound-feet of torque.

The Honda Civic is similar to the Honda Accord, but it has a different engine. It's called the V6 and it produces 400 horsepower and 400 pound-feet of torque.

The Honda Civic is similar to the Honda Accord, but it has a different engine. It's called the V6 and it produces 400 horsepower and 400 pound-feet of torque.

The Honda Civic is similar to the Honda Accord, but it has a different engine. It's called the V6 and it produces 400 horsepower and 400 pound-feet of torque.

The Honda Civic is similar to the Honda Accord, but it has a different engine. It's called the V6 and it produces 400 horsepower and 400 pound-feet of torque.

The Honda Civic is similar to the Honda Accord, but it has a"," Tesla in this respect. It uses a battery pack. It's a battery pack that can be charged through an electric motor. It's an electric vehicle that's driven by solar panels, and it's a battery pack that can be used to store energy. So it's actually a very efficient way to store energy.

I'm not sure that you could say that Tesla is a more efficient way to store energy than Nissan, but I think it's a very different way to store energy.

Nissan, if you look at the history of battery technology, it's been a very, very slow evolution. It's been in the laboratory for a while, and then it's been in the market for a while. It's only recently that it's been in the market for a while.

So it's been a very slow evolution. It's been in the laboratory for a while, and then it's been in the market for a while.

So I think the thing that is really interesting is that when we started talking about the battery, we were talking about batteries that were more efficient than the current battery technology. We were talking about batteries that were more efficient than lithium-ion, and we were talking about batteries that were more efficient than lithium-air.

And we were talking about batteries that were more efficient than lithium-polymer, and we were talking about batteries that were more efficient than lithium-cadmium.

And we were"," GM in that it is a hybrid car company, but it's built its own electric vehicle, the Chevrolet Bolt, and the Chevy Bolt EV.

The Bolt EV is a mid-size sedan that is powered by a plug-in hybrid engine. It's a very good choice for people looking for a mid-size car that's not too heavy and doesn't need to be driven quite as much.

The Bolt EV has a range of about 200 miles, which is pretty good for a mid-sized car. It's also the first car to be built with a fully electric motor, so it's a bit different from the Chevy Volt, which uses a gasoline engine to power the car.

The Bolt is a bit more expensive than the Volt, but it's still a good choice if you're looking to get into the mid-size car market.

The Bolt EV is available in two models: the Bolt EV 2 and Bolt EV 3. The 2 is a mid-size sedan with a starting price of $35,000, while the 3 is a more powerful version of the Bolt EV with a starting price of $40,000.

The Bolt EV 2 is a bit lighter and less expensive than the Bolt EV 3, and it comes with a couple of extra features. The most notable of which is that it comes with an 8-inch touchscreen display, which makes it a bit easier to navigate the car.

The Bolt EV 2 is"," Hyundai in that it has a huge number of models that are available in different color schemes, and its vehicles are also sold in different countries.

However, Hyundai's Korean division is the only one that can compete with Toyota's U.S. division, and it has been able to do so thanks to its much larger global sales.

The company also has a much better track record in Europe than it did in Japan, where the sales of the Mazda3 and Lexus are much lower.

In the U.S., the Toyota Prius is the only car that is sold in the U.S. with a hybrid engine, and the Toyota Camry is the only car that is sold in the U.S. with a gasoline engine.

The Toyota Prius has been the No. 1-selling vehicle in the U.S. for over a decade, and the Toyota Camry has been the No. 1-selling car in the U.S. for over a decade.

Toyota's sales in Europe have been boosted by the introduction of the Prius, which is now sold in almost every European country except the UK.

Of the 15 models sold in Europe, the Toyota Camry is the only one that is sold in the U.S.

The Toyota Prius has been the No. 1-selling vehicle in the U.S. for over a decade, and the Toyota Camry has been the No."," Volkswagen in that it is a carmaker that has been around for over 30 years, but it has been around for only four decades.

The company has been struggling with its image and reputation, and it has been a major player in the automotive industry for over 50 years.

The company is now in the process of buying back some of its assets, but it will have to do so in a way that allows it to keep its brand and its reputation.

In the meantime, it has been selling off some of its assets, including its U.S. production plants, and it is looking to reshape its operations to make sure it can remain relevant in the future.

The company has been trying to change its image since the early 1990s, when it began to sell its cars in Europe.

It began selling a number of models in the U.S. in the 1990s, and it has been selling cars in Europe since 2001.

But the company has been struggling with its image and reputation, and it has been a major player in the automotive industry for over 50 years.

The company has been trying to change its image since the early 1990s, when it began to sell its cars in Europe.

It began selling a number of models in the U.S. in the 1990s, and it has been selling cars in Europe since 2001.

The company has been struggling with its image and reputation, and it"," the Renault-Nissan alliance in that it has a few key advantages over its competitors, especially in terms of fuel economy, emissions and pricing.

Renault shares fell 0.8% to US$1.36 at 12:42 BST on Friday.

The company is also in the midst of a restructuring that will see it sell off its sports cars business and its hybrid business, the Renault Sport and Renault Energy brands.

The company has also said it will sell off its electric vehicle business, which it had tried to do in the past.

The Renault Group is the world's second-biggest automaker, with sales of cars and trucks accounting for more than half of its total output.<|endoftext|>The following blog post, unless otherwise noted, was written by a member of Gamasutra's community.

The thoughts and opinions expressed are those of the writer and not Gamasutra or its parent company.

I've always been a big fan of game development. I've worked on several AAA games, and always loved the work I was doing. I was also a huge fan of software development. I've worked on a few software projects in the past, and I've always loved the work I was doing. I was also a huge fan of game development. I've worked on a few software projects in the past, and I've always loved the work I was doing. I was also a huge fan of game development. I've worked on"," the McLaren F1, which is another example of a company that has been successful in the world of sports cars.

""I think the Lamborghini is the most successful sports car in the world,"" said Lamborghini founder Antonio Pagani.

""It's a supercar that has a history of being successful and always has been successful. It's the most successful sports car in the world.""

Lamborghini has been very successful in the world of sports cars, with the Lamborghini Gallardo, the Lamborghini Huracan and the Lamborghini Huracan S being all successful cars.

The Lamborghini Gallardo is the most successful sports car in the world, with the Lamborghini Huracan and the Lamborghini Huracan S being all successful cars.

The Lamborghini Gallardo, the Lamborghini Huracan and the Lamborghini Huracan S are all successful sports cars.

The Lamborghini Gallardo, the Lamborghini Huracan and the Lamborghini Huracan S are all successful sports cars.

In a statement, Lamborghini said: ""Lamborghini has a long history of sports car development and the Gallardo is a great addition to our portfolio.

""The Gallardo is a sports car that is capable of winning races and has a long history of winning races.

""The Gallardo is a great sports car, and we are very"," Mercedes-Benz, but not as good. However, there are some differences, especially in terms of the features and the prices.

It has received a lot of attention from the media and enthusiasts, but is struggling to keep up with the competition. However, its performance is superb and the range of models is huge.

The Mercedes-Benz E-Class is a compact, efficient and powerful car with a high level of safety. The E-Class is also the best-selling car in the world.

The E-Class is the most popular car in Europe and is the best-selling car in the world.

The E-Class is in the top ten most popular cars in the world.

The E-Class is the fifth most popular car in the world.

The E-Class is the second most popular car in the world.

The E-Class is the fourth most popular car in the world.

The E-Class is the third most popular car in the world.

The E-Class is the second most popular car in the world.

The E-Class is the third most popular car in the world.

The E-Class is the third most popular car in the world.

The E-Class is the fourth most popular car in the world.

The E-Class is the fourth most popular car in the world.

The E-Class is the fourth most"," the Volkswagen Golf, but with a smaller engine and a lower price. The BMW M3 is also a sports car, but it's more of a family car.

If you're looking for a budget car for your next trip, check out our list of the best budget cars for a car trip.<|endoftext|>Image caption The BBC's Steve Rosenberg tells the story of the BBC's investigation into the BBC's failure to report the collapse of the World Trade Centre

The BBC has been accused of covering up the collapse of the World Trade Centre on 9 September 2001 - by failing to report that fire had engulfed the building.

A report by the BBC's Fire and Rescue Service (FRS) says it was ""not until after the collapse that the BBC began reporting the collapse"".

It says it was only after the news of the collapse was broadcast that the BBC started to report the collapse.

The BBC has denied the allegations.

The BBC said it had not been aware of the collapse until the BBC News channel was shown the footage of the collapse from a helicopter.

The BBC said that the fire department did not receive any warning that the building was collapsing until after the initial reports of the collapse.

The BBC's Fire and Rescue Service (FRS) said it had been unable to get a copy of the initial report until it was sent to the building's fire station.

The BBC said it had not been aware of the collapse until the"," the other three. He has a long, fat nose and a big mouth that he uses to bite and suck on other people's ears. He is also a master of disguise. He wears a mask that is made of straw, which he uses to hide his face from the world. He also wears a hood that he uses to hide his body from other people.

He is one of the most famous characters in the series, and is generally considered to be one of the most popular characters in the series. He is also one of the most hated characters in the series, because he is often portrayed as a villain, and often as a racist.

Contents show]

Personality

As a child, he was very shy and timid. He was also very scared, but he learned to deal with it and had a very positive outlook on life. He was also very driven and driven to succeed, and he was always looking for his next challenge. He felt that he was born with great potential, and was determined to make the best of it.

He was very ambitious and ambitious, and was very proud of his abilities. He was also very driven and driven to succeed, and was always looking for his next challenge. He felt that he was born with great potential, and was determined to make the best of it.

He was very ambitious and ambitious, and was very proud of his abilities. He was also very driven and driven to succeed, and was"," the Porsche 911 Carrera GT, but with a Porsche 918 Spyder engine (the same as the Porsche 918 Spyder), and a new front fascia. It was not revealed if the car will be offered in the US, but the Porsche 918 Spyder is available in the US.

The 918 Spyder is the first Porsche to use a 918 platform and the first car to use the new 918 engine. The 918 engine is a twin-turbocharged, 4.3-liter flat-four, and produces 370 horsepower and 420 pound-feet of torque. The engine is rated at 5,000 rpm and the peak torque is 4,000 rpm. The engine is paired to an electric motor that produces 220 horsepower and 200 pound-feet of torque. It is paired to the 911 Turbo S, which is powered by an electric motor that produces 270 horsepower and 250 pound-feet of torque.

The car will be powered by a new 918 engine that is rated at 3,000 rpm. The new engine is paired to a new, 918-based twin-turbocharged 4.0-liter flat-four and produces 272 horsepower and 245 pound-feet of torque. It is paired to the 911 Turbo S, which is powered by an electric motor that produces 280 horsepower and 260 pound-feet of torque.

The 918 Spyder will be available in the US in 2016.<|endoftext|>The first three seasons of"," the Ford Focus in that it has a flat roof, which also lets it get away with a lot of aerodynamic tricks. The Audi is powered by a 2.0-liter four-cylinder engine that produces about 250 horsepower.

The Audi is a little bigger than the Ford Focus, and it's got a higher top speed of 155 mph, but it's not going to make you go too fast. It's not going to make you go too slow either. The Audi is a little bit more fun to drive than the Ford Focus.

The Audi is a little bit more fun to drive than the Ford Focus.

I think the Audi is going to have a lot more fun than the Ford Focus.

The Audi is a little bit more fun to drive than the Ford Focus.

The Audi is a little bit more fun to drive than the Ford Focus.

The Audi is a little bit more fun to drive than the Ford Focus.

The Audi is a little bit more fun to drive than the Ford Focus.

The Audi is a little bit more fun to drive than the Ford Focus.

The Audi is a little bit more fun to drive than the Ford Focus.

The Audi is a little bit more fun to drive than the Ford Focus.

The Audi is a little bit more fun to drive than the Ford Focus.

The Audi is a little bit more fun to drive than the Ford Focus."," the company that owns the NFL's Chicago Bears.

The company is one of the world's largest carmakers.

The company, based in Wolfsburg, Germany, said in a statement that VW has ""received the results of the investigations and will continue to cooperate with them.""

VW is also one of the world's largest carmakers, and has been under investigation by the U.S. Environmental Protection Agency for its emissions scandal.

The EPA has launched a criminal investigation into Volkswagen, and the company has said it will give up diesel cars made before 2002.

The EPA said last week that it was investigating whether Volkswagen is using software to cheat on emissions tests.

The German automaker has said it will unveil a new diesel engine next month.

The EPA has said it is ""very concerned"" by the emissions scandal.

The agency has said it has found ""no evidence that the vehicles are rigged to cheat on test emissions.""

The EPA said that the cars are ""probably not cheating on emissions tests.""

The cars that the EPA has tested have a ""clean diesel"" engine, which is used in the engines of the Volkswagen Passat and Passat SportWagen.

The EPA also said that the cars tested do not have ""defeat devices"" that would have allowed the cars to cheat on emissions tests.

The agency said that the cars tested ""do not have any exhaust systems that could allow the"," the Ferrari of the 60s and 70s, but it's a bit bigger and more powerful. It's also got a lot more power compared to its predecessor.

The new Ferrari is a 5.0-litre V8 engine that produces 600bhp, thanks to a new twin-scroll turbocharger with a bore of 5.9 litres. The new engine is more powerful than the Ferrari's 5.6-litre V8, and it produces a peak torque of 523Nm, and a peak torque of 542Nm at 5500rpm.

The new Ferrari has a maximum power output of 675Nm at 7500rpm, and it has a maximum torque of 514Nm at 5500rpm.

The new Ferrari is expected to be available in two colours, black and white. Ferrari has also announced that it will introduce a new standard-definition television for the new Ferrari. The new Ferrari will be available in two sizes, the standard and super-premium, and it will be available in two powertrains, the 6.0-litre V8 and the 6.2-litre V12.

The new Ferrari is expected to be available in four engine options, including the 6.0-litre V12, the 6.2-litre V12, the 6.2-litre V12, and the 6.0-litre V12.

"," the Corvette, but with a 5.5L V8 and an electronically controlled suspension. The car is also powered by a four-speed manual transmission, and has a top speed of 205 mph.

Image 7 of 7 Image 7 of 7

Image 8 of 7 Image 8 of 7

Image 9 of 7 Image 9 of 7

Image 10 of 7 Image 10 of 7

Image 11 of 7 Image 11 of 7

Image 12 of 7 Image 12 of 7

Image 13 of 7 Image 13 of 7

Image 14 of 7 Image 14 of 7

Image 15 of 7 Image 15 of 7

Image 16 of 7 Image 16 of 7

Image 17 of 7 Image 17 of 7

Image 18 of 7 Image 18 of 7

Image 19 of 7 Image 19 of 7

Image 20 of 7 Image 20 of 7

Image 21 of 7 Image 21 of 7

Image 22 of 7 Image 22 of 7

Image 23 of 7 Image 23 of 7

Image 24 of 7 Image 24 of 7

Image 25 of 7 Image 25 of 7

Image 26 of 7 Image 26 of 7

Image 27 of 7 Image 27 of 7

Image 28 of 7 Image 28 of 7

Image 29 of 7 Image 29 of 7

Image 30 of 7 Image 30 of 7

Image 31 of 7 Image 31 of 7

Image 32 of 7 Image 32 of 7"," the BMW X5, but with a 9-speed manual transmission. The X5 is available with either a manual transmission or a CVT, and the CVT is available only in the X5 XC.

The X5 XC is available in two models: the XC, which is based on the X5 XC, and the XC Plus, which is based on the X5 XC Plus. Both models come with a six-speed manual transmission.

The X5 XC Plus features a new all-wheel drive system and is available with either a manual or CVT transmission.

The X5 XC Plus starts at $27,500, while the X5 XC starts at $29,500.

The X5 XC Plus comes with a 14-inch touchscreen display, and the X5 XC Plus Plus includes a 16-inch touchscreen display.

The X5 XC is available with either a manual or CVT transmission. The CVT is available only in the X5 XC Plus.

The X5 XC Plus starts at $28,500, while the X5 XC Plus starts at $32,500.

The X5 XC Plus Plus features a new all-wheel drive system and is available with either a manual or CVT transmission.

The X5 XC Plus Plus starts at $34,500, while the X5 XC Plus"
