14," the previous generation of Jeep Wrangler models, which were built from the ground up for the modern era of Jeep. The Wrangler is powered by a 2.4-liter, four-cylinder diesel engine which produces 320 horsepower and 149 pound-feet of torque. The Wrangler's top speed is limited to 70 mph.<|endoftext|>The most popular type of game for kids is a game called ""Candy Crush"". It's a combination of games like Tetris and Candy Crush Saga. It's a lot of fun and there are tons of ways to win.

I've been playing Candy Crush Saga since it came out and I've been having a blast. I've been playing it for about a month and I think it's really fun. The thing is, even when I'm playing it, it gets a little boring. I don't want to go to bed at night thinking about how I can beat me and my friends. I want to play with my friends and have fun.

However, that's where the fun stops.

Candy Crush Saga is one of the most popular games on the App Store. It's been downloaded over 300 million times and it's been downloaded over 1 billion times.

So what's the problem?

I'm not sure.

I think it's because the game is so easy to learn.

There's a lot of reasons why people play Candy Crush Saga. The most popular one is because it's"," the way he was in the anime, but is much more mature. He is also much more intelligent and has a greater understanding of his surroundings. He is also able to understand and understand others, and is also much more patient and calm. He is also much more intelligent and has a greater understanding of his surroundings. He is also much more intelligent and has a greater understanding of his surroundings. He is also much more intelligent and has a greater understanding of his surroundings. He is also much more intelligent and has a greater understanding of his surroundings. He is also much more intelligent and has a greater understanding of his surroundings. He is also much more intelligent and has a greater understanding of his surroundings. He is also much more intelligent and has a greater understanding of his surroundings. He is also much more intelligent and has a greater understanding of his surroundings. He is also much more intelligent and has a greater understanding of his surroundings. He is also much more intelligent and has a greater understanding of his surroundings. He is also much more intelligent and has a greater understanding of his surroundings. He is also much more intelligent and has a greater understanding of his surroundings. He is also much more intelligent and has a greater understanding of his surroundings. He is also much more intelligent and has a greater understanding of his surroundings. He is also much more intelligent and has a greater understanding of his surroundings. He is also much more intelligent and has a greater understanding of his surroundings. He is also much more intelligent and has a greater understanding of"," the Dodge Charger, with the addition of a rear spoiler, and a new front spoiler.

The Dodge Charger was introduced in 2008, and was renamed the Dodge Charger S in 2012. The Charger S is powered by a 2.0-liter inline-four that produces a claimed 306 horsepower and 295 pound-feet of torque. It also features a six-speed manual transmission, and comes standard with a six-speed automatic transmission.

The Dodge Charger S is available in a variety of trim levels including the standard ""Sport"" package which includes a widebody front fascia, a rear spoiler, a rear diffuser, a rear spoiler, and a rear spoiler.

The Dodge Charger S is available in four different color options: Silver, Gold, Blue, and Black.

The Dodge Charger S also features a front spoiler with a chrome grille that can be removed for a black or silver paint job.

The Dodge Charger S is available in two different trim levels: Standard and Sport.

The Dodge Charger S is available in a variety of trim levels including the standard ""Sport"" package which includes a widebody front fascia, a rear spoiler, a rear diffuser, a rear spoiler, and a rear spoiler.

The Dodge Charger S is available in a variety of trim levels including the standard ""Sport"" package which includes a widebody front fascia, a rear spoiler, a rear diff"," Google, but it's a little bit bigger. It's a lot harder to find. And that's the reason why it's been so difficult to get into the market.

It's not really a question of if, it's a question of when.

It's a question of when are we going to have a world where we can do this?

Follow me on Twitter.

The full interview can be found here.<|endoftext|>The World of Warcraft subreddit has been banned for violating the rules of the subreddit.

The subreddit was created by redditors in 2012, and has been used to discuss everything from the game's lore to the various characters.

Reddit's rules state that any content posted on the site must be posted in a civil manner.

The subreddit was banned for violating the rules of the subreddit.

The subreddit was banned for violating the rules of the subreddit.

The subreddit was banned for violating the rules of the subreddit.

The subreddit was banned for violating the rules of the subreddit.

The subreddit was banned for violating the rules of the subreddit.

The subreddit was banned for violating the rules of the subreddit.

The subreddit was banned for violating the rules of the subreddit.

The subreddit was banned for violating the rules of the subreddit.

The subreddit was banned for violating the rules of the subreddit.

The subreddit was banned for violating the rules of the subreddit.

"," Tesla in that it is a more advanced electric vehicle, but the difference is that Toyota is actually making a car that can be used on the highway.

The first prototype of the Toyota Prius hybrid was unveiled at the Tokyo Motor Show in June. It uses a hybrid engine that produces electricity and uses less fuel than traditional combustion engines. The Prius is not the only hybrid car on the market, but it is the first to use a hybrid engine.

The Prius is a full electric car that can go from zero to 100 miles per hour in 3.5 seconds, which is faster than the average gasoline car. The Prius can go from 0 to 60 mph in 2.7 seconds and is rated at around 220 miles per gallon.

The Prius has an impressive range of around 200 miles, but the real value comes from its fuel efficiency. The Prius is designed to go from 0 to 100 miles per hour in 3.5 seconds, which is faster than the average gasoline car. The Prius can go from 0 to 60 mph in 2.7 seconds and is rated at around 220 miles per gallon.

The Prius has an impressive range of around 200 miles, but the real value comes from its fuel efficiency. The Prius is designed to go from 0 to 100 miles per hour in 3.5 seconds, which is faster than the average gasoline car. The Prius can go from 0 to 60 mph in 2.7 seconds and is"," Toyota in the way it has a number of different models that are all similar to one another. All of the vehicles in the Honda Civic are all Honda models.

The Honda Civic is a compact car that is designed to offer a very reasonable price, while still improving on the performance of its competitors. The Civic is based on a small-block engine that uses a direct injection system and a fuel injection system that uses a turbocharger.

Honda Civic Specifications

The Honda Civic has a 3.0 liter inline-four engine that produces a total of 500 horsepower and 400 pound-feet of torque. The engine is paired with a six-speed manual transmission. The Civic is powered by a six-speed automatic transmission.

The Civic comes in six different trim levels. The Honda Civic Sport is the most expensive trim level, while the Civic Touring is the cheapest. The Civic Touring comes with a 2.0 liter inline-four engine that is paired with a six-speed manual transmission. The Civic Sport comes with a very attractive price tag, but it is not a high-performance car.

The Civic Sport comes with a 2.0 liter inline-four engine that is paired with a six-speed manual transmission. The Civic Sport comes with a very attractive price tag, but it is not a high-performance car. The Civic Touring comes with a 2.0 liter inline-four engine that is paired with a six-speed manual transmission"," BMW in that it's a mature company with a stable of vehicles. In fact, Nissan has been around for over 80 years. However, in terms of technology, Nissan has been behind the curve for decades.

The Nissan Leaf is a hybrid electric vehicle that uses hydrogen to power its electric motor. It's called an Energi and it's a hybrid because its electric motor uses hydrogen to power its engine.

The Leaf has been around since 2005 and it's currently the most popular electric vehicle on the market. It's been sold to over 2.5 billion people around the world.

The Leaf has been a great success and it's been a big hit with consumers. The Leaf has been the most popular electric vehicle in the U.S. since 2009.

In fact, the Leaf has been the most popular electric vehicle in the world since 2009.

The Leaf is a great example of how a mature company like Nissan can be successful.

Nissan has been able to stay ahead of the curve in technology because they're a mature company.

Nissan is a mature company because they have a proven product that has been around for decades.

Nissan has been able to stay ahead of the curve because they're a mature company.

Nissan has been able to stay ahead of the curve because they're a mature company.

Nissan has been able to stay ahead of the curve because they're a mature company."," the Ford and GM brands. The company has been selling cars since 1872 and has over 150 brands including Chevrolet, GMC, Chevrolet, GMC, GMC, GMC, GMC, GMC, GMC, GMC, GMC, GMC, GMC, GMC, GMC, GMC, GMC, GMC, GMC, GMC, GMC, GMC, GMC, GMC, GMC, GMC, GMC, GMC, GMC, GMC, GMC, GMC, GMC, GMC, GMC, GMC, GMC, GMC, GMC, GMC, GMC, GMC, GMC, GMC, GMC, GMC, GMC, GMC, GMC, GMC, GMC, GMC, GMC, GMC, GMC, GMC, GMC, GMC, GMC, GMC, GMC, GMC, GMC, GMC, GMC, GMC, GMC, GMC, GMC, GMC, GMC, GMC, GMC, GMC, GMC, GMC, GMC, GMC, GMC, GMC, GMC, GMC, GMC, GMC, GMC, GMC, GMC, GMC, GMC, GMC, GMC, GMC, GMC, GMC"," the Hyundai Sonata, a compact sedan that started life as a midsize sedan. The Hyundai Sonata is the only Hyundai that has a manual transmission. There are two versions of the Hyundai Sonata, the standard model and the sporty version. The standard model is available in three models: the Sonata S, S-Class, and the Sonata EX. The sporty version is available in two models: the Sonata EX and the Sonata EX Plus. The interior of the Sonata EX is very similar to the Sonata EX.

The Hyundai Sonata is one of the few compact cars in the world to offer a manual transmission. The manual transmission is available in the Sonata EX and the Sonata EX Plus. The manual transmission is available in the Sonata EX Plus and Sonata EX.

The Sonata EX is the only Hyundai to offer a manual transmission. The manual transmission is available in the Sonata EX and the Sonata EX Plus. The manual transmission is available in the Sonata EX Plus.

The manual transmission is available in the Sonata EX and the Sonata EX Plus. The manual transmission is available in the Sonata EX Plus.

The manual transmission is available in the Sonata EX Plus.

The manual transmission is available in the Sonata EX Plus.

The manual transmission is available in the Sonata EX Plus.

The manual transmission is available in the Sonata EX Plus.

"," the carmaker in that it uses a two-mode engine that produces about 150 horsepower and 110 pound-feet of torque, but it also runs on a four-speed automatic transmission.

It's not clear when Mazda will introduce the new engine, but the company has said it will arrive later this year.

The Mazda6 has been a hit with the public, and the company says the new model will be available in all states in early 2016.<|endoftext|>The last time I checked, the US was about to go through a massive economic crisis. We were in a near-full-blown recession and unemployment was at an all-time high.

The government was spending more than ever before, the banks were in trouble, and the stock market was in free fall.

This was a great time to be a conservative, right?

Not really.

And the economy didn't really recover.

The following chart shows the percentage of the US economy that was in recession in the first quarter of this year. The red line is the total. The blue line is the percentage of the economy that was in recession in the first quarter of 2014.

So there's a lot of recovery, but it's still nowhere near enough.

This chart is from the Government Accountability Office, which tracks the way the government calculates the numbers that the government uses to estimate the economy's health. The chart above shows that in the first quarter of 2014, the"," Mercedes in that it's a big car, and has a lot of power. It's a big car, but it's also a big car with a lot of weight. It's not like Ferrari, which is a big car with a lot of weight.

""The problem is that the weight of the car is not enough to make this car really competitive.

""The weight of the car is not enough to make this car really competitive.

""The weight of the car is not enough to make this car really competitive.

""The weight of the car is not enough to make this car really competitive.

""It's not a question of weight. It's a question of performance.

""It's not a question of weight. It's a question of performance.

""It's not a question of weight. It's a question of performance.

""It's not a question of weight. It's a question of performance.

""It's not a question of weight. It's a question of performance.

""It's not a question of weight. It's a question of performance.

""It's not a question of weight. It's a question of performance.

""It's not a question of weight. It's a question of performance.

""It's not a question of weight. It's a question of performance.

""It's not a question of weight"," a car that is a Ferrari, but it is a Lamborghini.

Lamborghini is a car that is a Ferrari, but it is a Lamborghini.

Lamborghini is a car that is a Ferrari, but it is a Lamborghini.

Lamborghini is a car that is a Ferrari, but it is a Lamborghini.

Lamborghini is a car that is a Ferrari, but it is a Lamborghini.

Lamborghini is a car that is a Ferrari, but it is a Lamborghini.

Lamborghini is a car that is a Ferrari, but it is a Lamborghini.

Lamborghini is a car that is a Ferrari, but it is a Lamborghini.

Lamborghini is a car that is a Ferrari, but it is a Lamborghini.

Lamborghini is a car that is a Ferrari, but it is a Lamborghini.

Lamborghini is a car that is a Ferrari, but it is a Lamborghini.

Lamborghini is a car that is a Ferrari, but it is a Lamborghini.

Lamborghini is a car that is a Ferrari, but it is a Lamborghini.

Lamborghini is a car that is a Ferrari, but it is a Lamborghini"," the Mercedes-Benz S-Class, but with a much larger roofline and wider bodywork. The S-Class has been available on the Japanese market since 2011, and was discontinued in 2015. In addition to the S-Class, Mercedes-Benz has also released a new model in the S-Class S-Class S-Class S-Class S-Class S-Class S-Class S-Class S-Class S-Class S-Class S-Class S-Class S-Class S-Class S-Class S-Class S-Class S-Class S-Class S-Class S-Class S-Class S-Class S-Class S-Class S-Class S-Class S-Class S-Class S-Class S-Class S-Class S-Class S-Class S-Class S-Class S-Class S-Class S-Class S-Class S-Class S-Class S-Class S-Class S-Class S-Class S-Class S-Class S-Class S-Class S-Class S-Class S-Class S-Class S-Class S-Class S-Class S-Class S-Class S-Class S-Class S-Class S-Class S-Class S-Class S-Class S-Class S-Class S-Class S-Class S-Class S-Class S-Class S-Class S-Class S-Class S-Class S-Class S-Class S"," the BMW i3, but with a more all-wheel drive (AWD) system. The i3 is the most powerful saloon in BMW's lineup. The i3 is also the most affordable saloon in the lineup with a starting price of $30,620.

The BMW i3 is a direct successor to the BMW i3. The i3 is based on the same platform as the i3, but it has a much larger platform. It is also the first saloon to feature a 5-speed manual transmission, and it is also the first saloon to feature the all-wheel drive system. The i3 is also the first saloon to feature a rear seat.

The BMW i3 is available in four colors: Silver, White, Black and Gold. The BMW i3 is also available with a leather interior.

The BMW i3 is offered in two trim levels: Standard and Premium. The Premium trim is available in the United States and Canada, and the Standard trim is available worldwide.

The BMW i3 is available in the following models:

2015 BMW i3 -

Available in the following models:

2015 BMW i3 -

The BMW i3 is available in the following models:

2015 BMW i3 -

The BMW i3 is available in the following models:

2015 BMW i3 -

The BMW i3 is available in the following models:
"," the way you'd think of a woman: She wears a sensible dress, a necktie, and a couple of dresses. She's not a model. She's a person.""

She doesn't have a personality, either. She's not a person, and she's not a woman.

I'm not a woman.

I'm a woman who has a voice. I'm a woman who doesn't have a personality. I'm a woman who's not a person. I'm a woman who's not a person. I'm a woman who's not a person. A voice.

It's not a voice.

It's an image.

It's an image.

It's an image.

It's an image.

It's an image.

It's an image.

It's an image.

It's an image.

It's an image.

It's an image.

It's an image.

It's an image.

It's an image.

It's an image.

It's an image.

It's an image.

It's an image.

It's an image.

It's an image.

It's an image.

It's an image.

It's an image.

It's an image.

It's an image.
"," the Mercedes-Benz SLS AMG, but with a few differences. The car is capable of top speeds of over 300 mph, but the car's suspension is stiffened to make for a more stable ride.

The new car is rumored to be powered by a 1.6-liter turbocharged three-cylinder engine, but the engine will be located in the rear of the car. Porsche has not confirmed the engine's location, but it is likely to be located in the rear of the car, as the SLS AMG has been known to have a rear-mounted engine.

Porsche has not yet confirmed or denied the SLS AMG's name. However, the name of the car is known as the ""Porsche Boxster,"" and the company has previously said that the Boxster will be called the ""Porsche Boxster S.""

The SLS AMG will be the first Porsche car to feature a new, all-wheel drive system that Porsche claims will improve traction, handling, and fuel economy. The system is also expected to reduce weight by up to 25 pounds.

Porsche has said that the Boxster S will be the first car in the company's history to feature an all-wheel drive system. The SLS AMG will also be the first Porsche car to feature a rear-mounted engine.

Porsche has said that the Boxster S will be the first Porsche car to feature a rear-mounted"," the Ford Focus and the Hyundai Elantra. It's a compact car with a compact design, but it can handle a lot of work. It's a bit more rugged than the Ford Focus, but it's still a compact car.


You can find this model at a high price on eBay.


How to Find It on eBay

If you want to find this car, you can use this search tool.


Search for ""Cadillac CTS"" on eBay

If you don't find it there, try searching for ""Cadillac CTS"". It may be easier to find it online.


Buying Advice

If you really want to buy this car, you should consider getting a loan. The interest rate is very low, but you can get a loan for about 150,000 euros. This is a great deal, especially if you have a car loan.


The car loan is a good option for people who don't have a lot of money. It's also a good option for people who are in need of a car loan. You can also get a car loan for a small amount of money.


Buying Advice for an Old Car

You can get a loan for a car for about 150,000 euros, but if you want to buy an older car, you'll have to pay a lot of money. The interest rate is very low, but you can get a loan for about 150,"," the Volkswagen Group, which is headquartered in Wolfsburg, Germany. The company's sales have been increasing rapidly, and it has been in the news recently for its new diesel emissions scandal.

The company's sales have been increasing rapidly, and it has been in the news recently for its new diesel emissions scandal.

After the scandal broke, Volkswagen put on a public relations blitz to try and convince consumers that it was doing everything in its power to prevent the emissions scandal from impacting its sales.

The company's CEO, Matthias Mueller, said that he was ""thrilled"" that VW would be able to make a ""clean"" diesel engine, which he said would be able to meet the stricter emissions standards that were set by the U.S. Environmental Protection Agency.

The new diesel engine, which is being developed in conjunction with a German carmaker, would be able to meet the lower emissions standards, which are more stringent than those set by the EPA, and would be ""cleaner than anything we've ever done before,"" the company said in a statement.

The company also said it would be making a ""full disclosure"" to the public about the scandal.

The scandal has affected Volkswagen's bottom line, and the company has been under pressure from customers and lawmakers to do a better job of disclosing the extent of the scandal, which has affected its reputation.

The company has said that it is looking into how the scandal could affect the"," all other Ferrari models in that it is based on a 6.2L V12 engine that produces 330 horsepower and 354 pound-feet of torque. It's a very powerful engine, and it's one of the best in the sport. The Ferrari 500E is a more powerful version of the 500L, and the Ferrari 250 GTE is a more powerful version of the 250 GTO. The Ferrari 458 Italia is a great Ferrari, but it's not as powerful as a Ferrari 500, and the Ferrari 250 GTO is a great Ferrari.

McLaren's F1 car is a little different from Ferrari's in that it has a lot more power than the Ferrari, but it's not as powerful as a Ferrari. The McLaren F1 is a bit more powerful than the Ferrari F1, but it's not as powerful as a Ferrari.

The McLaren F1 is the only car that has a V12 engine, but the Ferrari F1 is the only car that has a V12 engine.

The McLaren F1 is a little bit faster than the Ferrari F1, but it's not as fast as a Ferrari.

The McLaren F1 is a little bit faster than the Ferrari F1, but it's not as fast as a Ferrari.

The McLaren F1 is a little bit faster than the Ferrari F1, but it's not as fast as a Ferrari.

The McLaren F1 is a little bit faster than"," the other cars in the series, but it is the first car that is completely different from the previous models. It is the first car that has a manual transmission, which is a relatively new technology. The transmission is automatic, but it is also available with an electric motor. The manual transmission is a lot faster than the automatic transmission, and it is not as comfortable to drive.

The car is also very heavy. It is almost twice the weight of the S550, and it weighs more than the S550. It is also quite wide, and it has large wheels. The car is very comfortable to drive. It is also very easy to move around. The driver can easily change from one car to another.

The car is also very easy to park. The driver can only drive it in the parking lot in the garage. The driver can also park it in the garage when the garage is empty. The driver can also park it in the garage when the garage is full. The driver can also park it in the garage when the garage is empty. The car is very easy to park in the garage. The driver can only drive it in the parking lot in the garage. The driver can also park it in the garage when the garage is empty. The car is very easy to park in the parking lot in the garage. The driver can only drive it in the parking lot in the garage. The driver can also park it in the garage when the garage is full. The"," Toyota in that it has two engines, one with a twin-turbo V6 and one with a single-turbo V8. It uses four-wheel drive, and it's a bit of a step up from the Toyota. The Volvo is also a bit larger than the Toyota, and it's slightly more expensive, but I think it's worth it.

The Volvo is the second-most expensive car in America, behind only the Toyota. The Volvo is also the most expensive car in Europe, behind only the Ferrari 458 Italia. The Volvo is also the most expensive car in China, behind only the Mercedes-Benz S-Class and the Audi A3.

The Volvo is the second-most expensive car in America, behind only the Toyota. The Volvo is also the most expensive car in Europe, behind only the Ferrari 458 Italia. The Volvo is also the most expensive car in China, behind only the Mercedes-Benz S-Class and the Audi A3.

The Volvo is the second-most expensive car in America, behind only the Toyota. The Volvo is also the most expensive car in Europe, behind only the Ferrari 458 Italia. The Volvo is also the most expensive car in China, behind only the Mercedes-Benz S-Class and the Audi A3.

The Volvo is the second-most expensive car in America, behind only the Toyota. The Volvo is also the most expensive car in Europe, behind only the Ferrari"
