7," the Jeep Cherokee. The Cherokee's steering wheel is a conventional one, and the seats are quite comfortable.

The Jeep Cherokee is also a bit larger than the Jeep Wrangler. It's the size of a car, but it's actually a little smaller than the Jeep Grand Cherokee. It's also a bit heavier.

The Jeep Cherokee has a V8 engine, but it's not quite as powerful as the 3.7-liter V8 in the Jeep Grand Cherokee. It's a little more powerful than the 2.5-liter V6 in the Jeep Grand Cherokee, but it's not quite as powerful as the 3.7-liter V8 in the Jeep Grand Cherokee.

The Jeep Cherokee has four doors. It has three rear doors. It has a roof rack. It has a rear seat that's a bit higher than the one in the Jeep Grand Cherokee.

The Jeep Cherokee has a four-wheel-drive system. It has a 5-speed manual transmission.

The Jeep Cherokee has a power steering system. It has a 6-speed manual transmission.

The Jeep Cherokee has a four-wheel-drive system. It has a 6-speed manual transmission.

The Jeep Cherokee is slightly smaller than the Jeep Grand Cherokee. It's about the same size as the Jeep Wrangler. It's about the same size as the Jeep Grand Cherokee.

The Jeep Cherokee is slightly larger than the Jeep Grand Cherokee. It"," the other characters in the series in that he was born with a certain personality. He is a very sadistic, cruel man who is always trying to fill his head with fantasies of killing everyone he meets. He is also a master manipulator, using his powers to manipulate people without their knowledge, and even to use his powers to destroy people. His most notable trait is that he has a hard time telling the difference between friend and foe.

Contents show]

Appearance

In the anime, Subaru resembles a man. He has short black hair and a white mustache. He wears a dark blue shirt and dark blue pants. He has a dark blue belt around his waist and a dark blue belt around his waistband. He has brown eyes and wears glasses. His eyes are blue and he is covered in black hair.

Personality

Emilia, her mother, and the rest of the royal family are also shown to be very cruel and cruel. They have shown to be very cruel towards Subaru, who was born with a certain personality. This is shown when they tried to take him away from his mother and father, and even tried to kill him. They also tried to kill him and even tried to strangle him.

Abilities

He is a master manipulator, using his powers to manipulate people without their knowledge, and even to use his powers to destroy people. He has demonstrated the ability to manipulate people without their knowledge.

Abilities"," the previous Dodge, but with a more aggressive stance and uses a much larger suspension. Dodge's rear suspension is much more aggressive than that of the previous Dodge, and it also has a much larger drivetrain, which is why it's often referred to as a ""Dodge"".

The Dodge Viper is a pretty straight forward car, but it has a lot of unique features, including a rear spoiler, a rear spoiler with a headlight, a rear spoiler with a rear diffuser, and a rear diffuser with a rear spoiler. It's also got a rear spoiler with a tailgate. Also, it has a rear spoiler with a tailgate.

The Dodge Viper's styling is very similar to the previous Dodge Viper, but has a much more aggressive stance and uses a much larger suspension. Dodge's rear suspension is much more aggressive than that of the previous Dodge, and it also has a much larger drivetrain, which is why it's often referred to as a ""Dodge"".

The Dodge Viper is a pretty straight forward car, but it has a lot of unique features, including a rear spoiler, a rear spoiler with a headlight, a rear spoiler with a rear diffuser, and a rear diffuser with a rear spoiler. It's also got a rear spoiler with a tailgate. Also, it has a rear spoiler with a tailgate.

The Dodge Viper is a pretty straight forward car, but it has a lot of unique features,"," a big bank. It's a company that's trying to make money by selling its cars and trucks and other goods to consumers.

Tesla's stock price has been rising steadily since it was spun off from General Motors in 2011. It's now up more than 20 percent this year, with the stock trading below the $400 mark.

The company's stock has been trading at an average of about $350 since the IPO in July 2012.

Tesla's CEO Elon Musk has said Tesla will be able to sell its cars and trucks for a fraction of the cost of traditional automakers.

""We're doing something very different,"" Musk said in a Q&A session at the company's headquarters in Palo Alto, California. ""We're not just selling cars but we're doing a lot of things that are just not possible in the traditional automobile industry. It's a very different business model for us.""

Tesla is also targeting a niche market of consumers who want to drive their cars on public roads.

The company's chief technology officer, JB Straubel, told CNBC last week that Tesla would be able to sell its cars at a fraction of the cost of traditional automakers.

While Tesla's stock price has been rising steadily since it was spun off from General Motors in 2011, it has been hit with recent losses.

Tesla's stock has fallen about 15 percent since it opened its doors in July 2012.

The company's stock price"," BMW, though it has a far more compact look.

The new Toyota is available in two versions, with a base price of $26,400 and a $29,200 version. The base model comes with a 2.0-liter four-cylinder engine and a four-speed automatic transmission.

A 1.6-liter four-cylinder engine and a six-speed automatic transmission are available for $29,000.

The Toyota is available in all-wheel drive only.

The new Toyota is available with a six-speed automatic transmission.

The Toyota is available with a four-speed automatic transmission.

Toyota is offering the new Toyota with a six-speed automatic transmission, with a price of $29,200.

The new Toyota is available with a six-speed automatic transmission, with a price of $29,200.

The new Toyota is available with a six-speed automatic transmission, with a price of $29,200.

The new Toyota is available with a six-speed automatic transmission, with a price of $29,200.

The new Toyota is available with a six-speed automatic transmission, with a price of $29,200.

The new Toyota is available with a six-speed automatic transmission, with a price of $29,200.

The new Toyota is available with a six-speed automatic transmission, with a price of $29"," Nissan in that it is a mass-market car maker. It's a huge brand and yet it only makes a few thousand cars a year. Honda is also the only automaker that makes cars that are not based on a single technology. It's not a Honda. It's a Honda.

But let's go back to the original question: What is the impact of Honda's failure on the industry?

The answer is that Honda is not going anywhere. It's a very successful company. It's a very successful company because of the way it operates. It's a company that is very focused on the quality of its cars, and it's also very focused on the quality of its product.

So if the only thing that's really going to happen is Honda's failure, then that's a terrible thing.

It's not a good thing for the industry.

It's a terrible thing for the market.

And that's the way it is.

In the meantime, there will be no Honda.

In the meantime, we're going to have a whole new generation of cars, and we'll be able to have a whole new generation of people. We'll be able to have a whole new generation of companies.

And that's a good thing.

That's a good thing for the market.

But I think the bigger question is, what happens when Honda is no longer a great company?
"," Tesla in terms of the production model but Nissan's production model is far more efficient and requires less fuel.

The Nissan Leaf is also a much better value than the Tesla Model S. The Leaf is currently $51,000 cheaper than the Model S while the Model S is currently $75,000 cheaper than the Leaf.

The Model S is also a much better value than the Chevy Volt.

The Model 3 is also a much better value than the Chevy Volt. The Model 3 is currently $35,000 cheaper than the Model S while the Model S is currently $55,000 cheaper than the Model 3.

The Model S is also a much better value than the Nissan Leaf.

The Model 3 is also a much better value than the Chevrolet Volt.

The Nissan Leaf is also a much better value than the Chevrolet Volt.

The Model 3 is also a much better value than the Chevrolet Volt.

The Nissan Leaf is also a much better value than the Chevrolet Volt.

The Model 3 is also a much better value than the Chevrolet Volt.

The Nissan Leaf is also a much better value than the Chevrolet Volt.

The Model 3 is also a much better value than the Chevrolet Volt.

The Nissan Leaf is also a much better value than the Chevrolet Volt.

The Nissan Leaf is also a much better value than the Chevrolet Volt.

The Model 3 is also a much better value than"," Tesla in that it is a car company that is making electric cars. It is also a company that is trying to make electric cars.

The main difference is that Tesla has been able to get its production of electric cars to market faster than Chevrolet has.

It's worth noting that there are many other companies out there that have been able to get their electric cars to market faster.

Tesla has also been able to sell its cars more quickly than Chevrolet.

The key difference between the two companies is that Tesla is a car company that is making electric cars.

In addition, Tesla is also a company that has been able to offer a lower price point for its cars than Chevrolet.

This means that Tesla can sell its cars at a lower price than Chevrolet can.

In fact, the average price of a Chevrolet Bolt EV is about $37,000.

So even though Tesla is a car company that is making electric cars, it is also a company that is selling electric cars at a lower price than Chevrolet.

The key difference between Tesla and Chevrolet is that Tesla is a car company that is making electric cars.

In addition, Tesla is also a company that has been able to offer a lower price point for its cars than Chevrolet.

This means that Tesla can sell its cars at a lower price than Chevrolet can.

There is a lot of competition between electric vehicles and traditional cars.

Tesla is also"," the Toyota Prius, but with a few differences. The Prius has a 3.5L V6 engine, while Hyundai's is a 1.5L V6. The Prius is powered by a 220-horsepower gasoline engine, while Hyundai's is powered by a 200-horsepower gasoline engine.

Hyundai's Prius is a first-generation electric car, while Hyundai's is a second-generation electric car. Toyota's Prius is a hybrid car, while Hyundai's is a plug-in hybrid car, which is what the Prius is rated for.

The Prius is currently on sale in the United States for $48,495. The Hyundai is on sale for $47,495.

Hyundai's Prius is expected to be available in the United States by the end of the year.<|endoftext|>The City of Los Angeles is planning to move its nearly $1 billion dollar construction project for a new high-speed rail line to the Bay Area, according to a report from the Los Angeles Times.

The project is expected to be completed by 2023. The new line would be the first line of high-speed rail in the world, and would connect the city of Los Angeles with Silicon Valley.

It would be the longest high-speed rail line in the world, but it would be less than half the length of the current track. The project would also require a huge amount of infrastructure to be built."," the Toyota Prius, only the Prius is a plug-in hybrid. The Mazda is a plug-in hybrid, but not a hybrid. It's a plug-in hybrid.

The Prius is a plug-in hybrid, but not a hybrid. It's a plug-in hybrid.

But, the Prius is a plug-in hybrid.

The Prius is a plug-in hybrid.

It's a plug-in hybrid.

The Prius is a plug-in hybrid.

The Prius is a plug-in hybrid.

But, the Prius is a plug-in hybrid.

The Prius is a plug-in hybrid.

But, the Prius is a plug-in hybrid.

The Prius is a plug-in hybrid.

But, the Prius is a plug-in hybrid.

The Prius is a plug-in hybrid.

The Prius is a plug-in hybrid.

But, the Prius is a plug-in hybrid.

The Prius is a plug-in hybrid.

The Prius is a plug-in hybrid.

The Prius is a plug-in hybrid.

But, the Prius is a plug-in hybrid.

The Prius is a plug-in hybrid.

The Prius is a plug-in hybrid"," Honda in terms of design, and we're still waiting for the production version of the FR-S to be launched. But Renault has shown that it can make a car that's attractive to a wide range of buyers, and we're looking forward to the launch of the FR-S in 2015.

What do you think of the FR-S? How much do you like the car? Let us know in the comments section below.<|endoftext|>A British man who was reportedly so drunk he couldn't remember his own name was arrested in Russia after allegedly raping a woman in the middle of the night.

The 21-year-old man was arrested after he allegedly raped a woman at a hotel in the city of Novosibirsk, Russia's TASS news agency reported on Friday.

The woman, who was in her mid-20s, said that the man, who was in his 20s, asked her to have sex with him, TASS reported.

The man was reportedly drunk and unable to remember his own name, the report said.

The man allegedly asked her to have sex with him, TASS said.

The woman told police that the man had raped her twice, but she did not report the incidents to police.

The woman was taken to hospital and treated for injuries, according to the station.

The man was arrested and is being held in a psychiatric hospital, police said.

The man is"," the Ferrari, but is a completely different car with its own unique features; namely, the Lamborghini Diablo. The Diablo is a sports car that has been designed to be light, fast and comfortable. The Lamborghini Diablo is an all-new concept car, which is based on the Lamborghini Gallardo and is expected to be introduced in the next few years.

The Diablo is a supercar with a supercharger that produces up to 500 horsepower. It has a very high chassis and chassis body that is made of carbon fiber. It is powered by a 5.2 liter V8 engine that produces up to 550 horsepower and is paired with a 5 speed manual gearbox. The Diablo is powered by a 5.2 liter V8 engine that produces up to 550 horsepower and is paired with a 5 speed manual gearbox.

The Diablo is a supercar with a supercharger that produces up to 500 horsepower. It has a very high chassis and chassis body that is made of carbon fiber. It is powered by a 5.2 liter V8 engine that produces up to 550 horsepower and is paired with a 5 speed manual gearbox. The Diablo is powered by a 5.2 liter V8 engine that produces up to 550 horsepower and is paired with a 5 speed manual gearbox.

The Diablo is a supercar with a supercharger that produces up to 500 horsepower. It has a very high chassis and chassis body that is made of carbon"," the Mercedes-Benz S-Class in terms of its interior, but it's a little smaller and lighter. The S-Class is also more comfortable to ride in than the S-Class, which is something we're sure many of you will enjoy.

The interior of the S-Class is not as refined as the interior of the S-Class, but it's definitely more comfortable and refined. The seats are comfortable and are not uncomfortable to sit in. The center console is a little bigger than the S-Class, but it's not big enough for you to sit in, so it's not a deal breaker. The center console is located in the center of the driver's seat, and there is a large center console in the middle of the driver's seat, which is actually a little larger than the S-Class.

The center console has a large center console in the middle of the driver's seat, which is actually a little larger than the S-Class. The front seats are slightly more comfortable than the S-Class, but they're not as comfortable as the S-Class. The S-Class has a smaller center console, which makes it a little less comfortable to sit in. The S-Class has a larger center console, which makes it a little less comfortable to sit in.

The S-Class has a smaller center console, which makes it a little less comfortable to sit in. The S-Class has a larger center console,"," the Porsches of the world but with some nice features. It has a much smaller engine, a much lighter weight, and a much more powerful engine. It is also much more efficient.

The BMW is a very safe car. It is also very safe in terms of accidents. The BMW is a very safe car in terms of accidents.

A BMW with ""B"" plates is shown above. The car is a BMW with ""B"" plates. The car is a BMW with ""B"" plates.

The BMW is a very safe car. It is also very safe in terms of accidents. The BMW is a very safe car in terms of accidents.

The BMW is a very safe car. It is also very safe in terms of accidents.

The BMW is a very safe car. It is also very safe in terms of accidents.

The BMW is a very safe car. It is also very safe in terms of accidents.

The BMW is a very safe car. It is also very safe in terms of accidents.

The BMW is a very safe car. It is also very safe in terms of accidents.

The BMW is a very safe car. It is also very safe in terms of accidents.

The BMW is a very safe car. It is also very safe in terms of accidents.

The BMW is a very safe car. It is also very safe in terms of accidents.

"," the company's best-selling Ford Focus, which is now available in the United States. Tesla's Model 3, which will be unveiled at the end of 2017, will be priced at $35,000.

The Model 3 is expected to go on sale in 2021.

Ford is also developing an electric car, the Fusion, that will be available in the United States by 2021.<|endoftext|>The UESPWiki – Your source for The Elder Scrolls since 1995

This page is currently being rewritten as part of the Morrowind Overhaul Project.

The page is being rewritten and checked in several stages. If you make an addition to this page, please update this template accordingly, but make sure you have observed the project guidelines. Detail Quests: not written

Services: written by Jeancey (none)

Personal Inventory: written by Forfeit (none)

House Contents: written by Jeancey (none)

Unique Dialogue: written by Forfeit (none)

Spells: written by Forfeit (none)


Abandoned House [ edit ]

This abandoned house is located on the far southwestern corner of the village. It is a large, dusty house with a small courtyard. The entrance is on the left side of the house, and there are two doors down the hall. There is a wooden door on the right side of the house that leads to a small room with a bench and"," the BMW M3, with its strong engine and strong drivetrain. But the Porsche is far more expensive, and it is only available in a limited number of countries.

The BMW M3 is a great car, but it is a very limited car, and it has a limited range.

You can buy a Porsche 918 Spyder in a limited number of countries, and it is very expensive.

The Porsche 918 Spyder is a very expensive car, but it is available in a very limited number of countries.

The Porsche 918 Spyder is very expensive car, but it is available in a very limited number of countries.

The Porsche 918 Spyder is very expensive car, but it is available in a very limited number of countries.

The Porsche 918 Spyder is very expensive car, but it is available in a very limited number of countries.

The Porsche 918 Spyder is very expensive car, but it is available in a very limited number of countries.

The Porsche 918 Spyder is very expensive car, but it is available in a very limited number of countries.

The Porsche 918 Spyder is very expensive car, but it is available in a very limited number of countries.

The Porsche 918 Spyder is very expensive car, but it is available in a very limited number of countries.

The Porsche 918 Spyder is very expensive car, but it"," the BMW i3, but has a smaller profile, less cargo space and a lower price tag.

""We have all these bikes and cars that we see that are very popular, but there is no one that is doing it with a more affordable price point,"" said Andrew Hickey, senior director of corporate communications at Audi. ""The Audi i3 is the first of its kind in the world. It is a great example of the Audi brand and of the confidence we have in the Audi brand.""

Hickey said the i3 is the first of its kind in the world to feature a full-size, rear-wheel drive version of the current Audi i8, which is also available on a four-door, rear-wheel drive platform.

The Audi i3's price tag is $75,000, compared to $100,000 for the BMW i3.

The i3 will be available in the United States later this year, but the company has not yet announced a launch date.

Audi's planned global launch is expected to be in the second quarter of this year.<|endoftext|>A new study finds that the number of migrants arriving in Europe has more than doubled in the past two years, and that more than 600,000 people could be fleeing the Middle East and Africa.

The study, published by the German Federal Statistical Office, surveyed more than 1,000 migrants and refugees who arrived in Germany in 2016.

"""," the VW Group in that it is a global company. It is a Volkswagen Group company, and therefore it is a VW Group company.

The way in which Volkswagen Group operates is similar to that of the Volkswagen Group.

The VW Group is a company that has a mission to meet the needs of its customers, and that is to make its vehicles and its products as good as they can be.

It is a company that is committed to maintaining its driving environment, and to doing so in a manner that is environmentally friendly, and that is to achieve its mission.

And yet, as we've seen in the past, the Volkswagen Group is also the company that has a mission to make its cars more efficient, more fuel efficient, more fuel-efficient, and more fuel-efficient than they could be.

And that's why we continue to invest in our cars.

And we continue to invest in our vehicles to make them better and more fuel-efficient.

And that's why we continue to invest in our vehicles to make them more fuel-efficient.

And that's why we continue to invest in our vehicles to make them more fuel-efficient.

And that's why we continue to invest in our vehicles to make them more fuel-efficient.

And that's why we continue to invest in our vehicles to make them more fuel-efficient.

And that's why we continue to invest in our vehicles to make"," Ferrari in its design, but it has a much more aggressive look. The Ferrari F40 is an incredible car, and it is not made for the street, but for the track. It is a race car, and it is with this car that Ferrari win the World Championship.

The Ferrari F40 is a racing car, but it is also a sports car. It is the Ferrari of the streets, and it is also the Ferrari of the track.

Ferrari F40

The Ferrari F40 is a car that is a bit like the Ferrari 250 GTO. The Ferrari F40 is a sports car, but it is also a racing car. It is the Ferrari of the streets, and it is also the Ferrari of the track.

Ferrari F40

The Ferrari F40 is a car that is a bit like the Ferrari 250 GTO. The Ferrari F40 is a sports car, but it is also a racing car. It is the Ferrari of the streets, and it is also the Ferrari of the track.

Ferrari F40

The Ferrari F40 is a car that is a bit like the Ferrari 250 GTO. The Ferrari F40 is a sports car, but it is also a racing car. It is the Ferrari of the streets, and it is also the Ferrari of the track.

Ferrari F40

The Ferrari F40 is a car that is a bit like"," the previous generation of cars in that they are designed to be driven on public roads, and they are therefore not allowed to be driven on private roads.

The first generation of the GSX-R had a very good reputation among the public, and it was followed by the second generation, which was much better and more popular.

In 2014, the GSX-R was the only car in the world to be awarded the ""Most Valuable Vehicle"" award by the Guinness Book of World Records.

The 2013 model year is the last in the series, and the GSX-R will be replaced with a new model, the GSX-R10.

The GSX-R10 will be launched in the second half of 2015.<|endoftext|>Greetings, fellow Tenno!

This is the official announcement of the new Tenno Update!

The Tenno Update is the first in a series of updates designed to improve the experience for all Tenno who play the game. We believe this is a great time to announce the new features and improvements we're making to the game, as well as the upcoming changes to the Tenno Store.

We look forward to seeing you in-game!

-The Tenno Team<|endoftext|>The world's largest solar power plant, which is expected to generate enough electricity to power more than 80,000 homes and businesses, has been built in southern France and will be operational by the end of 2017."," the Volkswagen. It has a manual transmission and a diesel engine. It is also a bit bigger and heavier than the Volkswagen. The Volvo is cheaper to buy.

The Volvo is a bit less fuel efficient than the Volkswagen. The Volkswagen is slightly more fuel efficient than the Volvo. The Volvo is more fuel efficient than the Volkswagen. The Volvo is more fuel efficient than the Volkswagen. The Volvo is slightly less fuel efficient than the Volkswagen. The Volvo is slightly less fuel efficient than the Volkswagen. The Volvo is slightly less fuel efficient than the Volkswagen. The Volvo is slightly less fuel efficient than the Volkswagen. The Volvo is slightly less fuel efficient than the Volkswagen. The Volvo is slightly less fuel efficient than the Volkswagen. The Volvo is slightly less fuel efficient than the Volkswagen. The Volvo is slightly less fuel efficient than the Volkswagen. The Volvo is slightly less fuel efficient than the Volkswagen. The Volvo is slightly less fuel efficient than the Volkswagen. The Volvo is slightly less fuel efficient than the Volkswagen. The Volvo is slightly less fuel efficient than the Volkswagen. The Volvo is slightly less fuel efficient than the Volkswagen. The Volvo is slightly less fuel efficient than the Volkswagen. The Volvo is slightly less fuel efficient than the Volkswagen. The Volvo is slightly less fuel efficient than the Volkswagen. The Volvo is slightly less fuel efficient than the Volkswagen. The Volvo is slightly less fuel efficient than the Volkswagen. The Volvo is slightly less fuel efficient than the Volkswagen. The Volvo is slightly less fuel efficient than the Volkswagen. The Volvo is"
