,Jeep is similar to,Subaru is similar to,Dodge is similar to,Tesla is similar to,Toyota is similar to,Honda is similar to,Nissan is similar to,Chevrolet is similar to,Hyundai is similar to,Mazda is similar to,Renault is similar to,Lamborghini is similar to,Mercedes-Benz is similar to,BMW is similar to,Ford is similar to,Porsche is similar to,Audi is similar to,Volkswagen is similar to,Ferrari is similar to,Lexus is similar to,Volvo is similar to
0," the Ford F-150 pickup truck, but it lacks the 6.2-liter V6 engine that powers the F-150.

The Jeep Wrangler is a four-door SUV.

The Jeep Wrangler is a four-door SUV. The Jeep Wrangler is a four-door SUV. The Jeep Wrangler is a four-door SUV. The Jeep Wrangler is a four-door SUV. The Jeep Wrangler is a four-door SUV. The Jeep Wrangler is a four-door SUV.

The Jeep Wrangler is a four-door SUV. The Jeep Wrangler is a four-door SUV. The Jeep Wrangler is a four-door SUV. The Jeep Wrangler is a four-door SUV. The Jeep Wrangler is a four-door SUV. The Jeep Wrangler is a four-door SUV. The Jeep Wrangler is a four-door SUV. The Jeep Wrangler is a four-door SUV. The Jeep Wrangler is a four-door SUV. The Jeep Wrangler is a four-door SUV. The Jeep Wrangler is a four-door SUV. The Jeep Wrangler is a four-door SUV. The Jeep Wrangler is a four-door SUV. The Jeep Wrangler is a four-door SUV. The Jeep Wrangler is a four-door SUV. The Jeep Wrangler is a four-door SUV. The Jeep Wrangler is a four-door SUV. The Jeep Wr"," the real Subaru in many ways. He is a little taller than Subaru, but has a much wider body, and his hair is longer and longer. He is also much more muscular than Subaru. He is also much more muscular than his older brother, Subaru and his brother are in comparison. He is also much taller than Subaru. He is also much taller than Subaru.

In the manga, Subaru's hair is much shorter than in the anime.

Subaru is the only member of the family that can use the Subaru Formula, and is the only one that can drive a car.

Subaru is the only member of the family who can use the Subaru Formula, and is the only one that can drive a car. He is the only member of the family that can drive a car. He is the only member of the family that can drive a car. He is the only member of the family that can drive a car.

He has a crush on his mother.

He is the only member of the family that can drive a car.

He is the only member of the family that can drive a car.

He is the only member of the family that can drive a car.

He is the only member of the family that can drive a car.

He is the only member of the family that can drive a car.

He is the only member of the family that can drive a car.

He"," the Dodge Viper, and is a direct descendant of the Dodge Viper. The Dodge Viper is a production car that was introduced in 1993. It's a Mercedes-Benz SLS AMG V8 coupe with a 1.8L V8 engine producing 600 horsepower.

The Dodge Viper is a more powerful, and more powerful version of the Dodge Viper. It's powered by a 6.2L V8 engine producing 600 horsepower. The Dodge Viper is a direct descendant of the Dodge Viper, and is a production car that was introduced in 1993. It's a Mercedes-Benz SLS AMG V8 coupe with a 1.8L V8 engine producing 600 horsepower.

Dodge Challenger

The Dodge Challenger is a direct descendant of the Dodge Challenger. It's a production car that was introduced in 1993. It's a Dodge Challenger with a 1.8L V8 engine producing 600 horsepower.

The Dodge Challenger is a more powerful, and more powerful version of the Dodge Challenger. It's powered by a 6.2L V8 engine producing 600 horsepower. The Dodge Challenger is a direct descendant of the Dodge Challenger, and is a production car that was introduced in 1993. It's a Dodge Challenger with a 1.8L V8 engine producing 600 horsepower.

Dodge Challenger SRT8

The Dodge Challenger SRT8 is a direct descendant of the Dodge Challenger. It's a production car that was introduced in 1993. It"," Uber, which has been aggressively pursuing its own self-driving car program.

""We're trying to bring this technology to the masses,"" Ford said. ""We're not trying to compete with Uber.""

Ford says it plans to release an autonomous car in 2021. Google's self-driving car program is expected to start in 2018.

The company has been working with Uber on autonomous cars, and has built its own car.

Ford said it would not release a timeline for when it would be able to test its own self-driving cars.

Ford has more than 1,000 employees who work on autonomous vehicle research. The company has also been working with Apple on the development of its own self-driving cars.

In April, Ford announced it would invest $1.5 billion in developing autonomous vehicles.

In a statement, Ford said the investment will help it ""enable the world's first fully autonomous, self-driving vehicle.""

The company said it is also working on a new generation of self-driving cars that will be able to handle high-speed traffic and navigate traffic better.

Ford said it is also working on a new generation of self-driving cars that will be able to handle high-speed traffic and navigate traffic better.

Ford said it will also be working on a new generation of self-driving cars that will be able to handle high-speed traffic and navigate traffic better.

Ford said"," Mazda, but Toyota is a hybrid car company, with a hybrid engine.

The Toyota Camry was introduced in 2007, and was the first car to have a hybrid engine. It has been a popular choice for the Japanese market, and is now sold in 38 countries.

The Toyota Prius was introduced in 2010, and has since been sold in 44 countries.

The Toyota Prius Plug-In Hybrid was introduced in 2015, and has since been sold in 42 countries.

The Toyota Prius Plug-In is a plug-in hybrid car that is sold in 43 countries.

The Toyota Prius Plug-In Hybrid is a plug-in hybrid car that is sold in 43 countries.

The Toyota Prius Plug-In Hybrid is a plug-in hybrid car that is sold in 43 countries.

The Toyota Prius Plug-In Hybrid is a plug-in hybrid car that is sold in 43 countries.

The Toyota Prius Plug-In Hybrid is a plug-in hybrid car that is sold in 43 countries.

The Toyota Prius Plug-In Hybrid is a plug-in hybrid car that is sold in 43 countries.

The Toyota Prius Plug-In Hybrid is a plug-in hybrid car that is sold in 43 countries.

The Toyota Prius Plug-In Hybrid is a plug-in hybrid car that is sold in 43 countries.

The Toyota Prius Plug-In"," the Honda Civic, but is 500cc more powerful, and comes standard with a folding rear seat. It was designed to be a smaller and lighter version of the Honda Civic, so the Civic-like styling is retained, but the Honda's engine is slightly larger and has an extra cylinder head. The Honda Civic is also a bit faster, with a top speed of 155mph.

The Honda Civic is a compact, practical, and affordable car. It's an excellent choice for anyone who wants to make the most of their limited budget, or who wants to own a compact car that is easy to drive, and that will last.

The Honda Civic is available in a variety of trim levels. The base model is a standard Honda Civic, but can be upgraded to a Civic S, Civic Hatchback, Civic EX, or Civic EX-S.

The Honda Civic is available in the following basic colors:

Luxury

Classic

Classic Coupe

Classic Coupe Hatchback

Classic Coupe EX

Classic Coupe EX-S

Classic Coupe EX-S Hatchback

Classic Coupe EX-S Hatchback Coupe

Classic Coupe EX-S Hatchback Coupe

Classic Coupe EX-S Hatchback Coupe

Classic Coupe EX-S Hatchback Coupe Premium

Premium Sport

Premium Sport Coupe

Premium Sport Hatchback

Premium Sport Hatch"," the Kia Soul EV, which doesn't get a top speed limit of over 140mph.

The new Nissan Leaf gets a design similar to that of the Nissan Leaf, but with a large battery pack. The battery pack is more compact than that of the Kia Soul EV and is capable of going up to 200 miles.

The new Leaf has a range of about 200 miles.

The Leaf has a range of about 200 miles. The Leaf's range is a little higher than that of the Nissan Leaf, but not by much. The Leaf can go up to 200 miles in a single charge, but the average range is around 200 miles.

The new Leaf has a range of about 200 miles. The Leaf's range is a little higher than that of the Nissan Leaf, but not by much. The Leaf can go up to 200 miles in a single charge, but the average range is around 200 miles. The Leaf has a range of about 200 miles. The Leaf has a range of about 200 miles. The Leaf has a range of about 200 miles. The Leaf has a range of about 200 miles. The Leaf has a range of about 200 miles. The Leaf has a range of about 200 miles. The Leaf has a range of about 200 miles. The Leaf has a range of about 200 miles. The Leaf has a range of about 200 miles. The Leaf has a range of about 200 miles. The Leaf has a range of about 200 miles. The"," the Ford Focus, with a few differences. The Focus is a four-door sedan, while the Chevy is a four-door pickup. The Focus is a four-door sedan, while the Chevy is a four-door pickup.

Suspension

The Focus is a four-door sedan, while the Chevy is a four-door pickup. The Focus is a four-door sedan, while the Chevy is a four-door pickup.

The Focus has a 1.6-liter, four-cylinder engine that produces 261 horsepower and 258 lb-ft of torque.

The Focus has a 1.6-liter, four-cylinder engine that produces 261 horsepower and 258 lb-ft of torque.

The Focus has a 2.5-liter, four-cylinder engine that produces 250 horsepower and 244 lb-ft of torque.

The Focus has a 2.5-liter, four-cylinder engine that produces 250 horsepower and 244 lb-ft of torque.

The Focus has a 3.7-liter, four-cylinder engine that produces 250 horsepower and 248 lb-ft of torque.

The Focus has a 3.7-liter, four-cylinder engine that produces 250 horsepower and 248 lb-ft of torque.

The Focus has a 4.0-liter, four-cylinder engine that produces 250 horsepower and 248 lb-ft of torque.

The Focus has"," GM in that it is a company that is built around a core philosophy of making cars that are as good as they are cheap.

It has a world-class engineering team that is dedicated to making the best cars in the world.

It has a huge number of customers that are passionate about making the best cars in the world.

And it has a huge number of people who are passionate about making the best cars in the world.

So, there's a lot of potential for Hyundai to be a huge player in the global auto industry.

So, if you're a company that wants to be a global player, you need to have a core philosophy of making cars that are as good as they are cheap.

And that means if you're going to be doing a lot of manufacturing, you need to have a core philosophy of making cars that are as good as they are cheap.

So, that's what we're trying to do here. We're trying to build an engine that's as good as it is cheap.

That's what we believe in.

And that's why we're investing in the next generation of our engines, the next generation of our transmissions, and the next generation of our transmissions.

So, if you're a company that wants to be a global player, you need to have a core philosophy of making cars that are as good as they are cheap.

And that means if you"," Toyota in that it is a car company that makes cars. It also is a company that makes a lot of cars. It makes some very expensive cars. It makes some cars that are very popular, but not as popular as they should be. It makes some cars that are very popular, but not as popular as they should be.

So what we're seeing is a company that's making a lot of cars that are not very popular. That's not a good thing.

So what we're seeing is a company that's making a lot of cars that are not very popular. That's not a good thing.

What we're seeing is that it's not a good thing for the auto industry.

And that's why I think it's important to focus on the future, not just the present.

So the future of the auto industry will be defined by the future of the auto industry. And the future of the auto industry will be defined by the future of the auto industry.

And the future of the auto industry will be defined by the future of the auto industry.

So what we're seeing is a company that's making a lot of cars that are not very popular. That's not a good thing.

So what we're seeing is a company that's making a lot of cars that are not very popular. That's not a good thing.

So what we're seeing is a company that's making a"," the Renault Sport Formula One team in terms of its technical leadership. The team has been working with Renault since the beginning of the season and has had a number of successful races with its cars.

The team is also well known for its technical expertise in the F1 paddock and the driver line-up has been made up of experienced drivers.

The team's technical director, Cyril Abiteboul, is also the managing director at Renault Sport Formula One. The team's team principal is Jolyon Palmer.

The new team's driver line-up will be announced on Friday.<|endoftext|>In this June 28, 2015, file photo, Texas Gov. Rick Perry speaks during a press conference in Austin, Texas. Perry's announcement that he's running for president is expected to boost his poll numbers, which have fallen in recent months. (AP Photo/LM Otero, File)

A new poll released Wednesday by a Democratic-leaning group shows that the Texas governor is losing ground with his supporters.

The poll, conducted by the Democratic-leaning Public Policy Polling, shows that Perry is losing nine points to Democratic presidential hopeful Sen. Bernie Sanders (I-Vt.). The poll also shows that Perry's support among Republican voters has dropped by nine points.

The poll was conducted from June 1 to June 7 among 1,082 registered voters and has a margin of error of plus or minus 4.2 percentage points.

"," the Chevrolet Corvette Stingray, but with the added feature of a 3.0 liter V-6 engine. The Lamborghini Huracan is powered by a 2.0 liter V-6 engine, and has a top speed of 200 mph. It is based on the Lamborghini Gallardo.

In 2008, the Lamborghini Huracan was made available in a red, white and blue color scheme. In 2009, the vehicle was made available in a black, green and blue color scheme.

In January 2010, the Lamborghini Huracan was released in a limited edition with a special edition of 10,000 pieces.

In October 2012, the Huracan was released with a special edition of 10,000 pieces. The Huracan was also released in a limited edition of 10,000 pieces.

The Huracan was also released in a limited edition of 25,000 pieces, which was released in October 2012.

In February 2013, the Huracan was released in a limited edition of 25,000 pieces.

In July 2013, the Huracan was released in a limited edition of 25,000 pieces.

In September 2014, the Huracan was released in a limited edition of 25,000 pieces.

In December 2014, the Huracan was released in a limited edition of 25,000 pieces.

In January 2015, the Huracan was released in a limited edition of 25,000 pieces.

"," Tesla in that it doesn't have to worry about being sued for using its technology.

""We have to do it ourselves,"" said Mercedes-Benz CEO Dieter Zetsche. ""It's not something we can do on our own.""

Zetsche said the company is not a car company, but a company that makes cars. And it's not a car company that wants to be sued for using its technology.

""We are not a car company,"" Zetsche said. ""We are a company that makes cars.""

Meanwhile, the carmaker is not a car company that wants to be sued for using its technology.

""We are not a car company,"" Zetsche said. ""We are a company that makes cars.""

Zetsche said Mercedes-Benz is not a car company.

Zetsche said Mercedes-Benz is not a car company.

""We are not a car company,"" Zetsche said. ""We are a company that makes cars.""

Zetsche said Mercedes-Benz is not a car company.

Zetsche said Mercedes-Benz is not a car company.

A Mercedes-Benz spokesperson declined to comment on the lawsuit.

The automaker's decision to use electric power in its cars is a first. The company has been working on electric cars for years, and only recently began to offer them in the U.S.

"," the BMW i3, but with a larger battery and a larger battery pack. Both are small electric cars that can be purchased from dealerships.

The BMW i3 is actually a hybrid. The BMW i3 is a plug-in hybrid. The BMW i3 is a plug-in hybrid.

The BMW i3 is a plug-in hybrid. The BMW i3 is a plug-in hybrid.

The BMW i3 is a plug-in hybrid. The BMW i3 is a plug-in hybrid.

The BMW i3 is a plug-in hybrid. The BMW i3 is a plug-in hybrid.

The BMW i3 is a plug-in hybrid. The BMW i3 is a plug-in hybrid.

The BMW i3 is a plug-in hybrid. The BMW i3 is a plug-in hybrid.

The BMW i3 is a plug-in hybrid. The BMW i3 is a plug-in hybrid.

The BMW i3 is a plug-in hybrid. The BMW i3 is a plug-in hybrid.

The BMW i3 is a plug-in hybrid. The BMW i3 is a plug-in hybrid.

The BMW i3 is a plug-in hybrid. The BMW i3 is a plug-in hybrid.

The BMW i3 is a plug-in hybrid. The BMW i3 is a plug-in"," the model that is used by the National Highway Traffic Safety Administration to determine the legal limits of speed.

The test is used to determine if a driver is at fault for a crash.

The test is not mandatory, but it can be a helpful tool for the driver.

The DMV can also offer the test at a reduced rate to those who are eligible.

The test is available from 7 a.m. to 7 p.m. Monday-Friday, 8 a.m. to 5 p.m. Saturday and 8 a.m. to 5 p.m. Sunday.

Drivers who are eligible for the test can register.

If you are eligible for the test, you must submit a completed Form 460, Motor Vehicle Accident Report, to your local DMV office.

You can find the DMV's office nearest you on the DMV website.

If you have questions about the test or about the DMV's registration requirements, contact the DMV at (800) 4-ARS-DOT.

Follow us on Twitter @WTOP and like us on Facebook.

© 2016 WTOP. All Rights Reserved.<|endoftext|>The world's first ""solar powered"" car is set to get its first real test on the road.

The solar-powered car is being developed by a group of scientists at the University of Washington, and will be driven on public roads by an engineer.

""We're"," the Tesla Model S, but with the added benefit of a more powerful battery. That's why the Model S is now the world's fastest-selling electric car, and why the company is also pushing the Model X, which is a more powerful version of the Model S.

The Model X is available now in the United States for $35,000, and the Model S is available in the United States for $35,000. Both cars are available from Tesla Motors in the United States.

Tesla has also announced that it is developing a new electric highway vehicle, the Model 3, which will be available in 2018.<|endoftext|>A woman who was struck and killed by a car in North Portland last week is remembered by her friends and family as a caring, kind and caring person.

""She was always there for people,"" said her friend, Amy Burns.

Burns said that when she was four years old, her mother died of cancer, so she ended up staying with her aunt.

""She was always working, always doing things,"" Burns said. ""She was always kind to people.""

Burns said she met the woman, who was 19 at the time, at a charity event in May.

""She was really kind,"" Burns said. ""She was always happy to help people.""

Burns said the woman was a good friend.

""She was always there for me,"" Burns said.

She"," the Volkswagen, Ford, and Toyota models. The Audi is a bit more expensive because of the higher price of battery and transmission.

The Audi is a hybrid vehicle with a gasoline engine and a diesel engine. It is powered by a hybrid motor that is connected to a gasoline engine. The battery is made of nickel-metal hydride (NiMH). The gas engine is connected to the electric motor. The electric motor drives the electric motor.

The electric motor is connected to the gasoline engine through a battery pack. The battery pack is a type of battery that is composed of nickel-metal hydride (NiMH). The nickel-metal hydride (NiMH) is a metal that is very reactive and can react with other metals. The reaction can cause the nickel-metal hydride (NiMH) to react with other metals and cause the nickel-metal hydride (NiMH) to react with other metals. The nickel-metal hydride (NiMH) is a reactive metal.

The nickel-metal hydride (NiMH) can be used as a battery. The nickel-metal hydride (NiMH) can be used as a battery because it is a reactive metal.

The nickel-metal hydride (NiMH) can be used as a battery because it is a reactive metal. The nickel-metal hydride (NiMH) can be used as a battery because it has a"," General Motors in that it has a large number of dealerships, but it also has a large number of dealerships that sell cars that are not sold in the dealerships.

In many ways, VW is a very large car manufacturer. It has more than 20,000 dealerships, and it has over 1 million vehicles on the road.

If you look at the dealerships, that's a lot of dealerships.

To get a sense of how large VW is, look at the number of dealerships in the United States.

VW has more than 1 million dealerships in the United States.

Those 1 million dealerships are located in the United States.

So, if you look at the number of dealerships in the United States, you will see that Volkswagen has more than 1 million dealerships.

On the other hand, General Motors has about 3 million dealerships, and it has about 1 million vehicles on the road.

So, if you look at the number of dealerships, you will see that General Motors has more than 3 million dealerships.

If you look at the number of dealerships, you will see that GM has more than 3 million dealerships.

So, if you look at the number of dealerships in the United States, you will see that GM has more than 3 million dealerships.

In the United States, the number of dealerships owned by Volkswagen is about"," Ferrari in how it approaches its cars. It is one of the most exciting teams in the sport, and it has a track record that has been impressive over the years.

The key difference is that Ferrari's cars have a more aggressive stance, which is something that McLaren and Mercedes have not been able to do.

McLaren's car is more aggressive, but its stance is more controlled, which is what Ferrari has done.

The difference in the way Ferrari and McLaren approach their cars is that McLaren's cars have more control of the car, while Ferrari's cars are more aggressive.

Ferrari's cars are more aggressive, but its stance is more controlled, which is what McLaren has done.

Ferrari's cars are more aggressive, but its stance is more controlled, which is what McLaren has done.

Ferrari's cars have more control of the car, but its stance is more controlled, which is what McLaren has done.

Ferrari's cars are more aggressive, but its stance is more controlled, which is what McLaren has done.

Ferrari's cars have more control of the car, but its stance is more controlled, which is what McLaren has done.

Ferrari's cars are more aggressive, but its stance is more controlled, which is what McLaren has done.

Ferrari's cars are more aggressive, but its stance is more controlled, which is what McLaren"," the BMW i3, but it is not quite as powerful. The i3 was one of the first cars to use the all-wheel drive system, and it was also the first car to use the rear-wheel drive system. The i3's powertrain is a 5.0-liter V8 engine that produces 6.5 horsepower and 6.5 lb-ft of torque. The i3 is powered by a 5-speed manual transmission. The i3 is available in four different trim levels: the standard sedan, the GLE sedan, the GLE coupe, and the GLE coupe Sport. It is also available in three different color combinations: black, red, and white. The i3 is available with either a six-speed manual or a six-speed automatic transmission. The i3 is available with either an optional dual-zone automatic transmission or a manual transmission.

The i3 has a base price of $36,360 and a starting price of $39,900. The i3 is available with a six-speed manual transmission or a six-speed automatic transmission. The i3 is available with either a six-speed manual or a six-speed automatic transmission. The i3 is available with either a six-speed manual or a six-speed automatic transmission. The i3 is available with either a six-speed manual or a six-speed automatic transmission. The i3 is available with either a six-speed manual or a"," its sibling, the Volvo XC90, in that it offers more space, but it also costs more. The XC90 starts at £23,040, but the XC90 Plus costs £27,440.

The XC90 is the most affordable of the three, and it's the easiest to compare. It's also the most expensive of the four, but that's because it's the only one of the four that comes with a manual transmission.

The XC90 Plus comes with a manual transmission. Volvo says that's because they want to make sure that customers who want to buy the XC90 Plus will have the option to buy the manual transmission.

So, if you want the Volvo XC90 Plus, you can buy it with either a manual or automatic transmission.

The XC90 has the best of both worlds, with a range that's big enough to suit everyone, with a high price tag to match.

The Volvo XC90 Plus is available in three models:

XC90 Plus Plus - £25,040

XC90 Plus Plus - £27,440

XC90 Plus Plus - £30,820

The Volvo XC90 Plus has a base price of £27,440, which means that if you buy it with a manual transmission, you're paying £24,080 more than if you buy it with a manual transmission.

The X"
