14," the Jeep Wrangler, but is built on a different platform. It is the same platform as the Jeep Grand Cherokee, Jeep Compass and Jeep Compass XL. The Jeep Compass and Jeep Compass XL are built on a different platform as well.

The Jeep Compass and Jeep Compass XL are the most popular (and expensive) Jeep models. The Jeep Compass XL is made on a platform that is similar to the Jeep Grand Cherokee, Jeep Compass and Jeep Compass XL. The Jeep Compass XL is built on a platform that is similar to the Jeep Grand Cherokee, Jeep Compass and Jeep Compass XL. The Jeep Compass XL is built on a platform that is similar to the Jeep Grand Cherokee, Jeep Compass and Jeep Compass XL. The Jeep Compass XL is built on a platform that is similar to the Jeep Grand Cherokee, Jeep Compass and Jeep Compass XL. The Jeep Compass XL is built on a platform that is similar to the Jeep Grand Cherokee, Jeep Compass and Jeep Compass XL. The Jeep Compass XL is built on a platform that is similar to the Jeep Grand Cherokee, Jeep Compass and Jeep Compass XL. The Jeep Compass XL is built on a platform that is similar to the Jeep Grand Cherokee, Jeep Compass and Jeep Compass XL. The Jeep Compass XL is built on a platform that is similar to the Jeep Grand Cherokee, Jeep Compass and Jeep Compass XL. The Jeep Compass XL is built on a platform that is similar to the Jeep Grand Cherokee, Jeep Compass and Jeep Compass XL. The Jeep Compass XL is built on a"," the protagonist in that he shares many of his traits with his brother. He is able to see the future, can manipulate the weather, and is also able to communicate with other animals. His only weakness is his inability to speak.His personality is very similar to that of his brother, who is also a powerful, but flawed character. He is a kind, caring, and caring person. He is also a very capable fighter, as he was able to defeat several of the villains in the series. He also has a good sense of humor, which is shown to be true when he was able to defeat the villains and save Subaru from the police.

He also has a strong sense of justice, as he was able to fight against the police, and even defeat them when they attempted to detain him.

In the manga, Subaru is shown to have a very strong sense of justice, as he was able to kill the police officers of the local police force, and even defeat them when they attempted to arrest him.

Abilities

Subaru is the strongest fighter in the series, and is able to fight against the police. He is also one of the few fighters who can use the wind magic.

Physical Abilities

Subaru is a skilled fighter, and is able to fight against the police. He is also one of the few fighters who can use the wind magic.

Abilities

Subaru is able to use the wind magic. He"," the Dodge Charger, but has the added ability to place the driver's seat forward. The Dodge Charger's front seat has a large, recessed seat that is attached to a metal frame. The Dodge Charger's rear seat has a large, recessed seat that is attached to a metal frame. The Dodge Charger's rear seat has a large, recessed seat that is attached to a metal frame. The Dodge Charger's rear seat has a large, recessed seat that is attached to a metal frame. The Dodge Charger's rear seat has a large, recessed seat that is attached to a metal frame. The Dodge Charger's rear seat has a large, recessed seat that is attached to a metal frame. The Dodge Charger's rear seat has a large, recessed seat that is attached to a metal frame. The Dodge Charger's rear seat has a large, recessed seat that is attached to a metal frame. The Dodge Charger's rear seat has a large, recessed seat that is attached to a metal frame. The Dodge Charger's rear seat has a large, recessed seat that is attached to a metal frame. The Dodge Charger's rear seat has a large, recessed seat that is attached to a metal frame. The Dodge Charger's rear seat has a large, recessed seat that is attached to a metal frame. The Dodge Charger's rear seat has a large, recessed seat that is attached to"," the Tesla Motors, but being a Tesla vehicle, it has a Tesla logo on it.

Tesla's Model S and Model X vehicles are the most popular cars in the world, with the latter being the most popular sedan in the world. It currently has over 9,000 customers.

The company has been criticized for its high price, although it has been criticised for its low quality.

Tesla has been criticized for its low quality, but it has been criticized for its high price.

Tesla Model S and Model X cars are the most popular cars in the world, with the latter being the most popular sedan in the world. It currently has over 9,000 customers.

Tesla Model S and Model X cars are the most popular cars in the world, with the latter being the most popular sedan in the world. It currently has over 9,000 customers.

Tesla Model S and Model X cars are the most popular cars in the world, with the latter being the most popular sedan in the world. It currently has over 9,000 customers.

Tesla Model S and Model X cars are the most popular cars in the world, with the latter being the most popular sedan in the world. It currently has over 9,000 customers.

Tesla Model S and Model X cars are the most popular cars in the world, with the latter being the most popular sedan in the world. It currently has over 9,000 customers.

Tesla Model"," Tesla in that it is a little more expensive, but it has a lot more features and a lot more power.

In this case, the differences are pretty big.

If you want to know more about the differences between these two cars, check out the comparison video.

You can find the Toyota Prius V vs Tesla Model S here.<|endoftext|>The best and most popular of the bitcoin mining rigs. Yes, it's a bit more expensive than the competition, but it's still worth it for the convenience of using your Bitcoin mining rig for the first time.

The mining rig is a single computer with a single GPU. It's capable of mining even more coins than the single GPU is capable of mining. The mining rig can also be connected to a PC via USB.

Here's the best part about the mining rig: It's easy to set up!

You can install the mining rig on a motherboard, or use a USB stick on a PC.

To set up the mining rig, you can download the latest version of the software from the links below:

Download the latest version of the software from the links below:

Download the latest version of the software from the links below:

Download the latest version of the software from the links below:

Download the latest version of the software from the links below:

Download the latest version of the software from the links below:

Download the latest version"," the Honda CR-V, Honda CR-V EX, and Honda CR-V EX EX Plus. The CR-V EX is a traditional sporty SUV with a small, sporty cabin, and is the most popular compact SUV in North America.

The Honda CR-V EX is available in the following models:

Honda CR-V EX Plus

Honda CR-V EX EX Plus

Honda CR-V EX EX Plus

Honda CR-V EX EX Plus

Honda CR-V EX EX Plus

Honda CR-V EX EX Plus

Honda CR-V EX EX Plus

Honda CR-V EX EX Plus

Honda CR-V EX EX Plus

Honda CR-V EX EX Plus

Honda CR-V EX EX Plus

Honda CR-V EX EX Plus

Honda CR-V EX EX Plus

Honda CR-V EX EX Plus

Honda CR-V EX EX Plus

Honda CR-V EX EX Plus

Honda CR-V EX EX Plus

Honda CR-V EX EX Plus

Honda CR-V EX EX Plus

Honda CR-V EX EX Plus

Honda CR-V EX EX Plus

Honda CR-V EX EX Plus

Honda CR-V EX EX Plus

Honda CR"," Tesla in the sense that it's a lot more expensive, but the company's CEO Elon Musk has said that it will be cheaper than Tesla in the near future.

The two companies have been trading at rock bottom prices lately, with Tesla's stock down more than 30% in the past month.

The two companies are also competitors in the mobile phone industry.

The two companies are in a constant battle for market share in the mobile phone industry, which has been dominated by Microsoft and Apple.

The two companies have been fighting for the mobile phone market for years.

Microsoft has been making a big push in the mobile phone market, and Apple has been dominating the market for years.

The two companies have been trading at rock bottom prices lately, with Tesla's stock down more than 30% in the past month.

Tesla has been promising to bring the Model 3 to market by the end of 2016.

The company has been working on the car for a while now, and it's expected the car will be ready for production by the end of this year.

Tesla has been working on the car for a while now, and it's expected the car will be ready for production by the end of this year.

The company has been working on the Model 3 for a while now, and it's expected the car will be ready for production by the end of this year.

The two companies have been trading at rock"," the Mercedes-Benz SLS AMG and BMW M5. It's a compact, all-wheel-drive sedan, and it's a pretty good one. It's got a 6.2-liter V8, which is a bit more powerful than the 6.1-liter V8 in the BMW M5. It has a very strong 0-60 mph time of just 3.8 seconds, and it's got a top speed of 236 mph. It's got a 6.7-liter V8, which is a bit more powerful than the 6.2-liter V8 in the BMW M5. It has a very strong 0-60 mph time of just 3.8 seconds, and it's got a top speed of 236 mph.

The Chevy Bolt is a six-door sedan, and it's a pretty good one. It's got a 6.2-liter V8, which is a bit more powerful than the 6.1-liter V8 in the BMW M5. It has a very strong 0-60 mph time of just 3.8 seconds, and it's got a top speed of 236 mph. It's got a 6.7-liter V8, which is a bit more powerful than the 6.2-liter V8 in the BMW M5. It has a very strong 0-60 mph time of just 3.8 seconds, and it's got a top speed of 236 mph.

The"," Ford in that it's a big brand with a lot of cash to spend. But unlike Ford, it's a big brand that has big ambitions. And Hyundai's ambitions are huge. The company is working on a new generation of compact models that it hopes will beat the likes of the Toyota Camry and Mercedes-Benz C-Class.

The 2017 Hyundai Elantra will be the first car to get the new all-wheel-drive system, and it'll be the first to come with a new all-wheel-drive system.

The Elantra is expected to get a 6.2-liter V-6 engine that's paired with a six-speed manual transmission. The automaker says it's the first car to get 6.2-liter V-6 engines.

Hyundai says its new hybrid system will be more efficient, but it's also expected to be more expensive than the current hybrid system.

The new all-wheel-drive system is expected to cut fuel consumption by up to 6 percent, and the new hybrid system is expected to reduce fuel consumption by up to 10 percent.

Hyundai is also expected to introduce a new, larger, all-wheel-drive system in the new Elantra.

The new all-wheel-drive system will feature a new technology called Adaptive Cruise Control that will allow the car to take over when other systems fail. To give you an idea of what this means,"," Toyota in that it's a manufacturer that makes cars that are powered by its own hybrid technology but also has a range of products that are powered by internal combustion engines.

The company is also a vehicle manufacturer that produces a wide range of vehicles that are powered by electric technology.

The company's new hybrid electric vehicle, the ZEV, is currently being developed as a concept vehicle that will be used in the production of the ZEV.

The company's electric vehicle, the ZEV, is currently being developed as a concept vehicle that will be used in the production of the ZEV.

Kia Motors, which is also a vehicle manufacturer, is also developing a hybrid electric vehicle called the Kia Soul.

Kia Motors, which is also a vehicle manufacturer, is also developing a hybrid electric vehicle called the Kia Soul.

According to a press release, Kia Motors is working on developing the Kia Soul as part of the company's efforts to develop a hybrid electric vehicle.

The Kia Soul is expected to be released in the second half of 2016.

The company's hybrid electric vehicle, the Kia Soul, is currently being developed as a concept vehicle that will be used in the production of the Kia Soul.

The company's electric vehicle, the Kia Soul, is expected to be released in the second half of 2016.

Toyota Motor Corp. is developing a new hybrid electric vehicle called"," the Renault-Nissan alliance, but it does not have the same alliance with Nissan.

The Renault-Nissan Alliance (RENA) is a partnership between Renault and Nissan.

The alliance was established in 2009 and has been in operation for over a decade.

It was formed to help meet the needs of the Renault-Nissan Alliance and Renault's customers.

The Renault-Nissan Alliance has been in existence since 2009 and has been in operation since 2005.

It was formed to help meet the needs of the Renault-Nissan Alliance and Renault's customers.

It is a joint venture between Renault and Nissan.

It is a joint venture between Renault and Nissan.

It is a joint venture between Renault and Nissan.

It is a joint venture between Renault and Nissan.

It is a joint venture between Renault and Nissan.

It is a joint venture between Renault and Nissan.

It is a joint venture between Renault and Nissan.

It is a joint venture between Renault and Nissan.

It is a joint venture between Renault and Nissan.

It is a joint venture between Renault and Nissan.

It is a joint venture between Renault and Nissan.

It is a joint venture between Renault and Nissan.

It is a joint venture between Renault and Nissan.

It is a joint venture between Renault and Nissan.

It is a joint venture between Renault and"," the Corvette, but with a higher output of 5.7 liters and a higher displacement 4.8L. It is powered by a 2.0-liter four-cylinder engine producing 604 horsepower and 578 pound-feet of torque. Lamborghini is also equipped with a 5.2L twin-turbocharged V12 engine producing 542 horsepower and 556 pound-feet of torque.

The Lamborghini Huracan will be available in the United States from January of 2016 and in Canada from January of 2017.

Source: Lamborghini<|endoftext|>The following article was originally published in the April 2016 issue of the Journal of Open Science, and is reposted here with permission.

Many scientists believe that the universe is expanding at an accelerating rate. But what happens when we look back in time?

In a paper published in the April 2016 issue of the journal Science, a team of astronomers from the University of Toronto and the University of New South Wales in Australia used data from the Large Synoptic Survey Telescope (LSST) to look back in time to measure the rate at which the universe expands.

The team used a technique called gravitational lensing to study the expansion of the universe. The lensing technique is a technique that attempts to detect the gravitational lensing of the universe by looking through a lens. The lensing technique works by detecting the gravitational lensing of the universe by looking through a lens.

To"," the Mercedes-Benz S-Class, but it's more expensive and has a higher starting price. However, it has a higher base price than the S-Class and comes with more advanced features, including a more powerful 1.6-liter V6 engine.

The new S-Class with a 3.0-liter V6 engine, which was introduced in the S-Class, comes with a starting price of $49,795.

The new S-Class with a 3.0-liter V6 engine, which was introduced in the S-Class, comes with a starting price of $49,795. Mercedes-Benz has also announced that it will offer the S-Class with a 3.0-liter V6 engine, which will cost $49,995.

The new S-Class with a 3.0-liter V6 engine, which was introduced in the S-Class, comes with a starting price of $49,995. Mercedes-Benz has also announced that it will offer the S-Class with a 3.0-liter V6 engine, which will cost $49,995.

The new S-Class with a 3.0-liter V6 engine, which was introduced in the S-Class, comes with a starting price of $49,995. Mercedes-Benz has also announced that it will offer the S-Class with a 3.0-liter V6 engine, which will cost $"," the BMW M4. The front end is similar to the BMW M3, and the rear end is similar to the BMW M3.

The design of BMW's new M3 is similar to the BMW M4. The front end is similar to the BMW M3, and the rear end is similar to the BMW M3.

The BMW M3 uses the same engine as the BMW M4, but the engine has been replaced with a twin-turbocharged V8.

The BMW M3 is offered with a 6-speed manual transmission.

The BMW M3 is available in a range of body styles, from sporty to sporty. The BMW M3 is offered in a range of body styles, from sporty to sporty.

The BMW M3 is available in several color combinations. The BMW M3 is available in several color combinations.

The BMW M3 is available in a range of trim levels. The BMW M3 is available in a range of trim levels.

The BMW M3 is available in a range of price ranges. The BMW M3 is available in a range of price ranges.

The BMW M3 is available in a range of price levels. The BMW M3 is available in a range of price levels.

The BMW M3 is available in a range of color options. The BMW M3 is available in a range of color options.

The BMW M"," their other cars in that they are built around a three-cylinder engine, with the engine being the only powertrain. The engine is a 4.0 liter V8 and is able to produce 350 horsepower and 350 lb-ft of torque. A six-speed manual transmission is standard on the Ford F-150.

The Ford F-150 is powered by a four-speed automatic transmission, which Ford calls the F-150S. The F-150S is a four-wheel drive truck with a 7.0 liter V8 engine that powers the truck's front axle. The truck's powertrain is a four-wheel drive V6 engine that powers the truck's rear axle. The truck's torque output is rated at 300 lb-ft of torque and 375 lb-ft of torque.

The truck's suspension is standard on the F-150S. The truck has a six-point adjustable suspension, with a coil spring and shock absorber. The suspension is adjustable in all four corners and there are six different settings for the coil spring and shock absorber.

Ford says the F-150S is the first truck to have a fully adjustable suspension.

The truck's body is made of aluminum and is covered in a soft-touch, leather-like material. The truck is powered by a 1.8 liter diesel engine that produces 320 horsepower.

The truck's tires are standard on the F-150S. The tires are"," other automakers in that they have a lot of history with the sportscar market, but they also have a lot of history with the sports car market, which is where they have been most successful. They have a tradition of pushing the envelope, and they've done that with the 911.

""The 911 is a great car, but it's also a car that's been around for a long time, and it's a car that's been around for a long time in the U.S., and it's a car that's been around for a long time in Europe, and it's a car that's been around for a long time in Asia, and it's a car that's been around for a long time in North America.

""So, the fact that it's been around for a long time in North America, and it's a car that's been around for a long time in Europe, and it's a car that's been around for a long time in Asia, and it's a car that's been around for a long time in Africa, and it's a car that's been around for a long time in South America, and it's a car that's been around for a long time in Latin America, and it's a car that's been around for a long time in Africa, and it's a car that's been around for a long time in South America, and it's a car that's been around for a long time in Asia"," the BMW Group in that it is a global company, and it is also based in the United States.

The Audi press release said the car would be available in the U.S. in the second quarter of 2015.

Audi's U.S. sales fell 6.7 percent to 9,606 units in the first quarter.

That was the second straight quarter of decline.<|endoftext|>(CNN) The number of Americans who think the US is losing control of its borders has skyrocketed in the past year, according to a new poll.

The new CNN/ORC International poll released Wednesday found that 53% of Americans think the US is losing control of its borders, up from 44% in January.

The survey found that the majority of Americans believe that the US is losing control of its borders, with 58% saying the US is losing control of its borders less than six months after President Donald Trump took office.

The majority of Americans also believe that the US is losing control of its borders more than six months after the election of President Donald Trump, with 59% saying the US is losing control of its borders less than six months after Trump's election, according to the CNN/ORC poll.

The poll also found that 52% of Americans think the US is losing control of its borders more than six months after the election of President Donald Trump, with only 37% saying the US is losing control of its borders less than six"," Tesla, with a range of about 100 miles, but the Model 3 is supposed to be much longer than that. The Model 3 is expected to have a range of more than 200 miles, and it will be equipped with the same technology as the Model S.

Tesla's Model S is less expensive than the Model 3, and it has a range of about 200 miles.

Tesla's Model X, meanwhile, is less expensive than the Model 3, and it has a range of about 200 miles.

The Model 3 will be available in two trim levels: the base model, which starts at $35,000 and includes a $5,000 destination charge, and the Plus model, which starts at $70,000 and includes a $7,500 destination charge.

Tesla's Model S starts at $35,000 and includes a $5,000 destination charge.

The Model 3 comes with a slew of new features, including an electric motor, electric brakes, solar panels, and the ability to tow a car with the help of a satellite navigation system.

The Model 3 is expected to have a range of more than 200 miles.

A Tesla spokesperson told Business Insider that the company is ""not sure how long the range of the Model 3 will be,"" adding that the company is ""working with our suppliers to figure out the exact range of the Model 3.""

Tesla has not yet confirmed that the Model 3 will have a range"," Ferrari, but with a different engine. It's called a turbocharged V6 and it's a completely different engine. It's got 6,000 horsepower, which is more than twice the power of the Ferrari F12. It's got an electric motor that's a little bit more powerful than the Ferrari F12, but it's not as powerful as the Ferrari F12.

There's a lot of technology that Ferrari has incorporated. It has a lot of technology that's being incorporated into the Ferrari F12. It's the same engine, it's the same engine, but it's got a new gearbox, which is a bit more powerful and it's got a new clutch, which is a bit more powerful.

So Ferrari has made a lot of technological advances, but it's very unique. It's very different from Ferrari.

What do you think of Ferrari's new engine?

I think it's a great engine, but I think it's more than that. It's the same engine, it's the same engine, but it's got a new gearbox, which is a bit more powerful and it's got a new clutch, which is a bit more powerful.

What I think is really interesting is that Ferrari is getting rid of the old engine, which is the V12, and they have replaced it with a turbocharged V6. And that's where they're going to get the most out of it. The V12"," the BMW M3, but with a more powerful engine and a higher price tag. The car is also equipped with a rear spoiler and a rear spoiler with a cantilever design. The rear spoiler is designed to allow the car to be angled in a more favorable direction.

The rear spoiler is designed to allow the car to be angled in a more favorable direction.

The rear spoiler is designed to allow the car to be angled in a more favorable direction.

The rear spoiler is designed to allow the car to be angled in a more favorable direction.

The rear spoiler is designed to allow the car to be angled in a more favorable direction.

The rear spoiler is designed to allow the car to be angled in a more favorable direction.

The rear spoiler is designed to allow the car to be angled in a more favorable direction.

The rear spoiler is designed to allow the car to be angled in a more favorable direction.

The rear spoiler is designed to allow the car to be angled in a more favorable direction.

The rear spoiler is designed to allow the car to be angled in a more favorable direction.

The rear spoiler is designed to allow the car to be angled in a more favorable direction.

The rear spoiler is designed to allow the car to be angled in a more favorable direction.

The rear spoiler is designed to allow the car to be angled in a more favorable direction.

The rear spoiler"," the BMW i8 in terms of design, but the Volvo XC90 is much more powerful and has a much better interior.

The XC90 is a new generation of Volvo that will be delivered in 2015. The XC90 will have a new engine and a new engine layout. The XC90 will be available in the following models:

XC90 XC90 XC90 S XC90 S S XC90 S S XC90 S S XC90 S S XC90 S S XC90 S S XC90 S S XC90 S S XC90 S S XC90 S S XC90 S S XC90 S S XC90 S S XC90 S S XC90 S S XC90 S S XC90 S S XC90 S S XC90 S S XC90 S S XC90 S S XC90 S S XC90 S S XC90 S S XC90 S S XC90 S S XC90 S S XC90 S S XC90 S S XC90 S S XC90 S S XC90 S S XC90 S S XC90 S S XC90 S S XC90 S S XC90 S S XC90 S S XC90 S S XC90 S S XC90 S S XC90 S S XC90 S S X"
