,The car brand is similar to
0," the Mercedes-Benz C-Class, Mercedes-Benz S-Class and the Mercedes-Benz C-Class E-Class. The C-Class is a compact family sedan that is also a sporty luxury car. It is available in two models, the C-Class E-Class and C-Class G-Class. The C-Class E-Class is a premium sedan with a 3.5-liter V6 engine that produces around 400 hp and is capable of reaching a top speed of 155 mph. The C-Class G-Class is a luxury sedan with a 3.0-liter V8 engine that produces around 400 hp and is capable of reaching a top speed of 195 mph.

The C-Class G-Class is a premium sedan with a 3.0-liter V8 engine that produces around 400 hp and is capable of reaching a top speed of 155 mph. The C-Class E-Class is a luxury sedan with a 3.0-liter V8 engine that produces around 400 hp and is capable of reaching a top speed of 195 mph.

The C-Class E-Class is a premium sedan with a 3.0-liter V8 engine that produces around 400 hp and is capable of reaching a top speed of 155 mph. The C-Class G-Class is a luxury sedan with a 3.0-liter V8 engine that produces around 400 hp and is capable of reaching a top speed of 195 mph.

"
1," Toyota in that it is a direct competitor to Nissan in terms of fuel economy. However, the Kia brand is also a direct competitor to Hyundai, which is a direct competitor to Toyota.

Kia's fuel economy is a little more impressive than the Toyota fuel economy figures. Kia's fuel economy is approximately 29 MPG lower than the Toyota fuel economy figures, but that's not really surprising. The fuel economy figures are based on a combination of fuel economy data from the EPA and fuel economy data from the manufacturer. Kia has increased its fuel economy by approximately 2 MPG since the beginning of 2011.

That's not to say that Kia's fuel economy is perfect, but it is far better than its competition. As with all fuel economy numbers, Kia's fuel economy is usually adjusted for differences in driving habits, weather, road conditions, etc.

So what's the big deal? Well, Kia has been making fuel economy figures since the beginning of the year. Since this is the first year that they've released them, it's important to note that the numbers are based on a combination of fuel economy data from the EPA and fuel economy data from the manufacturer.

The numbers are based on a combination of fuel economy data from the EPA and fuel economy data from the manufacturer.

Kia's fuel economy has been steadily increasing since 2011. In fact, the numbers have been increasing for the past several years. The fuel economy figures have been increasing"
2," the Jaguar XF and XJ models, but with a much more aggressive body shape, wider tires and more aggressive suspension.

The XJ will be released in the United States on April 13, 2018.

The Jaguar XJ was recently revealed at the 2016 Geneva Motor Show.

The XJ will be available in three variants:

XJ Sport – The sports version of the XJ, with the same engine and suspension as the XJ Sedan.

XJ Sport Plus – The extra-sport version of the XJ, with the same engine and suspension as the XJ Sport.

XJ Sport Plus Plus – The sports version of the XJ, with the same engine and suspension as the XJ Sport Plus.

The XJ Sport Plus Plus will be available in two models:

XJ Sport Plus Plus – The sports version of the XJ, with the same engine and suspension as the XJ Sport Plus.

XJ Sport Plus Plus Plus – The sports version of the XJ, with the same engine and suspension as the XJ Sport Plus Plus.<|endoftext|>The most popular Star Wars movie of all time, Star Wars: Episode IV A New Hope, is now the second most expensive film of all time.

According to a report by the Hollywood Reporter, the movie's box office take was $1.1 billion, beating out the $1.05 billion earned by the $1"
3," Audi and BMW, but it's no longer a luxury brand.

The Swedish firm has been taking the lead in the mobile-phone market with its brand-new A4 and A5 models, which are aimed at the middle-class.

The new A5, which is expected to be launched in October, is expected to sell for around $36,000.<|endoftext|>The greatest of all great men, and the greatest of all great women, was the great, and the greatest of all great nations, was the great, and the greatest of all great nations, was the great, and the greatest of all great nations, was the great, and the greatest of all great nations, was the great, and the greatest of all great nations, was the great, and the greatest of all great nations, was the great, and the greatest of all great nations, was the great, and the greatest of all great nations, was the great, and the greatest of all great nations, was the great, and the greatest of all great nations, was the great, and the greatest of all great nations, was the great, and the greatest of all great nations, was the great, and the greatest of all great nations, was the great, and the greatest of all great nations, was the great, and the greatest of all great nations, was the great, and the greatest of all great nations, was the great, and the greatest of all great nations, was the great"
4," the Mercedes-Benz S-Class, with a similar body style, but the S-Class is more expensive.

The new model will be available in the UK from the end of the year, with a launch expected in the spring.

The new model is expected to offer a range of optional equipment, including a 4WD, a 3.0-litre engine, a rear-wheel drive system, a manual transmission and a hybrid drivetrain.

The new model will also be available in the United States, with a launch expected in the fall.

The S-Class is a high-end luxury car that is expected to offer a range of luxury options, including a 4WD, a 3.0-litre engine, a manual transmission and a hybrid drivetrain.

The new model is expected to offer a range of optional equipment, including a 4WD, a 3.0-litre engine, a manual transmission and a hybrid drivetrain.

The new model is expected to offer a range of optional equipment, including a 4WD, a 3.0-litre engine, a manual transmission and a hybrid drivetrain.

The new model is expected to offer a range of optional equipment, including a 4WD, a 3.0-litre engine, a manual transmission and a hybrid drivetrain.

The new model is expected to offer a range of optional equipment, including a 4WD, a 3."
5," the McLaren F1 team, which is owned by McLaren and is based in McLaren's home city of McLaren-Honda.

The deal is expected to be completed by the end of the year.

The deal will see the team take over the team's current facility in the city of Barcelona, which has a capacity of about 30,000.

The team will also be based in the city of Barcelona's Olympic Park and will continue to run the team's current development of the car.

The team will be based in Barcelona for at least the next five years.

The deal is expected to be completed by the end of the year.

The team will also be based in the city of Barcelona's Olympic Park and will continue to run the team's current development of the car.

The deal is expected to be completed by the end of the year.

The team will also be based in the city of Barcelona's Olympic Park and will continue to run the team's current development of the car.

The deal is expected to be completed by the end of the year.

The team will also be based in the city of Barcelona's Olympic Park and will continue to run the team's current development of the car.

The deal is expected to be completed by the end of the year.

The team will also be based in the city of Barcelona's Olympic Park and will continue to run the team's current development of"
6," the Porsche 911 Carrera GT, but with a few differences.

The Porsche 911 Carrera GT

The Porsche 911 Carrera GT is the most famous car in the world. It was built in the early 1990s by Porsche and was the first Porsche car to achieve the highest speed of 760 km/h (489 mph). The car was designed by Porsche's designers and was based on the 911 Turbo, which was the first ""supercar"".

The car was also the first car to be licensed by the FIA (European Motor Sport Council) and was the first Porsche car to be officially registered in the United States.

The car is also one of the most recognizable cars in the world of sports cars. In fact, it is the most popular car in the world and one of the most recognizable cars in the world today. The car is a classic interpretation of the 911 Turbo, which was a light-weight sports car. The name 911 is a trademark of Porsche, which means ""quick"" or ""quick"" in German.

The car has a total of 1459 horsepower (14,788 kW) and 1450 lb.-ft. of torque (13,849 Nm). It is powered by a 4.0-liter V8 engine with a maximum output of 5,500 hp (3,600 kW) and 6,000 lb.-ft. (2,400 Nm).

The car is powered by a 6-"
7," Ford in its approach to electric vehicles, but it has made significant improvements to its range of vehicles. The 2016 Ford Fusion is the first to offer a fully electric drivetrain, and the company plans to roll out a range of plug-in hybrid models in the future.

The new Fusion is expected to offer a range of more than 200 miles on a single charge, which is good for 35 miles on a single charge. The EPA estimates that the vehicle will be able to go about 50 miles on a charge without refueling.

The new Fusion's range will be good enough for some of the most demanding driving conditions, including city driving, where a range of up to 150 miles is possible.

The company says that the Fusion's range is due to the car's ""autonomous driving system,"" which gives the driver control over the vehicle's driving behavior. The car is able to offer various modes of driving, such as automatic, manual and cruise control.

The new Fusion comes with a range of technology that allows it to go from zero to 60 mph in 4.8 seconds, and it can accelerate from 0 to 60 mph in 11.7 seconds. That's a huge improvement over the previous generation of the Fusion, which was able to go from 0 to 60 mph in just over 5.7 seconds.

The 2016 Ford Fusion is available with a maximum output of 250 horsepower, and the company says that the powertrain is capable of producing 300 horsepower from"
8," Audi, with its unique character and design, but its cars are more expensive than most.

""We have to be careful with what we say because we are not an Audi brand,"" said Carrera. ""We are a brand that is trying to make a name for ourselves.""

Under the new model, the new model will be a bit more affordable, he said.

""We have to make it a bit more affordable, but we also have to make it more attractive for the people who want to buy it,"" said Carrera.

But he said in the end, it will be a two-door, four-door sedan.

Carrera said the new model will be a little bit more affordable, but it will also have a lot more options.

""We have to be careful with our price point because we are not a luxury brand,"" he said. ""We are a luxury brand that is trying to make a name for ourselves.""

The new model will be available in the U.S. in the middle of next year.

The new model will be available in the U.S. in the middle of next year.

The new model will be available in the U.S. in the middle of next year.<|endoftext|>Image copyright EPA Image caption The US has been criticised for its treatment of Guantanamo Bay prisoners

A US judge has ruled that the US cannot indefinitely detain US citizens suspected of being terrorists."
9," the Porsche 918 Spyder, with the exception of the engine. The new car is based on the 911 Turbo, but with a more powerful 4.0-liter flat-four, a more powerful 2.4-liter flat-six, and a two-speed manual transmission.

The new 911 Turbo comes with a higher engine displacement of 583 cc, which is more than twice the power of the 911 Turbo. The new 911 Turbo is rated at 184 hp and 205 lb-ft of torque.

The new 911 Turbo has a 3.6-liter flat-four, paired with a 2.3-liter turbocharged V-6. The 4.0-liter flat-six, coupled with a 6-speed manual transmission, produces 184 hp and 236 lb-ft of torque. The new 911 Turbo also comes with a six-speed automatic transmission, which is rated at 184 hp and 224 lb-ft of torque.

The new 911 Turbo will be available in the United States beginning in late 2016. The price of the new 911 Turbo is set to be $23,995, which is $1,000 less than the price of the new 911 Turbo. The new 911 Turbo will be available in the United States starting in late 2016. The price of the new 911 Turbo is set to be $23,995, which is $1,000 less than the price of the new 911 Turbo.

The new 911 Turbo is expected to"
10," Mercedes-Benz, but it has more of a luxury-car feel. The styling is very similar to the Mercedes-Benz S-Class, which is also available in the U.S.

The new model, which is being developed by the Chinese company, is expected to be introduced in Q2 of this year. It will be available in two models: the base model with a 3.0-liter V6 engine that can produce up to 323 horsepower and a 1.8-liter V6 engine that can produce up to 540 horsepower, and the premium model with a 5.0-liter V8 engine that can produce up to 590 horsepower.

The base model will have the same price tag as the S-Class, but will have a lower price tag. It will be offered with a standard six-speed manual transmission, a six-speed dual-clutch automatic transmission, and a seven-speed dual-clutch automatic transmission.

The premium model will have a six-speed automatic transmission and a seven-speed dual-clutch automatic transmission.

The base model will be available in the U.S. for $37,900. The premium model will be available in the U.S. for $45,900.<|endoftext|>The following is a guest post by Daniel Zang.

On the morning of February 17, 2015, I woke up to a text message from a friend. It was a small message, but"
11," the BMW i3, which is based on the same platform.

The Mercedes-Benz S-Class is a compact SUV that is developed by Mercedes-Benz in collaboration with the German firm Saab. It is expected to be available in the UK in 2017.

The S-Class is the first car to be built in the UK by a German car manufacturer. The F1 team has been in discussions with Saab for some time, but the deal was not completed until recently.

The S-Class is the third car to be built in the UK by a German car manufacturer since the S-Class was introduced in 2011.

The Mercedes-Benz S-Class is a compact SUV that is developed by Mercedes-Benz in collaboration with the German firm Saab. It is expected to be available in the UK in 2017.

The Mercedes-Benz S-Class is a compact SUV that is developed by Mercedes-Benz in collaboration with the German firm Saab. It is expected to be available in the UK in 2017.

The Mercedes-Benz S-Class is a compact SUV that is developed by Mercedes-Benz in collaboration with the German firm Saab. It is expected to be available in the UK in 2017.

The Mercedes-Benz S-Class is a compact SUV that is developed by Mercedes-Benz in collaboration with the German firm Saab. It is expected to be available in the UK in 2017.

The Mercedes-"
12," Ferrari and Mercedes-Benz, and it's one of the most successful brands in the world.

""The car brand is similar to Ferrari and Mercedes-Benz, and it's one of the most successful brands in the world.""

The car brand will be sold in the UK and Europe, with a new model due to launch in the US in the next few months.

It is likely the new model will be based on the current Ferrari 458 Italia, but the new model will be based on the new version of the F1 car, which is due to be unveiled at the Geneva Motor Show next week.

Image copyright Getty Images Image caption Ferrari is a major investor in Formula One

The latest F1 car, which is being developed by Mercedes-Benz, has been designed by Rubens Barrichello, who also designed the F1 car for the late British manufacturer Aston Martin.

It is due to be unveiled at the Geneva Motor Show next week.

The car will be powered by a 5.0-litre V8 engine, which is expected to produce around 500bhp and 800lb ft of torque.

The car will be based on the next-generation Ferrari F40, which is expected to debut in the first half of 2016.<|endoftext|>A 20-year-old man has been charged with murder after he allegedly shot and killed his mother in her home in the northern city of Gudrun, police said on"
13," Mercedes-Benz, and the company had been planning to launch its first electric vehicle, the E-Class, in 2019.

""The E-Class is designed to be the first all-electric vehicle that is affordable for consumers who want to drive every day,"" Mercedes-Benz said in a statement.

The company said the E-Class will be offered in a variety of models, including the E-Class E-Class, E-Class E-Class S, E-Class E-Class S Plus, E-Class E-Class S Plus Plus, E-Class S, E-Class S Plus, E-Class S Plus Plus, E-Class S Plus, E-Class S Plus Plus, E-Class S Plus Plus, E-Class S Plus Plus, E-Class S Plus Plus Plus, E-Class S Plus Plus Plus and E-Class S Plus Plus Plus.

The E-Class will be available in four models: the E-Class E-Class, E-Class E-Class S, E-Class E-Class S Plus, and E-Class S Plus Plus.

The E-Class will be available in the U.S. starting in 2017, and the company said it expects to sell around 5,000 of the new vehicles a year.

The E-Class will be offered in a range of trim levels, including the E-Class E-Class and the E-Class E-"
14," Ford's Focus, but with a few key differences. The Focus' engine is a turbocharged 4.2-litre V8, while the Fiesta's is a flat-six.

The Fiesta's engine is a turbocharged 4.2-litre V8, while the Fiesta's is a flat-six. The Fiesta is the first Fiesta to be equipped with a 5.0-litre V8, which Ford has been using since the late 1960s. The V8 is a twin-scroll turbo, which is much more powerful than the V8 used on the Ford Fiesta ST.

The engine is a twin-scroll turbo, which is much more powerful than the V8 used on the Ford Fiesta ST. The Fiesta's engine is a turbocharged 4.2-litre V8, while the Fiesta's is a flat-six. The Fiesta is the first Fiesta to be equipped with a 5.0-litre V8, which Ford has been using since the late 1960s. The V8 is a twin-scroll turbo, which is much more powerful than the V8 used on the Ford Fiesta ST. The Fiesta is the first Fiesta to be equipped with a 5.0-litre V8, which Ford has been using since the late 1960s. The V8 is a twin-scroll turbo, which is much more powerful than the V8 used on the Ford Fiesta ST. The Fiesta is the first Fiesta to be"
15," Mercedes-Benz in that it's a compact car that also has a lot of power. But it's also got a little bit more personality. It's got a nice, sensual, sexy, aggressive feel to it. There's a lot of personality to it.

When I was in New York for the launch, I was very impressed by the way the car looked. I think that's the thing that really sets it apart from the other cars. The way it looks, it's very much like a Ferrari. It's an extremely sexy car. It's got a lot of personality. It's got a bit of a presence. It's got a bit of a personality. It's got a lot of personality. It's got a lot of personality. It's got a lot of personality. It's got a lot of personality. It's got a lot of personality. It's got a lot of personality.

I think that's the thing that really sets it apart from the other cars. It's very much like a Ferrari.

When I was in New York for the launch, I was very impressed by the way the car looked. I think that's the thing that really sets it apart from the other cars. The way it looks, it's very much like a Ferrari. It's an extremely sexy car. It's got a lot of personality. It's got a bit of a presence. It's got a bit of a personality. It's"
16," the Mercedes-Benz S-Class, which is also available in the US, but with a more luxurious interior.

The S-Class is available in both the standard and premium versions.

The sedan has a 5.0-liter V8 engine making 400 horsepower and 400 pound-feet of torque.

The sedan comes standard with a six-speed automatic transmission and a seven-speed automatic transmission.

The S-Class is available with 18-inch alloy wheels and a standard 20-inch alloy wheels.

The sedan comes with a six-speed manual transmission.

The S-Class is available with a power-adjustable six-speed automatic transmission.

The sedan comes with a power-adjustable six-speed manual transmission.

The S-Class comes with a power-adjustable six-speed automatic transmission.

The S-Class comes with a power-adjustable six-speed automatic transmission.

The sedan comes with a power-adjustable six-speed automatic transmission.

The sedan comes with a power-adjustable six-speed automatic transmission.

The sedan comes with a power-adjustable six-speed automatic transmission.

The sedan comes with a power-adjustable six-speed automatic transmission.

The sedan comes with a power-adjustable six-speed automatic transmission.

The sedan comes with a power-adjustable six-speed automatic transmission.

"
17," Audi, but it is a more affordable model, and has a more affordable price tag. The car is available in three trim levels, and comes with a standard 2.0-liter twin-turbocharged inline-four engine with four valves per cylinder, a four-speed manual transmission, and a seven-speed automatic transmission. The car comes with a pair of front-wheel drive, all-wheel drive, and a seven-speed manual transmission.

The car also comes with a heated steering wheel and heated seats.

In addition to the new Audi A8, the company also announced that it will be introducing a new hatchback model, the A8 Plus, in 2017. The A8 Plus is a sports car, and will sport a 3.0-liter twin-turbocharged inline-four engine with six-speed manual transmission and a seven-speed automatic transmission. The car will be available in two trim levels, and comes with a standard 2.0-liter twin-turbocharged inline-four engine with four valves per cylinder, a four-speed manual transmission, and a seven-speed manual transmission.

The A8 Plus will come with a five-speed automatic transmission, and will also come with a seven-speed manual transmission.

The new A8 Plus will come with a six-speed manual transmission. The A8 Plus will also come with a seven-speed manual transmission.

The new A8 will also"
18," the sports car brand Mercedes-Benz, which is currently in a legal battle with the European Commission over its tax avoidance scheme.

The company has been criticised for its tax affairs by the EU and has been ordered to pay €1.5bn (£1.1bn) in back taxes.

The company has been also fined €500m by the European Commission.

Clive Palmer, the former Australian Prime Minister, has also come under fire for his involvement in the car brand.

The Australian Government has also been ordered to pay $1.3bn (£1.2bn) in fines.

The Australian Government has also been ordered to pay $1.3bn (£1.2bn) in fines.

The car brand has been criticised for its tax affairs by the EU and has been ordered to pay €1.5bn (£1.1bn) in back taxes.

The company has also been fined €500m by the European Commission.

The Australian Government has also been ordered to pay $1.3bn (£1.2bn) in fines.

The car brand has been criticised for its tax affairs by the EU and has been ordered to pay €1.5bn (£1.1bn) in back taxes.

The company has also been fined €500m by the European Commission.

The car brand has been criticised for its tax affairs by the EU and has been ordered to"
19," Toyota, which is one of the largest car brands in the world.

The company is also developing a new sports car called the C-class.

The company says it is not making any announcements at this time.<|endoftext|>After the announcement of the Xbox One X, Microsoft is now looking to add more games to the lineup.

According to a report in Gamasutra, Microsoft is planning to launch a slew of new games for the console during the holiday season, with the company also looking to expand the Xbox Live Arcade library.

The report states that Microsoft will be releasing a number of new games for the Xbox One X during the holiday season, including a number of ""unique"" titles that will be exclusive to the console.

The games will include titles like ""Assassin's Creed: Unity,"" ""Assassin's Creed: Revelations,"" ""Battlefield 1,"" ""Call of Duty: WWII,"" and ""Call of Duty: WWII: WW2.""

The official Xbox Store page for the Xbox One X has not yet been updated.<|endoftext|>The New York Times has published a piece on the origins of the word ""cuckold."" The author, Jonathan Chait, writes that the term has been around for quite some time, but that it was first coined by a New York Times writer in the 1950s.

Chait writes:

It's not a new idea. In the 1950s, a journalist named John Berger wrote that he"
