368," BMW (BMWM), which is a subsidiary of Volkswagen AG (VW).

The German automaker is also the world's largest carmaker by sales.

The Black Friday deal is the largest such deal in history, according to the company.

The deal is worth $1.5 billion, the company said.

A spokesman said the deal was not linked to the Black Friday holiday, but was announced as part of BMW's strategy to boost sales.

In the UK, Black Friday sales are unaffected by the holiday, according to the company.

The deal is expected to close in the first quarter of 2015.

The deal is one of a number of deals announced by BMW in recent months, including the $1.5 billion purchase of Audi in January, the $1 billion purchase of Mercedes-Benz last month and the $1 billion deal for the UK's largest carmaker, Jaguar Land Rover, in January.

BMW's sales are expected to fall by 5 percent year-on-year, according to the company.<|endoftext|>The New York Post reported that the FBI has concluded that Russian hackers are responsible for the hacks of Democratic National Committee and Hillary Clinton campaign chairman John Podesta.

The Post reported that the FBI has concluded that Russian hackers are responsible for the hacks of Democratic National Committee and Hillary Clinton campaign chairman John Podesta.

The Post also reported that the FBI has concluded that Russian hackers are responsible for the hacks of"
369," Mercedes-Benz, BMW and Audi.

The company said it had no comment on the issue.

Topics: consumer-protection, federal---state-issues, business-economics-and-finance, australia

First posted<|endoftext|>A federal judge has denied a motion to dismiss a lawsuit filed by the state of New York against the American Civil Liberties Union, claiming the group has engaged in ""speech-and-press"" activities that violate the First Amendment.

The lawsuit was filed by the New York Civil Liberties Union on behalf of two people who were arrested in 2011 for allegedly violating New York's New York State Assembly Bill 598, which prohibits ""disparaging, disparaging, or insulting"" any person based on race, color, religion, sex, national origin, age, disability, sexual orientation, or gender identity.

The ACLU argued the law violated the First Amendment, which protects speech and press, because it prohibits the government from ""interfering with the free exercise"" of speech.

The ACLU said the law violated the First Amendment because it was vague, and that the law was designed to allow for the government's use of ""pre-recorded"" law enforcement audio recordings to justify arrests of people for alleged ""disparaging, disparaging, or insulting"" speech.

The New York Civil Liberties Union argued that the law was unconstitutional because it was vague and that the government was only required to prove that a person was"
370," the BMW M3, but it has been made with a more modern chassis. The result is a sporty and muscular car that is sure to please the fans of the sporty and sporty-looking BMW M3.

The new BMW M3 is powered by a 2.0-liter 4-cylinder engine with 184 horsepower and 184 pound-feet of torque. The car's engine produces 215 horsepower and 216 pound-feet of torque through the 6-speed automatic transmission.

The BMW M3 is equipped with a seven-speed manual transmission, a seven-speed automatic transmission, and a six-speed manual transmission. The car is also available with a six-speed manual transmission, which is available only for M3 models.

The car is powered by a 2.0-liter four-cylinder engine with 184 horsepower and 184 pound-feet of torque. The car's engine produces 215 horsepower and 216 pound-feet of torque through the 6-speed automatic transmission.

The new BMW M3 is equipped with a seven-speed manual transmission, a seven-speed automatic transmission, and a six-speed manual transmission. The car is also available with a six-speed manual transmission, which is available only for M3 models.

The car is powered by a 2.0-liter four-cylinder engine with 182 horsepower and 182 pound-feet of torque. The car's engine produces 215 horsepower and 216 pound-feet of torque"
371," Porsche in its design, but that doesn't mean it's a bad car. The interior is nice and the exterior is a bit more attractive than the Porsche.

The interior is nice and the exterior is a bit more attractive than the Porsche. The car is a bit more expensive than the Porsche, but you have to consider the fact that the Porsche is a bit more expensive.

The car is a bit more expensive than the Porsche, but you have to consider the fact that the Porsche is a bit more expensive. The car is a bit more expensive than the Porsche, but you have to consider the fact that the Porsche is a bit more expensive.

The car is a bit more expensive than the Porsche, but you have to consider the fact that the Porsche is a bit more expensive. The car is a bit more expensive than the Porsche, but you have to consider the fact that the Porsche is a bit more expensive.

The car is a bit more expensive than the Porsche, but you have to consider the fact that the Porsche is a bit more expensive. The car is a bit more expensive than the Porsche, but you have to consider the fact that the Porsche is a bit more expensive.

The car is a bit more expensive than the Porsche, but you have to consider the fact that the Porsche is a bit more expensive. The car is a bit more expensive than the Porsche, but you have to consider the fact that the Porsche is a bit more expensive"
372," Toyota, which has been accused of using its own engine to boost profits at the expense of the environment.

The scandal has led to the resignation of the company's chairman and CEO, and it has also led to a number of lawsuits against the firm.

The carmaker has also been fined for breaching environmental standards and paying illegal bonuses to top executives.<|endoftext|>The ""first lady"" of the United States will be a woman in the White House as well as the first lady of the United States, but this week, Donald Trump's daughter Ivanka Trump will be the first woman to serve as a senior adviser to the president.

Ivanka and her husband Jared Kushner, the president's son-in-law, will be the senior advisers to the president. They will be responsible for the president's daily schedule, supervision of the president's family and policy-making.

The White House press secretary, Sarah Huckabee Sanders, said on Tuesday that Ivanka will serve as an ""adviser to the president on a number of issues.""

However, the press secretary said that the White House would not be calling on Ivanka to be the first lady of the United States, because she is not a first lady. Instead, the White House will be calling on Ivanka to be the first lady of the United States.

The White House press secretary did not say whether Ivanka would serve as the first lady of the United States, but said that the White House would be calling on"
373," Porsche, and has been since the late 1990s.

The company has been criticised for not investing in new technology, and has been slow to introduce new models.

It has been criticised for not investing in new technology, and has been slow to introduce new models.

It has been criticised for not investing in new technology, and has been slow to introduce new models.

It has been criticised for not investing in new technology, and has been slow to introduce new models.

It has been criticised for not investing in new technology, and has been slow to introduce new models.

It has been criticised for not investing in new technology, and has been slow to introduce new models.

It has been criticised for not investing in new technology, and has been slow to introduce new models.

It has been criticised for not investing in new technology, and has been slow to introduce new models.

It has been criticised for not investing in new technology, and has been slow to introduce new models.

It has been criticised for not investing in new technology, and has been slow to introduce new models.

It has been criticised for not investing in new technology, and has been slow to introduce new models.

It has been criticised for not investing in new technology, and has been slow to introduce new models.

It has been criticised for not investing in new technology, and has been slow to introduce new models.

"
374," Audi, BMW and Mercedes-Benz in terms of design and features, but it's much more affordable.

The company has also launched a new line of luxury cars, including the BMW X5 and the BMW X6, that are designed to appeal to more affluent buyers.

The X5 is based on the X5 X3, which is the first car to be designed with electric powertrains. The X5 X3 is a four-door coupe that has a range of up to 310 miles, and it will be available from 2017.

The X6 is the successor to the BMW X5 X3, which is the first car to be designed with electric powertrains.

The X6 is a four-door sedan that has a range of up to 310 miles, and it will be available from 2017.

The X5 X3 is the predecessor of the X5, which is the first car to be designed with electric powertrains.

The X5 X3 is based on the X5, which is the first car to be designed with electric powertrains.

The X6 is a four-door sedan that has a range of up to 310 miles, and it will be available from 2017.

The X5 X3 is based on the X5, which is the first car to be designed with electric powertrains.

The X5 X3 is based on the X5"
375," Audi and BMW in terms of its design, but it's a bit more refined.

The car is fitted with a revised suspension system, which is more modern than the previous model. It has a rear wheel drive system, but the steering is handled by a wheeled system.

The car is powered by a 2.0-litre petrol engine, which produces 210bhp. It is paired to a six-speed automatic gearbox. The car has an all-wheel drive system, which can be switched on or off.

The standard equipment includes a leather-wrapped steering wheel and a power-adjustable rear wing. The car comes with a four-speed manual gearbox, which is available as an option.

The price of the 2015 Audi A4 is €43,540 ($55,000) in the European Union, which is comparable to the price of a Mercedes-Benz S-Class.

Audi has not revealed the price of the A4 in the US, but the Germans are offering the car for $40,000. In contrast, the A4 is available in the US for $36,000.

The A4 is a new model for Audi, which will be launched in the US in early 2015. It is expected to be the first car to feature a six-speed automatic gearbox.

Audi is also developing a new version of its A-Class sedan, the A3,"
376," the Mercedes-Benz S-Class, but with a few differences.

The S-Class is powered by a 1.6-liter, four-cylinder turbocharged engine, giving it a claimed 0-60 mph time of 7.2 seconds (the S-Class claimed a time of 6.5 seconds in the 2012 Los Angeles Auto Show). The S-Class also has a claimed 0-100 mph time of 9.7 seconds.

The car is powered by an all-wheel-drive system, with a claimed top speed of 155 mph.

The S-Class will hit the road in 2015, and will cost $150,000.

Source: Daily Mail<|endoftext|>Wristbands are currently only available for purchase on the website, but we are now offering them as a new product through our new partner, Sky.

We will be sending out wristbands to all customers who have registered for our new partnership.

To ensure the highest level of customer service, we have decided to announce a few changes to how wristbands are handled.

Wristbands will now be sent out as a gift.

To ensure the highest level of customer service, we have decided to announce a few changes to how wristbands are handled.

We will be sending out wristbands to all customers who have registered for our new partnership.

Wristbands will now be sent out as a gift.

To ensure the highest"
377," Jaguar Land Rover and Ferrari, but it has a more contemporary design and is available in either a coupe or sedan.

The car is designed for performance, performance, performance.

The 2017 Ford Mustang GT is a high-performance coupe.

The 2017 Ford Mustang GT is a high-performance coupe.

The car is similar to the 2017 Ford Mustang GT. It's a luxury coupe.

The car is similar to the 2017 Ford Mustang GT. It's a luxury coupe.

The car is similar to the 2017 Ford Mustang GT. It's a luxury coupe.

The car is similar to the 2017 Ford Mustang GT. It's a luxury coupe.

The car is similar to the 2017 Ford Mustang GT. It's a luxury coupe.

The car is similar to the 2017 Ford Mustang GT. It's a luxury coupe.

The car is similar to the 2017 Ford Mustang GT. It's a luxury coupe.

The car is similar to the 2017 Ford Mustang GT. It's a luxury coupe.

The car is similar to the 2017 Ford Mustang GT. It's a luxury coupe.

The car is similar to the 2017 Ford Mustang GT. It's a luxury coupe.

The car is similar to the 2017 Ford Mustang GT. It's a luxury coupe.

The car is similar to the 2017 Ford Mustang GT"
378," Audi, Mercedes, BMW and Porsche, but it has a lower price point and is more affordable than its competitors.

The company has been in the news for its failure to produce the latest model of its A4 sedan.

The latest A4 is the most expensive car in the world, but the company is struggling to keep up with the demand for the car.

The company has been struggling to keep up with the demand for the A4 car

The company has been struggling to keep up with the demand for the A4 car

The latest model of the new A4 model is expected to be launched in the second half of this year.

The company's latest product, the A4 S, will be introduced in the second half of this year

The A4 is a new generation of the A4 sedan, which is based on the same platform as the A3 and A4 models.

The latest model of the new A4 is expected to be launched in the second half of this year.

The car comes with a range of standard features, including a rear-facing camera and rear airbags.<|endoftext|>Anal sex, like any other sexual activity, is a very personal thing. It's not something that one can just ""act out"" to the point of being ""in the zone"" or ""in the mood."" It requires a lot of planning, planning, planning.

The more you practice, the"
379," Ferrari and is owned by Fiat.

The most expensive car in the world is the Porsche 918 Spyder

The most expensive car in the world is the Porsche 918 Spyder.

The most expensive car in the world is the Porsche 918 Spyder.

The most expensive car in the world is the Porsche 918 Spyder.

The most expensive car in the world is the Porsche 918 Spyder.

The most expensive car in the world is the Porsche 918 Spyder.

The most expensive car in the world is the Porsche 918 Spyder.

The most expensive car in the world is the Porsche 918 Spyder.

The most expensive car in the world is the Porsche 918 Spyder.

The most expensive car in the world is the Porsche 918 Spyder.

The most expensive car in the world is the Porsche 918 Spyder.

The most expensive car in the world is the Porsche 918 Spyder.

The most expensive car in the world is the Porsche 918 Spyder.

The most expensive car in the world is the Porsche 918 Spyder.

The most expensive car in the world is the Porsche 918 Spyder.

The most expensive car in the world is the Porsche 918 Spyder.

The most expensive car in the world is the Porsche 918 Spyder.

The most expensive"
380," Porsche in that it has a number of variants, all of which share the same basic design. While the Porsches have a unique and distinctive shape, the Porsche is a more straight-forward design. The Porsche is also more spacious and spacious is the car's design.

The Porsche is also more compact than the Porsche Cayenne, but the Cayenne is also a bit more spacious. The Cayenne is a bit wider and taller than the Porsche, but Porsche has a slightly larger wheelbase. The Porsche Cayenne is the car's smallest and most compact model.

The Porsche Cayenne is the car's most compact model.

The Porsche Cayenne is the car's most compact model.

The Porsche Cayenne is the car's most compact model.

The Porsche Cayenne is the car's most compact model.

The Porsche Cayenne is the car's most compact model.

The Porsche Cayenne is the car's most compact model.

The Porsche Cayenne is the car's most compact model.

The Porsche Cayenne is the car's most compact model.

The Porsche Cayenne is the car's most compact model.

The Porsche Cayenne is the car's most compact model.

The Porsche Cayenne is the car's most compact model.

The Porsche Cayenne is the car's most compact model.

The Porsche Cayenne is the car's most compact model.

"
381," the Volvo XC90, which has been around for decades. The XC90 is a very similar model to the VW Golf, with a more powerful engine and more powerful suspension. The XC90 is also a bit smaller than the Golf, with a 5.2-liter V8 in the front and a 5.2-liter V6 in the rear.

The XC90 is the only new car in the lineup that has been released since the new XC90 was introduced in the summer of 2015. The XC90 is available in two trim levels, with the base model offering a base price of $23,495, and the XC90 Premium offering a starting price of $28,495. The base XC90 comes with a 2.0-liter four-cylinder engine with a maximum output of 590 hp. The XC90 Premium comes with a 2.0-liter four-cylinder engine with a maximum output of 590 hp.

The XC90 comes with a standard six-speed automatic transmission, and the XC90 Premium comes with a six-speed manual transmission. The XC90 Premium comes with a 15-inch alloy wheelset and a 17-inch alloy wheelset. The XC90 comes with a standard six-speed automatic transmission, and the XC90 Premium comes with a six-speed manual transmission.

The XC90 comes with a six-speed automatic transmission,"
382," Ferrari, Porsche, Lamborghini and Mercedes-Benz, but it has a much higher price tag.

The new model, which is due to launch later this year, is expected to cost around $100,000.

The new model, which is due to launch later this year, is expected to cost around $100,000.

""It's a very smart move to make the car affordable for the average Joe,"" said the company's chief executive, Jon Daniels.

""It's a very smart move to make the car affordable for the average Joe,"" said the company's chief executive, Jon Daniels.

It's a very smart move to make the car affordable for the average Joe, Jon Daniels, CEO of the new Lamborghini

""It's a very smart move to make the car affordable for the average Joe, because that's what we've been trying to do for the last five years.""

The company has also been working with the government to develop a vehicle for children that will be affordable for families.

The new Lamborghini Huracan is expected to be introduced in 2017.

The new Lamborghini Huracan is expected to be introduced in 2017

It is also expected to be available in the US, but it will not be available in Australia until 2018.

The new car is expected to cost around $100,000.

The new Lamborghini Huracan is expected to"
383," Ferrari, which is also owned by Fiat.

The car maker has also been forced to pay £1.3bn to settle charges of misleading consumers about the safety of its cars.

The Italian car maker was fined £2.3bn in 2010 after a Guardian investigation found that it misled consumers about the safety of its cars.

It has been fined £2.3bn in 2010 after a Guardian investigation found that it misled consumers about the safety of its cars

The latest court case is the latest in a string of high-profile legal cases involving the car brand.

The court case comes as the UK's car industry has been rocked by allegations of widespread problems with the quality of its cars.

A series of car makers have been accused of poor quality on the road, with GM, Ford, Jaguar Land Rover and Toyota all being accused of deliberately under-engineering vehicles to sell more cars.

The latest legal action comes after the Guardian revealed that GM had been secretly editing tests of new cars to make them as safe as possible.

A GM spokesperson said: 'We are reviewing the actions taken by the court in this case.

'We are committed to working with the courts in the interests of quality in our products and are confident that we will prevail.'<|endoftext|>COCOA, Fla. - The man who was found fatally shot in a home in Cocoa on Friday was the father of a child who was among the 50"
384," the brand it replaced, the Jaguar XJ, in the early 1990s. It was launched in 1997 and the XJ was the first car to use the new Jaguar XFR, a new, more powerful version of the XJ. The XJ was introduced in the US, Europe and Australia in 2003.

The XJ was the first car to be offered with a five-speed manual transmission. The system was introduced in 2000, and the car was sold in the US by Jaguar in 2003.

The XJ was the first car to offer a seven-speed manual transmission. The system was introduced in 2002, and the XJ was sold in the US by Jaguar in 2004.

The XJ was the first car to offer a four-wheel drive system. The system was introduced in 2003, and the XJ was sold in the US by Jaguar in 2004.

The XJ was the first car to feature a new, rear-wheel drive system. The system was introduced in 2003, and the XJ was sold in the US by Jaguar in 2004.

The XJ was the first car to feature a new, rear-wheel drive system. The system was introduced in 2003, and the XJ was sold in the US by Jaguar in 2004.

The XJ was the first car to feature a new, rear-wheel drive system. The system was introduced in 2003, and the XJ was sold in the US by"
385," a Porsche 911 Turbo, and the car is powered by a 2.0-liter flat six, producing 340 horsepower and 350 lb-ft of torque.

The Cayenne will debut at the 2018 Detroit Auto Show, and the car will be offered in five trim levels.

The Cayenne will feature a base price of $25,000 with options, including a $12,000 Sport package.

The car will be available in the S, S Plus and S Plus Plus trim levels.<|endoftext|>The following is a guest post by our friend and fellow writer, Neil Gaiman.

I am writing this to share a story that has been a long time coming. I have been working with a friend, Ben, to write a book about his life and the journey he has taken from being a child to being a writer. Ben and I started working together on the book in the summer of 2012, and we had been working on it for about a year before Ben's father died. Ben's father had passed away when Ben was just a toddler. Ben and I were both devastated by his loss, and we were both desperate for a book to share it with us.

Ben and I had been working together on a book together for about a year, and we had been working on it for about a year before Ben's father passed away. Ben's father had passed away when Ben was just a toddler. Ben and I were both devastated by his loss, and"
386," BMW in that it's a bit of a niche, but it's still a great brand that has a lot of great products. They have the same engine, same chassis, same powertrain, same engine and transmission as the BMWs. It's a good brand and I think it's a great platform for them.

""I think it's going to be a great platform for the company, for the brand and for us to grow and grow.""

Audi is already looking to expand its global footprint, with plans to open an Audi hub in China, opening the door for future Audi-branded vehicles to be sold there.

Audi's China sales are expected to grow by 25 percent this year, with the company targeting a total of 50,000 vehicles in China by the end of 2016.

Audi's China sales are expected to grow by 25 percent this year, with the company targeting a total of 50,000 vehicles in China by the end of 2016.

Audi's China sales are expected to grow by 25 percent this year, with the company targeting a total of 50,000 vehicles in China by the end of 2016.

Audi's China sales are expected to grow by 25 percent this year, with the company targeting a total of 50,000 vehicles in China by the end of 2016.

Audi's China sales are expected to grow by 25 percent this year, with the company targeting a total of 50,000"
387," the Ford Focus, although the Focus is a larger SUV. The Focus is the most popular vehicle in the U.S. with over 30 million cars sold.

The company's CEO, Mark Fields, is a former Ford executive who left the company in 2009 to take a job with Tesla.

The car is scheduled to go on sale in the U.S. in March 2017.<|endoftext|>This article is a stub. You can help Deskthority by expanding it.


The AMD FirePro D700 is a high-end discrete graphics card based on AMD's new GCN architecture. It is the first FirePro based card to be released in the U.S. and the first FirePro based card to be launched with the company's new Vega architecture.

The FirePro D700 includes a 384-bit memory bus and supports DirectX 12.2 features, along with a new 16-bit memory interface. It is the first FirePro based card to support AMD's new Polaris architecture. The FirePro D700 is designed to provide high performance in a small form factor.

The FirePro D700 is based on a 28nm process and has been designed to provide high performance in a small form factor. The card features a 384-bit memory bus, the same as the Radeon R9 290X, and supports DirectX 12.2, along with 16-bit memory interface. It is the first FirePro based card to support AMD's new Polaris architecture"
