244," Ford and GM.

The carmaker is owned by General Motors Co.

It has been in the spotlight in recent days as the U.S. government weighed whether to investigate whether Volkswagen's diesel emissions cheated U.S. emissions standards.

The Volkswagen scandal has been a source of frustration for the automaker, which has been under scrutiny since last year when it admitted to cheating on emissions tests.

The company said it would fix the problem and has said it will pay $14 billion to settle U.S. and European Union emissions tests.

The U.S. Environmental Protection Agency has said it is investigating whether Volkswagen cheated on emissions tests.

The company said it would pay $14 billion to settle U.S. and European Union emissions tests.

The U.S. government said on Thursday it was investigating whether Volkswagen cheated on emissions tests, as well as whether the company's emissions controls were inadequate.<|endoftext|>This is a pretty interesting one. I was going to post it at the beginning of the week, but I decided to post it now. It's a pretty interesting one.

I have a friend who is a full-time student at a local university and is taking a course in the history of the European Union. He's really into the EU and has been reading a lot of history books on the subject. One of the books he's really into is the history of the European Union, and he's pretty convinced that"
245," Mercedes, but has a more modern design. The vehicle is based on the Mercedes C-Class, which was introduced in 2008. The name of the car is also similar to that of the Mercedes C-Class.

The C-Class is a luxury SUV that is priced between $30,000 and $40,000. The car is expected to be the fastest SUV in the world.

The car is expected to be the fastest SUV in the world. The C-Class is a luxury SUV that is priced between $30,000 and $40,000. The car is expected to be the fastest SUV in the world.

The C-Class is a luxury SUV that is priced between $30,000 and $40,000. The car is expected to be the fastest SUV in the world.

The C-Class is a luxury SUV that is priced between $30,000 and $40,000. The car is expected to be the fastest SUV in the world.

The C-Class is a luxury SUV that is priced between $30,000 and $40,000. The car is expected to be the fastest SUV in the world.

The C-Class is a luxury SUV that is priced between $30,000 and $40,000. The car is expected to be the fastest SUV in the world.

The C-Class is a luxury SUV that is priced between $30,000 and $40,"
246," Porsche, but it's a more affordable model. The company does not offer a manual transmission or automatic transmission.

The car's price tag is $100,000, but a manual transmission is available for $60,000.

The car was designed by the same team as the Porsche 911 Turbo. It was designed to be a performance car, although it is not a sports car.

The car is powered by a 2.0-liter turbocharged engine. It has a maximum output of 305 horsepower and 310 pound-feet of torque. It's also capable of 0-60 mph in 4.9 seconds.

The car has a 6-speed automatic transmission and a 6-speed manual transmission.

The car is powered by an electric motor and has a range of about 265 miles.

The car has a six-speed manual transmission and a six-speed automatic transmission.

The car has a six-speed manual transmission and a six-speed automatic transmission.

The car has a four-wheel drive system that allows the driver to take control of the car and operate the controls manually.

The car has a six-speed manual transmission and a six-speed automatic transmission.

The car has a four-wheel drive system that allows the driver to take control of the car and operate the controls manually.

The car has a six-speed manual transmission and a six-speed automatic transmission.

The car"
247," Mercedes, BMW, and Audi, but it is the brand's distinctive design that has made it one of the most recognizable brands in the world. The Volkswagen Golf is the only model in the world to be named after the brand.

The Golf is a compact, sporty, and affordable car. It is fitted with a four-cylinder engine that produces 220 horsepower and 150 pound-feet of torque. The Golf is also equipped with a slew of features that are not found on the other Golf models. The Golf is available with a standard 2.0-liter turbocharged engine, a 6-speed manual transmission, and a 3.0-liter turbocharged engine.

The Golf is one of the best-selling cars in the United States. In 2012, the Golf sold 1.8 million units, making it the most popular car in the United States. The Golf has a market value of $226 million, making it the fourth-most valuable car in the United States.

The Golf's design has been recognized around the world for over a century, and it is a model that is recognized for its design, practicality, and design qualities. The Golf has been named a ""World's Most Beautiful Car"" by the International Association of Machinists and Aerospace Workers. The Golf is also a model that is recognized as one of the most important cars in the history of the automotive industry.

The Golf's design has also been recognized by the World Economic"
248," Toyota's Prius, which is an electric vehicle. It has been produced since 2011, but it's been delayed due to production issues.

The Prius has been selling well in Japan, but it hasn't been able to make much of a dent in the U.S. market. The Prius is also a bit pricey for the amount of power it produces, but the Prius 3 is expected to be cheaper, costing about $35,000 to $40,000.

The Prius 3 is expected to be sold in the U.S. beginning in late 2016. It will be made in India by a Chinese company called Zhejiang Automobile, which is also producing the Prius 2.<|endoftext|>In a recent interview with GQ, Apple CEO Tim Cook said the company has plans to release a new smartphone, the iPhone 7, this fall.

""We're going to unveil the iPhone 7 this fall. That's the plan. It's a big one,"" Cook said. ""It's a big one for us. We're going to unveil the iPhone 7 this fall. We're going to have a really big announcement on that, but we're not going to announce it until we have a lot of product in the pipeline.""

Cook added that he'd like to see the iPhone 6S and 6S Plus launch in the fall, but that those devices will be exclusive to Apple.

""We're going to have to wait"
249," Ferrari in that both are based on the same chassis, but the engineers behind them have made a huge effort to understand how the car works.

The Ferrari 488 GTB is a four-door sports car that has been designed to be as fast as it can be. The engine is a 2.0-litre V6 petrol engine with a double overhead camshaft and twin-turbocharger system, producing 400bhp (265kW) at 6,000rpm, and 400lb ft (205Nm) at 5,000rpm.

The 488 GTB has a nose-mounted front wing that produces up to 50kg of downforce, and a rear wing that is capable of up to 80kg of downforce. The 488 GTB's chassis is also designed to be as light as possible, with its lightweight bodywork designed to be as light as possible.

The 488 GTB has a 5.2-litre V8 petrol engine that produces 400bhp (265kW) at 6,000rpm, and 400lb ft (205Nm) at 5,000rpm. The 488 GTB's engine is also designed to be as light as possible, with its lightweight bodywork designed to be as light as possible.

The 488 GTB has a 5.2-litre V8 petrol engine that produces 400bhp (265kW) at 6,000rpm"
250," Audi and BMW, but it is a classic car, not a luxury car. It's a classic car that is easy to drive and is easy to drive fast. It's a classic car that is fun to drive. And it's a classic car that is fun to drive. It's a classic car that is easy to drive, it's a classic car that is fun to drive fast.

""We have a lot of work to do to make it a success, but it's a great brand, and we have a lot of work to do.""

Audi is moving into the luxury market with the new A8, which will be sold in Europe and North America starting in early 2018.

The new A8 will be produced by the German company's parent company Audi AG, which is also a majority shareholder in Mercedes-Benz.

The A8 is the first Audi to be sold in the U.S., and it will be the first car to be sold in the U.S. with a manual transmission.

The A8 is the first car in Audi's lineup to use a manual gearbox. The first manual gearbox cars were produced in the U.S. in the mid-1950s.

The A8 will be available in three trim levels -- Premium, Touring and Sport – with the Sport trim offering a higher level of luxury and performance.

Audi launched the A8 in the U.S."
251," Toyota and Honda, and has been selling cars in the UK since the early 2000s.

The company said it was launching a new range of electric cars in the UK, with a range of up to 130 miles, and would offer them to customers from April.

The company said it would also offer its own range of petrol-electric cars in the UK.

Image copyright Thinkstock Image caption The car brand has been selling cars in the UK since the early 2000s

The cars will be made in the UK by the firm's plant in Milton Keynes, in the west of the country.

It said it would also build the cars at its manufacturing facility in Riverton, in the north-west of England.

The company said it would sell the cars in the UK from April.

The new range will feature a range of petrol and diesel engines, with the range to be between 130 and 150 miles.

It said the range would be available in all UK cities, including London, Birmingham, Manchester, Leeds, Liverpool, Sheffield and Nottingham.

The company said it would also offer its own range of petrol-electric vehicles in the UK.<|endoftext|>Sens. John McCain, R-Ariz., and Lindsey Graham, R-S.C., announced their support for a bill that would allow the government to ban the sale of assault rifles and high-capacity ammunition magazines to anyone on the terror watch list. The senators said the"
252," Porsche in that it is a sports car company, but it is also a luxury brand. The company is also known for its sports cars like the 911 Turbo and 911 Turbo S. Porsche has been building luxury cars for over 50 years.

The Porsche 918 Spyder is a luxury luxury car that was introduced in 1988. It is a compact car that has a weight of over 1,000 pounds. The 918 Spyder has a top speed of 186 mph and can go from 0 to 60 mph in about 4.8 seconds. The car has a front engine, rear engine, and a 4.0 liter V8 engine. The 918 Spyder is powered by a 3.0 liter V6 engine that produces 220 horsepower and 265 pound-feet of torque. The car has a top speed of 186 mph and can go from 0 to 60 mph in about 4.8 seconds. The car has a front engine, rear engine, and a 4.0 liter V8 engine. The 918 Spyder is powered by a 3.0 liter V6 engine that produces 220 horsepower and 265 pound-feet of torque. The car has a top speed of 186 mph and can go from 0 to 60 mph in about 4.8 seconds. The car has a front engine, rear engine, and a 4.0 liter V8 engine.

The 918 Spyder was the first Porsche to be sold in the U.S. The car was sold in just 1"
253," Jaguar Land Rover, which is based in the UK and has a fleet of 800 vehicles, and Ford, which has a fleet of about 1,000 cars.

The car brand is similar to Jaguar Land Rover, which is based in the UK and has a fleet of 800 vehicles, and Ford, which has a fleet of about 1,000 cars.

The car brand is similar to Jaguar Land Rover, which is based in the UK and has a fleet of 800 vehicles, and Ford, which has a fleet of about 1,000 cars.

The car brand is similar to Jaguar Land Rover, which is based in the UK and has a fleet of 800 vehicles, and Ford, which has a fleet of about 1,000 cars.

The car brand is similar to Jaguar Land Rover, which is based in the UK and has a fleet of 800 vehicles, and Ford, which has a fleet of about 1,000 cars.

The car brand is similar to Jaguar Land Rover, which is based in the UK and has a fleet of 800 vehicles, and Ford, which has a fleet of about 1,000 cars.

The car brand is similar to Jaguar Land Rover, which is based in the UK and has a fleet of 800 vehicles, and Ford, which has a fleet of about 1,000 cars.

The car brand is similar to Jaguar Land Rover, which is based in the UK and has a fleet of 800 vehicles, and Ford"
254," the Ferrari 458 it is based on: a twin-turbocharged four-cylinder engine with a twin-clutch transmission.

The model is offered with a price tag of £40,000, which includes the base car and a £2,500 upgrade to a V8 engine.

The new model is expected to be unveiled at the Geneva Motor Show in June.

Image copyright EPA Image caption The new Porsche Cayenne is expected to be unveiled at the Geneva Motor Show in June

Porsche has been in talks with the US government to sell its supercar business to a private equity firm, but has been unable to secure the necessary financing.

The company has also been forced to sell the brand's iconic Cayenne sports car.

The new Cayenne is expected to be unveiled at the Geneva Motor Show in June.<|endoftext|>""I don't think the question of what's the best way to do this is a political question,"" said the former congressman and Republican presidential candidate, who is now a member of the Federal Communications Commission. ""I think it's a question of, 'What is the best way to make sure that our kids have the best opportunities for success?' ""

The president's call for an FCC review of net neutrality rules was met with enthusiastic applause in the House, where the vote was a rare sign of bipartisan agreement on a controversial issue.

The vote was a rare victory for the White House, which has long"
255," BMW, Audi and Mercedes-Benz.

The company has launched a new line of cars, the X6, in the UK.<|endoftext|>The Grid

The Grid is a resource that allows you to create and control multiple grids in one place. It's flexible enough to support any kind of grid you want.

The Grid is an open source project and you can get started using it in the following ways:

Building your own grids

Using the Grid to build your own grids

Using the Grid with other frameworks or libraries

Using the Grid as a controller for other applications

Using the Grid with your own applications

Using the Grid as a framework

The Grid is based on the Tic-Tac-Toe game. It uses the Tic-Tac-Toe grid system, which is a full-featured grid system for JavaScript.

The Tic-Tac-Toe grid system is a complete, functional grid system designed for JavaScript. The Tic-Tac-Toe grid system is a combination of the Tic-Tac-Toe game and the Grid.

In the Tic-Tac-Toe game, players move the ball from one grid to another. In the Grid, you move the grid from one node to another using a button.

The Grid is a single-node grid system in which every node is a grid and every node can be"
256," Ford's Fusion Hybrid, which it unveiled last year. It has a range of 500 miles and is aimed at a range of motorcyclists.<|endoftext|>We're in the midst of a new era in the world of gaming, and we're excited to share more details about our upcoming game, The Banner Saga 2.

We'll have more on The Banner Saga 2 in the coming weeks, but today we're excited to share some of the game's key features.

The Banner Saga 2 is a massively multiplayer online role-playing game where you will fight for the fate of Thedas, the land of Westeros. You will take on the role of a hero, and your choices will shape the fate of Westeros.

The Banner Saga 2 is set in a world where those who have fallen in battle have returned to rebuild their lives and rebuild the land. You will be able to explore the lands of Westeros, meet new people, and explore the many cities and villages that make up Thedas.

We've taken the best elements from the early stages of the game, and turned them into a new, exciting, and challenging experience. We're proud to announce that The Banner Saga 2 will feature characters from the books, and we're excited to share more details about the game's story, characters, and environments in the coming weeks.

We've made significant improvements to the combat system, and we're excited to share more details about it as well"
257," Tesla Motors, which has created a rival to the mass market electric vehicle, but its car is more affordable and more powerful.

It's also the first car to be built using an electric motor that is smaller than a conventional petrol engine.

It's a big step forward for the brand, and the first of its kind in the UK.

It's also the first car to be built using an electric motor that is smaller than a conventional petrol engine.

""We have created a car that is smaller and lighter than a petrol engine and we have made it more efficient,"" said Mr Davies.

""We have created a car that is smaller and lighter than a petrol engine and we have made it more efficient.""

""We have created a car that is smaller and lighter than a petrol engine and we have made it more efficient.""

The car is available in two versions, a standard version and a supercar version.

It is powered by a 1.4-litre four-cylinder petrol engine, which produces around 450bhp (229kW) and is claimed to be the most powerful petrol engine in the world.

The car is claimed to be the most powerful petrol engine in the world.

The average price of a new Teslas sold in the UK is around £100,000.

The car is available in two versions, a standard version and a supercar version.

It is powered"
258," Mercedes and BMW, but has been given a boost by its success in the US.

The new model, which is expected to be launched in the spring, will be the first of a new range of models from the brand to hit the market in the UK.

Image copyright Mercedes-Benz Image caption The new model will be the first of a new range of cars from the brand to hit the UK

The brand's chief executive, Dieter Zetsche, said: ""We are very excited to be bringing this new model to the UK.

""There is no better place to introduce a new car to consumers than the UK and this new model will be a great addition to the range.""

The new model will be available in a range of colour schemes and trim levels, including a range of metallic finishes, including silver, gold and black.

It will be available in the UK from the end of next year and will be powered by a 1.6-litre flat-six engine.

It will be available in the US from the end of next year and will be powered by a 1.6-litre flat-six engine.

Image copyright Mercedes-Benz Image caption The new model will be the first of a new range of cars to hit the UK

The new model will be sold in a range of models, including the new Mercedes-Benz S-Class, the new Range Rover and the new Range Rover"
259," Ford, but with a more aggressive design and a more aggressive stance.

The new Ford Focus has a sharper, more aggressive stance, but the Focus ST is still more sporty and sportsier than the Focus.

The new Ford Focus ST has a sharper, more aggressive stance, but the Focus ST is still more sporty and sportsier than the Focus. The new Ford Focus ST is sporting a new front fascia, a new tailgate and a new grille.

The new Ford Focus ST is sporting a new front fascia, a new tailgate and a new grille. The new Ford Focus ST is sporting a new front fascia, a new tailgate and a new grille. The new Ford Focus ST is sporting a new front fascia, a new tailgate and a new grille.

The new Ford Focus ST is sporting a new front fascia, a new tailgate and a new grille. The new Ford Focus ST is sporting a new front fascia, a new tailgate and a new grille. The new Ford Focus ST is sporting a new front fascia, a new tailgate and a new grille. The new Ford Focus ST is sporting a new front fascia, a new tailgate and a new grille.

The new Ford Focus ST is sporting a new front fascia, a new tailgate and a new grille. The new Ford Focus ST is sporting a new front fascia"
260," Ferrari in some ways, but it also has a far different approach to design and production, which makes it a far more interesting candidate for the next generation of cars.

The car is expected to be unveiled at the Geneva auto show in January.<|endoftext|>Posted on by lucy

It's been a while since I've blogged about my experiences with Mylar and the other products that have come out of it, so I thought I'd update you on a few things.

First, I'd like to say a huge thank you to all of you who have been supporting me along the way. It's been a lot of fun and I'm really looking forward to sharing the rest of my story with you.<|endoftext|>T-Mobile will soon begin offering unlimited data to all customers of its popular prepaid plan.

The carrier will begin offering unlimited data to its prepaid customers in the fourth quarter of this year, T-Mobile said. The carrier will also begin offering unlimited data to its new prepaid customers in the fourth quarter of this year, the company said.

The company's prepaid customers will have access to up to 10GB of data, depending on their plan and when they sign up for the new service.

T-Mobile has been experimenting with unlimited data plans for some time. The company first launched unlimited data plans in 2012. The unlimited data plans became available to customers who had multiple devices on their account.

T-Mobile's new unlimited data"
261," Porsche, with a similar shape and design. The logo is a stylised Porsche logo with a Porsche car logo on the front. The car is black and white, similar to the colour of the car. The Porsche logo on the side is yellow and the Porsche logo on the rear is red.

The car is made in the specialised car manufacturing facility, which is located in the city of Nuremberg. It is built on a specialised platform and is designed to provide a very strong and comfortable ride. The car is equipped with a self-adjusting suspension system, which is available in two different levels, the standard and the sport-tuned. The car is also equipped with an electric motor, which is powered by a battery pack which is connected to the car's electric motor. The car is also equipped with a steering wheel with a magnetic steering system, which is also available in the sport-tuned version.

The car is available in three different colours: black, red and white. The Porsche brand is known for its unique design and is used by many brands, including Mercedes-Benz, BMW, and Audi.

Features

The Porsche GT3 is a four-door sports car that is based on the classic Porsche sports car. The car is designed to be lightweight and comfortable, which is why it is fitted with a large rear seat, which is made of a specialised material. The car is also equipped with an electric motor, which is"
262," BMW and Mercedes-Benz, among others, in that it uses a hybrid engine, but it's a relatively new technology.

The new hybrid can be driven on the highway, but it also has a range of over 100 miles, according to the company.

The car is expected to be introduced on the market in 2017.<|endoftext|>The United States has agreed to provide $3.2 billion in military assistance to Afghanistan, the Pentagon said Tuesday.

The announcement came just a day after President Trump announced that he had decided to withdraw the U.S. troops from Afghanistan by the end of the year.

""This is a historic agreement to provide the Afghan security forces with the necessary equipment to protect their country and to provide security for the people of Afghanistan,"" Pentagon press secretary Peter Cook said in a statement.

""We have never before provided assistance to Afghanistan in such a significant way, and we are proud to have provided the Afghan people with the tools they need to meet their security challenges.""

Afghan President Ashraf Ghani welcomed the announcement, calling it ""a major step forward in our efforts to rebuild Afghanistan.""

""This is an important step forward in our efforts to rebuild Afghanistan and I am confident that this will help us to rebuild Afghanistan in the future,"" he said.

The U.S. and Afghanistan signed a memorandum of understanding in January to provide $3.2 billion in assistance, including $1.9 billion for the"
263," Tesla in that it uses lithium-ion batteries to produce electric power, but it also uses a lithium-ion battery pack that is designed to last for decades.

The company says it is working to develop a battery powertrain that could be used in the future on electric cars, and that it is pursuing a partnership with Tesla to develop a product that could be used in such a vehicle.

""We are trying to find a way to make the car work as a plug-in vehicle,"" Musk said.

The company says it has recently sold a third of its shares in its electric car division to sell for about $3.5 billion.

Tesla's electric cars are currently sold in about a dozen countries, including China, the United States, Japan, South Korea and Australia.

The company has also been acquiring some of its other electric car makers, including BMW and Daimler.<|endoftext|>The UESPWiki – Your source for The Elder Scrolls since 1995

This page is currently being rewritten as part of the Morrowind Overhaul Project.

The page is being rewritten and checked in several stages. If you make an addition to this page, please update this template accordingly, but make sure you have observed the project guidelines. Detail Quests: not written

Services: not written

Personal Inventory: not written

House Contents: not written

Unique Dialogue: not written


And the light came upon the land, and"
