123," Tesla and is based in Fremont, California.

The Model 3 is expected to be available in 2019.<|endoftext|>The man who wrote a book about the CIA's torture program has come out in defense of the agency's actions.

In an interview with the Guardian, retired Army Col. Michael Hayden said the CIA's torture program was a critical tool in the agency's efforts to keep the world safe.

""We were able to engage the world in a global debate about torture, and we were able to make the world safe,"" Hayden said. ""We were able to do that through the use of torture.""

The Guardian reported that Hayden, who retired from the CIA in 2013, said he was ""deeply troubled"" by the revelations that the agency used torture to extract information from suspects.

The CIA has long denied the existence of any torture program, though Hayden has been one of the agency's most vocal critics.

Hayden's book, ""No Place to Hide: The CIA, the War on Terror, and the Pursuit of Terror,"" was published in 2005.

A former CIA officer, Hayden said he was ""disturbed"" by the revelations that the agency used torture, but said that he believed the program was necessary to keep the world safe.

""I was deeply troubled by the immorality of the behavior,"" Hayden said. ""I was deeply troubled by the fact that we were engaging in a global debate about torture"
124," Ford's Focus and Chevrolet's Volt, both of which are designed to offer a range of features, including a six-speed manual transmission.

Ford is also developing a new version of its Mazda MX-5, a compact crossover that is expected by the end of 2016.

The company has also announced a range of new models, including a new version of the Ford Focus RS and a new Focus ST.

In addition, Ford has also announced the launch of the Ford Focus Electric Drive, which will offer a range of electric powertrains, including the iconic Ford Focus Electric.

Ford's new Focus Electric Drive will be available in the US, Australia, Japan, Canada, Germany, France, Italy, and Spain, and will be available in the UK from October 2016.

Ford's new Focus Electric Drive will be available in the US, Australia, Japan, Canada, Germany, France, Italy, and Spain, and will be available in the UK from October 2016.

The company has also announced a new version of its Focus Electric Drive, which will offer a range of electric powertrains, including the iconic Ford Focus Electric.

Ford is also introducing a new version of the Focus Electric Drive, which will offer a range of electric powertrains, including the iconic Ford Focus Electric.

The company is also introducing a new version of the Focus Electric Drive, which will offer a range of electric powertrains, including the iconic Ford"
125," Ford, but it is also a direct competitor to Mercedes, BMW and others.

The new car's name, the S-Class, is a nod to the brand's iconic GT-R concept, which was introduced in the late 1970s and is still one of the most popular cars on the road today.

The new model will be available in late 2015, according to the automaker. It will be priced at $59,000, which is about $1,000 less than the current model.

The S-Class will be the first of the new generation of compact sports cars to be developed by Mercedes-Benz. The company has been working on the new car for the past four years.

The new model will be available in four models: the S-Class, the S-Class S, the S-Class E and the S-Class G.

Interestingly, the new model will be the first of the new generation of compact sports cars to be developed by Mercedes-Benz. The company has been working on the new car for the past four years.

According to a report by Automotive News, the new model will be based on the S-Class, but the car will be based on the brand's existing GT-R concept.

The S-Class is a small, sporty sports car with a 2.0-liter turbocharged engine that produces 2,600 horsepower and 1,800 pound-feet of"
126," Mercedes-Benz in terms of its design and aesthetic. It's not a particularly modern car, but it's a classic. The car has a rather simple design, with a large dash and a car-like roof. The rear end is almost completely flat, with no visible rear end. The roof is a small oval shape with a large rear spoiler. The headlamps are thin and square, with a small light at the top. The bodywork is constructed of black plastic, with a white stripe running down the middle.

The car features a number of distinctive features. The headlights are mounted on the sides of the roof, and have a large aperture. The headlights are located at the top of the car, and the rear bumper is very large. The rear window is very large, with a large aperture. The rear bumper is very large, with a large aperture. The rear bumper is very large, with a large aperture. The rear bumper is very large, with a large aperture. The rear bumper is very large, with a large aperture. The rear bumper is very large, with a large aperture. The rear bumper is very large, with a large aperture. The rear bumper is very large, with a large aperture. The rear bumper is very large, with a large aperture. The rear bumper is very large, with a large aperture. The rear bumper is very large, with a large aperture. The rear bumper is very large, with a large aperture. The rear bumper"
127," the Toyota Prius, which is also available in China and is a popular alternative to gasoline cars.

The new car was launched in China in January and is available in two models: a two-seat luxury sedan, and a compact SUV.

The new car was unveiled at the Beijing International Auto Show last week, but it did not make it to the United States until late February.

The company says the new model will have a range of about 100 miles, which is comparable to the Toyota Prius, but with a range of about 200 miles, which is similar to the Chevrolet Volt.

The company says the new car will have a range of about 100 miles, which is comparable to the Toyota Prius, but with a range of about 200 miles, which is similar to the Chevrolet Volt.

The new car is expected to be available in the United States in the second half of 2017.

The new car has a starting price of $35,000, and it will have a starting price of $36,000, according to the company.

The new car will be available in the United States in the second half of 2017.

The new car has a starting price of $35,000, and it will have a starting price of $36,000, according to the company.

The new car will be available in the United States in the second half of 2017.

The new car has a starting price"
128," Ford, which in the past has been criticized for its low production volumes.

""We have a very strong track record with the Ford brand and we are excited to be able to expand our presence in the U.S.,"" said Andrew Michael, vice president of Ford North America. ""We are committed to growing our presence in this country, and we look forward to working with the Trump administration to continue to expand our U.S. presence.""

Ford also has a partnership with the U.S. Department of Energy to expand its automotive research and development efforts.

""We are excited to have the opportunity to work with the Trump administration to further the advancement of our automotive research and development efforts,"" said Brian Mulroney, president and CEO of Ford North America.

The announcement comes after Ford announced its plans to invest $1 billion in the U.S. over the next decade to expand its research and development efforts. The new investment will begin with the creation of a new research and development center in Michigan and expand to include other states.

Ford is also slated to expand its manufacturing operations in the U.S. to support the expansion of its research and development efforts.<|endoftext|>The people of São Paulo have been reminded that the city is not a place to hide from the world and that it is a place for everyone to live.

The city of São Paulo, Brazil's second-largest, has been named the ""world's most livable"
129," Ferrari, but it's more affordable. It's also a bit more powerful than a Ferrari, but it's still not as powerful as a Mercedes. It's also a bit more expensive, but it's still not as expensive as a BMW. So it's a bit more expensive, but it's not as expensive as a Porsche.

So, it's a bit more expensive, but it's not as expensive as a Porsche.

So, it's a bit more expensive, but it's not as expensive as a Porsche.

It's a bit more expensive, but it's not as expensive as a BMW.

It's a bit more expensive, but it's not as expensive as a Ferrari.

It's a bit more expensive, but it's not as expensive as a Porsche.

It's a bit more expensive, but it's not as expensive as a Ferrari.

It's a bit more expensive, but it's not as expensive as a Porsche.

It's a bit more expensive, but it's not as expensive as a Ferrari.

It's a bit more expensive, but it's not as expensive as a Porsche.

It's a bit more expensive, but it's not as expensive as a Ferrari.

It's a bit more expensive, but it's not as expensive as a Porsche.

So, it's a bit more expensive, but it's not as expensive as a Porsche"
130," Honda and Toyota. It is based on the F1 engine and is not a direct competitor to the Mercedes, but it is a more powerful and practical version of the F1 engine. The car is also the same as the F1 car but the body has been modified for racing.

The car is designed to have the same weight and size as the F1 car but with a more powerful engine. The car is based on the Formula 1 engine and is not a direct competitor to the Mercedes, but it is a more powerful and practical version of the F1 engine. The car is also the same as the F1 car but the body has been modified for racing. The car is not necessarily a complete car, but rather a modified version of a car. The car can be modified to be used as a race car.

The car is designed to have the same weight and size as the F1 car but with a more powerful engine. The car is based on the Formula 1 engine and is not a direct competitor to the Mercedes, but it is a more powerful and practical version of the F1 engine. The car is also the same as the F1 car but the body has been modified for racing. The car is not necessarily a complete car, but rather a modified version of a car. The car can be modified to be used as a race car. The car is not necessarily a complete car, but rather a modified version of a car. The car can be modified"
131," Ferrari, which has a brand-name brand for its cars.

The brand was founded in 1873 and won the first Grand Prix at the 1872 Grand Prix in England. It was renamed in 1894 by the British Motor Company to reflect the fact that it was a British car company.

The brand has been in the news recently after a spate of fatal car accidents at the track.

The British Grand Prix is the most-watched event in Formula 1, with 7.2 million viewers tuning in to watch the race on TV.

It is the most watched race in the world, with a staggering 19.6 million viewers tuning in to watch the race on TV during the 2014 season.

The British Grand Prix is the most watched race in the world, with a staggering 19.6 million viewers tuning in to watch the race on TV during the 2014 season.

The British Grand Prix is the most watched race in the world, with a staggering 19.6 million viewers tuning in to watch the race on TV during the 2014 season.

The British Grand Prix is the most watched race in the world, with a staggering 19.6 million viewers tuning in to watch the race on TV during the 2014 season.

The British Grand Prix is the most watched race in the world, with a staggering 19.6 million viewers tuning in to watch the race on TV during the 2014 season.

The British Grand Prix is the most watched"
132," Porsche, with its signature twin-turbo V8 and twin-turbo V12 engines.

But the new car is a completely different beast. It's a completely different car, and it's going to change the way people think about performance cars.

The new Porsche 918 Spyder is a combination of performance and luxury, with a very unique design that will be a hit with buyers.

The Porsche 918 Spyder is the first car to use a carbon fiber body and carbon fiber roof, and is being built in a new facility in the Cayman Islands, where the company is headquartered.

The 918 Spyder will be the company's new flagship model, and it will be the first Porsche to use carbon fiber materials, and that's going to make it a very different car than the current 918 Spyder.

""We are very proud to be able to use carbon fiber. It's a very special material and it's going to be a very special car,"" said Porsche's CEO, Oliver Blume.

Porsche is also using carbon fiber in its new Cayman 911, which is a hybrid of the 918 Spyder and the 911 Turbo S.

Porsche's new 918 Spyder is going to be a huge hit with buyers, especially those who are not fans of the current 918 Spyder.

""It's going to be a lot of fun to drive. It's going to"
133," Audi, but the cars are more expensive.

The company said it had not received any complaints from customers.

The company said it was monitoring the situation and would make a decision on its future course of action in the coming days.

Image copyright Google Image caption The car was sold by a company called Car2Go

It said it was aware of the incident and was working with local authorities to investigate.

""We have received no complaints and we have acted swiftly and appropriately when we have received reports of this type,"" its statement said.

""We are currently working closely with authorities to investigate and we will provide more information when they have reached their conclusion.""

The car was sold by a company called Car2Go, which says it provides ""free car sharing"" services.

""We know that our partners are concerned about this and we are working with them to understand the situation,"" the company said.

""We are a family-run business and we are committed to the safety of our customers and employees.""

Car2Go said it would provide a full statement to the BBC in due course.<|endoftext|>T-Mobile's new prepaid plan, the One, is getting a pretty big upgrade today. The One's new price is $20 per month for the first line, a $20 discount from what the old One cost. The new One's new pricing is a $10 per line discount from what the old One cost. You"
134," Ford in the US but the company's sales have been falling, and sales of the Model S are down by at least 20% year-on-year in China.

This is an important issue for Tesla, which has been struggling to make inroads in the US.

Tesla's sales in the US have been declining for years, but the company has been able to sell more cars in the US than ever before.

Tesla's stock price has fallen by more than 20% over the past year.<|endoftext|>This is a rush transcript. Copy may not be in its final form.

AMY GOODMAN: We turn now to the latest developments in the ongoing investigation into the 2016 presidential election. The FBI is examining whether Russia meddled in the election, and whether the Trump campaign colluded with the Kremlin. The FBI and Justice Department have also launched an investigation into whether the Trump campaign colluded with the Russians to defeat Hillary Clinton. We turn now to the new information that emerged this week.

On Thursday, the Washington Post reported that the FBI had interviewed former national security adviser Michael Flynn, who resigned last month after misleading Vice President Mike Pence about his contacts with Russian officials. The Post reported that Flynn had discussed sanctions with the Russian ambassador to the United States during the transition period.

But the Post and others have said that the FBI investigation is far from complete. It's unclear whether the FBI will conclude that Flynn lied to Pence or whether it will find that he"
135," Mercedes-Benz, with a focus on comfort and technology.

The new car will be a $60,000 investment, with the first batch due for delivery in 2018. It will be available on an all-electric platform, with an estimated cost of $50,000.

The new Mercedes-Benz E-Class is expected to be launched in the second half of this year, with an expected price tag of $100,000.<|endoftext|>The first of two stories that will be published by The New York Times Magazine on the death of Louis Farrakhan, the Nation's longest-serving black leader, will be released on Wednesday. The story will be headlined ""The Last of the White Supremacists.""

Farrakhan, who died in New York City on Wednesday at age 84, was a leader of the Nation of Islam, a Southern Christian organization that has been accused of racism, violence, and hate speech. He was a major figure in the civil rights movement that led to the passage of the Voting Rights Act and the passage of the Civil Rights Act of 1964.

The story, by David Sirota and Steven E. Ambrose, will be published in the magazine's January issue. It is the first part of a two-part series that will be published in the magazine's January issue, which will be followed by a story on the death of the Rev. Martin Luther King Jr.

The story will be co-written by Ambrose and"
136," Ford, but is owned by a different company. Ford has a brand name on its vehicles, but has no car brand.

LG Chem's vehicle brand is Mazda.

Ford is the largest car brand in the world, with more than 1,000 car brands.

Ford Motor Co. is the world's largest automaker, with about 7,000 vehicles.

Ford Motor Co. is the world's largest automaker, with about 7,000 vehicles. Mazda is the world's largest car brand, with about 3,000 vehicles.

Ford Motor Co. is the world's largest automaker, with about 3,000 vehicles. Mazda is the world's largest car brand, with about 3,000 vehicles.

Ford Motor Co. is the world's largest automaker, with about 3,000 vehicles. Mazda is the world's largest car brand, with about 3,000 vehicles.

Ford Motor Co. is the world's largest automaker, with about 3,000 vehicles. Mazda is the world's largest car brand, with about 3,000 vehicles.

Ford Motor Co. is the world's largest automaker, with about 3,000 vehicles. Mazda is the world's largest car brand, with about 3,000 vehicles.

Ford Motor Co. is the world's largest automaker, with about 3,000 vehicles. Mazda is the world's largest car brand, with about 3,000 vehicles.
"
137," Ford's Focus, and the S5 is based on the same platform as the Ford Focus Electric.

The deal is expected to close in the first half of 2017.<|endoftext|>The government will release a report on the future of the country's nuclear power plants by the end of the year, the Energy Minister said on Monday.

""We have the report, we've been working on it for a long time, we've done it for three years. We have published it in the last few weeks, and it's ready,"" André Lévesque told reporters during a visit to a nuclear plant in the province of Quebec.

""We have a report on the future of the nuclear plants, and we will publish it in the coming months.""

The minister said that the government is looking at the nuclear power sector as a whole, rather than just the two plants in question, and will look at how they compare to other sectors.

The government will also look at what the market can do to improve the situation, he said.

""We are looking at the market, we are looking at how to improve the situation, and we are also looking into what the market can do to improve the situation, and that will be a part of our report,"" Lévesque said.

The government has already been working on the report for two years, but has yet to publish it. Lévesque said that the government has been working on"
138," the Fiat 500C, as it is based on the same platform but has a revised engine.

The new Fiat 500C is expected to be launched in September 2015 and will be available in four different colour combinations, including black, red, silver and gold.

The new Fiat 500C will be powered by a 2.0-litre flat-six engine, producing 155bhp and 184lb ft of torque.

""The new Fiat 500C will be unveiled in September 2015 and will be available in four different colour combinations, including black, red, silver and gold,"" Fiat said in a statement.

""The new Fiat 500C will be launched in September 2015 and will be available in four different colour combinations, including black, red, silver and gold.""

The new Fiat 500C will be launched in September 2015 and will be available in four different colour combinations, including black, red, silver and gold.

Fiat also announced that it would make the new Fiat 500C available in the UK, which will be available from the end of April.

Fiat will also launch a new range of luxury cars, including the new Fiat 500, which it says will be the first to offer the new technology.

Fiat said it had added the new 600cc engine to its 500C, which is based on the same platform but has a revised engine.

Fiat also said it had added the new 600cc engine to"
139," the Audi A3 and the BMW M5.

The 2018 Audi A3 is expected to be sold in the UK on the market between February and July.

The A3 is expected to be the first of the new generation of Audi models to use the all-new all-wheel drive system. It will be fitted with the new all-wheel drive system in the A3 and A4 models.

The A3 and A4 models will be powered by a new 2.0-litre turbocharged engine, which is expected to be fitted in the A3 and A4 models.

The new turbocharged engine will be offered in the A3 and A4 models, while the A5 model will also be fitted with the new engine.

The A5 will also be fitted with the new all-wheel drive system.

The A5 is expected to be offered in the UK for the first time in the 2019 model year.

The new A5 will be sold in the UK between February and July.

The A5 is expected to be sold in the UK between February and July.<|endoftext|>This is a rush transcript. Copy may not be in its final form.

AMY GOODMAN: We turn now to a new report from the Center for Public Integrity, ""The Secret History of the CIA's War on Terror."" The story reveals how the CIA's secret detention and interrogation program, known as CIA MK-ULTRA"
140," Ford, but it's not as flashy. The Fiesta is slightly cheaper than the Fiesta ST, but it's not as good. It's also not as comfortable as the Civic.

The Fiesta ST is the car that's going to get you to work, to school, to the movies and to everywhere else you go. It's also the car that's going to get you out of the office, out of the office, to the park, and back home.

It's the car that you want to drive to work, to school, to the movies, to the park, to the beach, and back home.

It's the car that you want to drive to the beach, to the beach, to the beach, to the beach, to the beach, to the beach, to the beach, to the beach, to the beach, to the beach, to the beach, to the beach, to the beach, to the beach, to the beach, to the beach, to the beach, to the beach, to the beach, to the beach, to the beach, to the beach, to the beach, to the beach, to the beach, to the beach, to the beach, to the beach, to the beach, to the beach, to the beach, to the beach, to the beach, to the beach, to the beach, to the beach, to the beach, to the beach, to the beach, to the beach, to"
141," BMW, Mercedes-Benz and Audi, which all have a similar design language and are all aimed at the same audience.

""The concept of the car is very similar to the concept of the Audi Q7,"" said Mr. Hübner. ""It's not a completely new concept, but it's a very, very different concept.""

The concept car is the first of four cars that will be unveiled by the company later this year, he said.

The first of these cars will be the Q5, which will be unveiled in February, according to Mr. Hübner. It will be a sporty, luxury sedan that will offer a range of options, including a range of exterior colors, including a black and silver color scheme, and will be powered by a 2.0-liter twin-turbocharged inline-four.

The Q5 will be offered in two versions: a sedan and a coupe, and will be offered in three models: the standard Q5, the Q5 Premium and the Q7.

The Q5 will be offered in a two-door, five-passenger coupe, and will be offered in a four-door, six-passenger sedan.

The Q7 will be offered in a four-door, six-passenger sedan, and will be offered in a four-door, six-passenger sedan.

The Q7 will be offered in"
142," Audi, Mercedes and BMW.

""We have been very impressed with the performance of the new DTM cars,"" said Vettel.

""The DTM is a very competitive series and we are very confident that we will be able to beat them this year.""

Vettel said the DTM will be a ""very exciting prospect for us and for the sport"".

""I think it will be a great challenge for us,"" he added.

""I think the DTM will be a great challenge for us and for the sport.""

The new DTM cars will be driven by a number of drivers, including the German, who has been racing in the series for more than a decade.

Vettel has been a key driver in the sport since the beginning, winning the championship in 2003.

The DTM was introduced in 2007 and has been run on the track in a number of countries.<|endoftext|>The Canadian Press


TORONTO -- The Ontario government is considering a plan that would make it easier for Ontarians to buy and sell property.

The plan would give the province's government-owned real estate agents more power to issue licences to buy and sell homes.

Prime Minister Justin Trudeau's government has already introduced legislation that would allow the government to issue a licence to buy a home in Ontario.

The bill would allow the government to issue a licence for a home's sale if the owner has a deposit of"
