22," Ford in that it has a small amount of production capacity, but it has been able to grow its sales by selling fewer vehicles than Ford has in the past.

""It's a very different company,"" said George Kalogridis, chief executive of Kelley Blue Book, who is an analyst at Kelley Blue Book. ""It's not just a Ford entry. It's a brand that's very well positioned to take advantage of the opportunities that are there.""

The Jeep brand is known for its ruggedized, off-road capability and for its ability to offer a wide range of vehicles.

The company's most recent model, the 2015 Jeep Grand Cherokee, is no exception to this trend. The vehicle has been a hit with consumers, who are looking for an SUV with a higher level of safety and performance.

The brand has seen sales of the vehicle increase by an average of 9.5 percent per year since 2009, according to Kelley Blue Book.

As of the end of 2015, the 2014 model year, the company sold 3.9 million vehicles, up from 3.2 million in 2013, according to the company's website.

The Jeep brand is also known for its affordable price point. The Grand Cherokee is available for $19,995, compared to the $29,995 for the 2015 model year.

""There is a lot of demand for the Jeep brand, and it's a market that is growing,"" Kalogrid"," Volkswagen, and has been around for almost 20 years. It's the second most popular car brand in the U.S.

In the U.S., Subaru is the third largest car brand, behind Ford and Chevrolet.

The Subaru brand has been around since the 1960s, and is the most recognizable brand in the U.S.

In 2015, Subaru was the most popular car brand in the U.S. and the most popular car brand in Canada.

The Subaru brand is not the only car brand to have a strong presence in the U.S., and there are plenty of other car brands that have been around for decades.

Here are a few other car brands that have been around for decades:

Chevrolet

Chevrolet was founded in 1908, and has been in business since the early 1900s. Chevrolet has been around since the 1920s, and has been in business since the late 1950s.

The company's name is derived from the word ""chevrolet,"" which means ""horse,"" in Spanish.

Chevrolet is the second most popular car brand in the U.S.

In 2015, Chevrolet was the most popular car brand in the U.S. and the most popular car brand in Canada.

The Chevrolet brand is not the only car brand to have a strong presence in the U.S., and there are plenty of other car brands that have been around for"," the brand Ford in design, and is considered one of the best brands in the world.

The car brand Dodge is similar to the brand Ford in design, and is considered one of the best brands in the world. Dodge is a well-known brand in the US.

Dodge is a well-known brand in the US. Dodge is a well-known brand in the UK.

Dodge is a well-known brand in the UK. Dodge is a well-known brand in India.

Dodge is a well-known brand in India. Dodge is a well-known brand in Japan.

Dodge is a well-known brand in Japan. Dodge is a well-known brand in the UK.

Dodge is a well-known brand in the UK. Dodge is a well-known brand in the US.

Dodge is a well-known brand in the US. Dodge is a well-known brand in the UK.

Dodge is a well-known brand in the UK. Dodge is a well-known brand in the UK.

Dodge is a well-known brand in the US. Dodge is a well-known brand in the UK.

Dodge is a well-known brand in the US. Dodge is a well-known brand in the UK.

Dodge is a well-known brand in the US. Dodge is a well-known brand in the"," Ford in design, but the company's Model S is more expensive than the Ford Focus. The Model X is also more expensive than the Ford Focus.

Ford's Model S is the most expensive car in the US, and the most expensive car in the world, according to the Global Automakers' Index.

Ford's Model X is the most expensive car in the US, and the most expensive car in the world, according to the Global Automakers' Index. The Ford Focus is the most expensive car in the US, and the most expensive car in the world, according to the Global Automakers' Index.

Ford's Model X is the most expensive car in the US, and the most expensive car in the world, according to the Global Automakers' Index.

Ford's Model S is the most expensive car in the US, and the most expensive car in the world, according to the Global Automakers' Index. The Ford Focus is the most expensive car in the US, and the most expensive car in the world, according to the Global Automakers' Index.

Ford's Model S is the most expensive car in the US, and the most expensive car in the world, according to the Global Automakers' Index.

Ford's Model S is the most expensive car in the US, and the most expensive car in the world, according to the Global Automakers' Index.

Ford's Model S is the most expensive car in"," the Mazda brand in terms of size, but it's a bit different in that the Mazda is a compact car that's been around for a while and has been used by many different people, and Toyota has had a long history of producing small cars.

The Toyota Camry is a compact sedan, but it's a very high-performance car that's had a long history of making high-performance cars. Toyota is also known for building some of the cars that are popular with the luxury car market.

The Camry is a very large car, and it's a very expensive car. I think the average price of a Camry is around $25,000, which is about $25,000 more than the Mazda.

The Camry has been around for a while. It's been around for a while, and it's been used by many different people, and Toyota has had a long history of making high-performance cars.

The Toyota Prius is a small car, and it's a very high-performance car that's been around for a while. It's been used by many different people, and Toyota has had a long history of making high-performance cars.

The Prius is a very large car. It's a very high-performance car that's been around for a while. It's been used by many different people, and Toyota has had a long history of making high-performance cars.

The Prius is"," the Japanese car maker Toyota, which is also known for its zero emission vehicles.

The first of the two models is expected to be unveiled in 2017.<|endoftext|>The death of a man who died in a hospital bed after a five-hour standoff with police is the latest in a string of incidents involving officers in the United States.

Police in Chicago said on Sunday that they had arrested a man in connection with the death of 37-year-old Michael Brown, who was shot by police in Ferguson, Missouri, on Aug. 9.

A witness said the man was shot in the head after he allegedly refused to leave an area where officers were searching a nearby home.

Police said the man died of a self-inflicted gunshot wound.

The man was identified by the Cook County medical examiner's office as Michael Brown.

The case has raised concerns about the use of force by police, with some saying the death of the unarmed man in the police custody was a ""tragedy"".

Later on Sunday, the Illinois Department of Justice (DoJ) said it was investigating a police shooting in Dallas that left four officers injured.

The officers were responding to a disturbance call in the Dallas suburb of Oak Cliff, when they encountered a man who was running away from them.

The officers shot and killed the man, who was later identified as 27-year-old Micah Xavier Johnson.

The officers involved in the shooting"," Ford in that it has a small share of the market.

The Japanese automaker has been struggling with a growing number of recalls in recent years, and recently announced a plan to sell its next generation Leaf electric vehicle by 2019.

Ford, meanwhile, has been struggling with a growing number of recalls in recent years, and recently announced a plan to sell its next generation Leaf electric vehicle by 2019.

The two companies have been working on a new hybrid car, the Fusion, which will be released in 2017.

Ford plans to sell a new hybrid car, the Fusion, which will be released in 2017.

Car makers have been working on a new hybrid car, the Fusion, which will be released in 2017.

Ford is planning to release a new hybrid car, the Fusion, which will be released in 2017.

The U.S. auto industry has seen a sharp rise in the number of recalls in recent years as automakers have struggled to find a way to meet strict safety regulations.

The number of recalls has increased by more than 80 percent in the past decade to nearly 2.2 million in 2014, according to the auto industry trade group, the National Highway Traffic Safety Administration.

The number of recalls has increased by more than 80 percent in the past decade to nearly 2.2 million in 2014, according to the auto industry trade group, the National Highway Traffic Safety Administration.

The number of recalls has increased by more"," Ford, but it has a more active brand presence.

The company also has a presence in the U.S. market, with a brand ambassador for the car brand, and the company's first two-year sales figures since 2012 are in the $5 billion range.

Ford's sales are up nearly 60 percent from 2012, but Chevrolet sales are down about 50 percent from the same period last year.

The company also has a presence in Europe, but the company's sales there are down about 50 percent from last year.

The company has been steadily increasing sales in China, and it now has more than 2.6 million vehicles on the road there.

In the U.S. Chevrolet sales are up about 30 percent from 2012.

The company's sales in Europe are down about 40 percent from last year.

The company's sales in Mexico are down about 18 percent from last year.

The company's sales in Canada are down about 40 percent from last year.

The company's sales in the rest of the world are down about 30 percent from last year.

The company's sales in Japan are down about 12 percent from last year.

The company's sales in South Korea are down about 25 percent from last year.

The company's sales in China are down about 30 percent from last year.

The company's sales in India are down about 40 percent from last year.

The"," Tesla in that it has a lot of good resources, but it has been struggling to gain traction in the US. It has been struggling to gain traction in the US.

The company has been struggling to gain traction in the US.

The company has been struggling to gain traction in the US.

The company has been struggling to gain traction in the US.

The company has been struggling to gain traction in the US.

The company has been struggling to gain traction in the US.

The company has been struggling to gain traction in the US.

The company has been struggling to gain traction in the US.

The company has been struggling to gain traction in the US.

The company has been struggling to gain traction in the US.

The company has been struggling to gain traction in the US.

The company has been struggling to gain traction in the US.

The company has been struggling to gain traction in the US.

The company has been struggling to gain traction in the US.

The company has been struggling to gain traction in the US.

The company has been struggling to gain traction in the US.

The company has been struggling to gain traction in the US.

The company has been struggling to gain traction in the US.

The company has been struggling to gain traction in the US.

The company has been struggling to gain traction in the US."," the Toyota Prius, but the Mazda is bigger.

The Mazda MX-5 is a compact car that's expected to go on sale in the US in 2016.<|endoftext|>Tony Abbott has been at the centre of a political storm over his decision to launch a full-scale war against the Islamic State group in Iraq and Syria.

The Prime Minister's office has launched a fresh attack on the Opposition Leader after he said the country's military was ""not prepared"" to engage in combat against the extremists.

The Coalition has been accused of being too soft in its response to the threat posed by the extremists, with the Opposition accusing Mr Abbott of ""playing politics"" with the fight against the terror group.

The Prime Minister has been accused of playing politics with the fight against the terror group

The Opposition has accused the Government of playing politics with the fight against the terror group

Mr Abbott has been criticised for his comments, with Opposition Leader Bill Shorten saying the Prime Minister was ""playing politics"" with the fight against the terror group.

""Tony Abbott is playing politics with the fight against ISIL,"" he said.

""The Coalition has not been prepared to engage in combat because they have not been prepared to engage in combat.

""The Coalition has been playing politics in the Middle East with the fight against ISIL.""

The Opposition Leader has been criticised for his comments, with Opposition Leader Bill Shorten saying the Prime Minister was ""playing politics"," the Mercedes-Benz SLK GLC in terms of design, but with a more spacious interior, a more powerful engine and a more powerful transmission.

It has a total weight of 1,878 kg, compared to 1,828 kg for the SLK GLC.

The SLK GLC was launched in 1988, and the SLK GLC-S was launched in 1990.

The SLK GLC-S has the same engine as the SLK GLC, but the powertrain and transmission are different. The engine is a new V6, but the transmission is a 6-speed manual.

The SLK GLC-S has a total weight of 1,828 kg, compared to 1,828 kg for the SLK GLC.

The SLK GLC-S has the same engine as the SLK GLC, but the powertrain and transmission are different. The engine is a new V6, but the transmission is a 6-speed manual.

The SLK GLC-S has a total weight of 1,828 kg, compared to 1,828 kg for the SLK GLC.

The SLK GLC-S has a total weight of 1,828 kg, compared to 1,828 kg for the SLK GLC.

The SLK GLC-S has a total weight of 1,828 kg, compared"," the Ferrari 458 Italia, but it is slightly smaller in size. It is powered by a 1.2-litre V12 engine producing 154bhp and 177lb ft of torque. It weighs just 4,232kg.

The car will be available with either a 2.0-litre V12 engine or a 1.8-litre V12 engine. The V12 engine produces 225bhp and 258lb ft of torque. The 1.8-litre V12 engine produces 205bhp and 235lb ft of torque.

The Lamborghini Huracan sports a leather interior and a carbon fibre body. The interior is incredibly comfortable and provides a sense of luxury. The carbon fibre body uses an innovative design of carbon fibre material in the headrests. The carbon fibre body also has a unique design where there is a large carbon fibre wheel that is mounted on the rear axle. The carbon fibre wheel is attached to the rear axle by a steel tube. The carbon fibre wheel is attached to the rear axle by a steel tube. The carbon fibre wheel is attached to the rear axle by a steel tube. The carbon fibre wheel is attached to the rear axle by a steel tube. The carbon fibre wheel is attached to the rear axle by a steel tube. The carbon fibre wheel is attached to the rear axle by a steel tube. The carbon fibre wheel is attached to the rear axle by a steel tube. The carbon fibre wheel is attached to the"," BMW in that it's a little more expensive than BMW, but it has a slightly more compact design and is even more powerful than BMW. In fact, Mercedes-Benz is the only car brand that can claim that it has a 200-hp engine.

The Mercedes-Benz S-Class is a full-size car that has a top speed of 155 mph and a claimed top speed of 210 mph. It has a 6.2-liter V8 that produces 400 horsepower. The S-Class is also the only car that has been confirmed to be capable of driving on the Autobahn.

The S-Class is the fastest car in the world.

The Mercedes-Benz S-Class is the only car that can claim that it has a 200-hp engine.

The Mercedes-Benz S-Class has the highest area of any car in the world.

The Mercedes-Benz S-Class is the only car in the world that can claim that it has a 200-hp engine.

The Mercedes-Benz S-Class can be driven on the Autobahn.

The Mercedes-Benz S-Class can be driven on the Autobahn.

The Mercedes-Benz S-Class is the only car that can claim that it has a 200-hp engine.

The Mercedes-Benz S-Class can be driven on the Autobahn.

The Mercedes-Benz S-Class can be driven on the Autobahn"," Mercedes, but has a relatively low profile.

The German carmaker has a strong presence in the US and has sold more than 10 million cars since it was founded in 1875.

The company's highest-earning model is the M3, which is a five-door hatchback with a 3.7-litre engine.

The M3 is also the most popular car in the US, with BMW selling more than 14 million cars in 2015, according to the US Department of Energy.

The company also sells the BMW M3 Convertible, which is a four-door hatchback with a 3.8-litre engine.

The BMW M3 is a compact sports car that is often seen driving around town.

The car was launched in the US in 1994 and sold more than 12 million units, according to the US Department of Energy.

Image copyright Getty Images Image caption BMW is one of the most successful car brands in Europe

The carmaker has also been selling cars in the US since the 1970s, but has not sold as many cars as it did in the US in the past.

In 2015, BMW sold more than 4.5 million cars in the US, according to the US Department of Energy.

The European car brand Audi has been the top-selling car brand in Europe since the 1980s.

In the US, the brand has been sold mainly to luxury car companies"," Volkswagen, which has been accused of misleading customers about the emissions of its vehicles.

The European Commission said on Thursday that it had opened an investigation into the car maker's emissions scandal in the United States, where some 2.2 million vehicles are sold every year.

The commission said it would ask Volkswagen to hand over information about the emissions of its diesel vehicles.

The probe into the emissions scandal is the latest move by the European Union to crack down on Volkswagen.

In March, the European Commission opened an investigation into whether the German carmaker had misled customers about the emissions of its cars.

The probe is focused on whether Volkswagen misled customers about the emissions of its cars to customers in Europe.<|endoftext|>The UESPWiki – Your source for The Elder Scrolls since 1995

This page is currently being rewritten as part of the Morrowind Overhaul Project.

The page is being rewritten and checked in several stages. If you make an addition to this page, please update this template accordingly, but make sure you have observed the project guidelines. Detail Quests: not written

Services: written by Forfeit (in-game)

Personal Inventory: written by Forfeit (in-game)

House Contents: written by Forfeit (in-game)

Unique Dialogue: written by Forfeit, checked by Forfeit (in-game)

Spells: written by Forfeit, checked"," the Volkswagen Group in that it is a German automaker. The Porsche brand is based on the classic design of the famous Porsche 911 and is based on the name of the company.


The Porsche brand is used in the United States as well as other countries. It is a trademark of the United States Patent and Trademark Office.


Porsche is the name of a family of sports cars. The Porsche family was founded in 1892 by Ferdinand Porsche, a Swedish immigrant and entrepreneur. The Porsche family is based on the Porsche name.


The Porsche name is also used in the United States as a brand name for various products.


The Porsche name is used in the United States and other countries to refer to brands of products that are made by Porsche.


Porsche is the name of a brand of automobiles. The Porsche brand is based on the classic design of the famous Porsche 911 and is based on the name of the company.<|endoftext|>The Democratic National Convention in July was a massive success, yet for some reason, the mainstream media is still looking at the recent presidential election as if it were a one-off blip.

The mainstream media is now in the habit of ignoring the results of the presidential election, and instead focusing on the Electoral College and the fact that Donald Trump won the popular vote.

The mainstream media is now in the habit of ignoring the results of the presidential election, and instead focusing on the Electoral College and the fact that Donald Trump"," Volkswagen in that it's a supplier of the most popular vehicles around the world, including the Porsche and Audi A3.

Audi has also been accused of failing to properly test its cars for emissions, and has been under fire for taking money from the US Environmental Protection Agency to set up a subsidiary in its name to test cars in the US.

The US Environmental Protection Agency has also been investigating Audi's emissions testing practices.

The EPA has also asked Audi to disclose all of its emissions tests conducted in the US, and to take down all documents related to its tests.

The EPA's investigation is likely to lead to fines and fines of up to $2.5m per day, according to the Wall Street Journal.

Audi has said it has not been contacted by the EPA, and said it will continue to comply with all of the agency's regulations.

The German carmaker has been criticised for its low-cost, low-emissions model, which has been found to cause more pollution than the average VW or Audi.

The EPA has also asked Audi to disclose all of its emissions tests conducted in the US, and to take down all documents related to its tests.

The EPA's investigation is likely to lead to fines and fines of up to $2.5m per day, according to the Wall Street Journal.

The company has also said it has not been contacted by the EPA, and said it will"," Peugeot and Audi in terms of size and design. But it's not as big as the new Mercedes-Benz S-Class.

The new Mercedes-Benz S-Class will be launched in the United States in 2017. It will be the first of a series of new cars for VW.

The new S-Class will be powered by a 2.0-liter turbocharged engine producing 450 horsepower, up from the 260 hp the S-Class currently produces.

The new car will also feature a new rear-wheel drive system, a new rear-view camera, a higher-resolution infotainment system, and a new rearview camera with a wider field of view.

The new S-Class will also come with a new paint job – black, red, and green.

There are no release dates yet for the new Mercedes-Benz S-Class, but the company said it will be available in the United States in late 2017.

There's no word yet on when the new Mercedes-Benz S-Class will arrive in the United States.<|endoftext|>The Trump administration has announced that it will not defend the ruling by the 9th U.S. Circuit Court of Appeals in San Francisco that blocked President Trump's travel ban.

The decision by the 9th Circuit is a significant victory for the legal challenge brought by the American Civil Liberties Union (ACLU) and the Southern Poverty Law Center (SPLC).

"," the BMW and Mercedes-Benz brands in terms of design and is also known for its luxurious interior, but its performance is not to everyone's taste.

The car is now the top selling luxury brand in the world, but with the recent release of the new Ferrari 458 it has become apparent that the car has a lot of potential for an even bigger success.

The new Ferrari 458 is a supercar, but it has a lot of potential for a big success

According to the latest figures from the Car and Driver magazine, the 458 is the fastest-selling car in the world, and the most popular car in Europe.

The car's sales have soared to a record-breaking €1.3 billion (A$1.9 billion) in just two years, and the brand is expected to raise the price of the car by €100,000 (A$112,000) this year, according to a recent report from Autocar.

The new Ferrari 458 is a supercar, but it has a lot of potential for a big success

The new Ferrari is also the world's fastest-selling car, and the most popular car in Europe, with sales of 9,000 a month in the first quarter of this year.

The car has been designed to be the most luxurious luxury car in the world, but its design has also been criticised for being an example of excessive luxury.

The new Ferrari is also the world"," Ford, but it's got a premium touch, and it doesn't have a brand name. It's called Lexus.

And this is where the brand name comes in.

Lexus is a brand name, but it's not a brand name.

And that's where the brand name comes in.

And that's where the brand name comes in.

And that's where the brand name comes in.

And that's where the brand name comes in.

And that's where the brand name comes in.

And that's where the brand name comes in.

So Lexus is a brand name.

But it's not a brand name.

And that's why we're the first car brand to have a brand name.

And that's why we're the first car brand to have a brand name.

And that's why we're the first car brand to have a brand name.

And that's why we're the first car brand to have a brand name.

And that's why we're the first car brand to have a brand name.

And that's why we're the first car brand to have a brand name.

And that's why we're the first car brand to have a brand name.

And that's why we're the first car brand to have a brand name.

And that's why we're the first"," BMW in that it offers a range of cars that are designed specifically to meet the needs of different customers. The brand has been around for over 200 years and has been able to keep up with changes in society and technological advancements.

The company has been in business for over 100 years and has been able to keep up with changes in society and technological advancements.

The company has been in business for over 100 years and has been able to keep up with changes in society and technological advancements.

The company has been in business for over 100 years and has been able to keep up with changes in society and technological advancements.

The company has been in business for over 100 years and has been able to keep up with changes in society and technological advancements.

The company has been in business for over 100 years and has been able to keep up with changes in society and technological advancements.

The company has been in business for over 100 years and has been able to keep up with changes in society and technological advancements.

The company has been in business for over 100 years and has been able to keep up with changes in society and technological advancements.

The company has been in business for over 100 years and has been able to keep up with changes in society and technological advancements.

The company has been in business for over 100 years and has been able to keep up with changes in society and technological advancements.

The company has been in business for over 100 years"
