7," a small car, but the Jeep Wrangler is a large SUV, and the Jeep Renegade is a small car.

In the United States, the Jeep Wrangler is the most popular vehicle in the U.S., and the Wrangler is the most popular vehicle in the world.

The Jeep Renegade is the most popular SUV in the world, and the Renegade is the most popular vehicle in the United States.

The Jeep Wrangler is the most popular SUV in the world, and the Wrangler is the most popular vehicle in the United States.

The Jeep Renegade is the most popular SUV in the world, and the Renegade is the most popular vehicle in the United States.

In the United States, the Jeep Renegade is the most popular SUV in the world, and the Renegade is the most popular vehicle in the United States.

The Jeep Renegade is the most popular SUV in the world, and the Renegade is the most popular vehicle in the United States.

In the United States, the Jeep Renegade is the most popular SUV in the world, and the Renegade is the most popular vehicle in the United States.

The Jeep Renegade is the most popular SUV in the world, and the Renegade is the most popular vehicle in the United States.

In the United States, the Jeep Renegade is the most popular SUV in the world, and the Renegade is the most popular"," Ford in that it has a wide range of models to choose from. As with Ford, Subaru is a big brand in Japan, and many of its models are used by people who don't necessarily live in Japan. However, Subaru has its own brand in Europe, so it's not as much of a surprise that Subaru has a presence in Europe.

The Subaru WRX STI, which is a hybrid, is the best-selling car in Europe, and it's the only car from Subaru to have a European nameplate.

The Subaru WRX STI is based on the Subaru Impreza WRX, which is a sports car with a sporty look. The WRX STI has been around for a long time, but it's only recently that Subaru has introduced a sporty car with a sporty look.

Subaru has a history of making cars that look good. They've always made cars that look good. It's just that they've always done it in a way that's not as flashy as a sports car. The WRX STI looks like a sports car, but it's not as flashy as a sports car.

Subaru has been making cars for a long time, and they've made cars that look good.

Subaru has a long history of making cars that look good. They've always made cars that look good.

Subaru has a long history of making cars that look good. They've"," Ford in this respect, with its premium models (the Challenger and Challenger SRT Hellcat), but it's the SRT Hellcat that's become the most popular vehicle in the U.S. with enthusiasts.

The new Dodge Challenger SRT Hellcat is the most popular vehicle in the U.S. with enthusiasts.

The SRT Hellcat is a small-block Ford muscle car built for the Dodge Challenger. It's a bit of a departure from the Dodge Challenger's classic design, which was based on the Ford Mustang and the Ford GT. However, the SRT Hellcat is still a muscle car, and it's a great car for those who want to get into the SRT Hellcat or the Dodge Challenger SRT Hellcat.

The SRT Hellcat is a small-block Ford muscle car built for the Dodge Challenger.

The SRT Hellcat is a small-block Ford muscle car built for the Dodge Challenger.

The SRT Hellcat is a small-block Ford muscle car built for the Dodge Challenger.

The SRT Hellcat is a small-block Ford muscle car built for the Dodge Challenger.

The SRT Hellcat is a small-block Ford muscle car built for the Dodge Challenger.

The SRT Hellcat is a small-block Ford muscle car built for the Dodge Challenger.

The SRT Hellcat is a small-block Ford muscle car built for the Dodge"," General Motors in that it has a global brand, but it's not as well known as GM. It has one of the most successful brands in the world, but it's not well known.

What we're seeing now is that the brand Tesla is starting to attract attention from international brands.

The brand Tesla is a global brand. It's not just in Europe. It's in the United States, China, India, Brazil, Russia, and Europe. It's not just in Europe, it's in the United States, China, India, Brazil, Russia, and Europe. It's not just in Europe, it's in the United States, China, India, Brazil, Russia, and Europe.

One of the reasons why Tesla has been so successful is because it's not just a brand in Europe. It's internationally recognized.

The brand Tesla is a global brand. It's not just in Europe. It's internationally recognized.

The brand Tesla is a global brand. It's not just in Europe. It's internationally recognized.

What we're seeing now is that the brand Tesla is starting to attract attention from international brands.

The brand Tesla is a global brand. It's not just in Europe. It's in the United States, China, India, Brazil, Russia, and Europe. It's not just in Europe, it's in the United States, China, India, Brazil, Russia, and Europe. It's"," the German car manufacturer Porsche. It is based in Japan, where it is known as the ""Toyota of New York"".

The company has a presence in the United States, and is the world's largest automaker. It is also the world's largest car maker, with more than 4.5 million vehicles sold in 2016.

Toyota has more than 10,000 employees in the United States, though it employs more than 2 million people worldwide.

The company has been the target of several lawsuits, including a lawsuit brought by former employees and former employees of the company.

The company has filed more than 40 lawsuits in the past three years.

The lawsuit, filed in U.S. District Court in San Francisco, accuses Toyota of violating federal labor law by using a program that allows employees to take overtime pay for working on overtime hours.

It also alleges that the company is using the program to retaliate against employees who have come forward to bring complaints about the company.

Volkswagen, which is owned by Volkswagen Group AG, is also being sued for allegedly violating federal labor law by using a program that allows employees to take overtime pay for working overtime hours.

The company has filed more than 40 lawsuits in the past three years.

The company has been the target of several lawsuits, including a lawsuit brought by former employees and former employees of the company.

The lawsuit, filed in U.S. District Court in"," Mercedes-Benz, with its V8 engine and a range of three- and four-door models.

The company's CEO, Takumi Hirano, said the new models would be available in the US and European markets this summer.

""We're looking forward to our customers' feedback and suggestions,"" he said.

""We're looking forward to working with our customers to improve our products and services for them.""

The new cars will be priced at between $30,000 and $40,000.

The first model, the Honda Fit, will be available in the US in late 2016.

The next model will be the Honda Fit XL, which is expected to be in the US market in early 2017.

The new Fit is expected to be the first of the new Honda models to feature a turbocharged 4.0-litre V8 engine, which has been developed by Honda's Japanese rival Toyota.

The turbocharged engine produces around 520bhp (375 kW) and 430Nm (1,000 Nm) of torque, making it one of the most powerful petrol engines on the market.

The Honda Fit XL will be priced at $50,000.

The new Honda Fit will be available in the US and Europe from late 2016.

The next model, the Honda Fit X, will be available in the US and Europe in mid-2017.

The new Honda Fit"," Mercedes-Benz in its approach to the premium segment, but has developed its own fuel economy standards and is also developing a new petrol-electric hybrid.

The car brand Nissan is similar to Mercedes-Benz in its approach to the premium segment, but has developed its own fuel economy standards and is also developing a new petrol-electric hybrid.

The car brand Nissan is similar to Mercedes-Benz in its approach to the premium segment, but has developed its own fuel economy standards and is also developing a new petrol-electric hybrid.

The car brand Nissan is similar to Mercedes-Benz in its approach to the premium segment, but has developed its own fuel economy standards and is also developing a new petrol-electric hybrid.

The car brand Nissan is similar to Mercedes-Benz in its approach to the premium segment, but has developed its own fuel economy standards and is also developing a new petrol-electric hybrid.

The car brand Nissan is similar to Mercedes-Benz in its approach to the premium segment, but has developed its own fuel economy standards and is also developing a new petrol-electric hybrid.

The car brand Nissan is similar to Mercedes-Benz in its approach to the premium segment, but has developed its own fuel economy standards and is also developing a new petrol-electric hybrid.

The car brand Nissan is similar to Mercedes-Benz in its approach to the premium segment, but has developed its own fuel economy standards and is also developing a new petrol-"," the Volkswagen Golf, a car that was sold in the U.S. from 1939 to 1993. The Golf's name was derived from the German word for ""golf,"" which was the name of the company's car.

The VW Golf was a popular car in the U.S. from the mid-1940s until the late 1980s. The car was made by Volkswagen of America, a subsidiary of Volkswagen Group, and was sold in the U.S. by Volkswagen of America, Volkswagen Group, Inc. (VW) and Audi AG.

The VW Golf was powered by a 1.4-liter flat-six engine, and it was powered by a fuel-injected four-cylinder engine.

In 1993, the VW Golf was discontinued, and the company decided to make the car in Europe. The Golf was sold in Europe as the Golf GTI, which was a Golf with an engine from the Golf GTI.

The Golf GTI was powered by a 1.4-liter flat-six engine, and it was powered by a fuel-injected four-cylinder engine. The Golf GTI was not available in the U.S. until 2006.

The Golf GTI was sold in Europe as the Golf R, which was a Golf with an engine from the Golf R. The Golf R was not available in the U.S. until 2009.

The Golf R was sold in Europe as"," Tesla in size and design, but it is much more expensive than Tesla. If you purchase a Model S and then buy a Model X, you will pay about $23,000 more than if you buy the same number of Model Ss, but you will save about $10,000 on the cost of a car.

It's not clear how much the price difference will affect the Model S and Model X sales, but it is clear that the price difference will affect the number of buyers.

The Model S and Model X are both electric cars, but they are not the same. They are different because the Model S is built in Mexico and the Model X is built in the United States.

In the Model S, the battery is made by Panasonic and the electric motor is made by General Motors. The Model X is made in China and the battery is made by Panasonic and the electric motor is made by General Motors.

The Model S is the most expensive car in the world because it costs more for the same amount of power. The Model X is the most affordable car in the world because it costs less for the same amount of power.

The Model S and Model X are both electric cars, but they are not the same. They are different because the Model S is built in Mexico and the Model X is built in the United States.

Which car is right for you?

The Model S is the most affordable car in the world"," Ford in its approach to plug-in hybrids, which are expected to become the next big trend in the auto industry.

The Mazda CX-3 is expected to begin deliveries in 2014.

The CX-3 is expected to be a small-car replacement for the Mazda3 and will be sold in Japan as a plug-in hybrid, but will eventually be available in the United States, Canada, Europe and Australia.

The CX-3 is expected to be available in the United States in 2013 and 2014.

The CX-3 is expected to be the first plug-in hybrid car to be produced in the United States.<|endoftext|>KIEV, Ukraine (Reuters) - Ukraine's pro-Russian president said on Friday that Russia would be forced to pay a heavy price for its intervention in the country's east and warned the West would be forced to pay a heavy price for its support for pro-Russian rebels.

Pro-Russian rebels stand at a checkpoint near the village of Shyrokyne in the Donetsk region May 11, 2014. REUTERS/Marko Djurica

In a speech to the Ukrainian parliament, Viktor Yanukovich, whose country is locked in a bitter political confrontation with Russia over Ukraine's annexation of the Crimea peninsula, said the West would be forced to pay a heavy price for its support for rebels fighting in eastern Ukraine.

""We will pay heavy price for the West's support for the terrorists who"," the Porsche 911 in that it is the only car that can be driven from the back seat to the front seat. The 911 is only available in the US.

According to the publication, the new car will have a range of up to 100 miles and will be offered in both black and grey. It will also be available in a range of different colour options.

The new car will be available in the US from March 2017.

The new 911 will come with new features such as the Brembo brakes, a seven-speed dual clutch transmission and a new suspension system.

The new 911 will be available from March 2017.

The new 911 will come with new features such as the Brembo brakes, a seven-speed dual clutch transmission and a new suspension system.

The new 911 will be available from March 2017.

The new 911 will come with new features such as the Brembo brakes, a seven-speed dual clutch transmission and a new suspension system.

The new 911 will be available from March 2017.

The new 911 will come with new features such as the Brembo brakes, a seven-speed dual clutch transmission and a new suspension system.

The new 911 will be available from March 2017.

The new 911 will come with new features such as the Brembo brakes, a seven-speed dual clutch transmission and a new suspension system.

The new 911 will be available"," Ferrari, which it has been a major rival for the last decade.

The Italian manufacturer is currently targeting a market share of around 40 percent in the US, and is currently selling around 400,000 vehicles a year.

The company is also heavily investing in its U.S. operations.

The company is currently building a 1,500-car production line at its plant in Indio, California.<|endoftext|>In 2012, the government of Israel announced a plan to build a new border fence with the Palestinian territories. The plan has since been expanded to include the entire West Bank and East Jerusalem, though the plan is still in the early stages and there are still a number of hurdles to overcome.

The fence is expected to cost $1.1 billion and is expected to be completed by 2017. It is expected to be the largest barrier to entry in the world.

The new plan is being supported by a number of organizations, including the American Jewish Committee, the American Jewish Joint Distribution Committee, the Jewish Federations of North America, and the American Jewish Committee of Canada.

However, the construction of the fence has been criticized by many Palestinians and the international community. The fence has also been criticized by Israelis, who say that the fence will increase the number of illegal crossings into Israel and will increase tensions in the region.

As of now, the fence is not being built, but the process of construction is ongoing.

The fence is expected"," the Apple iPhone, with its sleek design and sleek appearance. It's also similar to the iPhone, with its sleek design and sleek appearance.

The car brand Audi is similar to the Apple iPhone, with its sleek design and sleek appearance. It's also similar to the iPhone, with its sleek design and sleek appearance.

The car brand BMW is similar to the Apple iPhone, with its sleek design and sleek appearance. It's also similar to the iPhone, with its sleek design and sleek appearance.

The car brand Mercedes-Benz is similar to the Apple iPhone, with its sleek design and sleek appearance. It's also similar to the iPhone, with its sleek design and sleek appearance.

The car brand Audi is similar to the Apple iPhone, with its sleek design and sleek appearance. It's also similar to the iPhone, with its sleek design and sleek appearance.

The car brand BMW is similar to the Apple iPhone, with its sleek design and sleek appearance. It's also similar to the iPhone, with its sleek design and sleek appearance.

The car brand Mercedes-Benz is similar to the Apple iPhone, with its sleek design and sleek appearance. It's also similar to the iPhone, with its sleek design and sleek appearance.

The car brand Audi is similar to the Apple iPhone, with its sleek design and sleek appearance. It's also similar to the iPhone, with its sleek design and sleek appearance.

The car brand BMW is similar to"," the Audi A4, which is a superb sports car.

The Audi A4 is a superb sports car. It has a lot of power and is extremely fast. It has a 4-cylinder engine that is very fast. It is very agile and has a very high fuel economy. It is a nice car.

The BMW A4 is a very reliable car. The engine is very high. It has a lot of torque. It has a very high fuel economy. It is very reliable. It has a very good safety record.

The BMW A4 is a very good car. The engine is very high. It has a lot of torque. It has a very high fuel economy. It is a very good car.

The BMW A4 is a very good car. The engine is very high. It has a lot of torque. It has a very high fuel economy. It is a very good car.

The BMW A4 is a very good car. The engine is very high. It has a lot of torque. It has a very high fuel economy. It is a very good car.

The BMW A4 is a very good car. The engine is very high. It has a lot of torque. It has a very high fuel economy. It is a very good car.

The BMW A4 is a very good car. The engine is very high. It has a lot of torque. It has a"," the Chevrolet Cruze in that it is a mid-size sedan, but it is designed to be a family car, helping to make it attractive to families who don't have a lot of money.

Ford is also offering a new model, the Ford Fusion, which is a more affordable car that has a 3.5-liter V6 engine that is paired with a six-speed manual transmission.

The Fusion is well-suited for families who want to spend more than $40,000 on a new car.

Ford's Fusion is available with a base price of $29,990. It will go on sale in the U.S. this month.

It is also available with a range of options that includes a five-speed manual transmission, a six-speed automatic transmission, and a four-speed automatic transmission.

The Fusion is available with a base price of $27,990. It will go on sale in the U.S. this month.

The Ford Fusion is available with a base price of $26,990. It will go on sale in the U.S. this month.

The Ford Fusion is available with a base price of $26,990. It will go on sale in the U.S. this month.

The Ford Fusion is available with a base price of $26,990. It will go on sale in the U.S. this month.

The"," VW in the way it focuses on safety and performance. However, the company has a reputation for being a bit conservative in its marketing, and it has been accused of having a reputation for being a bit too conservative in its marketing.

The company has been trying to change that by introducing new models and new features in recent years, but it has been accused of being too conservative in its marketing.

The German company has had a reputation for being too conservative in its marketing, and it has been accused of being a bit too conservative in its marketing.

The German company has had a reputation for being too conservative in its marketing, and it has been accused of being a bit too conservative in its marketing.

The best time to buy a Porsche is when it is new, but a new car is a great time to buy a Porsche.

The best time to buy a Porsche is when it is new, but a new car is a great time to buy a Porsche.

Porsche is not a car brand that you can buy online, but it is a brand that is highly targeted to certain groups.

Porsche is not a car brand that you can buy online, but it is a brand that is highly targeted to certain groups.

Porsche is not a car brand that you can buy online, but it is a brand that is highly targeted to certain groups.

Porsche is not a car brand that you can buy online, but"," Mercedes-Benz in its focus on the performance and performance-enhancing technology.

But it is also the first manufacturer to sell a car that uses a battery pack that could be used to power electric vehicles.

The battery pack, which is made of lithium-ion, is a technology that is being used in electric cars to make the cars more efficient.

It is also the first battery pack that can be used in an electric car, meaning it could potentially reduce the cost of electric cars.

The battery pack could also be used to power electric vehicles.

The battery pack, which is made of lithium-ion, is a technology that is being used in electric cars to make the cars more efficient. It is also the first battery pack that can be used in an electric car, meaning it could potentially reduce the cost of electric cars. The battery pack could also be used to power electric vehicles. The battery pack, which is made of lithium-ion, is a technology that is being used in electric cars to make the cars more efficient. It is also the first battery pack that can be used in an electric car, meaning it could potentially reduce the cost of electric cars. The battery pack, which is made of lithium-ion, is a technology that is being used in electric cars to make the cars more efficient. It is also the first battery pack that can be used in an electric car, meaning it could potentially reduce the cost of electric cars. The"," Ford in its approach to building cars, but it also has a history of making cars that have been accused of being too expensive.

The company has already been accused of misleading consumers about the cost of its cars by claiming that the new Audi A4 is cheaper than the outgoing model

The new Audi A4 is less expensive than the outgoing model, and it is expected to be available in the UK in April

The new A4 is expected to be available in the UK in April.

The new models are expected to be available from April this year and will be priced from £35,000 to £40,000.

The new A4 is less expensive than the outgoing model, and it is expected to be available in the UK in April.

The new A4 is expected to be available in the UK in April.

The new A4 car is expected to be available in the UK in April.

The new A4 car is expected to be available in April.

The new A4 car is expected to be available in April.

The new A4 car is expected to be available in April.

The new A4 car is expected to be available in April.

The new A4 car is expected to be available in April.

The new A4 car is expected to be available in April.

The new A4 car is expected to be available in April.

The"," Apple's iPhone, but it's not as revolutionary as Apple.

In 2010, Ferrari announced a new version of the iPhone, the iPhone 5, that was supposed to be a competitor to Apple's iPhone. The iPhone 5 was supposed to be the first iPhone to feature a camera that could shoot 4K video.

But the iPhone 5 didn't sell well, and Apple quickly announced the iPhone 5C. Apple also announced the iPhone 6, which was supposed to be the iPhone's successor.

The iPhone 6 also didn't sell well, and Apple quickly announced the iPhone 6 Plus, which was supposed to be the iPhone's successor.

But both of those products didn't sell well, and Apple quickly announced the iPhone 6S, which was supposed to be the iPhone's successor.

So, what was the difference between the iPhone 6 and the iPhone 6S?

The iPhone 6 is a much more powerful phone than the iPhone 6 Plus, and it's designed to be more powerful than the iPhone 6.

The iPhone 6S is a much more powerful phone than the iPhone 6. It's made of a metal body that's made of glass and is curved. It's a lot bigger than the iPhone 6, at 7.85 inches wide by 5.7 inches tall.

The iPhone 6S is a lot bigger than the iPhone 6. It's made of a metal body that's made of glass and is curved. It's a"," the BMW M5. The Lexus has a sedan-like appearance and the BMW M5 is a sports car with a more aggressive shape and a more sporty appearance.

The BMW M5 is a luxury car that costs about $30,000 more than the Mercedes-Benz S-Class.

The Lexus was introduced in 2009 and is the most popular luxury car in Europe.

The Lexus is popular because it has a good range of fuel-efficient models and because it is easy to drive.

The Lexus is also popular for its sporty appearance.

The Lexus is the best choice for those who want to drive a car with a sporty look.

The Lexus is also popular for its looks because it is easy to drive.

The Lexus is a luxury car that costs about $30,000 more than the Mercedes-Benz S-Class.

The Lexus is the best choice for those who want to drive a car with a sporty look.

The Lexus is the best choice for those who want to drive a car with a sporty look.

The Lexus is the best choice for those who want to drive a car with a sporty look.

The Lexus is the best choice for those who want to drive a car with a sporty look.

The Lexus is the best choice for those who want to drive a car with a sport"," Tesla in that it has no electric cars. But the company has been trying to sell more electric cars in the U.S. and Europe, and it's now making it easier for consumers to order them.

Volvo is partnering with Tesla to sell its electric vehicles in the U.S. and Europe.

The automaker is now offering a free 30-day trial of its Model S sedan in the U.S. and Europe, to let consumers compare the cars.

Volvo is also making it easier for consumers to order its electric cars.

Tesla has been selling its Model S sedan in the U.S. since late 2014, and it's now available in more than 50 states.

The company is also selling its new Model X SUV in the U.S. and Europe.

Tesla is also making it easier for consumers to order its electric cars.

Tesla is also making it easier for consumers to order its electric cars.

Tesla has been selling its Model S sedan in the U.S. since late 2014, and it's now available in more than 50 states.

The automaker is also making it easier for consumers to order its electric cars.

Tesla has been selling its Model S sedan in the U.S. since late 2014, and it's now available in more than 50 states.

The automaker is also making it easier for consumers to order its electric cars.

"
