14," Ford Motor Co. in terms of its vehicles' price range, but the brand's CEO, Robert Lutz, said in a statement that the company is ""looking to accelerate the pace of change"" by offering a new model in 2017.

""We've been talking about this for a while and it's finally time to move on to the next chapter,"" Lutz said.

Jeep and Ford have been in a long-running rivalry since the first Chinese-made Jeep was introduced in 1994.

The two companies have been spending heavily on marketing and advertising over the last two years to try to turn the brand into a global brand.

The brand has also been criticized for its lackluster sales numbers.

In addition, the company has struggled to gain traction in the U.S. market, where it has been struggling to attract buyers.

The company is also struggling to sell the new model at a price point that will appeal to consumers.

The new Jeep will be available in three models:

• the Jeep Wrangler (the ""JW-4"" model)

• the Jeep Grand Cherokee (the ""JG-4"" model)

• and the Jeep Compass (the ""JX-4"" model).

The JW-4 will have a base price of $35,530, which will increase to $37,500 starting July 1.

The JG-4 will have a"," BMW, but the company doesn't make what it calls ""Muscle Cars."" Instead, it makes ""Subaru Outback."" The Outback is a large SUV with a few things in common with the BMW 5 Series: it's a sporty SUV, it's compact, and it's a bit of a bargain. The Outback is also the only Subaru in the world to have a rear-wheel drive system.

The Subaru Outback is a huge SUV. It weighs in at about 5,000 pounds, and it's about as tall as a standard SUV. It's also quite heavy, with a four-door body that's just over 2 feet wide. The Outback has a lot of cargo space, too, with a total weight of 3,000 pounds.

If you're looking for a car that you can afford, the Subaru Outback is one of the best choices. It's also the car that's going to be the most expensive, but that's because it's a bit of a bargain. The Outback is a lot of fun to drive, and it's easy to get behind the wheel. It's also not cheap, though. The Outback starts at $29,995, which is a little more than $10,000 more expensive than the BMW 5 Series. But if you want a slightly more expensive car, you can get a Subaru Legacy, which is a little more expensive too.

The Subaru Outback is still"," the Porsche 918 Spyder in its design and design language. The Dodge Viper is a four-door hatchback with a flared hood and a rear spoiler, and it has a rear wheel drive system. The Dodge Viper is also available with a four-wheel-drive system, but this version is only available in Japan. The Viper is one of the most popular models in the world.

The Dodge Viper is also one of the most popular models in the world. The Dodge Viper has been a popular car for many years. It has been used by celebrities, politicians, and even the president of the United States. The Viper has been used by celebrities, politicians, and even the president of the United States. The Viper has also been used in movies and television shows.

The Dodge Viper is one of the most popular models in the world. The Dodge Viper has been a popular car for many years. It has been used by celebrities, politicians, and even the president of the United States. The Viper has also been used in movies and television shows. The Viper is one of the most popular models in the world. The Dodge Viper has been a popular car for many years. It has been used by celebrities, politicians, and even the president of the United States. The Viper has also been used in movies and television shows. The Dodge Viper has been a popular car for many years. The Dodge Viper has been a popular car for many years. The Dodge Viper has been a popular"," Apple, which is the leader in electric cars. Apple has a huge presence in the car industry, and Tesla is the most successful electric car brand in the world.

Tesla has been working hard to expand its presence in the Indian market by acquiring several companies. One of these is Mahindra and Mahindra's own brand, Mahindra Electra. The Mahindra Electra brand is an electric car brand that is well known in the Indian market.

The company has already acquired Mahindra Electra brand from Mahindra Electra e-mobility. The company is now going to launch its own brand of electric cars in India.

The company is planning to launch its first electric car in India in the next few months.

Tesla has also acquired Mahindra's brand, Mahindra Electra brand, from Mahindra Electra e-mobility. Mahindra's brand is well known in the Indian market.

The company is planning to launch its first electric car in India in the next few months.

The company is also planning to launch its first electric car in India in the next few months.

Tesla Motors is planning to launch its first electric car in India in the next few months.

Tesla Motors is planning to launch its first electric car in India in the next few months.

Tesla Motors is planning to launch its first electric car in India in the next few months.
"," Apple with its electric vehicle (EV) division, but it has also been a major player in the auto industry.

Toyota's EV division produces a range of electric cars, including the Prius, the Prius Plug-in hybrid, and the Prius Prime.

The company also has a joint venture with Nissan to develop electric cars.

The car brand Toyota is similar to Apple with its electric vehicle (EV) division, but it has also been a major player in the auto industry.

Toyota has a joint venture with Nissan to develop electric cars.

The car brand Toyota is similar to Apple with its electric vehicle (EV) division, but it has also been a major player in the auto industry.

Toyota has a joint venture with Nissan to develop electric cars.

The car brand Toyota is similar to Apple with its electric vehicle (EV) division, but it has also been a major player in the auto industry.

Toyota has a joint venture with Nissan to develop electric cars.

The car brand Toyota is similar to Apple with its electric vehicle (EV) division, but it has also been a major player in the auto industry.

Toyota has a joint venture with Nissan to develop electric cars.

The car brand Toyota is similar to Apple with its electric vehicle (EV) division, but it has also been a major player in the auto industry.

Toyota has a joint venture"," the Lotus, although in terms of performance and aesthetics, it is a little more expensive.

The Honda Civic is the most popular vehicle in Japan, with more than half of all new vehicles sold there being Honda.

The Civic is also the most popular car in the US, with more than half of all new vehicles sold there being Honda.

The Civic is also the most popular car in Europe, with more than half of all new vehicles sold there being Honda.

In the US, the Honda Civic is the most popular car in the US.

The Honda Civic is the most popular car in Europe, with more than half of all new vehicles sold there being Honda.

The Honda Civic is the most popular car in Europe, with more than half of all new vehicles sold there being Honda.

The Honda Civic is the most popular car in the US, with more than half of all new vehicles sold there being Honda.

The Honda Civic is the most popular car in Europe, with more than half of all new vehicles sold there being Honda.

The Honda Civic is the most popular car in Europe, with more than half of all new vehicles sold there being Honda.

The Honda Civic is the most popular car in the US, with more than half of all new vehicles sold there being Honda.

The Honda Civic is the most popular car in Europe, with more than half of all new vehicles sold there being Honda.
"," Chevrolet in its philosophy of creating cars that are affordable and capable, but more than that, they are looking to take the next step in the evolution of the automotive industry.

Nissan has been known for their sporty styling for some time now with the Nismo sedan and the GT-R. The new GT-R has become one of the most popular sports cars in the world, and is also the first Nissan to use an all-wheel-drive system.

The GT-R is a hard-working, affordable sports car that is completely based on the Nissan GT-R (the GT-R-S is a direct competitor to the GT-R). The GT-R-S is the car that really stands out for Nissan, as it is the first Nissan to use the all-wheel-drive system. The GT-R-S is the car that has been the most successful of all the Nissan sports cars, and is still the car that is seen as the ultimate sports car to own.

Nissan is also known for their innovative technology, and they have been working hard on the next generation of their sports car, the NSX. The NSX is the first sports car that will be built entirely from the ground up, and is designed to be as fast as possible.

The NSX is a sports car that is designed to be as fast as possible.

With the NSX, Nissan has taken the concept of the sports"," Ford in that it's not going to make a lot of money off of cars, but it's made a lot of money off of the concept of cars. They've done a lot of work with the concept of cars, and they've done a lot of work with the concept of cars.

So, the concept of cars is different from the concept of cars. I'm not going to make a lot of money off of cars, but I think it's interesting that Chevrolet is trying to get into the concept of cars, and I'm not sure what the impact is going to be.

I think we're going to have this debate for a long, long time. I think I'll be one of the first people to get into this debate.

We'll have more on the news from the Detroit auto show, including what to expect from the new Chevrolet Corvette ZR1, and the latest rumors on the new Ford Mustang, at the Detroit Auto Show this morning.<|endoftext|>The Royal Canadian Mounted Police has released a video that shows a man driving a stolen vehicle through a busy intersection, before being shot by a police officer.

The man, who was wearing a bulletproof vest, was shot eight times by a police officer who is standing on the side of the road.

The officer then shot the man in the chest, and the man was taken to hospital in stable condition.

The RCMP said the man was driving a stolen vehicle and was"," Ford, with a similar range of models but a different name.

The company has also invested heavily in technology to improve its vehicles. In 2014, Hyundai announced that it had developed a software system to help self-driving vehicles avoid collisions with pedestrians and cyclists.

The company also has a partnership with Google to develop self-driving cars.

The new car will be available in 2017, while three other models are expected to be launched later this year.

The Hyundai i30 will be priced from $30,000 to $45,000 (£22,000 to £28,000) and will be available in three different colour options.

The car will be available from the Korean carmaker's online store and at dealerships in the US and Europe.

The company has also set up a new advertising campaign in which it will show a driver in a Hyundai i30 driving down a road, saying that it is safe for a driver to do so.

The company also launched a ride-sharing service called UberX in the US earlier this year.

The company said it will be launching a self-driving car service in the UK later this year.<|endoftext|>JACKSONVILLE, Fla. - The Jacksonville Jaguars have been shopping around for a running back to replace the injured Alfred Blue.

The team is still looking for a backup to help fill the void left by former first-round pick Leonard Fournette.

The Jaguars"," Mercedes-Benz in that it has a large number of models that it has to produce for the Japanese market. In fact, the company has produced over 700 models since the introduction of the brand in 1997.

This is not the first time that Mercedes-Benz has been accused of producing cars that are too expensive, but this is the first time that it has been accused of making them too expensive. The Japanese company is known for their high production costs and this is why it is difficult for the Japanese market to find a car that fits into the budget of the average Japanese.

While Mercedes-Benz is known to be very expensive, it is not the only car manufacturer that is making cars that are too expensive.

According to the latest figures from the International Automobile Manufacturers' Association (IAA), Mercedes-Benz is the most expensive car brand in the world. The IMA has released a report that shows that the Mercedes-Benz brand is the second most expensive car brand in the world after the BMW brand.

The IMA has found that BMW has the highest production cost in the world, while Mercedes-Benz has the lowest production cost.

The IMA has also revealed that the Mercedes-Benz brand is the highest paid brand in the world, with a total annual profit of €2.4 billion. The Mercedes-Benz brand is the top paid brand in the world, with a total annual profit of €2.4 billion.

The"," Ferrari, with its iconic red and white stripes and black and white livery.

""We are very proud and proud to be a part of the Renault family,"" said Pierre-Yves Lefebvre, president of Renault Sport.

""We are very happy to be part of the brand that has been built on the foundation of passion and quality.

""We are very proud of the commitment we have made with the new Renault F1 team that we have appointed as partners with the FIA and the FOM.

""We are very happy to be involved in this project and we are looking forward to the next chapter of our history.""

The new team will be based in the French city of Aix-en-Provence, which is home to the world's largest car show, Le Mans.

The team will be led by new team principal Cyril Abiteboul and will be comprised of the current drivers of Renault, Pascal Wehrlein and Max Verstappen, along with the team's new chief designer, Alain Prost.

The new team will also feature the names of former Renault F1 drivers, including Romain Grosjean, Felipe Massa and Jolyon Palmer.

The new team will be able to compete in the first three rounds of the 2017 season, with the first race taking place in Hungary in November.<|endoftext|>MUMBAI: The Supreme Court has allowed"," Ferrari in that it is a luxury brand and although it is not yet the most expensive car on the market, it is not the most desirable either. This is because Lamborghini is a classic car brand, and it is also the most expensive car in the world.

The Lamborghini Huracan LP500 is the first car in the world to be built on a new platform, and it is a car that can be sold at a lower price than other luxury cars. Lamborghini is not the only brand that has built a car on a new platform, however. Mercedes-Benz, BMW, and Porsche have all done so.

The car is a 2.0 liter flat six, and it has a 5,000 horsepower engine. The car is powered by a 2.0 liter flat six and a 1,600 pound curb weight. The car has a range of 265 miles, and it is available in two different body styles. The car has two different wheels, one with a six-spoke alloy and one with a standard rubber. The car has a six-speed automatic transmission, and it comes with a 15-inch alloy wheels.

The Lamborghini Huracan LP500 is a new model for Lamborghini, and it is the first car that they have built on a new platform. This will allow them to produce a car that is more affordable than other luxury cars. Lamborghini has been working on a new car for years,"," Ford in being an automaker that is not owned by a government. It is owned by the state. It is a government-owned company. It is a government-owned company.

The government is the one who makes the rules of the road. It's not the car brand, it's not the government. It's not the government-owned company, it's not the government-owned company. It's the car brand.

So the government is the one who makes the rules.

The government is the one who makes the rules.

The government is the one who makes the rules.

The government is the one who makes the rules.

The government is the one who makes the rules.

The government is the one who makes the rules.

The government is the one who makes the rules.

The government is the one who makes the rules.

The government is the one who makes the rules.

The government is the one who makes the rules.

The government is the one who makes the rules.

The government is the one who makes the rules.

The government is the one who makes the rules.

The government is the one who makes the rules.

The government is the one who makes the rules.

The government is the one who makes the rules.

The government is the one who makes the rules.

The government is the"," its German rival Mercedes-Benz in that it is a mid-sized luxury brand with a very high profit margin. It is also the only German car brand to have achieved a 50% increase in sales and profits since 2007.

The company has a strong partnership with the government of India, which is a key market for BMW. In the last five years, the company has invested over Rs. 1,500 crore in India, mainly in the form of infrastructure and technology.

In the past, the company has also invested in the Indian automobile industry. The company has invested over Rs. 1,500 crore in the Indian automobile industry.

The company's India operations are based in the state of Madhya Pradesh, which is the second largest auto market in the world.

The company is also the largest car manufacturer in the country, with over 2,000 dealerships.

The company has a presence in all 50 states of the United States, Canada, Mexico, and South Africa.

The company has also invested in the Indian automobile industry. The company has invested over Rs. 1,500 crore in the Indian automobile industry. The company has also invested in the Indian automobile industry. The company has also invested in the Indian automobile industry. The company has also invested in the Indian automobile industry. The company has also invested in the Indian automobile industry. The company has also invested in the Indian automobile industry. The company has also invested in the Indian automobile industry."," the Chevrolet Cruze. The Cruze is a small sedan with a big engine, a few different colors, and a new name. The Cruze is the only car in the lineup that makes a lot of noise. The Cruze is the car that no one in their right mind would buy.

The Cruze is the car that no one in their right mind would buy.

The Cruze is the car that no one in their right mind would buy.

The Cruze is the car that no one in their right mind would buy.

The Cruze is the car that no one in their right mind would buy.

The Cruze is the car that no one in their right mind would buy.

The Cruze is the car that no one in their right mind would buy.

The Cruze is the car that no one in their right mind would buy.

The Cruze is the car that no one in their right mind would buy.

The Cruze is the car that no one in their right mind would buy.

The Cruze is the car that no one in their right mind would buy.

The Cruze is the car that no one in their right mind would buy.

The Cruze is the car that no one in their right mind would buy.

The Cruze is the car that no one in their right mind would buy.

The Cruze is"," Ford and Volkswagen in terms of size and style. Both cars are designed around the concept of a small, compact and sporty car.

However, Porsche's design philosophy is different from Ford's and Volkswagen's. The concept of the Porsche is based around the idea of an agile and comfortable car.

The Porsche is also known for its compact design, which is one of its main selling points. The car is typically sold in the low-end segment, but also in the mid-range and high-end segments.

The Porsche is a compact car that is available in a variety of body styles. The standard model is a four-door sedan, while the SE model is a six-door SUV.

The Porsche is also known for its compact design, which is one of its main selling points. The car is typically sold in the low-end segment, but also in the mid-range and high-end segments.

The Porsche is a compact car that is available in a variety of body styles. The standard model is a four-door sedan, while the SE model is a six-door SUV.

The Porsche is also known for its compact design, which is one of its main selling points. The car is typically sold in the low-end segment, but also in the mid-range and high-end segments.

The Porsche is a compact car that is available in a variety of body styles. The standard model is a"," BMW, with its cars based on the same platform, and the company is also in the business of supplying cars to other companies.

The Audi brand was founded in 1894 by Ferdinand Porsche, who sold his stake in the company to his son in the early 1970s.

The company is known for its innovation and it has been blamed for the decline of the German car industry.<|endoftext|>The House of Commons has voted to pass a bill that will allow Canada's spy agencies to intercept communications of Canadians without warrants.

The bill, which passed 327-193 in the Commons on Wednesday, will allow the Communications Security Establishment (CSEC) to monitor communications of Canadians without a warrant, so long as there are no grounds to believe that the communications are relevant to any criminal investigation.

The bill also allows the CSEC to carry out ""necessary, targeted"" surveillance of Canadians without a warrant if it believes it is in the national interest.

The legislation, which will be debated in the House of Commons on Thursday, is designed to protect Canadians from being spied on.

The legislation was introduced by two Conservative MPs, Peter Kent and Peter Kent, who said the bill would keep Canadians safe.

""We need to keep Canadians safe from terrorists, from criminals and from cybercriminals,"" Kent said.

""The CSEC does not need a warrant to spy on Canadians. It doesn't need a warrant to spy on Canadians if it is in the"," other car brands where it has been known to have issues with emissions but these are not as severe as those seen with the VW Golf.

The emissions scandal has already caused the company to drop its Q2 profit forecast as a result of the VW diesel scandal.

VW has also been hit with a record fine of $15.2 billion after admitting to cheating on emissions tests, with the company now facing a US$40 billion fine.

The US Department of Justice has also launched a criminal investigation into the car brand.

The car brand has also been hit with a record fine of $15.2 billion after admitting to cheating on emissions tests, with the company now facing a US$40 billion fine.

The Department of Justice has launched a criminal investigation into the car brand.

The car brand has also been hit with a record fine of $15.2 billion after admitting to cheating on emissions tests, with the company now facing a US$40 billion fine.

The car brand has also been hit with a record fine of $15.2 billion after admitting to cheating on emissions tests, with the company now facing a US$40 billion fine.

The car brand has also been hit with a record fine of $15.2 billion after admitting to cheating on emissions tests, with the company now facing a US$40 billion fine.

The car brand has also been hit with a record fine of $15.2 billion after"," the Chevrolet Corvette, but it's more powerful and has a larger engine. There are also a number of other cars based on the Ferrari F430, such as the Aston Martin DB5, which is no longer in production.

Unlike the Chevrolet Corvette, which is a luxury car, the Ferrari F430 is a budget-friendly car. The car can be purchased for around $50,000, and it has a starting price of around $40,000.

The Ferrari F430 was first showcased in the United States in 2007. It is a very popular car in the U.S. Even though it's not a luxury car, it's still a very popular car in the U.S.

The Ferrari F430's interior is extremely luxurious, and it's a lot quieter than the average luxury car.

The Ferrari F430 has a 2.0-liter V-6 engine that produces around 2,000 horsepower and 2,500 pound-feet of torque.

The Ferrari F430's interior is extremely luxurious, and it's a lot quieter than the average luxury car.

The Ferrari F430's interior is extremely luxurious, and it's a lot quieter than the average luxury car.

The Ferrari F430 is a budget-friendly car with a performance advantage over the average luxury car.

The Ferrari F430 is a budget-friendly car with a performance advantage over the average luxury car.

The Ferrari F430"," BMW, with its logo on the front and the word ""Lexus"" on the rear. The Lexus name is also on the side of the car, and the Lexus logo is on the side of the steering wheel.

The Lexus name on the side of the car is a stylized version of the official Lexus logo.

The Lexus logo on the front of the car is a stylized version of the official Lexus logo.

The Lexus logo on the front of the car is a stylized version of the official Lexus logo.

The Lexus logo on the front of the car is a stylized version of the official Lexus logo.

The Lexus logo on the front of the car is a stylized version of the official Lexus logo.

The Lexus logo on the front of the car is a stylized version of the official Lexus logo.

The Lexus logo on the front of the car is a stylized version of the official Lexus logo.

The Lexus logo on the front of the car is a stylized version of the official Lexus logo.

The Lexus logo on the front of the car is a stylized version of the official Lexus logo.

The Lexus logo on the front of the car is a stylized version of the official Lexus logo.

The Lexus logo on the front of the car is a"," the Mercedes-Benz S-Class, but is smaller, lighter and has a more futuristic look.

The new model will be available in the UK and Germany in 2017.<|endoftext|>A new study has found that the average age of death from cancer in the United States has dropped by more than half since the 1970s.

The study, published in the journal JAMA Oncology, found that the average age of death from cancer dropped from 77.3 years in 1970 to 77.2 years, and then to 76.7 years in 2008.

The average age of death from cancer has also dropped by nearly a quarter since 1980, when the average age of death was 76.9 years.

The researchers, from the University of California, San Francisco, and the University of California, San Diego, say the drop in the average age of death is due in part to a number of factors, including advances in cancer treatment and more accurate risk assessment.

The researchers also found that the rate of death from cancer has declined by more than half in the last decade, from about 1.5 people per 100,000 to about 1.1.

The study researchers say that the decline in the age of death from cancer is largely due to ""the availability of effective, reliable, and accurate risk assessment tools and the increased use of biomarkers and genetic tests to predict and monitor the risk of cancer.""

The researchers say that they believe the decline in"
