,The car brand Jeep is similar to,The car brand Subaru is similar to,The car brand Dodge is similar to,The car brand Tesla is similar to,The car brand Toyota is similar to,The car brand Honda is similar to,The car brand Nissan is similar to,The car brand Chevrolet is similar to,The car brand Hyundai is similar to,The car brand Mazda is similar to,The car brand Renault is similar to,The car brand Lamborghini is similar to,The car brand Mercedes-Benz is similar to,The car brand BMW is similar to,The car brand Ford is similar to,The car brand Porsche is similar to,The car brand Audi is similar to,The car brand Volkswagen is similar to,The car brand Ferrari is similar to,The car brand Lexus is similar to,The car brand Volvo is similar to
0," the Ferrari and Lamborghini in that it is a luxury car manufacturer. The company has a number of divisions, including one that produces sport utility vehicles such as the Jeep Wrangler and Jeep Grand Cherokee.

""It's a great way to start your career in the industry,"" said Steve Haughey, a marketing executive at Jeep. ""It's a great way to gain experience.""

Jaguar's Jeep division is a subsidiary of the parent company, which was founded in 1966.

The Jeep brand was launched in the 1950s as a way for the company to attract and retain new customers, as well as to develop and market its rugged, sport utility vehicle.

The company has been in the news recently for a series of lawsuits filed against it by former employees.

Jaguar has been embroiled in a series of lawsuits against former employees and former employees who allege they were fired for speaking out against the company.

Jaguar has also been sued for allegedly lying about the quality of its products, and for failing to meet its obligations to its customers.

In a statement, Chrysler said Jeep was ""a great opportunity for young professionals, and the Jeep brand is a great way to get there.""

Jaguar's Jeep division is led by former Chrysler employees, including the former chief executive of the Jeep brand, John D. Winter.

Jaguar's Jeep division has about 4,500 employees worldwide.

"," Tesla in that it is a pure electric vehicle manufacturer. But let's be honest, the company is much better at electric car technology than Tesla.

The company is developing a range of electric vehicles, including a sport utility vehicle (SUV) that will be a plug-in hybrid (PHEV). According to the company, the car will be capable of driving on the highway for up to 55 miles on a charge.

This is a big deal for Subaru, as the company has been trying to make electric vehicles more accessible to consumers.

The company recently launched a partnership with Tesla to develop a low-cost electric vehicle called the Tesla Roadster. The vehicle will be available in the U.S. in the second half of 2017.

The company also announced that it has entered into a partnership with a Chinese company, Jiaotong Electric, to develop a low-cost electric vehicle called the Tesla Roadster.

The company is also working on a partnership with a Japanese auto company, Hitachi, to develop a low-cost electric vehicle called the Tesla Roadster. The company is also working on a partnership with a Chinese auto company, Hitachi, to develop a low-cost electric vehicle called the Tesla Roadster.

The car maker has also announced that it will build a vehicle in partnership with the American automaker, General Motors. The vehicle is expected to be available in the first quarter of 2017.

The company has also"," the Ford Mustang in that it's an American muscle car company, but it's also a luxury brand. It's got a good reputation for quality and durability.

The car company Dodge is similar to the Ford Mustang in that it's an American muscle car company, but it's also a luxury brand. It's got a good reputation for quality and durability.

The new Dodge Challenger SRT Hellcat is a car that's been designed for the modern man. It's not a new muscle car, but it's a modern muscle car that's got a lot of the same features as the Dodge Viper.

Dodge is known for offering a lot of affordable cars and it has a huge range of models. The Challenger SRT Hellcat is a great choice for a budget car, and it's a great car for the man who just wants to get out of the house and see the world.

The Challenger SRT Hellcat is a car that's been designed for the modern man. It's not a new muscle car, but it's a modern muscle car that's got a lot of the same features as the Dodge Viper.

The Challenger SRT Hellcat is a car that's been designed for the modern man. It's not a new muscle car, but it's a modern muscle car that's got a lot of the same features as the Dodge Viper.

The new Dodge Challenger SRT Hellcat is a car that's been designed for"," BMW in that it is an electric car company based in California. However, Tesla is also the world's largest maker of all-electric cars.

The Tesla Model S is the company's flagship model, the first and only one of its kind. It is a luxury sedan that has a range of approximately 200 miles. The Model S is a luxury car that has a range of approximately 200 miles.

In the US, Tesla has a retail store and a service center in Las Vegas, Nevada. There are also some service centers in New York, California, and California.

Tesla Model S

The Model S is a sports sedan that has a range of approximately 200 miles. The Model S has a range of approximately 200 miles.

The Model S is a luxury sedan that has a range of approximately 200 miles. The Model S is a luxury sedan that has a range of approximately 200 miles.

The Model S is a luxury sedan that has a range of approximately 200 miles. The Model S is a luxury sedan that has a range of approximately 200 miles.

The Model S is a luxury sedan that has a range of approximately 200 miles. The Model S is a luxury sedan that has a range of approximately 200 miles.

The Model S is a luxury sedan that has a range of approximately 200 miles. The Model S is a luxury sedan that has a range of approximately 200 miles.

The Model S is a luxury sedan that has a range"," Renault and is owned by a consortium of French companies.

It is the latest in a series of moves to make it more attractive to foreign investors.

Takata is among the world's biggest carmakers, but its use of safety equipment and clean energy sources has been criticised.

The Japanese company has also been under pressure to produce cars that are more environmentally friendly, after its latest model, the Prius, was found to have dangerous levels of nitrogen oxide in its exhaust.

In January, it announced plans to cut its emissions by 30 per cent by 2020.

Toyota said it would invest $1.6bn (£1.1bn) in an electric car battery factory in the US, and is also looking to build a hydrogen fuel cell car plant in China.

The Japanese company is also investing $2.3bn in a new plant in Mexico to produce hydrogen fuel cells.

But it has also been accused of not doing enough to stop the emissions of its vehicles.

It has also been criticised for not doing enough to tackle the pollution of its factories, which can pollute with nitrogen oxides and other pollutants.

Toyota has also been criticised for not doing enough to tackle the pollution of its factories, which can pollute with nitrogen oxides and other pollutants.

In January, it announced plans to cut its emissions by 30 per cent by 2020, and announced plans to invest $1.6bn"," the Hyundai and Ford brands, which are based in the United States. The Honda Civic is powered by a 1.6-liter engine and produces 250 horsepower and 249 lb-ft of torque. The Civic is available in both a manual and automatic transmission.

The Honda Civic is available in three different trim levels: Sport, Touring and Premium. The Sport trim is the most luxurious, and features a sport seats, heated steering wheel and a leather-wrapped steering wheel and pedals. The Sport trim is available in a range of colors, including blue, white, black, red, grey and silver.

The Touring trim is the most economical of the three, and is available in two color options, silver and black. The Touring trim is available in three different trim levels: Sport, Touring, and Premium. The Touring trim is available in three different trim levels: Sport, Touring, and Premium.

The Premium trim is the most luxurious of the three, and is available in three different trim levels: Premium, Touring, and Sport. The Premium trim is available in three different trim levels: Sport, Touring, and Premium.

The Premium model is available in three different trim levels: Premium, Touring, and Sport. The Premium model is available in three different trim levels: Premium, Touring, and Sport.

The Premium model is available in three different trim levels: Premium, Touring, and Sport. The"," Ferrari, but it's not a brand that has had a lot of success in the past.

In 2008, Ferrari won the world championship in just one season, but the Japanese brand has been struggling in recent years.

The brand has seen its share of sales decline in recent years, with the number of cars sold declining by over 20 percent in 2011.

The company is now targeting a 2016 debut.

The new generation of Nissan Leaf will be made by a joint venture between Nissan and Daimler, the German automaker's parent company.

The company is also in talks with a number of other car brands, including Audi, BMW and Mercedes-Benz, according to The Wall Street Journal.

The new Leaf is expected to be unveiled in the first quarter of 2016, according to the report.

The carmaker is also working on a new electric car, but that car is due to be announced in the first half of next year.<|endoftext|>The world's biggest tech company is going to send a drone to help police in the US stop people from carrying out mass shootings.

The drone is being developed by DJI, which is the maker of the Phantom 4 and the popular Phantom 3.

DJI says it is going to use the drone to help police use the technology in the future.

It will be able to fly over crowds of people, and see what's going on around them.

The drone will"," Ford in the US. It is a member of the Ford Motor Company, which is owned by Ford Motor Company.

In the US, the Chevrolet Cruze is sold in the following states: Alabama, Arizona, Arkansas, California, Colorado, Connecticut, Delaware, Florida, Georgia, Hawaii, Illinois, Indiana, Iowa, Kansas, Kentucky, Louisiana, Maine, Maryland, Massachusetts, Michigan, Minnesota, Mississippi, Missouri, Montana, Nebraska, Nevada, New Hampshire, New Jersey, New Mexico, New York, North Carolina, North Dakota, Ohio, Oklahoma, Oregon, Pennsylvania, Rhode Island, South Carolina, South Dakota, Tennessee, Texas, Utah, Vermont, Virginia, Washington, West Virginia, Wisconsin, Wyoming.

In the UK, the Chevrolet Cruze is sold in the following states: England, Wales, Northern Ireland, Scotland, Wales.

Chrysler Cruze

Chrysler Cruze is a compact car from the Canadian manufacturer, Chrysler Group. Its name is derived from the name of the German company, as well as the name of the first car designed by German engineer Ferdinand Porsche. The Cruze is a compact car with a 5-passenger capacity.

Chrysler Cruze is the most popular compact car in the world, with over 50 million sales since the year 2000.

Chrysler Cruze is manufactured by Ford Motor Company.

Chrysler is the largest automaker in the world, with a"," the Toyota Camry, with a similar layout and design.

The brand's most popular model is the 2017 Hyundai Elantra, with a range of 205 miles and a starting price of $29,995.

The brand also has a range of Camry variants which are similar to the 2017 Hyundai Elantra.

The 2017 Hyundai Elantra comes with a range of 205 miles and a starting price of $29,995.

The 2017 Hyundai Elantra comes with a range of 205 miles and a starting price of $29,995.

The 2017 Hyundai Elantra comes with a range of 205 miles and a starting price of $29,995.

The 2017 Hyundai Elantra comes with a range of 205 miles and a starting price of $29,995.

The 2017 Hyundai Elantra comes with a range of 205 miles and a starting price of $29,995.

The 2017 Hyundai Elantra comes with a range of 205 miles and a starting price of $29,995.

The 2017 Hyundai Elantra comes with a range of 205 miles and a starting price of $29,995.

The 2017 Hyundai Elantra comes with a range of 205 miles and a starting price of $29,995.

The 2017 Hyundai Elantra comes with a range of 205 miles and a starting price of $29,995.

The 2017 Hyundai Elantra"," Tesla in that it has a focus on electric cars, but it also has a history of building and selling electric cars.

The company's first electric car, the Mazda4, went on sale in 2011 and has since been followed by the Mazda3, the Mazda6, the Mazda3i, the Mazda3, the Mazda3i and the Mazda6.

It's also worth noting that the car brand's electric cars have been far more expensive than Tesla's.

Tesla Motors

Tesla Motors has been around since 2009. In 2014, the company launched the Model 3, which is a $35,000 electric car that will be available to order starting in late 2017.

The company's electric cars, which are made by General Motors, are much more expensive than Tesla's.

The Model 3 is available in three different models, with the $35,000 model being the highest-end. It's also the most expensive car in Tesla's lineup, with a base price of $71,300.

Tesla's Model 3 costs $35,000, but the company's Model S, which is more affordable, goes for $35,000.

Tesla Model S, $35,000

Tesla Model S, $35,000

Tesla Model X, $35,000

Tesla Model X, $35,000

Tesla Model 3, $35,000

Tesla Model 3, $35"," the BMW i3 and Mercedes AMG GT3, both of which have been designed to compete with the Audi R8 Energi and BMW M3 in the high-performance segment.

The R8 Energi is a 5-door sedan with a 5.7-litre twin-turbo V12 engine that produces a peak output of 566bhp and a top speed of 155mph. The new model is expected to be offered in the UK in 2015, while the Audi R8 Energi will be available in the US in early 2016.

The new BMW M3 is a six-door sedan that can be fitted with either a 5-door or 6-door engine. It is expected to be offered in the UK in 2015, while the Audi R8 Energi will be available in the US in early 2016.

The new BMW M3 M3 will be offered with either a 5-door or 6-door engine. It is expected to be offered in the UK in 2015, while the Audi R8 Energi will be available in the US in early 2016.

The BMW i3 is a four-door sedan that can be fitted with either a 5-door or 6-door engine. It is expected to be available in the UK in 2015, while the Audi R8 Energi will be available in the US in early 2016.

The BMW i3 is a four-door sedan"," Ferrari and Rolls-Royce.

Car manufacturers are usually transparent about their product and their costs.

The latest figures show the average price of a new car sold in the UK was £23,000.<|endoftext|>The latest step in the process of creating a new movie, the first of its kind in the world, is being completed this week, and it's a big one.

The majority of the movie, the story of a group of young girls who discover that they are descended from the powerful and powerful families of ancient Egypt, is set to be shot in Morocco, and will be shot in the beautiful, ancient city of Casablanca, Morocco.

The film's official title will be ""The Last of the Pharaohs,"" and it will be directed by a Moroccan filmmaker named Nadia Boudou, and will be produced by the Moroccan company Al Jadid Films.

The project will be financed by the Moroccan government, and the film will be released in the United States and other countries around the world.

The first of the ""Last of the Pharaohs"" movies will be a young adult movie, and will be shot in the United States and Europe, but a second movie, titled ""The Last of the Pharaohs II,"" will be shot in Morocco.

The new movie, the first of its kind in the world, is being completed this week, and it's a big one.

The first movie, in"," the German carmaker BMW in its focus on innovation and technology. The company has developed a range of electric vehicles including the E-Class, a four-door sedan, and the E-Class Luxury, a five-door sedan. The Mercedes-Benz E-Class is the world's most popular car, with sales of more than 30 million vehicles in 2014.

The company also has a range of electric vehicles, including the B-Class, a four-door sedan, and the B-Class Luxury, a five-door sedan.

The company is also attempting to make a statement on climate change. The company has announced plans to phase out coal-fired electricity by 2030, which will save the company $24 billion in the next decade.

The company has also announced plans to phase out coal-fired electricity by 2030, which will save the company $24 billion in the next decade. In addition to its electric vehicles, the company also has a range of electric vehicles, including the E-Class, a four-door sedan, and the E-Class Luxury, a five-door sedan.

""We are committed to investing in clean technologies and innovation that will help our customers meet their energy needs and make the world a cleaner place,"" said Jean-Marc Baudouin, president and CEO of Mercedes-Benz. ""We are also committed to developing technologies that will enable us to deliver electric vehicles that are more affordable and that will help"," the Porsche 911 in that it has an engine that is a twin turbocharged six cylinder engine, but the BMW is also capable of producing 300 horsepower and 300 lb-ft of torque.

The Porsche 911 has a similar engine to the BMW, but it has a different turbocharger. The Porsche 911 is also capable of producing 600 horsepower and 600 lb-ft of torque.

The Porsche 911 is also capable of producing 600 horsepower and 600 lb-ft of torque. The Porsche 911 is also capable of producing 600 horsepower and 600 lb-ft of torque. The Porsche 911 is also capable of producing 600 horsepower and 600 lb-ft of torque. The Porsche 911 is also capable of producing 600 horsepower and 600 lb-ft of torque. The Porsche 911 is also capable of producing 600 horsepower and 600 lb-ft of torque. The Porsche 911 is also capable of producing 600 horsepower and 600 lb-ft of torque. The Porsche 911 is also capable of producing 600 horsepower and 600 lb-ft of torque. The Porsche 911 is also capable of producing 600 horsepower and 600 lb-ft of torque. The Porsche 911 is also capable of producing 600 horsepower and 600 lb-ft of torque. The Porsche 911 is also capable of producing 600 horsepower and 600 lb-ft of torque. The Porsche 911 is also capable of producing 600 horsepower and 600 lb-ft of torque. The Porsche 911 is also capable of producing 600 horsepower and 600 lb-ft of torque. The Porsche 911 is also"," BMW in that it has a lot of high-end models, but they are not as high-end as BMW. They are not as high-end as Mercedes-Benz or Audi. But they are all high-end.

In terms of the luxury segment, you have the Mercedes-Benz S-Class, Mercedes-Benz A-Class, BMW 5-Series, BMW X5, and the BMW X1.

BMW X6

BMW X6, the X6, is a 5-door sedan that is quite similar to the X5. It has a 2.0-liter turbocharged four-cylinder engine, with an output of 258 horsepower. It has a claimed range of 265 miles on the highway.

BMW X6 is available in a range of colors, including a black exterior and a silver interior.

BMW X6 is available in a range of colors, including a black exterior and a silver interior.

BMW X5

The BMW X5 is a 5-door sedan that is quite similar to the X5. It has a 2.0-liter turbocharged four-cylinder engine, with an output of 258 horsepower. It has a claimed range of 265 miles on the highway.

BMW X5 is available in a range of colors, including a black exterior and a silver interior.

BMW X4

The BMW X4 is a 4"," Ferrari but it is not as powerful as Ferrari's V12 engines.

According to the report, the company had to spend €1.4bn in the last two years to acquire the rights to the Porsche name in the EU.

The report also said that the consortium that owns the rights to the Porsche name has decided to sell the rights to the car brand to a private owner.

The consortium has agreed to pay €1.8bn for the rights to the car brand.

The report said that the consortium has also agreed to sell the rights to the car brand to a European car maker.<|endoftext|>By

Chapter 3/7 for the week!

Read here: Chapter 90‍

If you're enjoying Hedonist Sovereign, please drop a vote here! :) http://gravitytales.com/vote

Official synopsis: Doing quests, romancing beauties, fighting rich young masters and battling evil tyrants! His goal is very clear: to become the number one Hedonist Sovereign in the universe!

Translator's synopsis: A rich young master, a hedonist, has the Hedonist Sovereign System forced upon him. Follow this hedonist on his adventure of becoming a Hedonist Sovereign through doing real life quests, filled with action-packed battles and hilarious moments. A lazy and slothful hedonist doing exercise in the morning? A spoilt and self-entitled hedon"," VW in that it has been around for over 40 years. It started out as a German auto maker, but now has a global presence. The Audi brand is used in every country, and is the largest car brand in the world.

The Audi brand is used in every country, and is the largest car brand in the world.

The Audi brand is used in every country, and is the largest car brand in the world.

The Audi brand is used in every country, and is the largest car brand in the world.

The Audi brand is used in every country, and is the largest car brand in the world.

The Audi brand is used in every country, and is the largest car brand in the world.

The Audi brand is used in every country, and is the largest car brand in the world.

The Audi brand is used in every country, and is the largest car brand in the world.

The Audi brand is used in every country, and is the largest car brand in the world.

The Audi brand is used in every country, and is the largest car brand in the world.

The Audi brand is used in every country, and is the largest car brand in the world.

The Audi brand is used in every country, and is the largest car brand in the world.

The Audi brand is used in every country, and is the largest car brand in the world.
"," the Porsche in that it's a luxury brand. The Porsche is a luxury brand because it's been around for a long time, but the VW is a luxury brand because it's been around for a long time and has been making cars for a long time.

And I think that's what people are going to be concerned about.

You've got to remember, the VW is a brand that has been around for a long time. There's a very good reason why VW has been around for so long. It's because it's good.

It's a good car.

And it's a good car.

It's a good car.

It's a good car.

It's a good car.

It's a good car.

It's a good car.

It's a good car.

It's a good car.

It's a good car.

It's a good car.

It's a good car.

It's a good car.

It's a good car.

It's a good car.

It's a good car.

It's a good car.

It's a good car.

It's a good car.

It's a good car.

It's a good car.

It's a good car.

It's a good car.

It"," the Mercedes-Benz brand in that it is a major manufacturer, but it is still owned by the Italian government.

The company's most recent financial results showed that Ferrari was the third-largest car brand in the world, behind only BMW and Mercedes.

The company's management has been criticized for its management style, which has been criticized by some in the industry.

The company has recently been involved in a dispute with a former employee in the US over his claims that he was fired for complaining about his treatment.

In January, the company was hit with a lawsuit from a former employee who claimed that his termination was due to the company's management style.

The lawsuit, which was filed in California, claimed that the company's management style led to his ""termination without cause.""

In the lawsuit, the former employee said that he was fired because he complained about his treatment by Ferrari's management.

The former employee also alleged that he was denied a promotion and was retaliated against for his complaints.

Ferrari has denied the allegations and said that it was a matter for the US authorities.<|endoftext|>The following is an excerpt from ""The Man Who Killed All the People in the World,"" by James C. Scott. It was published in The New Yorker in October, 1993.

I had been working for a year or so on a novel about a man named John, who, like me, had spent his life in a small"," Nissan in that it also has a range of vehicles that are designed to be used by people who don't drive a car. The Lexus RX450h, for example, is a sports car that has been designed to be used by people who love to drive. The RX450h is a sports car that has been designed to be used by people who love to drive.

The Lexus RX450h sports car is a sports car that has been designed to be used by people who love to drive.

The Lexus RX450h sports car is a sports car that has been designed to be used by people who love to drive.

The Lexus RX450h sports car is a sports car that has been designed to be used by people who love to drive.

The Lexus RX450h sports car is a sports car that has been designed to be used by people who love to drive.

The Lexus RX450h sports car is a sports car that has been designed to be used by people who love to drive.

The Lexus RX450h sports car is a sports car that has been designed to be used by people who love to drive.

The Lexus RX450h sports car is a sports car that has been designed to be used by people who love to drive.

The Lexus RX450h sports car is a sports car that has been designed to be used by people who love to drive.
"," the Mercedes-Benz S-Class, but unlike the S-Class, the S-Class is available only in black with tinted windows and a rear spoiler. It is available in two versions, the S-Class and the S-Class E, with the S-Class E available only in the US. The S-Class E is available in four trim levels, including the standard S-Class, with a starting price of $51,800.

The S-Class E was sold in the US in 2009, but it was not until 2011 that it was available in other markets. It was first offered in Europe in 2012, and in Australia in 2013. It was also available in the UK in 2014, but the S-Class E was not available in the UK until 2015.

The S-Class E is available only in the US.<|endoftext|>A week after the announcement of his candidacy for the presidency, Donald Trump has been widely criticized for saying that the U.S. should ""bomb the shit"" out of ISIS.

""We have to get our asses out of the Middle East and down to the Middle East and out of the Muslim world,"" Trump said during a rally in Orange County, California on Tuesday night. ""We're going to bomb the shit out of ISIS.""

The comments came after Trump had said that he would be willing to ""bomb the shit out"" of ISIS if that's what it took to defeat the group.
"
