57," Volkswagen, where the concept of autonomous driving was invented. The new cars will also feature autonomous driving functions, as well as ride-sharing features, allowing for faster and more traveled routes.

Currently, Uber is trying to merge with the likes of Lyft and Sidecar. The company may be turning this into another big opportunity.

According to the post, the company hopes to open up more than 15 new SVP positions over the next three years, bringing the new positions to almost 200.

Future of autonomous vehicles

The robocar concept can bring a lot to many car buyers. What will be important to the car brand is to see how this technology will be used in end-user scenarios, such as driving for leisure.

As a result, Uber is hoping that its vehicles will be used primarily by commuters who need to enjoy their commute by themselves.

""The car brand will continue to separate itself from traditional models. We are focused on building a future where no one is left behind,"" reads the post.

""Our vision for the future is to bring the technology of autonomous driving to every car, from the humble car to high-end electric vehicles. We are excited to be part of this journey,"" said Ravinder Kumar, CEO and co-founder of Uber.

Source: Uber (Japanese)<|endoftext|>As some of you know, Ingrid Newkirk was a member of the committee that enabled the state to officially legalize same-"
58," Volvo in the way it designs its cars under pressure from rising fuel costs. It must make the most of today's limited supply of gasoline as new car sales are slowing. It is also moving aggressively into autonomous vehicles, using data from its car fleet as it adjusts its software for the vehicles.

Related: Tesla releases Autopilot 2.0 software update

Tesla has been rolling out car-to-car and car-to-home software updates to its cars since it debuted the System-on-a-Chip-for-Autonomous Vehicles for a 2013 test drive. The update to the Tesla Roadster in Waymo's autonomous testing program included turning off automatic parking when the vehicle was parked or in the same lane of traffic. Tesla was able to do this because it did not need to rely on the car's speed to do so.

More recently, Waymo's AlphaGo played a pivotal role in defeating five players in the world's most famous chess tournament. Almost two weeks later, Waymo announced the development of its Self-Driving Car project.

Waymo specializes in developing autonomous driving applications for state and local agencies and authorities across the country. It began previewing the project in February of this year with the start of the autonomous vehicle program.

The company is continuing to improve its technology for vehicles to be able to overcome obstacles and distinguish the victims from the aggressors to drive safely through intersections without any human intervention. By 2018, the company"
59," Volvo, which shares its name with one of the world's leading vehicles brands, Spethobox. General Motors, too, shares its name with one of the world's leading vehicles brands.

""There have been several attempts to merge technology into premium products over the last five years; however, a combined company's brand must remain unique and separate from other brands,"" said Siva Sharma, EVP of the Siva Group.

The merger of the EV investing company and a vehicle manufacturer is expected to create the largest auto finance company in the world and could lead to deep integration of finance in India and globally as the economy matures.

The Car State Machine (CSM) has assembled the first wave of high-end cars in India under a partnership with Turkish bodybuilder ALAMEX.

The other groups in the first phase of the process include energy, investment, media and automotive industries.

Dassault Solar is a French consortium that is developing production technology for solar panel equipment.

""It is an opportunity to meet the needs of India's rising energy demanding consumers,"" said Daira Bhattacharya, senior vice president, strategic industries with Dassault Solar.

""We are pleased to expand into India and look forward to working with the government to understand their needs on realistic scale,"" Bhattacharya added.

""This has been a long gestation period, but we are taking all the necessary steps to prepare successfully for our"
