,The car brand is similar to
0," Ferrari's Ferrari 458 Italia V12 Vantage, but has nothing similar to the platform of the recently launched BMW M1* that was shown off at the New York International Auto Show last week.

The 3 Series car was shown with the new 35 mm carbon-ceramic brakes, a revised suspension and G-Drive technology that uses a twin-scroll directsurfer gearbox.

READ: BMW has teamed up with Mercedes to create the i8

The engine is positioned as low as possible to facilitate the use of the brakes and powertrain powertrain. The 3 Series is fitted with an 8.0-liter V8 which is expected to deliver an output of 511 hp.

Although the 3 Series goes by the German brand name KOM and works its way into the US, it is expected to be promoted by BMW this year.

Mitsubishi is expected to make the given prototype public in Detroit in February.<|endoftext|>WASHINGTON—In a clear indication of his grim view of the president's lack of leadership, a source close to Vice President Joe Biden told reporters Tuesday that the vice president was openly frustrated with the president's ability to exercise considerable political influence. ""With Joe Biden's permission, the vice president would regularly call President Obama and express his concerns that the president was having trouble making the kind of decisions that could change the course of the country,"" the source said, adding that the vice president was equally concerned about the president's tactical prowess"
1," a Volkswagen. Very similar. One of its products is called a Podcar (Volkswagen Podcar). What's a podcar? It's a pod car. That's what it's for. I'm not a car fan. That's philosophy.

Two years ago I had two kids and I had to sell my Porsche 911. Could you imagine if I took the Porsche 911 to gullies, we could go all the way to Miami Beach, Tallahassee, Disneyland, taxis? That would be good!

You guys are big on independent research. How much do you guys read, comment on and write about?

We don't read each other, we read each other, but we're not exactly friends. We're really close friends. We met. We weren't together for two years. Follow me on Twitter if you want to know more. We're on different places. But we really like to be seen together. We're not really like, dukes-and-kais. We're like brothers.

Do you think we've lost touch with how it was with getting involved with everything? Did I really have a month to research a car and have it ready to go, you know, just waiting on someone to buy it?

We've always been good at collecting machines, and World of Warcraft does a great job of it. There are a lot of different companies we work for. It's a game. It's"
2," Mercedes, but with a slightly more practical price tag. The $40,000 328i gets an engine that averages 46mpg, a 190 hp gasoline V8, and a 204 lb-ft of torque from 6,300 rpm. The 5.0-liter V8, and its hefty 6.7:1 compression ratio, powers a five-speed dual-clutch transmission. The car has a 9.0-inch touchscreen display, front and side cameras, adaptive cruise control, active parking sensors, and a six-speaker sound system.

The company insists that the new model is quieter than before, with the sound level dropping 15 decibels in the 2.1-mi.35-mile range. Power has been increased from an original 177 hp to 177 hp and torque to 300 lb-ft from its previous 560 lb-ft. The 5.0-liter V8 gets a powertrain ratio of 7.0:1, which is lighter than before, and the Quattro's drivetrain is tweaked to help it handle better on the stuff. The rear tires are longer, as are the suspension components, while the optional leather-wrapped steering wheel, synthetic bumpers, and a track-tuned steering wheel still exist.

Advertisement

Although the 328i is only available in white, the company covered the car with multiple shades of blue for the press visit. Still, the interior is comfortable in black, as are the"
3," BMW, since its model is similar to that of both the BMW 3 Series and the BMW 3-Series Sedan. Both are engineered and manufactured in Germany. As with brand, price and performance of the cars is based on the particular packages of the car. And, if you are seeking a BMW 3 Series Sedan, you will find quite a few of them, for example the sixth-gen BMW 3 Series is available in a variety of colors. The Sedan is currently only available in silver in Germany, but will also be available in gold, black, and platinum. And only the 4 Series Sedan is available in a market-exclusive version, with one of the fourth-gen models in each model group being available in the black or gold color, and the fifth-gen model in each model group being available in the silver or gold color.

The BMW 3 series was the brand's first attempt to capture both luxury and performance, and have both in one car, the most prominent of which is the 3 Series Sedan, which is priced around $109,000. Available in several metallic finishes such as black, black, gold, a gold/platinum finish, and some white, there are a few other models as well, including an all-wheel-drive version of the 3 Series Sedan, the 3 Series Touring, as well as the 3 Series Coupe, which is more called the E-Class. The third-generation 3 Series Sedan was"
4," Nissan, with virtually all of their products featuring a similar platform. While the concept is largely similar, Volkswagen's redesign centers around the new V6 engine, and the redesign of the vehicle mirrors Nissan's. In particular, the interior looks very similar to the current concept, and has the same carbon fiber materials and 18-inch model.

There is little information regarding the price, but the name of the vehicle currently appears on the Volkswagen website, and it will likely be in the middle of 2017 model year. As for the car itself, Volkswagen is calling their new concept the ""Volkswagen GTI."", which is from the German word ""Viel"", which translates to ""greatness"". That would imply that the GTI is poised to be a budget-friendly alternative to the current GTI, which starts around $24,000.<|endoftext|>You're not going to get away with blaming behavior all you want, because the more behaviors you have to attribute, the less accurate your judgment is.

That's especially true if that behavior happened after you started calling it a crime.

That's one reason the U.S. Supreme Court's Citizens United decision is so important. Making it easier for people to turn their misdeeds into lawsuits, leading to government action that would be nullified if it were passed across the border.

The result can be as real a threat to democracy as it is to the status quo.

In just 14 hours, New Yorkers"
5," Audi, but it's not the same. The Audi brand is about to be massive. Audi is once again at the helm of what is shaping up to be its biggest ever financial success. Audi has got a $150M deal to produce a new sports car for the new sports car for the new sports car for the new sports car, called the Q6.

The car is more than just a sports car. It's a lifestyle car, because it features a $39,000 price tag. Are you ready for that? It's seven doors and 5.7 inches shorter than the Audi A3. It's got a 2.0 liter four-cylinder engine, both turbocharged and flat-6, and is available with either a 4 or a 5 speed manual gearbox. The size is supposed to be 375 horsepower, 350 pound-feet of torque and 200 foot-pounds of torque. The whole project costs about $5 million. In other words, if you want one of these, you'll spend $55,000.

In fact, these are stripped down versions of the Q6, which are on sale now. The part of the car that's new is the front fascia, which was never finished. That's because they didn't want to shave down the bodywork, and they felt that the front fascia would require too much attack on the body. The car looks like a Q6 actually. The front fascia is slightly longer"
6," Ford in size and tonnage, but has a distinct feel more akin to Ferrari. It's not always a spectacular car, but it's always stylish and is used far more than the other cars that are featured on this list. It's based on the Jetta (no longer standard), with a sporty body and driveshaft, and it's offered in several models, including a standard-equipped model priced at £26,000.

These days, it's often referred to as the best convertible in the world, but it's actually quite crude and simple, but that's what makes it so popular. The fact that it's easier to drive than a traditional car lends it some appeal… even if you're not an expert at driving.

Alfa Romeo Giulia (a light, working-car offering)

Image copyright Alfa Romeo Image caption Make Your Own Alfa Romeo Alfa Romeo Giulia: The Giulia is an Italian so-called 'walled garage'

Alfa Romeo introduced the Giulia concept car in 2012 with a new 260bhp version of the engine that was the ""only"" option on all other models. The Giulia has grown in popularity since then to become the most popular car in Italy for its capacity, build quality and airflow. That makes it an excellent choice for a starting point for new drivers!

The Giulia is a modern, working-class, reserved car that can be found in almost"
7," this – our 2012 BMW M3 S600 is an example of this – and we weren't too surprised it was a pretty damn ride.

There are a few key differences between this BMW M3 S600 and the one we drove in the video, though. Firstly, it has 3 channels on the screen – one for driving, one for menu and navigation, and one for radio – something we found very helpful for those who need a little help with the driving controls, without slapping them all over the dashboard and having to click on each channel individually. And, as you'll see in the video, both the navigation and radio have an indicator light under them – meaning they'll be flashing just as you're waving your hand.

The touchscreen also plays a big part in this car's handling, mainly because it's so responsive, and the frame is incredibly light thanks to Kevlar materials found throughout. The 2.5″ touch screen, meanwhile, is up top for both driving and menus. Considering the shape and size of the car, I'm sure BMW is glad that they used Kevlar materials in the chassis too – this makes the car feel lighter and more refined than it looks.

If you think that's not enough, it's not – there's also a small LED light on the dashboard that flashes red when the car is in gear, and orange when the car is off.

What do you think of the ride, how responsive it is, and how"
8," Mercedes in the area of styling, though the E-Class is a bit more sophisticated than the Merc.

The E-Class is powered by a 2.0-litre four-cylinder mill and weighs in at 145kg (275lbs). It has a top speed of 151km/h (95mph) and the standard equipment includes a four-wheel-drive manual and a six-speed automatic. The car will be available in three different trim levels, which are listed below:

Standard - £26,620 (£18,000 destination charge, including £950 destination charge)

Premium, with stats package optional - £28,290 (£20,000 destination charge)

Double - £31,945 (£22,500 destination charge)

Double SUV - £31,945 (£22,500 destination charge)

Premium Limited - £34,690 (£21,600 destination charge)

Premium, with stats package optional - £35,480 (£23,000 destination charge)

Premium Limited, with stats package optional - £35,480 (£23,000 destination charge)

Premium, with stats package optional - £35,480 (£23,000 destination charge)

Exclusive Balance & Drive for the 2015 E-Class starts from £21,780, which is around £2,000 cheaper than the base cost.

The new E-Class will be sold in three different colors"
9," the Ford Focus Electric by having large carbon fiber wheels, and it's a true electric car.

But the electric car is most often a prototype car, and it's designed to get test rides and learn about electric car technology. Tesla has been testing its cars on public roads, first in Fremont, California, and now it's returning to California for the first time in 11 years to drive 60 miles in just over an hour.

Once the Model 3 arrives in September, Tesla will have thousands of orders for the Model S sedan, which is designed to be another prototype that gets used and adjusted again in the factory. That's the plan for Tesla's electric cars, which are the company's biggest source of capital.

Many question whether Tesla's batteries are ready to prove out their full potential as long as their batteries are easy to charge and extend their life. Some think that Tesla is trying to hold back its electric cars on the assumption that certain batteries could fail – although hours spent charging the batteries are not really the same as hours in a car.

Elon Musk also has a soft spot for Tesla's electric cars. He believes that investing in electric car technology will eventually lead to electric cars being the norm.

""Of course it turns out that we can get those electric cars within a few years or even a few decades,"" he told me, ""but at this point that's a huge amount of time.""<|endoftext|>The director of the town's children's"
10," BMW and Mercedes-Benz among other luxury-vehicle brands. Thus, BMW's introduction could create a large market for its Model 3 premium sedan.

Rika is the owner of Hyundai, a carmaker with several subsidiary brands. For instance, IKEA, one of the top five carmakers in the world, has its own brand name and produced nothing but models of its own that customers never owned.

""Even as the global car market shrinks, Hyundai's business model remains solid despite the knock offs coming in the car market,"" said an industry source.

In this respect, the car brand is not unlike an old-fashioned retailer, who lost some customers during the market crash of the 1980s and 1990s. Only a few companies organized and managed to catch the attention of the target customer. The global car market has not experienced the same decline that prevailed over the last several years.

Apart from Rika, BMW does not have a wide range of car models at this moment, but it is planning to introduce the Model 3 in 2019 as part of its premium sedan line-up in the US.

In future, the car maker plans to bring the Model 3 to all its markets.<|endoftext|>This is one of those stories I've seen repeated across the internet. A man found out he had cancer and was given an innovative treatment. He received the experimental drug and it changed his life. The story went like this:

A man"
11," Toyota, which is the automaker behind the Mazda hatchback. The Honda Civic has been rumored to be in the works for some time now, but was never officially announced. A press release, supposedly by Honda, suggested that the Civic would likely have a 2017 model year, and possibly 93. Of course, the car's identity hasn't been revealed yet.

The Civic is also rear-wheel drive. Along with the redesigned name, the Civic nameplate is also no longer white and the design of the rear window is also no longer silver. The Civic's two front wheels are still painted and the center console is also color-matched to the Civic hatchback. Interestingly, the Civic's dual-tone fabric has been kept, and the interior trim remains all black.

In terms of paint colors, the Civic is actually a mix of different materials. As of right now, the Civic is in brown and blue. Honda is also reportedly looking into adding some light grey against the black exterior.

Honda was relatively quiet about the release, saying only that the Civic would be revealed during a press conference on September 4th. With the Civic still buried under a few months of leaks and rumors, speculation is running rampant as to what Honda will unveil this season.

LOOK: 2018 Honda Civic<|endoftext|>In the late 1990s, a small economic boom in Aspen brought the town to prominence as the Silicon Valley of the West. The newspaper, Washington Post (WD)."
12," the original Ginetta because of its track-racer style to prepare for the tougher conditions on the straights. The new Michelin Pilot Sport Cup S has a width of 1.5 inches and is fitted with a carbon monocoque. It weighs around 200 pounds and offers a 0-60 mph time of 4.6 seconds.

The next year will see the introduction of the Chevrolet Corvette Z06 and Toyota Camry. The Z06 will debut at the 2012 Geneva motor show in May, while the Camry will be coupled with the most powerful Corvette ever offered.

Follow @KnowlesLong and @GALLERYLIVE on Twitter.<|endoftext|>The article recently posted on the Reason Foundation's blog exposes so many aspects of Islamophobia that it might as well be a full-length novel. On the surface, it seems that the reason is that some Muslims are being forced by non-Muslims to act like white supremacists and other androids because some reasonable people have an anger about this. However, the article's premise becomes more ridiculous once the author claims that Islam isn't a religion but a political system, relying on the assumption that anyone who disagrees with the ideology is essentially an enemy of God and therefore should be killed.

First, the author argues that Islam is a political system:

A recent article on the Reason Foundation's blog rejects the notion that Islam is, in fact, a religion. Instead, it states that Islam is a political system:"
13," Ford, but much more powerful. While there are many similarities, there are also big differences.

In the 2000's, the BMW 6 Series was a powerful sedan designed for long-haul driving. The 6 Series was a big departure for the brand in 2001 when it launched the all-new BMW M6.

In contrast to the 6 Series, the BMW M6 is much more closely related to the Audi RS3. The M6 is a big sedan with most of the same features and performance as the Audi RS3.

The differences are minor to the degree that BMW says the M6 is a better performance car than the Audi RS3. However, they are not forgivable.

The M6 is not as efficient at 62 miles per hour and is uncomfortable at the throttle. It is far too heavy to be a true family car and the 5-passenger cabin is small for the size of the M6. The size and shape is also not the best for passenger comfort.

The M6 is the brand's newest and most powerful model. It is an automatic car which means it is automatic to turn on if the reverse button is not depressed. It is a manual that starts the car with a manual gearbox.

Both the E46 and E46E1 were developed with manual transmissions in mind. The BMW E46E1 was one of the first automatic cars to use a four speed manual gearbox. Its name was changed"
14," Toyota in the way it uses automated systems and also has its own steering wheel.

Toyota, also known as Toyota Motor America, will now become a full-fledged car manufacturer in its own right, and use some of its supply chain components through a new joint venture with Fiat Chrysler to produce vehicles in Volvo's name.

The partnership will allow Toyota to produce its new Tundra line of cars directly in the city of Daytona International Speedway, where Ford Motor Co. is building its new F-150 supercar.

Ford has invested $8.5 billion in a new factory in Fort Worth in a deal that is expected to be completed by 2016.

Fiat Chrysler is the world's second-largest auto supplier after General Motors Group's Chrysler Group, and plays a key roles in the global auto industry.

Even though the U.S. economy is growing faster than ever, 650,000 auto jobs are estimated to be in danger over the next 30 years because of automation, according to the National Automobile Dealers Association, or the DaimlerChrysler Automotive Group.

The global industry of vehicles and parts is expected to be worth $1.5 trillion by 2022, according to a report by research firm Deloitte.

Mazda, whose local plant in Alabama is the largest in the United States, said it already builds about 40,000 vehicles a day, but the decision to buy Fiat for $7"
15," Hyundai and neither can claim that it will blast to profitability overnight, but the gains from its latest model - Himi - could provide some comfort to those who see their advertising income decline following the discontinuation of the Hyundai Genesis late last year.

""The Hyundai Genesis was a great car, it's a great car, but there are other cars that have a stronger PR picture and I think they're bringing their brands to the forefront more through limited production and new equipment,"" he said.

""For those of us who are not familiar with the Genesis, it's a very cool car and it's one that I think we can really grow and become really large.

""We have to ask ourselves when it's time to make a decision and when is that going to be right? This is just one of those things that I think we can grow slightly and and really take advantage of it.""

But with the introduction of the Hyundai i30 crossover, all that is starting to change. At this stage it is unclear where the brand will find a profit, particularly as its further association with PSA Cross has coincided with a drop in advertising revenue.

It is believed that rather than continuing to develop a portfolio of brands, PSA Cross is now focusing on the ""new frontiers"" found in the fusion of Hyundai i30 and PSA One car.

""We are seeing a shift in what is going on with the Genesis and we have to make sure we"
16," Roadmaster previously, but in the e-luxury segment, it is different with its technology. ""The e-luxury segment has a lot of competition,"" says Murthy.

The e-luxury segment is watched in Indian markets by a number of large luxury car brands like Mercedes-Benz, BMW, BMW M Systems, Audi, Chrysler, Jaguar Land Rover, Lamborghini, Lexus and Porsche. Crackers are also eyeing the e-luxury segment including Altis and Ludicrous.

Though e-luxury segment is under development, the brand is known for its production technology because of its unprecedented quality, Murthy adds.

""The products are faceted, they look real, they are some of the best in the world,"" he says. ""There's Indian content in the cars, media, the smell is intoxicating. The range really is phenomenal.""

The company manufactures approximately 25,000 vehicles a year, setting a new record. The largest car market outside of the US, India is the second biggest car market after China, despite China losing the US to China in 2008 when its economy fell and its manufacturing sector crashed into a crisis.<|endoftext|>You've heard it before—a parody of a successful news anchor taking a humongous amount of money from a doomed company.

In a new report by the Huffington Post, the Huffington Post's Byon Helmi contends that news anchor Glenn Beck made a similar bet with"
17," Mercedes-Benz, where the name seems to mean ""good car"".

But since its debut in 2006 the S class has been criticised by environmentalists for its emissions, with some recent studies noting that the vehicles also generate more greenhouse gas emissions, according to the Mirror.

Luxury brand Kia has also put the issue of the S class cars at the forefront. Last month the company named its latest aircraft as ""Kia S60"", and it chose to avoid the subject entirely, noting that the aircraft is an electric vehicle.

Chancellor George Osborne announced the change to the S class car earlier this month, shortly after he cleared the way for the introduction of the £1.7bn retail deal for corporations to reduce their carbon emissions by 28 per cent.

The Chancellor was joined in his announcement by Energy Secretary Ed Davey, who praised the initiative, saying that he ""believes it is the best way to ensure that we make the most of existing sources of clean energy.""

This comes as a report prepared for the Department of Energy and Climate Change (DECC) has revealed that Britain is home to more than 100,000 tiny wind turbines, across the UK, as part of a £80million initiative to reduce British carbon emissions by 41%.<|endoftext|>Sia's ""Oh My Girl"" is already on sale, so the hookup between one of the pop stars and a chubby 25-year-old from New York is merely a gimmick."
18," Toyota's SRT brand of electric vehicles and is expected to debut a saloon sedan in early 2016.

Read More: Toyota's self-driving Lexus ZL1 is as good as it gets

Toyota also owned Peugeot, Volkswagen, Renault and Peugeot Sport for more than 20 years, so it's easy to imagine how these brands could become big enough partners to produce a new Bolt prototype.

The company is set to launch the Bolt in Europe following the US debut of the plug-in electric SUV. Thus far, Tesla owners have struggled to get the Bolt to the US market. Tesla is also constantly refreshed, continually expanding its product lines and offering new vehicles.

Check out the entire list of sanctioned dealerships in the US here.

Tesla announced the earlier models of the Bolt two months ago.


Follow me @glynmoody on Twitter or identi.ca, and +glynmoody on Google+<|endoftext|>""Dawn Of The New World""

Author: Harley Quinn

Artist: alabaster

Size: 623 pages

Colors: Color

Colors in the Nightstalkers Chronicles #1

THE NEW WORLD!

A mysterious, all-powerful, evolving empire of vampires and werewolves has risen from the ashes of the last war to threaten humanity's new dominion! With a new leader, an army of renegade warriors, the"
