19," Mercedes, but it is lighter, and it is built on the same platform as Mercedes, using the same layout and chassis. Honda Civic, BMW and other manufacturers have all entered the Honda segment, but none of them has the potential of Honda.<|endoftext|>24

4996 N St

Davenport , IA 50432


(515) 463-2180

I never seem to get a heart attack here. I read plenty about how bad this place is and how miserable people are, but I always find it odd when people I know take time out of their busy schedules to come here. I try not to be rude but I wasn't expecting to be rude, so I do apologize. I hate to leave a review but I don't know if it's not important or not. We were seated at the bar, followed by two servers and two waiters who looked pretty ready to take orders. I ordered a Gatorade and a Diet Coke. The first one shared 49 coke for all of us. I tried to order a Diet Coke but he claimed it's sodas and I just said I didn't want it, so he put it in my drink. I finished my drink and waited for my order to be placed. We were seated and he took my order. I was beyond excited to order a Diet Coke, but he refused to give it to me. The three waiters were not impressed with me and said I was not being nice because I"
20," Ferrari who's $9 million project is to build the world's first circuit in the United Arab Emirates.

The five- and six-seat cars compete in its version of the Tour de France with a racing to be held in the desert in 2017 and a road race in 2020.

British billionaire businessman and Dubai's former mayor, Nasser Bin Rashid Al Maktoum, who put the project on the agenda last year, has also raised currency worth millions of dollars from partners in the UAE for the project.

Last Update: Sunday, 6 October 2015 KSA 23:33 - GMT 20:33<|endoftext|>readme.md a guest Dec 27th, 2014 115 Never a guest115Never

Not a member of Pastebin yet? Sign Up , it unlocks many cool features!

rawdownloadcloneembedreportprint text 92.67 KB Basic commands/configurations for the utility: #!/bin/sh #Author : Redhat #Shared Library : su #License : GPLv2, Public Domain #----------------------------------------------------------------------------- # # Project: .NET 2.0 # #Author : Matt Goetter #Project: Core## #Keywords: userconfig, ./config, logging, ##, cgroup, profile, wow, networkmanager # #Extensions: netscored-core, netapi-core, netapi-spectator # https://github.com/goetter/netapi-core ##Debian based distributions: #https://launch"
21," Daimler, where it had its original name ""Daimler AG"".

But it was an indication in a new report by the German magazine Auto Motor und Sport that the parent company in fact changed its name to Mercedes-Benz last year.

Image copyright AP Image caption Mercedes-Benz has been criticised for its spending on advertising

The magazine says that while the company had been known as Mercedes-Benz before, the new name was decided in 2010 when it bought out the company's smaller parent company, Accord.

The magazine also reveals that Mercedes' parent company has paid millions of euros in dividends to shareholders while it is not paying any profits.

The magazine says that after the decision to change the name, the German carmaker had been trying to pressure its parent Company Daimler AG not to change the name.

A company spokesman told the BBC that there was no reason why the name change was not noted earlier.

""In the brief period in which we were legally required to do that there was no need to announce it,"" he said.

But the magazine also says that the website and social media accounts used by the company show it frequently used the name Mercedes-Benz for advertising.

The firm was also criticised at the time for its spending on advertising.

The magazine says that after it bought out the company, the Daimler group had switched to advertising methods that were also different to those used by the parent company"
22," the Ford Model T, also being launched in 2016. It has a range of more than 300 miles, comes with a range extender and is available with six-speed manual or electric.

The name Dodge also reflects the choice of two of its American Superstar vehicles. The El Camino is a rare example, and it is being introduced as a more affordable alternative. It is a 6.1-liter V-8 with an output of 550 horsepower and 700 pound-feet of torque.

The El Camino also already has more than a quarter-million sales. Its speed is boosted by Automatic Emergency Downshifting, where the engine automatically shifts to higher cylinders when the steering wheel is in neutral.

It is also easier to drive than a V-8 engine, and we expect this car to sell well, especially if it is an all-electric version of the El Camino.

If Volkswagen chooses to unveil another ELC variant with a-split production, it will be a rare, iconic and costly option.

We'll keep an eye on this for more details.<|endoftext|>One of the many problems with America is the dual citizenship of all of its citizens (hence the term ""welfare state""). Your Middle America, your Middle America knows nothing of the Middle East. It, or you, are the biggest problem in the case of the US, as every other country in the Western world would like to have you. You have the potential"
23," R8 in terms of design, but this is a model with a notably better setup, which is notably lower down the ladder compared to its rivals. The car is called a WRX and is based on the 1.4-litre 4-cylinder turbocharged engine. The one engine that shouldn't ever be ahead of the others is the 1.6-litre V6, which powers the car. Looking back at the CCX, the car has a lot to dance around. The modification to its intake must have cost more than $10,000. At the same time, the car's performance is barely different from that of the outgoing CCX, especially since it has been upgraded with a far better suspension and brakes. It's not quite as technically proficient on the street as those cars, but it will surely act as an accommodating driver's car in traffic.

In terms of price and performance, the CCX has an impressive 131bhp in the 1.4-litre V6, which makes it far less competitive than the CCX's rivals. Its 1.6-litre V6 is a great example of a tuned turbocharged engine running comfortably, though, and the CCX is now the fastest CCX on the circuit. However, compared to the 1.8-litre V6, which is much more capable, the CCX is a spectacular performer. Performance aside, the CCX still demands quite a bit of money for the"
24," BMW's M3 in appearance and function, but it packs quite a punch. In comparison with its big brother, this supermini has noticeably larger wheels, more powerful engines and a turbocharged four-cylinder. In 2010, BMW's M division produced just over 155,000 supermini cars, which are ranked among the best sellers in the market.

To Top

Source : Swedish daily Dagens Nyheter

back to top

Car of the Year

Toyota Hilux

The Toyota Hilux is a compact, little-known brand that has been winning spectacularly at the level of performance cars. Using the same logic as the Accord, the Toyota Hilux achieves an fuel economy of 14 mpg on the low-duty road, while doing so in less than 3 minutes during acceleration. By contrast, the Accord's fuel economy is only 12.3 mpg on the same highway, while pulling around in 7.4 seconds.

Toyota Hilux is a tough rival for BMW, Mercedes-Benz and Porsche.

Primary Objectives

Toyota Hilux is a powerful and luxurious performer, with an excellent driving experience and premium character. It's also the most popular compact car you can buy in Sweden. Not only does it have excellent fuel economy, it's also spacious and comfortable to drive, particularly for a small car. Unlike BMW's M division, Toyota's Hilux does not produce any versions of the Hilux sedan"
25," Ford Canada because it is accompanied by a Ford hardtop, F-150 pickup truck and a Ford hybrid pickup truck with a 12-volt electric motor. However, the Super Duty model will be something completely different, he said.

""It's much more associated with the city riders who might be going to work, actually into work, things like that. That's a larger vehicle, it's heavier, it features more technologies and features than the standard model. So we think it will have a much larger market share. We're excited about that,"" he said.

And the customers that will come to buy a Super Duty aren't just people who drive them for everyday city activities.

""It's hard to do drop-offs, it's very hard to do pick-ups, it's very hard to do deliveries, it's a very big vehicle. It features many technology features that will appeal to all sorts of customers,"" he said.

Ford Canada continues to expand its offerings with a number of new models launched this year, including an all-new Ford Focus and the nameplates have been re-launched with the addition of a Mazda Miata, Cortina and a Ford Explorer.

Also, Honda has introduced much of its new group of fuel-efficient, fuel-air hybrid vehicles: the Honda Accord Hybrid, the Honda Civic Hybrid, the Honda CR-V Hybrid, the Nissan Leaf Hybrid, the Toyota Prius Plug-In and the"
26," Volvo Cars before they went public. It wants to establish itself as a global sports car brand.

Instead of Cadillac, the company has already unveiled a car that's about to enter production for their mission – the CTS Coupe.

""The coupe is the next step in the CTS family. It is a big step forward in the evolution of the sporty CTS motor sports coupe from SCCA to the brand new CTS Coupe, which will be launched in 2016,"" CEO of VW AG Karl Drollinger said.

The CTS Coupe will start at around £46,700 (US$59,000) and then rise in price as it goes. As you can see by the price, the CTS is so good at sports car, it's not even that good in this respect. And, let's not forget, there are BMWs that are much more expensive.

If people think about the engines, the power is, again, BMW. The engine is the same, but it's done on a different platform. The CTS is the engine that powers the 2 Series, so it's next-generation, as BMW is next to the next generation 2 Series.

The CTS Coupe will be on the road first in 2017 and then it will be on the road in 2018.

""The CTS Coupe is a far cry from the SCCA concept, and the CTS"
27," Ferrari in that it has become very good at making big cars and having those models come into production.

The Melbourne car is one of three Toro Rosso cars to be built in the future. The other two are Front Wing and the The Daytona.

It's understood the Melbourne dinner will be chaired by junior principal Mark Webber and includes representatives from A-Team and McLaren.

McLaren wants to continue with the team for at least two more years.

Webber succeeded Peter Sauber as principal of Toro Rosso, bringing in a number of former team leaders as the team prepares to return to Formula 1 racing with its No. 80 car for the first time since 1999.<|endoftext|>President Donald Trump has chosen Rep. Ryan Zinke (R-MT) to lead the Interior Department.

The Department of the Interior announced the decision to appoint Zinke, who served as Southern Montana's top congressman from 2011 to 2014, after Zinke's public statements that he would be a tough on crime advocate.

SPONSORED

""I am honored to be a part of the Trump administration,"" Zinke said in a statement. ""This administration is focused on protecting America's natural resources and protecting our environment. That will translate to building a smarter, stronger, stronger country and, ultimately, a country that works for everyone.""

The Tennessee native has said he would take a hard line on crime, testing the legal boundaries of what is constitutional in a move that"
28," Aston Martin and Jaguar for its distinctive styling, which the company has seen be copied by other car companies. The new A-Type is due out around 2018.

Related: Bentley unveils stunning new concept car

The A-Type first rolled off the production line at the end of May following almost 15 years of development. Its initial counterpart, the Golf R, was briefly offered with a 7-speed manual transmission before it was replaced by an automatic manual gearbox.

Other carmakers have tried the automatic transmission concept, including Mercedes-Benz, BMW, Porsche and Ford.

Auto segments have enjoyed steady growth in recent years. The luxury car segment, which is dwarfed by the luxury SUV category, still represents a significant portion of the market, according to industry research firm Kelley Blue Book.

This is not the first time Volkswagen has tried to put its cars on a platform developed by Mercedes-Benz. VW launched the Polo RS in 2015 to model after the German automaker's T6 SUV, but was turned down by Mercedes-Benz, which said it would not fit into the carmaker's model and would only appeal to ""racy consumers using the same platform.""

Airbags, shock absorbers and brake pads are vital to safety manufacturing, as well as airbags for the front seats, all of which need to be safe in some way. Weighing 4,000 pounds and boasting a dry weight of around 3,000 pounds, the"
29," Mercedes-Benz or BMW which share the same architecture and engineering, but they are not ballistic, and have the capability to deliver levels of momentum that date back to the mid-1990s. The introduction of the C-Class space shuttle is one reason why there is such a high expectation of the C-Class and what it means for the future of travel.

Mercedes is also expected to add a new model to the C-Class lineup of concepts, but once the Japanese car company doesn't decide on which one to release, we'll have a better idea of which one that will appear.

This article was originally published on InsideEVs and is republished here with permission.<|endoftext|>Google Translate ""I'm going to go to a movie tonight."" ""Where do I go with the movie?"" ""Who's there?"" ""Who's that guy with the hat?""

The above are just a few examples in Russian, English, French and Swedish, but they are just a few examples that are used almost everywhere in the world, and they are all part of words that are used in Russian. Some examples of words that are often used in Russian include:

каланомения [ раганатия ] Common sense : to obviously have a suitable set of words and phrases

백크화서 [ 발비�"
30," Ferrari, Volkswagen and Lamborghini, but its designs are not quite as refined.

The rivals are all based on the same basic platform, but with slightly different exterior design elements. Four-wheel drive on the M4 is plentiful, but it's equipped with dual front and rear seats that resemble a plastic two-in-one driving position. The top of the car is jutting from a white roof, and it has rear-view high-definition cameras that can identify passengers, nearby people and even passing motorists at a distance. The ""Le Mans"" branding overlaps the door sill with the bumper, which acts as a ""doorstop,"" also hiding the passenger's seat.

You'll find different textures on the car's trunk, which serves as the company's outdoor storage space and also serves as the company's promotional event space. While the car's interior is designed as workmen's comfort, the interior is also designed as a sign of the people on the team. The seats are hard plastic, and the seats are adjustable for arm and leg length, but it is important to note that the seats are extremely small, made for people who are too short to fit inside. The six-pointed star is located on the center console, along with the company's logo. On top of the dash, sitting inside, there are two wide steering wheel mounted, plastic pedals with textured rubber control surfaces.

On the tail section of the car, there is"
31," Mercedes in terms of structure, but it has been doing a few exclusive projects that are focused on a more global market to compete with Audi, Ferrari and all the others. In the short term, Audi has a strong argument that they are the only brand in the world capable of making an attractive and effective building product. For BMW, it is more complex, with more than one model line and designs to cater to each country, but as of now it has no direct competitor in its segment. BMW is definitely less global, but will still continue as a major player.<|endoftext|>Image: An image from the PIHKALERIA (Pharmacological Investigation of Thrombospondylitis with Extrahepatic Burden) study (not the device).
Image: We have also attached a PDF file of the PIHKALERIA study's abstract. (Click to download the full version, which is 7.8MB.)
Manuscript preparation and study protocol, c-mar.
Abstract of the current PIHKALERIA study:
Patients with thrombospondylitis have been shown to be more aggressive than controls, more certain to die before the condition gets worse, and therefore based more on disease-related expectations than designed objective outcomes. There is a need to improve difficult patient outcomes before they become unacceptable and to identify patterns of thrombospondylitis by which specific expectations can be modified. In this study, we examined the efficacy of a"
32," Subaru and they are a vital part of the market.

""This industry has taken off despite trying the industry difficult times. We would have to look at the entire industry"" Mike Moll says.

The numbers below show premiums paid by an Australian driver in 2015.

* The estimated average doing the calculation.

Source: RACTA data

Top

Mullallyoning's research points to many reasons why consumer purchasing decisions may be shifting.

There is also evidence the industry is starting to look at some of its costs so it is not necessary to make recommendations off the top of their heads.

There are also issues around the degree to which drivers should carry their insurance.

""The industry has got to get back on its feet as they are not gaining any ground in their 'Go to Watch' game as far as insurer made sure they're not paying it at all,"" Moll says.

The government has faced questions about its likely role in the industry since NBN Co took over the project and has taken steps to reduce the risk.

But Moll says the industry may soon be facing new issues.

""We've got one of the largest car manufacturers out there. We don't have a lot of focus on food and drink,"" he says.

""So the industry, particularly in terms of the cost of car insurance, literally goes up and down. There's authorisations for modelling and there's"
33," Audi's E-tron, Vauxhall's C-class and Fiat Chrysler's Fiat 500X models. The electric car rears its head in the 2015 model year, with the system being featured in the 2015 BMW i8 and Audi A3. The automaker is also helping to develop electric vehicles.

The news comes as Audi has released a new smartphone app for the brand's Audi Weltmeister car park. It will let users register the new car for free, which in turn will give a discount to members of Audi's Audi Club. Also, members can unlock the car on their own without paying, as well as take advantage of the company's 100 percent guarantee for free Audi products and services.

Attention to battery storage

Audi's plant in Oxnard, California, has been upgraded with new 4,000 kW (6,500 hp) battery storage. The Audi Group is investing more than $360 million to upgrade its suppliers of the technology, which makes it easier for manufacturers to improve battery technology.

Audi's top driver Sebastien Buemi has stressed to the press that the AWD system is ""difficult to abuse"".

It has been recently reported that whether or not fully electric cars will be commercially available by the end of next year, more models will be introduced from Audi, ranging from the luxurious sports coupe models to the premium SUVs.

Source: Automotive News<|endoftext|>On the 3rd of"
34," Mercedes-Benz, which has a car brand called ""Mitsubishi"" for its vehicles. Neither brand is known for producing cars that can run low on fuel.


The Japanese company announced a ""Fuel Cell"" concept that will be formally unveiled in the U.S. at next year's Consumer Electronics Show.


The commercial vehicle in question will be a 278-feet long sales-oriented vehicle, a concept that the company calls TSX-V.


TSX-V has been under development since 2008 and is currently scheduled to be delivered commercially in late 2017 or early 2018.


There are currently two different pricing plans: For an initial $50,000 deposit on the car, Mitsubishi will offer a 98-percent sales-oriented vehicle and the highly anticipated $70,000 'Fuel Cell.' Enthusiasts are encouraged to show their support for the brand by ordering products from the TSX-V website for just $150.


The company says that the financial benefits of its efforts are expected to help boost overall consumer tastes.

In September 2011, Mitsubishi announced plans to produce a fuel cell to compete against high-end cars like Tesla's Model S.<|endoftext|>G Itenwood, I'm surprised you haven't asked this already. There is a very high probability that the majority of all surviving long-term survivors, people with the current version of both classic and modern viruses, will not collect their ancestral virus CERS"
35," Peugeot's CCV series. While CCV cars are more long-lived compared to single-purpose vehicles and offer more power, Qadri is probably the best selling CCV.

The brand recently launched three new CCVs, with this one the most lauded. Known for its long-lasting engines, the CCV is available with an active exhaust system, which can raise the power to 650 horsepower. The engine is powered by a 2-Series TDI that has an extra gearbox that can also boost the torque of the engine. The other two models are powered by the same 2-Series TDI, but it can provide an additional 900 hp and 1500 lb-ft of torque.

The CCV is expected to hit stores in the second half of 2015.

Source: diesellife.com

Read More: CCV Regeneration (Chevroletbase V-6)<|endoftext|>Still loading...

A B C D E F G H I J K L M N O P Q R S T U V W X Y Z 1 u/Garcia amigoBarts TKAnimals jay07 collectingCCG intellibrativeMizzr Pockets in forms of his own 2 Name Date PTS Info 5U 1.0 WOW Flash 812 175-174 9/25/2017 0.4.1/3.0/3.3/3.7/3.8/3.9"
36," Tesla, which offers a range of cars equipped with electric motors for a reasonable price.

The first of the Tesla Model S sedans is set to be released on April 25, and there are plans to make the Model X, a much bigger sedan combining the Tesla Model S and Model X P85D.

But it looks like Tesla will not release any of the Model X owners' skill sets, according to an e-mail sent to a representative for the company.

""We don't have any Model X buyers from Tesla, they are all very different,"" the email read.

But it remains unclear what the update will mean for customers who have bought the new cars, which make up the bulk of the Tesla's sales and are likely to attract more look-alikes.

Tesla has already been given European customer approval for one of the cars, the Model S Energi, whereas it still hasn't been given approval for the Ezo.

Subscribe to our newsletter<|endoftext|>A feminist dedication to equality in the workplace, feminism can be divisive and very divisive. But if, like me, you're struggling with a mixed partner, then even hardline feminists will benefit from the idea of equality between men and women.

So, to begin, let me state the obvious – men and women are different. I can't stress this enough.

For other people to be attracted to you, you have to be attractive and cool some people can"
37," the Tata group, which owns Tata Motors, Renault and Nissan, in India but also has right-fielders Pastore and Fiala. It is said to have a $20 million budget to develop its own car.

GM has said it will not invest in its own vehicle operations.<|endoftext|>We have the Deep Space Network around the world. By the way, a number of these things are called high-capacity memory cards, and the technology is called direct memory access (DMA).

In the current version of Linux, the bit-corrected memory (DMA) controller is now also called direct memory access (DMA-PD). DMA-PD is generally designed for a physical card (memory card). It is not designed for wireless technology or for distributed storage, although it can be used with both, according to the specifications.

Also, DMA is a kind of transfer function (that means that there is the possibility to change the instructions using the bit-corrected bit-rotating mechanism).

In Linux, DMA can also be used to consume a large number of bytes and to transfer large amounts of data.

Both of these are some of the benefits of DMA, but one, which any Linux user should really be aware of, is that it is implemented in an ""Open Source"" way.

This article was originally published by nps, an excellent information resource about e-learning and DMA, and originally"
