38," Ford and since the high price of diesel, it is losing face.

But the Nihonkei reports that Toyota is working on generating electricity from its own rooftop wind power and is taking note of the cars' towing capabilities.

To be sure, Toyota's loss of market share is a concern, but it will ultimately be an economic problem. Because Toyota, like Honda, will have to buy at least half of its fuel-efficient cars (both fuel cars and hybrids) from new competitors.

Toyota's Toyota Prius pickup truck.

In other news, a report from Forbes last week indicates that the even better-selling Prius electric vehicle will soon go on sale.

And Axiom Research, Axiom's research and development firm, is promoting the behemoth Saturn Nova.

UPDATE (Feb. 21, 4:52 p.m. EST): The Toyota pickup is now advertised for $32,500.<|endoftext|>Unless you're already well used to traditional small business models, this strategy doesn't seem like a foolproof strategy. As long as you're using the traditional method of transportation, it'll work, sure, but it's never a simple matter to get your freelance work done or keep your books in good shape. After all, you have to prioritize your time and keep track of your things, right?

I know what you're thinking: ""Absolutely, but how do I do that? Or are there any"
39," BMW's X5 hatchback and produces nearly as many models as all the other manufacturers combined. But despite its production, BMW, which makes more than 14 percent of the world's vehicles, is the largest auto brand in terms of market share.

Can you see the big picture? The BMW brand is a complex family of cars, and a good portion of them are created by factory localizers and suppliers. The company raises money globally through sales and marketing, and those sorts of reports could be just as important as the actual sales of the car.

The brand is supported by BMW itself, a private wealth fund run by its longtime chairman, Oliver Blume. Blume will often be seen racing on Concours d'Elegance for the US BMW Motorrad dealer network, and he's a big BMW fan.

That doesn't mean BMW and Blume don't have individual responsibilities as a business. BMW's chief executive, Harald Krueger, is one of the most successful family men in one of the most successful manufacturing companies in the world. In 2012, the company announced that he was leaving to take on a prominent role in the U.S. Jewish community. He will join Sunoco Logistics Partnership, a major retail chain based in New York City.

Pricing and availability of the cars and their parts remain wildly complex. The cars are often of the same diameter, and many of them have a rear-wheel-drive configuration."
40," Ignite, but now with a few more obvious upgrades and a premium look.

MORE:

Read today's exclusive interview with Koenigsegg's Ferdinand Piech, which goes behind the scenes to figure out what exactly makes it tick.<|endoftext|>A State Department official said Saturday that President Obama's call to a Chinese official with Beijing's approval to stop cyberattacks against domestic targets was not a ""red line"" that would trigger China to intervene.

""I can't speak to that because I can't speak for the president, but I don't think it is a red line,"" State Department spokesman John Kirby told reporters during a press briefing on Friday. ""I think President Obama made the point that he was committed to working towards that sense of cybersecurity understanding.""

The letter signed by Obama to Chinese President Xi Jinping on Saturday morning was, he said, ""a normal agreement to work towards that new understanding between the two countries, that there were no rules or red lines.""

In his meeting with Xi on Friday, Obama said the United States would ""be prepared to vigorously defend the sovereignty, territorial integrity and independence of our two states, and we would oppose any attempts by any nation to undermine the overall ability of the other to conduct its own affairs,"" according to an NBC News report. A State Department official did not say whether that meant China was included in that discussion.

""You know, we've always said that cyberattacks are an unacceptable threat,"" Obama"
41," Audi, but is not part of the Volkswagen group.<|endoftext|>For a related article, see Marriage

Marriage is a widespread phenomenon. It has, in fact, become a religion in some parts of the world.

Contents show]

Medievalists

The best-known medievalist in the Americas was Frater Nicolaus of Cana, who regarded marriage as the highest form of love. [1] The writings of Frater Nicolaus of Cana and writings of other Renaissance philosophers regarding marriage and family life are also considered sources of the theology of marriage and family life.

In Europe divorce was often considered harmful to the family. In short, the Catholic Church felt that divorce and remarriage were bad for marriage. Blessed (aka Edward the Confessor) was forced to reform Catholicism so that it would take care of its children.

In the close of the 17th century, the Catholic Church started to transform itself. The Holy Spirit took the initiative to transform the Church's teachings and practice, but at the same time the Church changed from a faith to a culture. The result was a new way of living that gave the Church a practical reason for moving away from its old ways.

The Catholic Church in its efforts to convert the Church away from its old structures, such as institutions for teaching, literature, and the like, brought across the idea of marriage to the continent. The Roman Catholic Church, however, rejected marriage.

Some"
42," that of Mercedes Benz, Audi, and BMW. The company had to offer cars in the $40,000 range, but is now offering them for as little as $29,800.

Toyota already has a huge presence in the coming weekend — its new Camry sedan is already getting a few Autoblog Firecracker reviews. Last year the automaker launched GT-R.<|endoftext|>The owner of a Florida man who was involved in a crash earlier this month in which he was killed has been charged with manslaughter after police say his passenger was ready to jump out of the car.

Shields County Attorney Jason Cavanaugh said 53-year-old Michael Totten was sitting in the backseat of a 2007 Toyota Corolla with 20-year-old Terence Mackenzie inside when Totten slid into the middle turn lane.

SPONSORED

The wreck happened about 5:45 a.m. local time on the island of Kauai, Kauai County Sheriff's Office Lt. Tim Beck said.

Beck said Totten's passenger, Kenneth Cole, 26, had jumped out of the car into the intersection of Sunshine Highway and Highway 5 in the neighborhood of Placer County.

""They both got out and Ketchup poured out of the bottle and came flying up through the air,"" Beck said.

Police said Cole had been drinking vodka when he jumped out of the car, which was coming out of a turn and heading to the wrong side"
43," Mercedes-Benz. The problem is that Mercedes-Benz has already brought in Mercedes-Benz AMG car to replace its W05, the brand's new sports sedan.

This sporty car is far bigger than the W05. The car is 26 meters long, 32 meters wide, and 17 meters tall, making it too big for the mere spectator to ride. Even though the car is not meant for the townie, it has strong doors and wide windows. The car has a hyperdrive that enables it to reach speeds of up to 120 kilometers per hour.

So who would choose the W05? Well, it is still very cheap but the price is usually expensive if you want it. The price of the car is around 400,000 won – more than a smartphone. The car has two-wheeled capability and is only available in black.

This new supercar is an acquisition of Mercedes-Benz. But the company has been struggling with its market share in the market for luxury cars, especially Mercedes-Benz. According to Techwire, according to a Bloomberg report, the regional market for Mercedes-Benz surpassed 1 million in 2014, bringing it back to a top of 9.3 million. It is not just Mercedes-Benz that is suffering from declining popularity and market share in the luxury car market.

According to Bloomberg, the autonomous cars are now better than the average driver in terms of speed, and are taking their toll on safety.

"
44," the McLaren McLaren MP4-12C-P. You can see relatively clean lines with no crumple zones. The car looks to have incredibly clean lines, and I personally think the car looks pretty good with the power, and that's why I felt that it was on par with a car like the Toyota Celica V6-Verde. The car looks good in the heat, and I don't think it gets too hot. Likewise, the car feels quite stable in the braking state.

In the rear I am looking at a similar car to the Golf GTI. I think that the GTI is a little better tuned to be better facing down. I think that the car also has a bit more power under the hood, but I'm not sure how much. If I can't see the power difference, I think that the car is quite similar. The only time I can say that the GTI is better placed is in edge grip, because when compared with the Golf, the GTI has more bite. I think that the GTI's overall grip is reaching a certain level.

More On This: All 2014 BMW M3

On a side note I also noticed that, even though the Jetta I saw had the same powertrain as the car I drove with, the stock-spec car comes with the trading-car suspension layout, which I think is very positive. I'm not saying that the all-parallel all-wheel-"
45," Mercedes-Benz (20.3%) and BMW (20%) but is now the most widely used brand among mid-sized and small businesses.

By 2017, this trend is forecast to continue with the Jeep brands accounting for nearly three-quarters of all sales and the BMW brand extra popular among large enterprises.

Andreessen Horowitz CEO David Sacks said yet another way that car brands will continue to grow in the future has to do with demographic changes.

""Constant changes, particularly in the workforce, have consequences for how the firms that we engage with operate, and how they can serve consumers,"" he said. ""In the future, even as the US economy recovers, Europe also faces its own challenges with mass unemployment and increasing consumer spending. It's going to be important for car brands to recognize that these conditions will be hard to overcome.""

Write to Benjamin I. Friedman at benjamin.friedman@wsj.com<|endoftext|>Well this is an interesting story!

I guess that a lot of people realize Kendo rules were introduced with the Cabuyin wushu 2, but in reality, they were actually invented in the 90's by the Japanese in order to maximize train speeds and to expand their popularity. According to http://www.japan_tachi.com/cabuyin.htm, which is a website devoted to the history of Alabaster, most Alabaster wushu players still consider these rules highly"
46," Honda's compact Civic and Hyundai's Sling, though it has a more powerful engine, and a smaller grille.

Powertrain and styling

With the D-Cruise fitted with a bigger, more powerful 6.4-litre V8 engine, it can reach 60km/h faster than its predecessors, and hit a top speed of 160km/h.

It also comes with a larger range of luxury amenities, including eco-drive and cargo-reserve technology.

Advanced technology and performance

Check out a video of the D-Cruise in action.

Image 2 of 9 Image 2 of 9

The car uses Hyundai's popular Intelligent Drive system to aid dynamic manoeuvring and reduced energy consumption.

Hyundai says the D-Cruise can accelerate from 0-100km/h in 3.5 seconds, which is similar to the top-end Honda Accord sedan.

The D-Cruise will be available from April this year in three different colours: gold, blue and red.

The car has a range of 135 kilometres, and, although there's no official announcement yet, we expect it to be available in at least 8 further countries in 2019.

Image 3 of 9 Image 3 of 9

The model starts at $146,500 (£105,000) and it's set to be available on the market from mid to late 2019.

Specifications

Engine"
47," Toyota's Infiniti, which was launched in 2007. The company has also noted that the Nissan Leaf has sold 500,000 units of vehicles since it's debut in June 2013, making it the second-biggest electric vehicle brand in the world after Tesla.

Tesla beat out Toyota, Ford, and General Motors with a' $7.2 billion investment in the brand last September. Tesla is No. 2 behind Porsche in EVs sales in North America and about 90% ahead of Chevy Volt.

Abundant data thanks to iSuppli, another US car-market intelligence company, shows that Americans purchase electric cars at a rate of 12.5 new electric cars per 100,000 people per year, compared to 6.4 electric cars per 100,000 people per year in the US. The US market produces a total of 3.4 million cars, compared to 1.3 million EVs in Europe.

That hasn't stopped BMW, which claims that it has sold over 6 million electric cars in the US since it launched its new model in 2012.

Meanwhile, the large-scale production of battery packs for the EVs is expected to further boost demand for electric cars. In September, the utility company PerkinElmer said it would be hearing from interested buyers in California this year. It said it wanted to see good deployment of fast-charging infrastructure for its electric vehicles, driving down prices.

Automakers are also looking to their electric vehicles'"
48," the Porsche Carrera, but the upgraded version will come with a powerful engine and will be around 900 hp.

The brand is selling an 800 hp version of the 919 Spyder which is about half the size of the current model. This car goes on sale in Japan on August 14.<|endoftext|>(CNN) The video shows an officer shooting a white man with a taser in the back, splattering blood across a campus campus in Minneapolis.

The video, posted to YouTube , captures different angles of the shooting and the officer's response. A police officer is heard screaming: ""You got to be kidding me.""

'A gun in the hand'

The officer pulls out a gun and points it at the man.

After the individual is arrested, the officer says he would like to talk to the defendant, but is interrupted by a phone call from the gunman.

The first 911 call comes in around 10:15 a.m. from Alex Tavis, telling dispatchers that he's shot. He tells dispatchers that he was shot and is deceased.

Then, a cellphone rings at 9:31:30 a.m. -- the exact time the video shows the suspect being arrested.

The officer then points the gun at the suspect's head.

""I got the gun in the hand now YOU have to calm down and back off,"" the officer says, according to the image on YouTube.
"
49," Volkswagen and Audi in some ways but it's grossing over $1 billion in monthly sales.

Historically, only Supercars have been considered as an option for the models on the list. It's been around for years in the nascent categories but was a decade ago canceled in favor of a much smaller series of models.

But through a seed funding effort, it's set to be one of the first car brands to become available in the U.S. The company plans to launch its next car this summer.

Here's what else to know about the Supercars 3:

What is the Supercars 3?

The Supercars 3 is the third generation of the Supercar series, but after the WRX, it's the last before the company moves on to the brand's flagship sedan, the RSV4.

The car will be available in two models — the Supercar 400 and the Supercar 400 S.

The Supercars 3 isn't limited to the roads — you can take it camping in many of its permutations with three lock-down parking spots, as well as a tech center that houses its latest electronics and a log cabin that houses its supercharging station.

It will be available in two models — the Supercar 400 and the Supercar 400 S.

Who is building the Supercars 3?

Engineered by Range Rover (RV), the Supercars 3 will likely be the first of"
50," the company previously known as Toyota, which bought the designer classic brand in 2006. The device is expected to go on sale this year.<|endoftext|>Defense Minister Sergei Shoigu arrives at the arrival hall of the Moscow airport in Moscow, Russia, Monday, Feb. 9, 2016. Shoigu announced that Russia began a new arms control program aimed at countering the proliferation of weapons of mass destruction. (AP Photo/Sergei Karpukhin) The Associated Press

MOSCOW (AP) — Defense Minister Sergei Shoigu has ordered new weapons and new training in response to the production of weapons that could be used in Syria, Iran and North Korea, the Russian newspaper Izvestia reported Sunday, citing the Defense Ministry.

Gen. Igor Konashenkov, head of the Russian General Staff and deputy chief of staff for the general staff said Russia will build up a new material system, providing training in adapting the new systems to the nation's requirements. He said the new system will be developed by the People's Emergency Service (RIA-Novosti) and the Russian Defense Academy.

The smaller-scale training will be aimed at reducing the number of Russian servicemen who die or take ill, Konashenkov said.

Russia began a long-running arms control program aimed at countering the proliferation of weapons of mass destruction. The advantages of preventing the proliferation of weapons of mass destruction, though, include the Islamic State's striking brutality,"
51," Ford's recently introduced F-series lineup. As of now only the CT6 is available.

The key difference sharing its pricing with the Ford Fiesta is the active rear spoiler like in the Fiesta. The Fiesta puts a larger rear spoiler in the CT6. This on top of the narrow front axle so it can generate faster top speeds. This setup is capable of taking the car to a maximum speed of nearly 220 km per hour.

The Cupertino automaker does a great job of making sure our driver does not lose sight of the road too easily. The exterior styling should be similar to the redesigned RAV4 and the cabin looks great on any road. The cheerful tail lights are a great addition and are a bright addition while giving the car a modern look.

The rear seat in the CT6 is quite comfortable and makes the car seem small. The seats are comfortable and the cupholder makes the seating position very comfortable. The seat height is small with a 7 inch upper front seat. The driver sits in the rear of the car. The seat angle goes from right to left with the back up to about 70 degrees. A combination of headroom and ankle room are a must. The head restraint is very comfortable on even the driest ruts. The driver has a nearly roomy cockpit. The steering wheel is the same and also similar to the Fiesta. The steering wheel can be adjusted a bit; depending on the driver's driving style. The radio has"
52," its younger brother, Mazda, and attracted several customers after the company released a lot of trim levels in 2013. In 2014, the company rolled out the 730 SUV, priced at $25,000. The premium set with the sporty model was not exclusive to Mazda. It's also sold in several other countries, including parts dealer stores, malls, and even some parts suppliers.

""Autopilot is a technical capability that we're still working on,"" said Vicente Conde, spokesman for the automaker. ""At this point, we're focused on developing our vehicle's software to improve safety, provide better controls and performance.""

There are immediately practical limitations of Autopilot. It may not prevent the automatic transmission from regularly shifting gears, for example. And it can't be used to override road signs, much less prevent a driver from driving into the path of another vehicle, in other words, something that has been the subject of intense controversy.

The feature was introduced in 2014; companies like Tesla now offer their own self-driving cars as a part of their Tesla Roadster.

For those of us that have a little more experience with cars, the present situation is interesting. People can sit in front of their computers sitting in the shade, hearing the rain, passing by, watching traffic. The risk is small. But people's enjoyment of a car is what matters.<|endoftext|>SANTA CLARA, Calif. -- Those knocking Bill Belichick's offensive"
53," their best-selling sports cars, the Porsche Cayenne and Cayenne Turbo, and now comes with a 9-inch hard-top that looks like a pair of sunglasses. The interior is a tranquil mix of leather and die-cast metal. The seats are comfortable, and the panoramic glass also gives a sense of scale. After multiple owners, we settled on the Sebring II, a compact that isn't quite the same as the Cayenne. It comes only in a sporty color, but it does fit the Sebring name — it was designed to be a stickler for technical details and to cook a meal in a way that's not top-of-the-line.

Advertisement - Continue Reading Below

The Sebring II Sport Package comes with a 9.3-inch screen, an electric-stereo-equipped stereo, and an 8.7-inch screen. There are four seats in this package for the driver, one rear seat and two front seats. The vehicle is produced in China, and is supposed to be available this fall.

We've been through a few variations of the luxury car scene, but few have captured the real essence of luxury like the Sebring. This car connects to that market through the luxury brand's sporty, modern design. The Sebring II is the finest example of the BMW's latest class of Mercedes-Benz cars. It's every bit as engineering-heavy as the current incarnation but more subtle and"
54," BMW, which operates in several countries.

""At the moment we want to focus on technical development, publicity and brand presentation, but we want to build a brand for our customers who have a lot of passion for cars,"" Gottfried told the news agency DPA.

""In the future, we will also focus more on customer Service and Targeted Media.""

In a statement, Deutsche Telekom said: ""It is a very difficult choice, since BMW is just one new car series and I have to choose between two built by different manufacturers.

""Fiat is obviously more expensive than BMW. On the other hand, one might argue that BMW is the higher-priced model and the Ford Focus S with all the fun features is cheaper.""

In its announcement, the brand said: ""The production car series in which we will be racing is based on the innovative movement of the M model from 1987.""

The German carmakers are expected to be racing two new models in the US and Europe, the TT.DAMAG and M3 S.

This would have to be the first time in more than two decades that BMW has raced in a car series, although after a few successful campaigns, it is practically required to take pilots for any potential series.

The TT.DAMAG entered the US in the DTM in 1996, while the M3 S entered the US in 1999.

BMW has not yet"
55," Ford's F-150 pickup truck, with a red grille, black and gold chrome interior, and a folding rear seat.

""For us, all of our cars, they're just about having curves, being lightweight, and protecting the vehicle,"" said Sam Conrad, GM's chief marketing officer for the Camaro. ""That's just the foundation of the Camaro.""<|endoftext|>A New York State court has ruled that a 17-year-old girl who claimed to be from a Muslim school won't have to face felony charges for posting a photo of herself with the Islamic flag on her roommate's Facebook page.

She was convicted of possessing a flag for destruction and sentenced to three years in prison, according to DNAInfo.com.

As the New York Post revealed years ago, however, the girl's story had been embellished. She claimed that she was a student at a Muslim school, but since she was only 14 years old, she could not be charged with possession of a flag for destruction without showing her ID.

Now, the girl has filed a federal lawsuit against the school, which teaches Islamic curricula and has its own Facebook page that distributed the photo to students.

The hateful comments on the page in question, which was apparently made by the roommate of the girl, have been downvoted thousands of times and mostly serve to spur anger and frustration.

The Good News Foundation reported: ""The photos are among the most disturbing that"
56," German Mercedes-Benz, and its cars are estimated to be worth around £130m, while Mercedes-Benz also owns a 50% stake in Audi.

But the future of the Audi brand might not come so easily.

Herbert provided an in-depth analysis of the ads posted on social media by his colleague, who called the brand ""a sick joke"".

The Mercedes-Benz ads feature ""Nazi-like"" characters, including a housewife, a Christian pastor and a sexual seductress, Herbert said.

He also said the ""sex fetish"" ad also featured a female character on the back of a truck.

IBTimesUK has contacted Mercedes-Benz for comment.

Overall, the ads could be regarded as a ""gross insult"", according to Herbert.

As a result, the company is considering a legal intervention against the ad, according to a statement by Herbert on the company's website.

""Audi would like to assure its customers that the ad shown here does not glorify physical violence or violence against women that is harmful to their emotional well-being, based on a thorough review of the material by a team of experienced legal experts.""

This week, 14 of the 20 cars in the Mercedes-Benz range were temporarily banned from sale after being targeted in the ad.

The ads were found to include cartoon violence ahead of the Frankfurt auto show.

Pau Arabia

A report by"
