22," the Honda Accord, but with a few notable differences.

The sedan's front fascia is slightly larger than the coupe's, and the rear fenders are slightly longer. Both vehicles are available in the S model and the Wrangler.

For 2017, the Wrangler continues to be the most popular model in the Wrangler lineup, while the S model is the most popular model in the Wrangler lineup. The Wrangler's popularity among the Wrangler's buyers is a result of its compact, sporty styling and the fact that it is the only model that can be paired with a four-wheel-drive system.

The 2017 Jeep Wrangler has been available in the U.S. since 2012, and it is expected to be available in the U.S. in 2017.

In addition to the Wrangler, the 2017 Jeep Wrangler has been offered in the following models:

Jaguar F-Sport:

The 2017 Jeep Wrangler will be available in the U.S. starting in 2017.

The 2017 Jeep Wrangler F-Sport is a sporty, all-wheel-drive SUV that is designed to be a crossover between the Jeep Grand Cherokee and the Jeep Renegade.

The 2017 Jeep Wrangler F-Sport will be available with five-spoke alloy wheels and a V6 engine.

The 2017 Jeep Wrangler F-Sport will be available with a five-spoke alloy"," Volkswagen, but it has been making a few changes to its lineup to appeal to younger buyers. Subaru is now offering a new 4Runner model, the WRX STI, which will be available in the U.S. for the first time. Subaru said the new WRX STI will be offered in both the standard and advanced versions of the STI.

The WRX STI will be the first 4Runner to feature a dual-motor transmission, which is a bit unusual for Subaru. Subaru has only offered dual-motor transmissions on the Subaru Legacy and Impreza WRX models since the WRX STI debuted in 2009.

The WRX STI will be available in four trim levels: the base WRX STI, the Limited, the Premium and the Touring. The Limited model is available in the base WRX STI, the Premium model and the Touring model. The Limited will be available in Japan in November, while the Premium model will be available in the U.S. in late December.

The WRX STI will be available with a new front fascia design, and a new grille that is much slimmer and more rectangular than the current grille. The grille will also feature LED headlights, and a new rear spoiler.

The WRX STI will also be offered with a new 3.5-liter turbocharged engine that will produce 315 horsepower and 350 pound-feet of torque"," the Ford Focus, which has been around for decades. Dodge has sold more than a million Ford Focus cars since 2009, and it's also the company's most popular vehicle for the last decade.

The new Focus is expected to be the first all-electric car to hit the market. The company says it will be available in the U.S. in 2019.

The automaker says that the new Focus will be available in the U.S. from 2019.

In addition to the new Focus, Dodge is also working on the new Dodge Charger and the new Dodge Challenger.<|endoftext|>""The people of the United States need to know that the U.S. government is not above the law,"" he said in a statement. ""The U.S. government is not above the law and it will not tolerate any form of abuse of power or corruption.""<|endoftext|>The following is a guest post from Eric W. Pincus, a professor of economics at the University of California, Berkeley.

The latest recession has been a major distraction from the real economy. In the past few years, the financial sector has been a major driver of the U.S. economy. But now that the recession has ended, the financial sector is back in the news.

The financial sector has been the main driver of the U.S. economy since the Great Depression. In the early years, the financial sector was mostly made up of banks and investment banks, but"," VW in that it makes a number of electric vehicles, and uses the same technology to produce the vehicles.

The two companies are currently the world's largest carmakers.

But Tesla's capital spending on research and development has been growing at a faster rate than VW's.

A report by Bloomberg showed that the $1.2bn company's capital spending on research and development was up by $1.3bn in the first half of the year.

The company's research and development spending on electric vehicles is also up by $1.2bn.

The German carmaker said that it would spend $1.5bn on electric vehicles this year, up from $1bn in 2015.

It also said it would spend $1.4bn on research and development of the Model 3, which it expects to begin deliveries later this year.

Tesla has also announced plans to build a factory in Mexico to produce its electric cars there by 2020.

The company has also said it will invest $1bn in its Gigafactory, which will produce batteries for electric cars.<|endoftext|>Meet the new boss of the Houston Texans: Former NFL star and current CEO of the NFL's Houston Texans, Bob McNair, has been hired to be the next head coach of the team.

McNair will take over as the Texans' head coach on April 1st.

""Bob's a great addition to our football team and"," Apple in terms of its design, but the company's design is not as sophisticated as Apple's.

The company's design team is in charge of the car, but Toyota's are not.

The Toyota Camry's design is similar to Apple's, but the Toyota's design is not as sophisticated as Apple's.

Toyota's design team is in charge of the car, but Toyota's are not.

The Toyota Camry's design is similar to Apple's, but the Toyota's design is not as sophisticated as Apple's.

The Toyota Camry's design is similar to Apple's, but the Toyota's design is not as sophisticated as Apple's.

The Toyota Camry's design is similar to Apple's, but the Toyota's design is not as sophisticated as Apple's.

The Toyota Camry's design is similar to Apple's, but the Toyota's design is not as sophisticated as Apple's.

The Toyota Camry's design is similar to Apple's, but the Toyota's design is not as sophisticated as Apple's.

The Toyota Camry's design is similar to Apple's, but the Toyota's design is not as sophisticated as Apple's.

The Toyota Camry's design is similar to Apple's, but the Toyota's design is not as sophisticated as Apple's.

The Toyota Camry's design is similar to Apple's, but the Toyota's design is not as sophisticated as"," Volkswagen in that it is cheap, but it is also a bit more complicated, as it is a hybrid car. It uses a battery that is made of two lithium-ion cells and a lithium-polymer battery that is made of lithium-ion polymer. The lithium-ion polymer is a type of polymer that is not as cheap as the other types of polymer used in the car, but it is still useful.

The lithium-polymer battery is loaded with a lithium-ion battery compound that is made of lithium-ion metal and lithium-ion polymers. The lithium-ion polymer is used by the car to store energy from the solar cells, and the lithium-polymer battery is used for the electric motor.

The lithium-polymer battery is loaded with a lithium-ion battery compound that is made of lithium-ion metal and lithium-ion polymers. The lithium-ion polymer is used by the car to store energy from the solar cells, and the lithium-polymer battery is used for the electric motor. A battery is a type of chemical that has a chemical structure that is a combination of a chemical element and a metal.

A battery is a type of chemical that has a chemical structure that is a combination of a chemical element and a metal. A battery is a chemical that is made of a chemical element that is a combination of a metal and a chemical element.

A battery is made of a chemical element that is a chemical"," Hyundai, but it's more expensive.

Nissan's ""non-hybrid"" model, the i-MiEV, is a hybrid that uses hydrogen fuel cells to generate electricity, but it's not a hydrogen car.

The i-MiEV is a hybrid that uses hydrogen fuel cells to generate electricity, but it's not a hydrogen car.

The i-MiEV is a hybrid that uses hydrogen fuel cells to generate electricity, but it's not a hydrogen car.

The i-MiEV is a hybrid that uses hydrogen fuel cells to generate electricity, but it's not a hydrogen car.

The i-MiEV is a hybrid that uses hydrogen fuel cells to generate electricity, but it's not a hydrogen car.

The i-MiEV is a hybrid that uses hydrogen fuel cells to generate electricity, but it's not a hydrogen car.

The i-MiEV is a hybrid that uses hydrogen fuel cells to generate electricity, but it's not a hydrogen car.

The i-MiEV is a hybrid that uses hydrogen fuel cells to generate electricity, but it's not a hydrogen car.

The i-MiEV is a hybrid that uses hydrogen fuel cells to generate electricity, but it's not a hydrogen car.

The i-MiEV is a hybrid that uses hydrogen fuel cells to generate electricity, but it's not a hydrogen car.

The i-MiEV is a hybrid"," Volkswagen, but they don't share the same range of models.

The VW brand is currently the most popular car brand in the world, with sales reaching more than 5.5 million cars in 2015.

VW's share of the global market has increased from 2.2% in 2011 to 3.7% in 2015, according to the latest figures from the German carmaker.

The company is aiming to increase its share of the global market to 12.5% in 2020.

In the United States, sales of the VW brand dropped from 7.4 million cars in 2015 to 6.1 million in 2016.

The company is also working on a new model for 2017 called the Passat.

The new Passat will feature a more powerful engine and will be available in a range of different models.

The company said on Friday that sales of the Passat have increased by 15% in the past year, and that the company has ""the highest level of orders we've ever seen"".

It added that the company will deliver up to 1 million vehicles in 2017 and that it expects to sell over 1.2 million in 2018.

The company said that it expects to sell over 3 million vehicles in 2019 and that it expects to sell between 1.5 million and 1.7 million in 2020.

The company said that it expects to sell around 1 million vehicles in 2021 and that it expects to sell between 1."," Ford, with its Focus and Lincoln models.

The company has been facing criticism for its low-cost cars and for not catering to the fast-growing middle class.

The company has been criticised for its low-cost cars and for not catering to the fast-growing middle class.

A spokesman said the company was committed to creating jobs and improving the lives of British families.

He said: ""We're committed to building on the success of our cars and our commitment to the wider economy.

""We're investing in the next generation of cars, including the next generation of electric cars.

""We're investing in the next generation of cars, including the next generation of electric cars.

""We're investing in the next generation of cars, including the next generation of electric cars.

""We're investing in the next generation of cars, including the next generation of electric cars.

""We're investing in the next generation of cars, including the next generation of electric cars.

""We're investing in the next generation of cars, including the next generation of electric cars.

""We're investing in the next generation of cars, including the next generation of electric cars.

""We're investing in the next generation of cars, including the next generation of electric cars.

""We're investing in the next generation of cars, including the next generation of electric cars.

""We're investing"," Tesla in that it is not a traditional car maker. Rather it is a technology company that is building a car that is more like Tesla. What Mazda is doing is building a car that is more like Tesla and there is no doubt that it will be successful.

The company is also a car brand that has been around for a long time. It has been around since the 1950s. And it is one of the oldest car brands in the world. It is the brand that is widely known for its affordable cars.

So, how does the company make its cars? Mazda is a car brand that has been around for a long time. It has been around since the 1950s. And it is one of the oldest car brands in the world. It is the brand that is widely known for its affordable cars.

The company is also a car brand that has been around for a long time. It has been around since the 1950s. And it is one of the oldest car brands in the world. It is the brand that is widely known for its affordable cars.

The car brand is also a car brand that has been around for a long time. It has been around since the 1950s. And it is one of the oldest car brands in the world. It is the brand that is widely known for its affordable cars.

The car brand is also a car brand that has been around for a long time. It has been around since the 1950s"," Toyota, but it's also a little more limited than Toyota. It doesn't have as much power as the Toyota with its V6, but it has a lot of torque. It's more than enough to pull off a lot of tricks and it's got a lot of grip.

It's got an interesting design. It's got an interesting shape, a little bit of a curve to it. It's got a very short wheelbase, but it's got a very long wheelbase. It's got a very long wheelbase, but it's got a very short wheelbase. It's got a very long wheelbase, but it's got a very short wheelbase.

So it's got a very long wheelbase, but it's got a very short wheelbase. It's got a very long wheelbase, but it's got a very short wheelbase. It's got a very long wheelbase, but it's got a very short wheelbase. It's got a very long wheelbase, but it's got a very short wheelbase.

It's got a very long wheelbase, but it's got a very short wheelbase. It's got a very long wheelbase, but it's got a very short wheelbase. It's got a very long wheelbase, but it's got a very short wheelbase.

It's got a very long wheelbase, but it's got a very short wheelbase. It's"," the Volkswagen Group, which is also owned by Volkswagen Group.

Lamborghini's Carrera S is a sports car, but it has also been called the ""world's fastest car"".

The company has been under pressure to change its image after a series of scandal involving the use of banned performance-enhancing drugs in the sports cars.

The scandal has led to the resignation of the company's chairman and CEO Sergio Marchionne.

The company's stock was up 0.7% at €47.45 in afternoon trading on the Australian Stock Exchange.

The car brand has been embroiled in controversy in recent years, with several investigations into its performance-enhancing drug use.

In June, the US Justice Department charged former team boss Marco Mattiacci with conspiracy to commit securities fraud and conspiracy to commit wire fraud.

Mattiacci was also charged with money laundering and wire fraud.

In October, the German government announced it would be investigating whether the company knowingly supplied performance-enhancing drugs to team drivers.

The investigation has been led by the Federal Office for the Protection of the Constitution (BfV), the Federal Criminal Police Office (BKA), the German Federal Criminal Police Office (BKA), the Federal Office for the Investigation of Crimes against the Peace (BKA) and the Federal Criminal Police of the country of Germany (BKA).

Lamborghini is also under investigation in the United"," Tesla in that it is a small company with a very large market share. But it has been doing things differently in recent years, and it is now entering the private sector.

The company has been working on its own electric car, the E-Class, which is designed to compete with Tesla. The car is expected to go on sale in 2017.

The company has been working on a series of electric vehicles, including its own electric SUV, the E-Class, which is designed to compete with Tesla. The car is expected to go on sale in 2017.

The company has been working on its own electric car, the E-Class, which is designed to compete with Tesla.

Tesla Motors Inc. is the largest publicly traded electric vehicle maker in the United States, with sales of more than 2,400 vehicles in 2015.

Tesla has been working on an electric vehicle since 2012. The company has been working on an electric vehicle since 2012.

Tesla Motors Inc. has been working on an electric vehicle since 2012.

Tesla Motors Inc. has been working on an electric vehicle since 2012.

The company has been working on an electric vehicle since 2012.

The company has been working on an electric vehicle since 2012.

The company has been working on an electric vehicle since 2012.

The company has been working on an electric vehicle since 2012.

The company has been working on an electric vehicle since 2012."," the Toyota Prius, and the BMW i3 is similar to the Audi A3. Both cars are highly efficient, but the BMW i3 is more economical, and the Toyota Prius is more environmentally friendly. The BMW i3 is also more efficient than the Toyota Prius, and it is also more environmentally friendly than the Audi A3.

The BMW i3 is also more efficient than the Toyota Prius, and it is also more environmentally friendly than the Audi A3. The BMW i3 is also more efficient than the Toyota Prius, and it is also more environmentally friendly than the Audi A3. The BMW i3 is also more efficient than the Toyota Prius, and it is also more environmentally friendly than the Audi A3. The BMW i3 is also more efficient than the Toyota Prius, and it is also more environmentally friendly than the Audi A3. The BMW i3 is also more efficient than the Toyota Prius, and it is also more environmentally friendly than the Audi A3. The BMW i3 is also more efficient than the Toyota Prius, and it is also more environmentally friendly than the Audi A3. The BMW i3 is also more efficient than the Toyota Prius, and it is also more environmentally friendly than the Audi A3.

The BMW i3 is also more efficient than the Toyota Prius, and it is also more environmentally friendly than the Audi A3. The BMW i3 is also more efficient than the"," the Volkswagen brand, but the Ford GT is a much more refined and refined model of the Volkswagen Golf. The Ford GT is designed to be a luxury car, and it is intended to be the ultimate sports car. Ford is known for its high-performance cars, and the Ford GT is a high-performance sports car.

The Ford GT is manufactured at the Ford Assembly Plant in Mexico. The Ford GT is not only the most expensive sports car on the market, but it is also the most expensive sports car in the world. The Ford GT is also the most expensive sports car in the world.

The Ford GT is a four-door sports car with a 2.0-liter four-cylinder engine that produces 170 horsepower and 170 lb-ft of torque. The Ford GT is also equipped with a 6.2-liter V-6 engine that produces 235 horsepower and 245 lb-ft of torque. The Ford GT is equipped with a six-speed manual transmission.

The Ford GT is powered by the 4.0-liter V-8 engine that produces 235 horsepower and 245 lb-ft of torque. The Ford GT is powered by the 5.0-liter V-8 engine that produces 190 horsepower and 190 lb-ft of torque. The Ford GT is powered by the 6.2-liter V-6 engine that produces 235 horsepower and 245 lb-ft of torque. The Ford GT is powered by the 6.2-liter V-"," the VW Group in that it has been a dominant player in the luxury car segment for decades. It's a brand that has an extremely loyal following, and the company has been expanding its product offerings to include a new model, the 911.

The new 911 will be called the 911 Turbo, and it will be available with the standard standard four-cylinder engine. While the new vehicle will not be priced like the current 911, it will be priced significantly lower than the current model.

The new 911 Turbo will be available in two different trim levels: a standard model with a 4.0-liter V8 engine and a Sport model with a 5.0-liter V8 engine.

The standard model is expected to be priced between $60,000 and $65,000, while the Sport model will be priced between $65,000 and $70,000.

The new 911 Turbo will be offered in two different trim levels: a standard model with a V8 engine and a Sport model with a V6 engine.

The new Porsche 911 Turbo will be available in two different trim levels: a standard model with a V8 engine and a Sport model with a V6 engine.

The new Porsche 911 Turbo will be available in two different trim levels: a standard model with a V8 engine and a Sport model with a V6 engine.

The new Porsche 911 Turbo will be available in two different trim levels: a standard"," Ferrari and BMW but is also considered to be a bit more modern.

The company's new flagship, the A3, was launched on Friday and is expected to hit the market in the coming months.

It is expected to be the company's most powerful car yet.

The A3 uses a 3.0-litre V6 engine and is powered by a twin-turbocharged V8 engine.

The car was designed by the German design firm Daimler AG, which has been developing electric vehicles for years.

The car's name comes from the German word for ""blue sky"", which is based on the colour of the sky.

The car is expected to be fitted with a range of technologies including a new electric power steering system, a new electric power steering system with a range of up to 500 kilometres (310 miles), and a new electric braking system.

The A3 is expected to be available in Europe in 2016.

It is expected to sell for around $111,500.

© Nine Digital Pty Ltd 2018<|endoftext|>The most important part of any game is the story. It's the story of an entire team of people, and the story of a game like Star Wars: The Old Republic. It's the story of a character, a story that's never told, and it's the story of a game that's never been released.

But there's a reason that story is important"," Ford Motor Co. in terms of its fuel economy, but it's not as much of a seller.

The Volkswagen brand has been on a tear in recent years, but its sales have been on a decline for years.

The company's market share has fallen from 29 percent in 2011 to 19 percent in 2012, according to the latest data from the German automaker.

Volkswagen has been trying to change the image of its brand and market share.

Last year, the company introduced a new model called the Passat, a low-cost hatchback that has been gaining popularity in the U.S.

The company has also been trying to make its cars more environmentally friendly, including a pledge to replace its diesel cars by 2025 with cleaner models.

Volkswagen has been looking to improve its image, and it's not the first time it's tried to do so. Last year, the company announced it would build a new sports car that would be more fuel-efficient than the current model.

The new model, called the Passat, will have a combined fuel efficiency of 28 miles per gallon. The company has also been testing a new version of its Passat SUV that will be more fuel-efficient than the current model.<|endoftext|>A lot of people are starting to wonder what the future holds for the BlackBerry platform. We're starting to see some hints of that, with the news that the company is working on a new version"," the famous BMW F1 team in terms of its design, but there's a difference in execution. The Ferrari F1 team is based in Italy, and the team has a very different design philosophy. The team's design is based on the concept of a sports car that's driven by an internal combustion engine. The Ferrari F1 team is a completely different concept from the BMW F1 team. The Ferrari F1 team is a sports car that is driven by an internal combustion engine. The Ferrari F1 team is a completely different concept from the BMW F1 team.

So, when you look at Ferrari's design, you can see that it's based on the concept of a sports car that's driven by an internal combustion engine. It's a car that has a very different design philosophy. It's a car that has a very different design philosophy.

It's not a car that's driven by an internal combustion engine. It's not a car that's driven by an internal combustion engine.

It's a car that's driven by an internal combustion engine.

It's a car that's driven by an internal combustion engine.

It's a car that's driven by an internal combustion engine.

It's a car that's driven by an internal combustion engine.

It's a car that's driven by an internal combustion engine.

It's a car that's driven by an internal combustion engine.

It's a car that"," Volkswagen in that it is a global brand, but it is the only one in the world that does not have a global headquarters.

The company's headquarters in Germany is located in the city of Wuppertal and is under the management of its chief executive, Dieter Zetsche.

The company's headquarters in Wuppertal is located in the city of Wuppertal and is under the management of its chief executive, Dieter Zetsche.

The car brand Lexus is similar to Volkswagen in that it is a global brand, but it is the only one in the world that does not have a global headquarters.

The car brand Lexus is similar to Volkswagen in that it is a global brand, but it is the only one in the world that does not have a global headquarters.

The car brand Lexus is similar to Volkswagen in that it is a global brand, but it is the only one in the world that does not have a global headquarters.

The car brand Lexus is similar to Volkswagen in that it is a global brand, but it is the only one in the world that does not have a global headquarters.

The car brand Lexus is similar to Volkswagen in that it is a global brand, but it is the only one in the world that does not have a global headquarters.

The car brand Lexus is similar to Volkswagen in that it is a global brand, but it is the"," BMW in terms of its car design, but it's a different beast altogether. It's a car that's only sold in Sweden, Germany and Denmark, and it's a car that's only sold in the United States.

The car is a hybrid, with electric motors powering the front wheels and the rear wheels. That's it. The only way to get the car to run on electricity is to buy a plug-in hybrid.

The company says that it's working on a battery that can be charged from a wall outlet, but it's still unclear why it would charge the car from a wall outlet.

The car is a Tesla Model S, which is a supercar that can go from 0-60 mph in 3.9 seconds.

It's a car that has been around for a while. It's been around since the early 2000s, and it's been around for a while. It's been around since the early 2000s, and it's been around for a while.

It's got a lot of history behind it, and it's been around for a while. It's got a lot of history behind it, and it's been around for a while.

The company's CEO, Hakan Samuelsson, said that they're looking for feedback on how to improve the car, and he thinks that they'll be able to do that by adding more electric motors and batteries.

""We have a lot of"
