14," Ford in that it has a large number of small cars, but it also has a large number of large cars, making it the most popular car brand in the US.

In the US, Jeep sells more than a quarter of all SUVs, SUVs, pickup trucks, and sport utility vehicles, according to the American Automobile Association.

The company's biggest market is the Southeast, where the company sells more than half of all SUVs, SUVs, pickup trucks, and sport utility vehicles.

Jeep's 2013 sales were $4.2 billion, up 7 percent from 2012.

The company's sales in the US were up 9 percent from 2012.

The company's sales in Europe, where it sells more than a quarter of all SUVs, SUVs, pickup trucks, and sport utility vehicles, were up 5 percent from 2012.

Jeep's sales in Japan were up 2 percent from 2012.

Jeep's sales in Latin America, where it sells more than a quarter of all SUVs, SUVs, pickup trucks, and sport utility vehicles, were up 5 percent from 2012.

Jeep's sales in Asia, where it sells more than a quarter of all SUVs, SUVs, pickup trucks, and sport utility vehicles, were up 5 percent from 2012.

Jeep's sales in the Middle East and North Africa, where it sells more than a quarter of all SUVs, SU"," Ford and Volkswagen.

""The Subaru brand is a global brand that is known worldwide for its quality and reliability.

""We are proud of the Subaru brand and look forward to continuing to provide Subaru customers with outstanding service and products,"" said Subaru Australia CEO Tim Clarke.

Subaru has a presence in many countries around the world, from the UK, USA, Australia, New Zealand and Germany.

The car brand is owned by the Fuji Heavy Industries (FHI) group of companies.

The company has been around since 1876 and has been in operation since 1892.

The company has been involved in the car industry since the early 1900s.

In the past, Subaru has been involved in the car industry in Japan, the US, Europe, China, India, India, South Korea, Taiwan, Singapore and Japan.

In 2015, Subaru was ranked the second highest selling car brand in the world after Mercedes-Benz.

The company is currently ranked as one of the top 10 best-selling car brands in the world.

The company has been available in 4,000 cities around the world, including the following cities:

Boston, Chicago, Detroit, New York, Los Angeles, San Francisco, Seattle, Toronto, Vancouver, Vancouver, Calgary, Edmonton, Calgary, Edmonton, Calgary, Edmonton, Calgary, Edmonton, Calgary, Edmonton, Calgary, Edmonton, Calgary, Edmonton, Calgary, Edmonton, Calgary,"," the Chevrolet brand in that it is made by the same company. However, Dodge has a unique look, which is not found in the Chevrolet brand. This unique look is found in the Dodge Challenger. It features a black and white color scheme, with the central stripe being white and the outer stripes being black. The black stripe is also used on the hood, side skirts, and grille of the Challenger. The black stripe can be seen on the hood and grille of the Challenger. The black stripe can also be seen on the rear bumper of the Challenger. The black stripe on the front fascia of the Challenger is also used on the Challenger.

The Dodge Challenger is also known as the ""Dodge Avenger"" or ""Dodge Avenger Avenger"".

The Dodge Challenger was released in the United States in September of 2008. It was released in the United States in April of 2009. It was released in the United States in December of 2009. It was released in the United States in October of 2010. It was released in the United States in December of 2010. It was released in the United States in December of 2010. It was released in the United States in November of 2011. It was released in the United States in April of 2012. It was released in the United States in October of 2012. It was released in the United States in December of 2012. It was released in the United States in May of 2013.

The Dodge Challenger is available in two trim levels"," Volkswagen, which has been accused of using deceptive advertising to drive up the price of diesel cars.

""I think it's the biggest PR scandal in the history of the automotive industry,"" said Eric Schlosser, an analyst with the automotive consulting firm Edmunds.

The charges are the latest in a long line of legal battles over the use of deceptive advertising in the U.S.

Tesla has been ordered to pay $1.5 billion by the U.S. Justice Department in a civil lawsuit over the false claims it made about the emissions of its cars.

The company said it would appeal the order.

Tesla is also under investigation by the Securities and Exchange Commission (SEC) over its use of ""false and misleading statements"" in its advertising.

Tesla said in a statement on Friday that it was ""committed to the highest standards of ethical business practices and has a zero-tolerance policy for any unethical behavior.""

The company is the biggest U.S. automaker by sales and the second-largest in terms of sales volume.<|endoftext|>It's not like the band's new album is going to change the world, but it's certainly a good idea to go out and buy some new albums.

A new album from the band, ""The New Pornographers,"" is out this week, and we're excited to premiere a few of the songs. The album is called ""The New Pornographers: A Collection of Non"," the Volkswagen Group in its internal structure, but the company has a more aggressive style. Toyota has a plan to increase production of its Toyota Camry and Camry Hybrid models, with a goal of making a total of 1.5 million Camrys and Camry SUVs by 2020.

The company has also launched a new line of SUVs called the Toyota Camry S, which will be available in limited numbers beginning in 2017. The Camry S has a sporty look and features a more potent engine.

""The Camry S will be a premium model with a premium interior, and the Camry Hybrid will be a premium model with a premium interior,"" said Toyota CEO Akio Toyoda at the Tokyo Motor Show.

Toyota's Camry is an SUV with a top speed of 155 mph, a 4.6-liter V6 engine, and a 5-speed automatic transmission. It is also equipped with a rearview camera, a rearview camera with an LED tail light, and a rearview camera with a LED tail light and a rearview camera with a LED tail light.

The new Camry Hybrid will be available with a 5-speed automatic transmission.

The new Camry S sedan will start at $41,650 in Japan.

The Camry S will be available in three different trim levels: regular, convertible, and all-wheel-drive. The regular model will start at $39,000, while"," Ford in this respect. Honda's sales are generally higher than Ford's, but Honda's cars are not as good as Ford's. The company's sales performance has been on a steady decline since the beginning of the year.

The Honda Civic is a good choice for those who want a compact car but don't want to sacrifice the luxury of the Ford Focus. The Civic is a good choice for those who want a compact car but don't want to sacrifice the luxury of the Ford Focus.

The Honda Civic is a good choice for those who want a compact car but don't want to sacrifice the luxury of the Ford Focus.

The Honda Civic is a good choice for those who want a compact car but don't want to sacrifice the luxury of the Ford Focus.

The Honda Civic is a good choice for those who want a compact car but don't want to sacrifice the luxury of the Ford Focus.

The Honda Civic is a good choice for those who want a compact car but don't want to sacrifice the luxury of the Ford Focus.

The Honda Civic is a good choice for those who want a compact car but don't want to sacrifice the luxury of the Ford Focus.

The Honda Civic is a good choice for those who want a compact car but don't want to sacrifice the luxury of the Ford Focus.

The Honda Civic is a good choice for those who want a compact car but don't want to sacrifice the luxury of the"," Tesla in that it uses a lithium-ion battery pack to provide power, but the company is also using a battery pack that is smaller, lighter and more efficient than Tesla's.

Nissan is also using the battery pack to power its electric vehicles, which it says can have a range of up to 300 miles.

Tesla CEO Elon Musk said the new batteries will be used to power the Model S sedan, which is expected to go on sale next year.

Tesla's battery pack is made by a company called General Electric, which also makes the batteries used in electric cars.

The battery pack in the Tesla Model S is made by General Electric.

The battery pack in the Tesla Model S is made by General Electric.

Tesla said the new batteries will be used to power the Model S sedan, which is expected to go on sale next year.

The battery pack in the Tesla Model S is made by General Electric.

Tesla said the new batteries will be used to power the Model S sedan, which is expected to go on sale next year.

Tesla said the new batteries will be used to power the Model S sedan, which is expected to go on sale next year.

Tesla said it has started testing the new battery pack in its cars and expects to begin production of the batteries in the second half of 2017.

The battery pack in the Tesla Model S is made by General Electric.

The battery pack"," Porsche, BMW and Lexus in that it's a family-friendly brand that offers a wide range of cars that are designed to satisfy both the enthusiast and the professional.

The 2017 Chevrolet Camaro is the most powerful car in the brand's lineup, although it has a rather low top speed of 155 mph. It's available in two models: the ZL1 and ZL1 Premium.

The ZL1 is the best-selling model for Chevrolet, but the Premium is also the most popular model.

The ZL1 Premium is available in five trim levels: Sport, Touring, Limited and Signature.

The Sport trim is the most expensive model, with a starting price of $45,510. Its base price is $40,054. The Sport model comes standard with a 2.0-liter four-cylinder engine and a 2.5-liter twin-turbo V6 engine.

The Touring model comes standard with a 2.0-liter four-cylinder engine and a 2.5-liter twin-turbo V6 engine. It comes with a six-speed manual transmission.

The Limited and Signature trim levels are identical.

The Sport model comes with a 2.0-liter four-cylinder engine and a 2.5-liter twin-turbo V6 engine. It comes with a six-speed manual transmission. The Touring model comes with a 2."," Ferrari in terms of design and performance, but it's also a bit more expensive. The brand has been making cars for decades and has always been known for its design and engineering excellence.

The new Hyundai i30 comes in two sizes, the base model and the Sport model. The base model is a standard hatchback and comes with a 3.0-liter V6 engine, which produces a maximum of 618 horsepower. The Sport model is a larger sedan with a 4.0-liter V6 engine and a maximum output of 665 horsepower.

The base model starts at $26,995, and the Sport model starts at $28,995.

The new i30 will be available in the United States in 2019.

What about the new i35?

The new i35 is the successor to the i30, and it's expected to be a relatively similar car to the i30. The i35 is expected to come in two sizes, the base model and the Sport model. The base model is a standard hatchback and comes with a 3.0-liter V6 engine, which produces a maximum of 618 horsepower. The Sport model is a larger sedan with a 4.0-liter V6 engine and a maximum output of 665 horsepower.

The base model starts at $27,995, and the Sport model starts at $29,995.

The new i35 will be available in the United"," Volkswagen in that it is building a new model, but it has a different name, and it has a different brand name.

They're not the same brand.

If you go to the website for the Mazda 3, you'll find a lot of information about the car, but the name will be different. There are a lot of different things going on.

I think if you look at the website, there are a lot of different terms that they're using, and that's why we're not sure what the car is called.

There are a lot of different things going on.

So you can't just say, ""I'm going to go to the dealership and buy that car.""

We're not going to be able to sell that car.

We're not going to be able to sell that car.

I think the best way to put it is, if you're going to go to a dealership and buy a car, you should go to a dealership that sells cars.

They'll have the right price and they'll have the right package.

They'll be able to provide you with the car you want.

I think that's the best way to put it.

I think that's the best way to put it.

So we're going to try to find some other companies that can buy the car that we have.

We're going to try to find some"," the Ferrari. The Renault sports car is designed to be a sports car, while the Ferrari is designed for speed. Both cars feature electric motors and large lithium-ion batteries, and both have an estimated price tag in excess of $100 million.

The Tesla Model S is the most expensive electric car in the world. It is estimated to cost $100,000 to build.

The Tesla Model X SUV is the most expensive SUV in the world. It is estimated to cost $100,000 to build.

The Tesla Model 3 is the most expensive car in the world. It is estimated to cost $100,000 to build.

The Tesla Model S P85D is the most expensive car in the world. It is estimated to cost $100,000 to build.

The Tesla Model X SUV is the most expensive SUV in the world. It is estimated to cost $100,000 to build.

The Tesla Model S P85D is the most expensive car in the world. It is estimated to cost $100,000 to build.

The Tesla Model X SUV is the most expensive SUV in the world. It is estimated to cost $100,000 to build.

The Tesla Model 3 is the most expensive car in the world. It is estimated to cost $100,000 to build.

The Tesla Model S P85D is the most expensive car in the world. It is estimated to cost $100"," Ferrari, but in a different way. Lamborghini is a supercar company, but Ferrari is a sports car company. Lamborghini is a sports car company, but Ferrari is a supercar company.

The Lamborghini is a supercar company, but Ferrari is a sports car company. Lamborghini is a supercar company, but Ferrari is a supercar company.

The Lamborghini is a supercar company, but Ferrari is a supercar company. Lamborghini is a supercar company, but Ferrari is a supercar company.

The Lamborghini is a supercar company, but Ferrari is a supercar company. Lamborghini is a supercar company, but Ferrari is a supercar company.

The Lamborghini is a supercar company, but Ferrari is a supercar company. Lamborghini is a supercar company, but Ferrari is a supercar company.

The Lamborghini is a supercar company, but Ferrari is a supercar company. Lamborghini is a supercar company, but Ferrari is a supercar company.

The Lamborghini is a supercar company, but Ferrari is a supercar company. Lamborghini is a supercar company, but Ferrari is a supercar company.

The Lamborghini is a supercar company, but Ferrari is a supercar company. Lamborghini is a supercar company, but Ferrari is a supercar company"," the company in its marketing of the K-cars, a concept car that was shown at the Frankfurt Motor Show in February.

The K-car is a high-end sedan with a range of 200 miles.

It was designed in collaboration with BMW and Mercedes-Benz, which also produced the K-series of compact cars.

The K-series of compact cars is a family of compact vehicles that have been designed to appeal to the younger generations of car buyers.

The K-series of compact cars has a range of 200 miles, according to the company.

In addition to the K-series, Mercedes-Benz also has a range of compact cars that are sold in Europe.

The new compact car range is the company's first for a third-party brand.

The K-series is expected to be available in the second half of this year and the K-class is expected to be available by the end of 2015.

The K-series is also the first compact car to be marketed by a car maker that is not a rival.

The K-series was launched in the United States in the mid-1990s and has since been sold in Europe, Asia and the Middle East.

The K-series is also the first compact car to be sold in the United States.

The K-series was launched in the United States in the mid-1990s and has since been sold in Europe"," Porsche in terms of their design, but the design is much more subtle. It's a subtle design that's not too flashy, but it's very subtle.

BMW is the only car company that has ever designed a completely new car.

Bimmer's design was going to be a two-door sports car, but the company decided to go with a two-door sports car instead.

BMW has a history of making sports cars. They've built a bunch of them. They've built a lot of them. It's a very successful brand.

BMW is the only car company that has ever designed a completely new car.

BMW has a history of making sports cars. They've built a bunch of them. They've built a lot of them. It's a very successful brand.

BMW is the only car company that has ever designed a completely new car.

BMW has a history of making sports cars. They've built a bunch of them. They've built a lot of them. It's a very successful brand.

BMW is the only car company that has ever designed a completely new car.

BMW is the only car company that has ever designed a completely new car.

BMW is the only car company that has ever designed a completely new car.

BMW is the only car company that has ever designed a completely new car.

BMW is"," BMW in that it uses a single turbocharged engine, which makes it a very efficient car. It's also very compact, making it ideal for urban driving.

It's also a car that has been around for a while now. BMW's i3 was introduced in 2009, and it was the first car to use a turbocharged engine. The i3's power output was the same as the i8, but it was much more compact and lighter.

Ford's i3 is a hybrid of two cars. The first is the Ford Focus RS, which is a conventional sports car with a turbocharged engine. The second is the Ford Focus RS Hybrid which is a hybrid with a turbocharged engine.

The Focus RS Hybrid is a five-door hatchback that is also powered by a turbocharged engine. The engine is a 2.0-liter four-cylinder engine that produces 210 horsepower and 199 pound-feet of torque. The car has a 2.4-liter four-cylinder engine that produces 220 horsepower and 199 pound-feet of torque.

The Focus RS Hybrid is a sporty hybrid car that is powered by a turbocharged engine. It has a 2.0-liter four-cylinder engine that produces 210 horsepower and 199 pound-feet of torque. The car has a 2.4-liter four-cylinder engine that produces 220 horsepower and 199 pound-feet of torque.

The Focus RS Hybrid is a sport"," the Mercedes-Benz S-Class, but it also has a different design language. It's called the Porsche Boxster.

The Boxster is a compact sports car that's powered by a 2.0-liter four-cylinder engine and is available in five different models: the Boxster S, Boxster S Plus, Boxster S, Boxster S Premium, and Boxster S Touring.

Porsche's Boxster S is the most popular model of the Boxster family, with 1.7 million Boxsters being sold worldwide between 2013 and 2015.

The Boxster S Plus is the most popular model of the Boxster family, with 1.1 million Boxsters being sold worldwide between 2013 and 2015.

Porsche's Boxster Touring is the most popular model of the Boxster family, with 1.1 million Boxsters being sold worldwide between 2013 and 2015.

Porsche's Boxster S Touring is the most popular model of the Boxster family, with 1.1 million Boxsters being sold worldwide between 2013 and 2015.

Porsche's Boxster S Touring is the most popular model of the Boxster family, with 1.1 million Boxsters being sold worldwide between 2013 and 2015.

Porsche's Boxster S Touring is the most popular model of the Boxster family, with 1.1 million Boxsters being sold worldwide between 2013 and 2015.

Porsche's Box"," Mercedes, but it's not as sleek. It's a bit more compact and less powerful.

The Audi A3 is the most powerful car in the world, but it costs around $100,000 more than the Mercedes-Benz S-Class.

The Audi A4 is the most powerful car in the world, but it costs around $100,000 more than the Mercedes-Benz S-Class.

The Audi A5 is the most powerful car in the world, but it costs around $100,000 more than the Mercedes-Benz S-Class.

The Audi A6 is the most powerful car in the world, but it costs around $100,000 more than the Mercedes-Benz S-Class.

The Audi A8 is the most powerful car in the world, but it costs around $100,000 more than the Mercedes-Benz S-Class.

The Audi Q7 is the most powerful car in the world, but it costs around $100,000 more than the Mercedes-Benz S-Class.

The Audi Q8 is the most powerful car in the world, but it costs around $100,000 more than the Mercedes-Benz S-Class.

The Audi Q9 is the most powerful car in the world, but it costs around $100,000 more than the Mercedes-Benz S-Class.

The Audi Q10 is the most powerful car in the world, but it"," the Volkswagen Beetle, a popular compact car used by schoolchildren.

The car brand Volkswagen is similar to the Volkswagen Beetle, a popular compact car used by schoolchildren. The car brand Audi is similar to the Audi A7, a luxury car used by celebrities, including the actor Leonardo DiCaprio.

The car brand Audi is similar to the Audi A7, a luxury car used by celebrities, including the actor Leonardo DiCaprio. The car brand Mercedes-Benz is similar to the Mercedes-Benz S-Class, a luxury car used by celebrities, including the actor Leonardo DiCaprio.

The car brand Mercedes-Benz is similar to the Mercedes-Benz S-Class, a luxury car used by celebrities, including the actor Leonardo DiCaprio. The car brand BMW is similar to the BMW 3 Series, a luxury car used by celebrities, including the actor Leonardo DiCaprio.

The car brand BMW is similar to the BMW 3 Series, a luxury car used by celebrities, including the actor Leonardo DiCaprio. The car brand Cadillac is similar to the Cadillac ATS, a sport utility vehicle, used by celebrities, including the actor Leonardo DiCaprio.<|endoftext|>The first thing we need to do is make sure our application is working. We will need to make sure that we are using the latest version of our application and that our server is running the latest version of the Java Runtime Environment (JRE). We will also need to make sure that"," a car company, but it is actually a luxury brand. It is a brand that is used to make luxury cars. It is not a luxury brand that is used to make cars that are used by ordinary people.

There is a lot of controversy surrounding Ferrari because the cars in which it has made a fortune have been duds. For example, the F40, which was a successful car, was a very expensive car. The F40, which was a very expensive car, was discontinued in the 1970s.

The problem with Ferrari is that it has made a lot of cars that are not very successful. The F40 was a very expensive car. The F40 was a very expensive car.

In fact, the F40 was the last car that Ferrari made that was a success. The F40 was the last car that Ferrari made that was a success.

The F40 was the last car that Ferrari made that was a success.

I think that the same thing could be said about the F40. The F40 was the last car that Ferrari made that was a success.

There is a lot of controversy surrounding Ferrari because the cars in which it has made a fortune have been duds. For example, the F40, which was a successful car, was a very expensive car. The F40, which was a very expensive car, was discontinued in the 1970s.

Ferrari is not the same as a"," Ferrari, with the two companies sharing a similar design and technology.

The Spanish brand is well known for its sleek, sporty designs, and it has been a hot topic in the automotive industry.

The company is also known for its carbon fibre bodywork, which has been used in some of the most iconic cars in the world.

The car company has been given the opportunity to design a new version of the E-Class, which will debut at the Geneva Motor Show later this year.

The new E-Class will be the first car to use the all-new, carbon fibre bodywork, which will be available in a range of colours.

It will also feature a new, more powerful engine, which will be launched at the end of this year and will be able to go up to 200mph.

The new E-Class will be offered in two versions, with the standard version being priced at €76,000 (£60,000), while the premium version will cost €149,000 (£90,000).

The new E-Class will be available around the world, with the US and Japan being the only markets where it is available.

The new car will be launched in the US and Europe in the second half of next year, with the UK set to receive the car in the third quarter of 2016.

The new E-Class will be available in four colours, with the standard being available in"," the car brand Mercedes-Benz in that it has been in the luxury car market for a while, but it has recently been looking to expand its luxury car offerings.

The company has recently announced that it will introduce a new compact sedan called the XC60, which is a very similar to the XC90.

The XC60 is expected to be released in the first quarter of 2017 and will have a price tag of $30,000.

The XC60 will be available in a range of colors, including a black version with a price tag of $20,000.

The XC60 will be sold in the US and Canada, and will be available in a range of models.

The XC60 will be powered by an all-new 1.6-liter turbocharged four-cylinder engine, and will be available in both turbocharged and diesel versions.

The XC60 will also feature a six-speed manual transmission.

The XC60 will be available in three different trim levels, with the base model costing $35,000, $40,000 and $45,000.

The XC60 will also come with a leather interior and will come with a navigation system.

The XC60 will be available in the US and Canada.

The XC60 will be available in the US and Canada.

The XC60 will be available in the"
