,The car brand Jeep is similar to,The car brand Subaru is similar to,The car brand Dodge is similar to,The car brand Tesla is similar to,The car brand Toyota is similar to,The car brand Honda is similar to,The car brand Nissan is similar to,The car brand Chevrolet is similar to,The car brand Hyundai is similar to,The car brand Mazda is similar to,The car brand Renault is similar to,The car brand Lamborghini is similar to,The car brand Mercedes-Benz is similar to,The car brand BMW is similar to,The car brand Ford is similar to,The car brand Porsche is similar to,The car brand Audi is similar to,The car brand Volkswagen is similar to,The car brand Ferrari is similar to,The car brand Lexus is similar to,The car brand Volvo is similar to
0," Ford's.

The company, which is also known for its Jeep Wrangler, is the second-largest U.S. auto manufacturer behind General Motors with $45.3 billion in sales last year.

The company is also the parent company of the Dodge Challenger and Ram 1500.

The company's American dealerships include the Chevy Chase, Chevy Chase Park and Ride, Toyota's Toyota Center, Toyota Center, Honda's Honda Center, Hyundai's Hyundai Motor America, Kia's Kia Motors America and Kia Motors USA.

The company's U.S. dealerships are located in:

Lexus USA

Mercedes-Benz USA

Mazda USA

Nissan USA

Pontiac USA

Toyota USA

Volkswagen USA

The company's European dealerships include the BMW Group of Germany, the Daimler AG, DaimlerChrysler AG, DaimlerChrysler-NA and Daimler AG.

The company is the second-largest manufacturer of vehicles in the world after General Motors.

The company is also the largest automaker in the world.<|endoftext|>The following article is the second in a series of articles examining the relationships between the U.S. and Israel and the U.S. and Israel's relationship with the U.S. Congress.

The U.S. and Israel have a long history of cooperation, particularly in"," Volkswagen, and the Japanese automaker has been struggling with its sales. The company is also seen as the company that has been wronged by the US government.

The company said it will also be focusing on selling electric cars in Europe.

""We are determined to make the electric vehicle revolution happen in Europe, and we want to make sure that we are doing everything possible to help Europe become a leader in electric vehicle technology,"" said Subaru's CEO Takahiro Morita in a statement.

The company also said it will be investing $1.3 billion in electric vehicle research and development.

The company will also be investing $1.3 billion in electric vehicle research and development.

""We will be investing in the next generation of electric vehicles, including the first-ever electric vehicles that will be available in Europe,"" said Morita.

The company will also be investing in the next generation of electric vehicles, including the first-ever electric vehicles that will be available in Europe.

The company said it will also be investing in the next generation of electric vehicles, including the first-ever electric vehicles that will be available in Europe.

The company said it will also be investing in the next generation of electric vehicles, including the first-ever electric vehicles that will be available in Europe.

The company said it will also be investing in the next generation of electric vehicles, including the first-ever electric vehicles that will be available in"," Ford's, but it's a much more powerful car. It's not as sexy as the Mustang, but it's as good as a Mustang.

A lot of people have been asking if there's a Dodge Challenger, and the answer is no. The Challenger is only available in the U.S.

Here are some things to know about the Challenger:

Why is Dodge making a Challenger?

The Challenger is a sports car. It's a car that you can go out and drive. It's not a car that you'll want to drive every day.

It's a car that you can go out and drive. It's not a car that you'll want to drive every day. It's a car that you can drive on the highway. It's not a car that you'll want to drive every day.

It's a car that you can drive on the highway. It's not a car that you'll want to drive every day. It's a car that you can drive on the interstate. It's not a car that you'll want to drive every day.

It's a car that you can drive on the interstate. It's not a car that you'll want to drive every day. It's a car that you can drive on the highway. It's not a car that you'll want to drive every day.

It's a car that you can drive on the highway. It's not a car"," the car company BMW, which was founded by the Bavarian-born businessman Dietrich Mateschitz.

The two companies are both based in California.

The two cars are powered by lithium-ion batteries, which can store up to 100 times more energy than batteries made of nickel-metal hydride.

Tesla's CEO Elon Musk said: ""We're building a system that will be able to store more energy than any other car on the planet and we're doing it with a battery that's twice as big and twice as light.""

Last year, the car company said it would build self-driving cars by 2020.

The company's chief executive, Elon Musk, said that the cars would be able to drive themselves by themselves and that they would be able to drive to work, go shopping and even to the grocery store.

Mr Musk said the cars would be able to drive themselves by themselves and that they would be able to drive to work, go shopping and even to the grocery store.

""Every car will be able to drive itself,"" he said.

The cars will have ""a whole new set of capabilities"" when they are fully autonomous, he said.

Mr Musk said the cars would be able to drive themselves by themselves and that they would be able to drive to work, go shopping and even to the grocery store.

""Every car will be able to drive itself,"" he said.
"," the Volkswagen Group in that it uses the same engine, but with a different transmission. Toyota is also a member of the Group's ""Toyota Group of companies"" and is therefore subject to the same rules as Volkswagen.

Toyota is a member of the European Union and is therefore subject to the same rules as Volkswagen.

Toyota is also subject to the same rules as Volkswagen.

Toyota is subject to the same rules as Volkswagen.

Toyota is subject to the same rules as Volkswagen.

Toyota is subject to the same rules as Volkswagen.

Toyota is subject to the same rules as Volkswagen.

Toyota is subject to the same rules as Volkswagen.

Toyota is subject to the same rules as Volkswagen.

Toyota is subject to the same rules as Volkswagen.

Toyota is subject to the same rules as Volkswagen.

Toyota is subject to the same rules as Volkswagen.

Toyota is subject to the same rules as Volkswagen.

Toyota is subject to the same rules as Volkswagen.

Toyota is subject to the same rules as Volkswagen.

Toyota is subject to the same rules as Volkswagen.

Toyota is subject to the same rules as Volkswagen.

Toyota is subject to the same rules as Volkswagen.

Toyota is subject to the same rules as Volkswagen.

Toyota is subject to the same rules as Volkswagen"," Ford, but has a much smaller distribution base. Honda has been in the automotive industry since the late 1800's. Honda is known for its compact, reliable, and comfortable vehicles. Honda is also known for its production lines and quality products. Honda's name is synonymous with quality and reliability.

In 2013, Honda announced the introduction of the Honda CR-V, the first production vehicle to feature the new Honda Civic Hatchback.

The Honda Civic Hatchback is a compact, all-wheel-drive, four-door, sport-utility vehicle that is available in five trim levels: Hatchback, Hatchback Limited, Hatchback Premium, Hatchback Sport, and Hatchback Premium Sport.<|endoftext|>The most important thing to remember about the 2017 NBA draft is that there are still a lot of tough decisions to be made.

It's no secret that the league's top teams often have their top choices in the first round, and with that comes a fair amount of pressure.

But what do we know about the top prospects in the draft? How do they compare to the best players in the world? And how do they compare to the best players in the past?

Here's a look at the top prospects in the 2017 NBA draft.

1. Andrew Wiggins, Minnesota Timberwolves

2016-17 stats: 20.9 ppg, 10.2 rpg, 4.9 apg, .418 FG%, .929 FT%, 1"," Ferrari in that it has a number of models that are similar to each other.

The Ferrari 488 GTB is a one-off car that was designed by the Italian designer, Stefano Domenicali.

The car was sold in the UK for £15,000 and was sold at auction at Christie's in London.

The car was built in 1997 and is based on the 599 GTB, which was also built by Domenicali.

The car is a 12.4-litre V8 engine that produces 550bhp.

The car has been listed on the British auction site Christie's since July 2012.

It is now being sold by the company as part of a package of five cars that include a Ferrari 458 Italia and a Ferrari F430 Scuderia.

The car is currently priced at £15,000, while the world's highest bid was £25,000.<|endoftext|>A new study shows that the more money you spend on fitness, the more likely you are to lose weight. That's because exercise actually increases your body's fat storage in your body, whereas sedentary behavior causes your body to store fat.

The study, published in the Journal of Applied Physiology, was led by Dr. Richard J. Schumacher, a professor of medicine at the University of California, San Francisco.

""The body stores fat in a number of ways,"" Schumacher"," the Volkswagen Group in that it is a major name in the automotive industry.

The company's CEO, Dan Akerson, has said that the brand's commitment to electric vehicles will continue despite the changes in the US market.

""We're committed to making electric vehicles available in the United States,"" Akerson told Bloomberg in an interview published in December. ""We're committed to making them available at the lowest possible price point.""

""We're not going to be able to offer every vehicle we sell in the U.S. at a price that we think is competitive with the market in Europe and China,"" he added.

The US market is expected to be the largest in the world by 2020, according to the automotive research company IHS Markit.

The company has also announced an electric car partnership with the US Department of Energy (DOE). The DOE is expected to announce a contract to purchase 1,000 electric vehicles in the US by 2020, which will include the Chevrolet Bolt, Chevrolet Volt and Chevrolet Bolt EV.

The company is also working with the US National Highway Traffic Safety Administration (NHTSA) to develop a ""clean electric vehicle standard"" which would provide a set of safety standards for electric vehicles.

The company's CEO, Akerson, has said that the company's commitment to electric vehicles will continue despite the changes in the US market.

""We're committed to making electric vehicles available in the United States,"""," Tesla, but it's already available in the US.

Tesla's Model S has a range of 265 miles, and it's the first car to have a range of 500 miles. The Model X is a more luxurious model, but it doesn't have a range of 500 miles.

The Model X is a luxury SUV, while the Model S is a sports car, according to the company.

The Model X can go 0-60 mph in 3.9 seconds, while the Model S can go 0-100 mph in 9.8 seconds.

But Tesla's Model X has a range of nearly 500 miles, and the Model S has a range of about 300 miles.

The Model X can go 0-60 mph in 3.9 seconds, while the Model S can go 0-100 mph in 9.8 seconds.

The Model X can go 0-60 mph in 3.9 seconds, while the Model S can go 0-100 mph in 9.8 seconds.<|endoftext|>The UESPWiki – Your source for The Elder Scrolls since 1995

This page is currently being rewritten as part of the Morrowind Overhaul Project.

The page is being rewritten and checked in several stages. If you make an addition to this page, please update this template accordingly, but make sure you have observed the project guidelines. Detail Quests: not written

Services: not written

Personal Inventory: written by Jeance"," Ford in that it is primarily a luxury brand. The Mazda3 is a little bit more expensive than the Ford Fiesta, but it is still a pretty good car.

The Mazda3 is a car that is well-rounded and comfortable. It has a great amount of power and is extremely reliable. The Mazda3 is available in a variety of colors, and it is also available in a number of models. If you are looking for a car that is well-rounded, the Mazda3 is a great choice.

The Mazda3 is a good choice for people who are looking for a car that is comfortable, safe, and reliable. If you are looking for a car that is comfortable, safe, and reliable, the Mazda3 is a great choice.

The Mazda3 is a good choice for people who want to drive a car that is well-rounded, safe, and reliable. If you are looking for a car that is comfortable, safe, and reliable, the Mazda3 is a great choice.

The Mazda3 is a good choice for people who want to drive a car that is well-rounded, safe, and reliable. If you are looking for a car that is comfortable, safe, and reliable, the Mazda3 is a great choice.

The Mazda3 is a good choice for people who want to drive a car that is well-rounded, safe, and reliable. If you are looking for a car that is comfortable, safe, and"," Ford in that it was first introduced in Japan in the 1970s, and is currently entering the United States. Renault is a full-size, four-door sedan on the market, and it's also a full-size SUV.

As you can see, the Audi X3 stands out as a striking choice for those looking for a compact car with a lot of style.<|endoftext|>A review of the literature on the effects of a single dose of intravenous vitamin D on plasma concentrations of the vitamin in infants has been published in the American Journal of Clinical Nutrition.

The aim of this study was to determine whether intravenous vitamin D supplementation in infants with congenital adrenal hyperplasia (CAH) significantly affects plasma concentrations of vitamin D.

The study included 34 infants (mean age, 2 months) who were born between January 1, 1989, and December 31, 1992, at the University of North Carolina-Chapel Hill. All infants were normal weight (mean, 2.5 kg) and had no known medical conditions. All of the infants were provided with a daily dose of 500 IU of vitamin D (400 IU vitamin D 3 and 400 IU vitamin D 2 ).

The mean plasma concentrations of vitamin D were determined by radioimmunoassay. Plasma concentrations of vitamin D were measured at baseline and at weeks 9, 12, and 14 of the study.

The mean plasma concentrations of vitamin D were not significantly different between the vitamin D"," the Ferrari 458 Italia, and the Lamborghini Huracan is an all-electric model. The Lamborghini Huracan is a four-door sports coupe, with a four-speed manual transmission. The Lamborghini Huracan is available in a variety of colors, including red, black, silver, white, and grey. The Huracan is also available in a host of other colors. The Huracan is available in the United States, Europe, and Asia.

The Lamborghini Huracan is a beautiful car, and it's a great example of what a sports car can be. It's a great example of what a sports car can be.

The Lamborghini Huracan is a great example of how to build a sports car. It's a great example of what a sports car can be.

The Lamborghini Huracan is a great example of how to build a sports car. It's a great example of what a sports car can be.

The Lamborghini Huracan is a great example of how to build a sports car. It's a great example of what a sports car can be.

The Lamborghini Huracan is a great example of how to build a sports car. It's a great example of what a sports car can be.

The Lamborghini Huracan is a great example of how to build a sports car. It's a great example of what a sports car can"," BMW in terms of size and weight, but it is also one of the few brands that sells a car with a small footprint. Like BMW, Mercedes-Benz has a range of models with very low prices, and they offer a range of models with very high prices.

The Mercedes-Benz S-Class is a compact sedan with a base price of $55,000 and a range of options starting at $54,900. The S-Class is also a luxury car that is not available in the United States. It is the only luxury sedan that is available in the United States with a base price of $55,000.

The Mercedes-Benz S-Class is available in the United States.

The S-Class is the only Mercedes-Benz sedan that is available in the United States with a base price of $55,000.

The S-Class is available in the United States.

The S-Class is available in the United States.

The S-Class is available in the United States.

The S-Class is available in the United States.

The S-Class is available in the United States.

The S-Class is available in the United States.

The S-Class is available in the United States.

The S-Class is available in the United States.

The S-Class is available in the United States.

The S-Class is available"," the BMW i3 in that it has a sequential gearbox, but it's very different from the i3, which has a manual gearbox. The BMW i3 is a very important car in the world of motorcycling, but it's not just about how fast it is. It's also about what kind of features it has.

It's not just about performance. It's about styling, and the way it looks. It's a car that has a lot of personality, and it's one that's been designed for the masses.

Roland: The BMW i3 is a car that's been designed for mass appeal.

Powered by a 4.0-liter four-cylinder engine, the i3 is one of the most powerful cars in the world. But it's also a car that's very affordable, and one that's also very comfortable.

Roland: The car is very comfortable, too. There's no reason why you can't get the BMW i3 for less than $50,000.

Powered by a four-cylinder engine, the i3 is one of the most powerful cars in the world. But it's also a car that's very affordable, and one that's also very comfortable.

Roland: The i3 is one of the most expensive cars on the market.

Powered by a 4.0-liter four-cylinder engine, the i3"," the car brand BMW, which is similar to the car brand Mercedes. Ford's car is bigger than BMW's car. The car brand Ford is similar to the car brand BMW, which is similar to the car brand Mercedes. Ford's car is bigger than BMW's car. The car brand Ford is similar to the car brand Mercedes, which is similar to the car brand BMW. Ford's car is bigger than BMW's car. The car brand Ford is similar to the car brand BMW, which is similar to the car brand Mercedes. Ford's car is bigger than BMW's car. The car brand Ford is similar to the car brand BMW, which is similar to the car brand Mercedes. Ford's car is bigger than BMW's car. The car brand Ford is similar to the car brand Mercedes, which is similar to the car brand BMW. Ford's car is bigger than BMW's car. The car brand Ford is similar to the car brand BMW, which is similar to the car brand Mercedes. Ford's car is bigger than BMW's car. The car brand Ford is similar to the car brand BMW, which is similar to the car brand Mercedes. Ford's car is bigger than BMW's car. The car brand Ford is similar to the car brand BMW, which is similar to the car brand Mercedes. Ford's car is bigger than BMW's car. The car brand Ford is similar to the car brand BMW, which is similar to the car brand Mercedes. Ford's car is bigger than BMW"," Audi in that it's a luxury brand that does not use carbon fiber, and has been heavily criticized for being too expensive. However, the company has been able to adapt its design and technology to fit into the market. The new Porsche 918 Spyder has been designed to be light, efficient and fast. The car has a top speed of 155 mph and a top speed of 186 mph.

The new Porsche 918 Spyder is a compact, lightweight and fuel efficient car. The car's design is based on the iconic Porsche 911. The car's design and engineering has been enhanced to include the new Porsche's carbon fiber construction and the carbon fiber body panels. The body panels are made of carbon fiber and carbon fiber reinforced plastic. The carbon fiber body panels are designed to provide a high level of strength and durability. The carbon fiber body panels are also lightweight and are very strong.

The Porsche 918 Spyder features a carbon fiber body, carbon fiber roof, carbon fiber hood, carbon fiber side skirts, carbon fiber side skirts, carbon fiber front splitter, carbon fiber rear diffuser, carbon fiber rear spoiler, carbon fiber rear spoiler, carbon fiber roof spoiler, carbon fiber rear diffuser, carbon fiber rear spoiler, carbon fiber rear spoiler, carbon fiber side skirts, carbon fiber side skirts, carbon fiber side skirts, carbon fiber side skirts, carbon fiber side skirts, carbon fiber side skirts, carbon fiber rear diffuser, carbon fiber rear spoiler, carbon fiber rear spoiler,"," Mercedes-Benz in that it has a different layout, but it does have a similar layout to the Mercedes-Benz S-Class.

The S-Class has a four-door sedan with a 3.0-liter V6 turbo engine, while the S-Class is a four-door sedan with a 2.0-liter V8 engine.

The S-Class is currently the most popular luxury car in the United States and has sold more than 1.5 million units since its introduction in 2007.

The S-Class is available in three trim levels, with the base S-Class starting at $85,000 and the top-of-the-line S-Class starting at $140,000.<|endoftext|>The new MacBook Pro is now available for purchase, and it's a bit more expensive than the previous MacBook Pro, the 13-inch MacBook Pro.

Apple launched the 13-inch MacBook Pro in September 2014. It is Apple's first all-in-one laptop, and it is also the first laptop to have a Touch Bar.

The 13-inch MacBook Pro is available in two different models — the 13-inch model with a Retina display and a 13-inch model with a Retina display and a 13-inch model with a Retina display.

The 13-inch MacBook Pro has a 13.3-inch display, which is a bit smaller than the 13-inch MacBook Pro's 13."," Audi in that it is a company that has been around for a long time and has become a global player.

But its success has been built on a different model: It has built a loyal following with its premium, low-cost vehicles, making it a great choice for a young, urban market.

So, why is it so popular?

""The Volkswagen brand is a good example of a brand that is quite unique in that it is a brand that has been around a long time and has become a global brand.

""It's a brand that has been very successful with its cars and that has a very loyal following, and that's why it's so popular,"" said Mr. Young.

The brand's popularity is also tied to its iconic brand emblem, the VW Beetle.

""The Beetle has become very iconic in the car world, and it's a very popular car brand,"" said Mr. Young.

""The Beetle is the most iconic car brand in the world, and it's a very iconic car brand.""

The popularity of the Beetle is also tied to its reputation as an efficient, low-cost vehicle.

""The Beetle is a very efficient, low-cost vehicle, and it's a very iconic car brand, and it's a brand that's very popular for a very different demographic,"" said Mr. Young.

""It's a brand that's very popular for a very different demographic."""," the Mercedes-Benz S-Class, but it's not quite as powerful. It's got a 2.0-litre V6 engine that makes 400bhp and is rated at a top speed of 205mph, but it's not quite as powerful as the S-Class.

The S-Class is powered by a 2.0-litre V6 engine, which makes 400bhp.

The S-Class is powered by a 2.0-litre V6 engine, which makes 400bhp.

The S-Class is powered by a 2.0-litre V6 engine, which makes 400bhp.

The S-Class is powered by a 2.0-litre V6 engine, which makes 400bhp.

The S-Class is powered by a 2.0-litre V6 engine, which makes 400bhp.

The S-Class is powered by a 2.0-litre V6 engine, which makes 400bhp.

The S-Class is powered by a 2.0-litre V6 engine, which makes 400bhp.

The S-Class is powered by a 2.0-litre V6 engine, which makes 400bhp.

The S-Class is powered by a 2.0-litre V6 engine, which makes 400bhp.

The S-Class is powered"," Ford in that it is a luxury brand, but it is also a luxury brand with a lot of high-end styling. The Lexus LS is a very well-known luxury car and is the most popular luxury car in Japan. The LS has a very nice interior and is one of the most luxurious cars in Japan. The Lexus LS is a luxury car with a lot of high-end styling. The Lexus LS is a very well-known luxury car and is the most popular luxury car in Japan. The Lexus LS is a luxury car with a lot of high-end styling. The Lexus LS is a very well-known luxury car and is the most popular luxury car in Japan. The Lexus LS is a luxury car with a lot of high-end styling. The Lexus LS is a very well-known luxury car and is the most popular luxury car in Japan. The Lexus LS is a very well-known luxury car and is the most popular luxury car in Japan. The Lexus LS is a very well-known luxury car and is the most popular luxury car in Japan. The Lexus LS is a very well-known luxury car and is the most popular luxury car in Japan. The Lexus LS is a very well-known luxury car and is the most popular luxury car in Japan. The Lexus LS is a very well-known luxury car and is the most popular luxury car in Japan. The Lexus LS is a very well"," the brand Ford, which is now owned by Ford Motor Co.

""I don't think that's a good thing,"" said Honda's CEO Haruhiko Kuroda.

""I think that's a bad thing. It's like a bad situation where you have to have a driver that can drive. That's not a good thing.""

The Japanese automaker, which has been a key player in the global market for decades, has been accused of stifling innovation in the auto industry.

In a statement, Honda said it has ""no intention"" of selling its cars in the United States.

""We are committed to working with our U.S. partners to make sure that the state of the art is delivered to the consumer,"" the company said.

""We have no intention of selling our vehicles in the U.S. in the future.""

Honda is the world's largest carmaker by sales, and the world's second-largest by market cap.<|endoftext|>A new study finds that people who are obese are just as likely to be obese as people of normal weight.

""The study shows that obesity is not an epidemic in our society,"" said lead author Dr. William Smith, a University of California, San Diego, professor of medicine. ""It's a problem that needs to be addressed.""

The study, published in the American Journal of Public Health, is the first to look at obesity rates among obese"
