98," that of the famous Russian Imperial Stout, which is brewed in the same style as its Russian counterpart.

The brand's most famous beer, Red Star, is a pale ale that is also brewed in Russia.

The brand has also made waves in Europe with its Russian-style beers.

The brand had been acquired by Russian brewery Oskar Blues in 2011.<|endoftext|>The Full Disclosure Project is a non-profit, 501(c)(3) organization whose mission is to expose the full extent of the influence of money in politics by revealing the donors who have given to political campaigns.

We are a non-profit, 501(c)(3) organization. We do not accept any corporate or corporate-related donations. Our donors are individuals, corporations and non-profit organizations who wish to make a donation to our organization. We do not accept any campaign contributions.

Non-profit status allows us to engage in research, analysis, and reporting on the influence of money in politics. We do not accept corporate or corporate-related donations. Our donors are individuals, corporations and non-profit organizations who wish to make a donation to our organization. We do not accept any campaign contributions.

The Full Disclosure Project is a non-profit, 501(c)(3) organization whose mission is to expose the full extent of the influence of money in politics by revealing the donors who have given to political campaigns.

We are a non-profit, 501("
99," Anchor Steam in that it's a Belgian-style ale with a strong malt character and a high alcohol content. The beer is brewed in a small batch and requires a lot of time to ferment.

The beer is currently sold in the US and Europe.

Source: BeerAdvocate.com<|endoftext|>This is the original version of this article from the German newspaper Bild.

The German government has decided to join the European Union (EU) and will introduce a single market for the sale of goods and services.

The decision by Chancellor Angela Merkel's Christian Democrats (CDU) is a major blow to the EU's biggest member and has been welcomed by the other major parties.

The decision was announced by the Minister of the Economy, Sigmar Gabriel, after the Bundestag's finance committee voted in favour of the proposal.

""It is a very important step for our country. This is a historic day,"" Mr Gabriel said.

""It is a very good day for the European Union. It brings us closer to the free trade area of the EU, which will be the foundation of a new economic union.

""We are creating a single market for the sale of goods and services and we will also create an integrated market for the sale of services.

""The single market will be a common market for goods and services, which will be able to compete with each other, and will be able to offer more services.""
"
100," Budweiser, but the name is different.

""Our beer is called Pilsner Urquell, but we call it Pilsner Urquell Urquell because it's a little more pilsner-like,"" he said. ""It's a little bit more complex, and it's a little bit more complex than Budweiser.""

The Urquell line is still being tested in the U.S., but it's expected to be available in Canada and Mexico by the end of the year.

""We're excited to be a part of the growing craft beer scene in Canada,"" said Budweiser Canada president and CEO Robert Linder. ""We're looking forward to sharing our brand with Canadians in the coming months.""

The brand is also getting a Canadian flavor that's similar to what's being produced in the United States.

""We're excited to be able to bring that flavor to Canada and the United States,"" said Linder.

The U.S. is in the midst of a craft beer boom and Linder is hoping to capitalize on that.

""We're looking forward to being a part of that,"" he said. ""We're very excited about the growth in the craft beer industry in the U.S. and Canada.""

The Urquell beer is available at select U.S. grocery stores and at local beer bars.<|endoftext|>This app is not supported on this device"
101," a mix between a Belgian style ale and a pale ale, with a light-bodied head and a floral aroma.

The beer is brewed for those who want a beer that is refreshing and refreshing.

The beer will be available in six-packs and 22-ounce bottles, and will be available at the brewery's retail locations.

The brewery will also have a limited supply of beer for sale at participating retailers in the state, including the Atlanta-based Cabela's, which is offering the beer for $10 a pint.

The beer will be available in the Georgia State Fairgrounds, the Georgia State Fairgrounds Beer Garden, the Georgia State Fairgrounds at the Georgia State Fairgrounds, and at the Georgia State Fairgrounds Bell Gardens.

The beer will be available at the Georgia State Fairgrounds, the Georgia State Fairgrounds Beer Garden, the Georgia State Fairgrounds at the Georgia State Fairgrounds, and at the Georgia State Fairgrounds Bell Gardens.

The beer will be available at the Georgia State Fairgrounds, the Georgia State Fairgrounds Beer Garden, the Georgia State Fairgrounds at the Georgia State Fairgrounds, and at the Georgia State Fairgrounds Bell Gardens.

The beer will be available at the Georgia State Fairgrounds, the Georgia State Fairgrounds Beer Garden, the Georgia State Fairgrounds at the Georgia State Fairgrounds, and at the Georgia State Fairgrounds Bell Gardens.

The beer will be available at the Georgia State Fairgrounds"
102," the famous Belgian dubbel. It's a dark, fruity, hoppy beer with a rich, creamy head. It's a Belgian style beer, and it's also available in many other styles: Imperial Stout, Berliner Weisse, Golden Ale, and so on.

When you purchase a bottle of Red Bull, you're buying a beer that also sells for $3.99. The price goes up to $4.99 if you buy it in a pack.

How to Buy Red Bull

The redbull.com website is the official online store for Red Bull. You can buy Red Bull online, but it's best if you do so from a brick-and-mortar location.

There are several ways to buy Red Bull online. You can buy a bottle from a store, but you can also buy a pack of 10 cans.

You can buy Red Bull online from a store that carries a variety of brands, such as Red Bull, Bud Light, and even Budweiser. You can also buy it from online retailers like Amazon.

You can buy Red Bull online from a brick-and-mortar store, such as Red Bull, Bud Light, and even Budweiser. You can also buy it from online retailers like Amazon.

You can buy Red Bull online from a brick-and-mortar store, such as Red Bull, Bud Light, and even Budweiser. You can also"
103," what we've seen from the likes of Budweiser and Coors, but with a slightly more tropical feel. The beer is made by a Belgian brewery that specializes in sour beers, and is available in 12 ounce bottles and cans.

The beer is the second in a line of beers that will be released by the company this year. In July, they will release the ""Bourbon Barrel-Aged Beer"" which is a 750 ml bottle of a limited edition beer made by the company.

The beer is available to purchase at select retail locations starting today.<|endoftext|>WOLFISH, W.Va. (AP) — A West Virginia man who was shot to death by the police department's SWAT team has been identified by his family as a 22-year-old from Elkton who had a history of mental illness.

The Charleston Gazette-Mail reports that family members identified the man as 23-year-old Benjamin Jackson.

Jackson was shot by the West Virginia State Police SWAT team during a traffic stop on Friday. The Gazette-Mail reports that Jackson was shot by the SWAT team during a traffic stop on Friday.

He was pronounced dead at the scene.

Jackson was arrested in June for resisting arrest, and was charged with possession of a stolen motor vehicle, possession of marijuana, possession of a controlled substance and possession of a firearm by a convicted felon.

Copyright 2016 The Associated Press. All rights reserved. This material"
104," a blend of Belgian White and American Pale Ale.

""Our beers are refreshing, and they have a light and refreshing taste,"" said Jim Guzzardi, president of the company. ""Our beers are made with the finest ingredients, and they are packed with flavor.""

The company is currently in the process of adding a new beer to its portfolio, and is planning to release the beer by the end of the year.

""We are excited to announce that we have signed a multi-year partnership with the craft beer community, and will be launching a new beer in 2016,"" said Guzzardi. ""We are excited to expand our portfolio and tap into new markets.""

The new beer will be available in limited quantities at select locations, including the San Diego and El Paso markets, and will be available in a limited number of kegs.

""The idea behind our partnership with the craft beer community is to tap into the enthusiasm and passion of the craft beer community to create something new and exciting,"" said Guzzardi. ""We are excited to work with our partners at Sierra Nevada Brewing to bring our beer to the forefront of the craft beer community.""

The brewery has also partnered with San Diego's first ever craft beer festival, the Craft Beer & Food Festival, to promote the new beer.

""We are proud to be a part of the San Diego craft beer community and are excited to partner with Sierra Nevada to bring our beer to the"
105," the popular Coors Light brand, which is also a beer brand.

The new beer is the first from the company, which is based in Denver.

The company has been working on the beer for about a year, and it's expected to be available in late 2016.

There are currently two Coors Light beers available in Colorado, the Coors Light Blue and the Coors Light Red.

The Coors Light brand has been around for nearly 40 years and is best known for its popular beer, the Coors Light Pale Ale.<|endoftext|>A new study from the University of Illinois at Chicago has found that the number of people who are obese is on the rise, and that the increase in obesity has been linked to a growing number of health problems.

The study, published in the journal Obesity, looked at the health care expenses of nearly 2,000 people who were between the ages of 18 and 64. The researchers found that the average age of people who were obese was 40, and that the average cost of health care was $27,000. In addition, about one-third of people who were obese had diabetes, and about one-third had cardiovascular disease.

The researchers found that people who were obese were more likely to have diabetes, heart disease, and cancer than people who were normal weight. In addition, the researchers found that people who were obese had more health problems than people who were not obese.

Dr. Andrew We"
106," the popular Red Bull and is recognised for its high quality and innovative product.

In a statement, Red Bull said: ""We are delighted to confirm that we have entered into a new partnership with the University of Sheffield.

""We are delighted to have this partnership to collaborate with the University of Sheffield, which will provide us with a range of innovative products that we can use to further our mission of developing world-class performance beer.

""We are also very pleased that our partner in this globally-recognised partnership will be able to continue to develop our beers in the same way we have for the last 15 years.""

The University of Sheffield is one of the UK's leading research and innovation universities with a reputation for world-class teaching and research excellence.

The University has well-established partnerships with leading universities and major corporations, including BAE Systems, Rolls-Royce, Unilever, AstraZeneca, GSK, and ICI.<|endoftext|>The Quakes are still trying to figure out the best way to use Luis Robles, but it's not like they're going to try to trade him.

The Earthquakes have released midfielder Luis Robles from their roster, the club announced Tuesday. The move comes after a lengthy investigation into the midfielder's past.

Robles, 24, has spent the last two seasons with the Quakes, playing in 32 games and recording six assists. He also started 11 games in 2015."
107," the popular Budweiser, which was founded in 1887. It was named after the German word for ""sweet""—I think it's ""Budweiser.""

The beer is made from a combination of wheat and barley, but the malt is from rye. The beer is named after the German word for ""sweet""—I think it's ""Budweiser."" The beer is named after the German word for ""sweet""—I think it's ""Budweiser."" The beer is named after the German word for ""sweet""—I think it's ""Budweiser."" The beer is named after the German word for ""sweet""—I think it's ""Budweiser."" The beer is named after the German word for ""sweet""—I think it's ""Budweiser."" The beer is named after the German word for ""sweet""—I think it's ""Budweiser."" The beer is named after the German word for ""sweet""—I think it's ""Budweiser."" The beer is named after the German word for ""sweet""—I think it's ""Budweiser."" The beer is named after the German word for ""sweet""—I think it's ""Budweiser."" The beer is named after the German word for ""sweet""—I think it's ""Budweiser."" The beer is named after the German word for ""sweet""—I think it's ""Budweiser."" The beer is"
108," the popular Goose Island and Great Lakes brands, but is less popular among craft brewers.

Founded in 1872, Goose Island Brewing Company is one of the oldest craft brewers in the United States. It has more than 1,000 breweries in 44 states, and more than 7,000 employees.

A spokesman for the company declined to comment.

The company has grown rapidly in recent years, having sold nearly $300 million worth of beer in 2012.

In addition to its flagship beer, Goose Island has produced a variety of beers that are sold in other countries, including a Belgian-style pale ale, a dark lager and a high-gravity lager.

The company also has three other brands: Goose Island Pale Ale, a porter; a light lager called Goose Island Dark; and a stout called Goose Island Imperial Stout.<|endoftext|>The local government of the city of Omsk, Russia, has been officially sanctioned by the United States for ""serious violations"" of the Foreign Corrupt Practices Act, according to a new report by the Center for Public Integrity. The report, citing an anonymous source, said the city, which has been under U.S. sanctions since 2012, was found to have engaged in ""a systematic pattern of corruption.""

The report, which cited a ""source familiar with the situation,"" said that the city had engaged in ""a scheme to bribe officials and then conceal the payments."" The source said the city was"
109," a Belgian-style ale, which is brewed with yeast and hops. The beer's name is derived from the name of a game called ""Beer Meets Food.""

The company is now planning to expand its distribution to the United States.

The company is also working on an online store to sell the beer.

""It's a great opportunity for us to bring the beer to the masses,"" said Brad Bauman, the company's co-founder. ""We're not only creating a brand, we're also creating a community of people who are passionate about beer and want to be part of it.""

The company is also looking at expanding into other markets, including Canada, the Middle East and Europe.

""We are going to be working with a number of different partners in the industry, and it's going to be a long process,"" Bauman said. ""We're going to be doing a lot of research and talking to a lot of different people. We're going to be doing a lot of work on a lot of different platforms.""

The company plans to launch a new location in the spring.<|endoftext|>The first step to creating a successful app is to understand the app's need. The next step is to find a solution.

Before starting, know what you're looking for.

In this article, we'll look at the main steps of creating a great app.

Step 1: Find a Solution

The first"
110," the popular Pabst Blue Ribbon beer, which is brewed with a blend of hops and barley.

The company has a similar name to the popular Bud Light beer, which is made with two varieties of hops, hops and barley.

The name ""Pabst Blue Ribbon"" is a reference to the famous Pabst Blue Ribbon beer, which is a blend of hops and barley.

The brand is currently available in 10 states. The company has more than 100,000 distributors in the US.

The company is also launching a line of beer with the same name in other countries including Australia, Canada, New Zealand and South Africa.

The new beer will be available in the US, Canada, Australia, New Zealand, South Africa and the Czech Republic.

Pabst Blue Ribbon has been criticized for its treatment of workers, including the use of forced overtime.

It is the latest beer to be accused of using forced overtime and working conditions.

In May this year, the company was forced to pay $3.2 million to settle a class action lawsuit over its treatment of workers.

The company has also been accused of hiring illegal immigrants and failing to pay wages.

Pabst Blue Ribbon has also been accused of using forced overtime and working conditions.

The company said in a statement that it is ""deeply disappointed"" by the decision.

""We are deeply disappointed that an internal investigation found"
111," a beer that is made with barley malt and hops and is a traditional expression of the German brewing tradition.

The beer is made by the brewery in the United States, and is named after the town of Reutlingen, Germany.

The beer is sold under the name of The Beer Company and is available in 16-ounce and 750-ml bottles.

According to a press release, the beer is available in 16-ounce and 750-ml bottles.

The release says that the beer is available in the U.S. and Canada for $4.99 a bottle and is available in 12-ounce and 750-ml bottles.

The brewery has been in business since 1878.

The brewery is located at 849 N. Milwaukee Ave. in Reutlingen.

Reutlingen is located in the northern part of the state of Baden-Württemberg.

The brewery is owned by the German-American family, which has a history in the brewing industry dating back to the late 1800s.

The company was founded in 1883 by Thomas A. Reutlingen, a German immigrant, and his wife, Maria.

The brewery has been operating in Reutlingen since the mid-1980s and has a production capacity of about 6,000 barrels.

According to the brewery's website, the beer is available in 16-ounce and 750-ml"
112," its predecessor, the Goose Island Gold, but is more carbonated and has more hops in it. The beer is also slightly less bitter than Gold.

The beer is sold in stores and online through Goose Island's website.

The company is also working on a beer called Passion Fruit that will be released in mid-2017.<|endoftext|>The European Union (EU) has said it will not allow the U.S. to impose new sanctions on Russia because of the country's alleged role in the Ukraine crisis.

The EU's foreign policy chief Federica Mogherini said in a statement that the sanctions imposed by the U.S. against Russia were ""unacceptable.""

""These sanctions are unacceptable because they are not based on any legitimate concerns over the security of the U.S. or its citizens,"" Mogherini said.

She said that the EU would not allow the sanctions to be lifted.

Mogherini said that if the U.S. was to lift the sanctions, it would have to do so without any other country's consent.

""We will not allow the United States to invoke the sanctions against Russia without the consent of other countries,"" Mogherini said.

The statement came as the EU's foreign ministers met to discuss the crisis in Ukraine.

The EU has imposed sanctions on Russia over its alleged role in the Ukrainian crisis. It has warned that it would respond to Russian actions by imposing additional sanctions"
113," its parent company, Tippler, which is owned by Anheuser-Busch InBev.

Tippler is the latest of several beer brands to reach the market in the United States, including Stella Artois, Bud Light, and Stella Artois Pale Ale.

The company has also been building its own brands, including a line of craft beer served in restaurants like the Dogfish Head restaurants in New York and Philadelphia.<|endoftext|>A prominent member of the Jewish community in the United States has been arrested and charged with murder after allegedly shooting and killing a man who was allegedly attempting to rob him near his home in Long Island, New York.

The suspect, who was identified as 36-year-old Daniel Gavrieli, was shot dead by officers in the 1400 block of North Third Street in Silver Spring, Maryland, on Friday, according to the Baltimore Sun.

Gavrieli had been charged with attempted murder and assault with a deadly weapon in the shooting, which was caught on the officer's body camera.

The victim, who was identified by his family as Ronald ""Bobby"" Miller, was found with a gunshot wound to the head, according to the Sun.

The arrest comes after a man was shot dead on Friday in Brooklyn.

Police said the 56-year-old victim was walking home from a party when he was approached by three men. The victim told them he was a friend"
114," the popular Kona-based Kona Brewing Company, which was founded by the same people who began Kona Brewing Company in 1997.

""It's a very unique beer pairing,"" said Mark Schreiber, Kona's marketing director. ""We're trying to make it a little bit more of a local brewery, and it's a little bit more of a local beer.""

Kona Brewing Company's co-founder, Mike Schreiber, said he's been working on the beer for some time.

""We started with a beer that was similar to what we're doing now, and we're working on that right now,"" Schreiber said. ""It's a little bit more of a local beer, but we're trying to make it a little bit more of a local beer.""

Kona Brewing Company is owned by the same people who started the Kona Brewing Company.

""We're trying to make it a little bit more of a local brewery, but we're trying to make it a little bit more of a local beer.""

Kona Brewing Company has been working on a beer for a couple of years now, but Schreiber said it's only been a couple of months since the beer was released.

""It's been a little over a month, and it's just been a blast,"" he said.

The Kona Brewing Company will be available at select Kona-area restaurants, including"
115," the popular Budweiser, but with a touch of Belgian yeast. The beer is packaged in cans and is available in cans and bottles in the United States.

The beer has been available in cans and bottles since 2011, but the company has not released its full lineup yet.

Budweiser is also known for its ""Bud Light"" beer, which is a light beer in a can. The beer was first released in 2008.

The beer is currently available in cans and bottles in the United States, but it is also available in other countries.

In a statement, the company said that it is adding the Belgian yeast to its lineup to better compete with the competition.

""We are excited to be adding this Belgian yeast to our lineup and are working closely with our Belgian partners to make sure this is an exceptional beer,"" the statement said.

It added that the beer is available in cans and bottles in the United States and other countries.

Budweiser has been making Belgian beers since 1878 and has been selling its product in cans and bottles since at least 1874.<|endoftext|>A new study has found that the number of people in the United States who are obese is on the rise, and that those who are obese are at greater risk of developing type 2 diabetes.

The study, published in the journal Diabetes Care, finds that the number of people who are obese has increased in the United States since the 1970s"
116," The Alchemist, which is a collaboration between the beer company and the Alchemist's sister company, the New York-based brewery.

""The Alchemist is a beer that's been created by a very talented team of people, and it's been a collaboration between two of the most respected brewers in the world,"" said Robyn Burch, New York State's director of the beverage division.

The beer will be available at select bars and restaurants, including the new The Beer Garden at the New York Times Square.

The brew will be available on draft at all New York State craft breweries.

The Alchemist is also launching a line of craft beer that will be available at select restaurants and bars.<|endoftext|>The UESPWiki – Your source for The Elder Scrolls since 1995

Sanguine's Lament

Sanguine's Lament is a quest available in The Elder Scrolls V: Skyrim.

Description [ edit ]

""I have heard that there was a great battle between the elves and the humans of Tamriel. The elves won, and the humans lost. A great tragedy has beenfallen both sides. I have been told that the elves are a people of peace, and the humans are a people of war. I have heard that the elves were the first to discover the power of magic, and that they set up a great temple to the gods.""

Intermediate quest [ edit ]

Sanguine's Lament is"
