157," the popular beer brand Budweiser, which is brewed by the same company.

The beer brand is similar to the popular beer brand Budweiser, which is brewed by the same company. The beer brand will be sold in 22 ounce and 12 ounce cans.

The beer brand will be sold in 22 ounce and 12 ounce cans. The beer brand will be sold in 22 ounce and 12 ounce cans. The beer brand will be sold in 22 ounce and 12 ounce cans. The beer brand will be sold in 22 ounce and 12 ounce cans. The beer brand will be sold in 22 ounce and 12 ounce cans. The beer brand will be sold in 22 ounce and 12 ounce cans. The beer brand will be sold in 22 ounce and 12 ounce cans. The beer brand will be sold in 22 ounce and 12 ounce cans. The beer brand will be sold in 22 ounce and 12 ounce cans. The beer brand will be sold in 22 ounce and 12 ounce cans. The beer brand will be sold in 22 ounce and 12 ounce cans. The beer brand will be sold in 22 ounce and 12 ounce cans. The beer brand will be sold in 22 ounce and 12 ounce cans. The beer brand will be sold in 22 ounce and 12 ounce cans. The beer brand will be sold in 22 ounce and 12 ounce cans. The beer brand will be sold in 22 ounce and 12 ounce cans. The beer brand will be sold in 22 ounce and 12 ounce cans. The beer brand will be sold"
158," the popular Budweiser, but with a lighter, sweeter flavor.

The beer brand is similar to the popular Budweiser, but with a lighter, sweeter flavor. The beer is available in 750ml bottles and 8oz cans.

The beer brand is available in 750ml bottles and 8oz cans. The beer is currently available in cans only.

The beer brand is currently available in cans only. The beer is currently available in cans only. The beer is currently available in cans only. The beer is currently available in cans only. The beer is currently available in cans only. The beer is currently available in cans only. The beer is currently available in cans only. The beer is currently available in cans only. The beer is currently available in cans only. The beer is currently available in cans only. The beer is currently available in cans only. The beer is currently available in cans only. The beer is currently available in cans only. The beer is currently available in cans only. The beer is currently available in cans only. The beer is currently available in cans only. The beer is currently available in cans only. The beer is currently available in cans only. The beer is currently available in cans only. The beer is currently available in cans only. The beer is currently available in cans only. The beer is currently available in cans only. The beer is currently available in cans only. The beer is currently available in cans only. The beer is currently available"
159," its predecessor, the Belgian-style Liefmans Lager, but with a slight twist. The beer is made with a special yeast strain that is grown in the brewery's own barns. It is then aged in oak barrels and bottled in a special barrel that is specially designed for the beer.

Liefmans is a small company with a strong focus on sustainability. The brewery has a large warehouse that has been used to store and grow its own hops. It also grows its own barley and corn, and has a well-established distribution network.

The beer's name comes from a German word for ""pale ale,"" a beer that has a lighter body and a more intense flavor. The beer is also named after the city of Liefmans, Belgium, which is one of the biggest beer cities in Europe.<|endoftext|>There are a lot of ways to make a game.

There are a lot of ways to make a game.

There are a lot of ways to make a game.

There are a lot of ways to make a game.

There are a lot of ways to make a game.

There are a lot of ways to make a game.

There are a lot of ways to make a game.

There are a lot of ways to make a game.

There are a lot of ways to make a game.

There are a lot of ways to make a game.

There"
160," the ""Bud Light Beer"" that was introduced in 1987 and has been widely promoted since then. It is sold in a variety of flavors including Bud Light, Bud Light Blue, Bud Light Red, Bud Light Amber, Bud Light Amber Red, Bud Light Amber Red, and Bud Light Amber.

Bud Light is the only beer brand that has been promoted for over 20 years and is the most popular beer brand in the world. It is available in over 120 countries and was created in 1961.

Bud Light is the brand name for a line of light beer. It is a light beer made with a low alcohol content of 5.7%. Bud Light is the most popular beer brand in the world.

Bud Light is the brand name for a line of light beer. It is a light beer made with a low alcohol content of 5.7%. Bud Light is the most popular beer brand in the world. Bud Light is the brand name for a line of light beer. It is a light beer made with a low alcohol content of 5.7%. Bud Light is the brand name for a line of light beer. It is a light beer made with a low alcohol content of 5.7%. Bud Light is the brand name for a line of light beer. It is a light beer made with a low alcohol content of 5.7%. Bud Light is the brand name for a line of light beer. It is a light beer made with a low alcohol content"
161," the popular beers from the West Coast, but it's brewed in Germany. It's named after the city of Munich, which is home to the city's brewery.

The beer is currently available at select locations across the United States, as well as in select markets in Europe.

The beer is available for purchase in 16-ounce bottles in select stores in the United States, but it will soon be available in cans and kegs in select markets.

The beer will retail for $5.50 per bottle, with the cans being available for $8.50 and the kegs for $7.50.

The brewery is currently working on a limited run of 12 bottles, and will begin selling them on March 2.

The beer will be available in select states through the end of the year, and will go on sale in December 2015.

The brewery will also be releasing a limited run of 100 teas, which will be available in a limited number of stores.

Taste of Munich will be available in select markets throughout the United States, and will be sold in a limited quantity in December 2015.

The beer will be available in limited quantities at select retailers in the United States, and will go on sale in December 2015.

The brewery will also be releasing a limited edition beer, a limited edition taproom, and a limited edition taproom tour.

Taste of Munich is the first beer from the brewery"
162," the one that went into the beer cans in the 1970s.

The company's website says it has been in business for more than 50 years and is the largest producer of craft beer in the world.

The company also has a global presence, with four locations in the United States and Canada.<|endoftext|>This is a conversation between a monkey and a girl with a cat .

a monkey with a cat: *I'm a monkey*

a monkey with a cat: *I'm a monkey*

a monkey with a cat: *I'm a monkey*

a monkey with a cat: *I'm a monkey*

a monkey with a cat: *I'm a monkey*

a monkey with a cat: *I'm a monkey*

a monkey with a cat: *I'm a monkey*

a monkey with a cat: *I'm a monkey*

a monkey with a cat: *I'm a monkey*

a monkey with a cat: *I'm a monkey*

a monkey with a cat: *I'm a monkey*

a monkey with a cat: *I'm a monkey*

a monkey with a cat: *I'm a monkey*

a monkey with a cat: *I'm a monkey*

a monkey with a cat: *I'm a monkey*

a monkey with a cat: *I'm a monkey"
163," its namesake, the beer that makes you feel as though you're in a cartoon. This beer is a collaboration between the brewery and a small group of beer enthusiasts who want to create something different.

The beer is called ""The Six Million Dollar Man"" and it's currently available in select stores in America. The idea is that the beer is a tribute to the diminutive man who is one million dollars.

The beer is made with a blend of hops, barley, and yeast from the brewery's own farm. The beer is made with a yeast strain that's been modified to produce a unique flavor profile.

The beer was originally launched in May of last year and has been sold out in the last two weeks. The beer is available in a variety of bottle sizes, but you can get a 750ml bottle for $12.99.

The beer will be available at select locations across the country in November. You can check out the official website for the beer here.<|endoftext|>The first thing to understand about the Fourth Amendment is that it's not a protection for you or anyone else. It's a protection for you and your property. The Fourth Amendment was created to protect Americans from unreasonable searches and seizures.

The Fourth Amendment protects you from both police and private citizens. At the same time, it's a limitation on the police. The Fourth Amendment is designed to limit the police to the things they are authorized to do.

The Fourth Amendment protects you"
164," the beer that was brewed by the brewery's former owner, Tommy Lee.

The beer is brewed in a different style and is very similar to the beer that was brewed by the brewery's former owner, Tommy Lee.

""We're excited to be able to partner with the brewery to create a new beer that is locally grown and produced, and we're looking forward to sharing this new beer with our customers and our guests,"" said John Martin, head brewer at The Brewery, in a press release.

The brewery will also be launching a new line of beer that is unique to the brewery. The new line of beer will be called ""The West Coast IPA.""

The new beer will be available in cans and on draft at the brewery and at select retailers.

The brewery will also be open from 9 a.m. to 7 p.m. Monday through Friday.

The brewery is located at 1201 E. Main St. in the Westside.

The brewery will be open for regular hours on Sunday through Thursday from 9 a.m. to 5 p.m.<|endoftext|>The White House said on Wednesday that President Donald Trump's son-in-law and senior adviser, Jared Kushner, was involved in a meeting with a Russian banker who was being investigated by the FBI.

The Washington Post reported on Wednesday that Kushner met with Sergey Gorkov, a Russian banker who was being investigated by the FBI. The banker was a Russian"
165," MillerCoors, which is owned by the same parent company as Coors Light.

The new brewery is expected to open in the coming months.<|endoftext|>It's a little late to be getting excited about the NFL Draft, but that doesn't mean it's not worth it.

The Eagles have been heavily linked to the Texas A&M receiver, and the team has been making their case to A&M coach Kevin Sumlin. The Eagles are also looking at a couple of other receivers with wide receiver potential.

The Eagles have been linked to Texas A&M receiver Devin Funchess. AP Photo/Frederick Breedon

The Eagles have a lot of receivers that could be available in the first round, including cornerback Ronald Darby and offensive tackle Lane Johnson.

But they also have an opportunity to add a playmaker to their receiving corps.

Funchess is considered one of the top receivers in the country. He's a big, physical receiver that can beat his man and make plays downfield.

Funchess has a ton of upside, and he's a great fit for the Eagles.

They could use a playmaker at receiver, but they also have to consider other options. The Eagles have several receivers that can play tight end, but they also have a need at receiver.

The Eagles have two receivers that could fit that bill: tight end Zach Ertz and running back Darren Sproles.
"
166," the popular Hopslam, a pale ale brewed with Cascade hops.

""We're excited to be working with one of the most recognized breweries in the world, and we're looking forward to creating a beer that will be a welcome addition to any beer lover's glassware,"" said Greg Porter, president of Budweiser. ""We're excited to join forces with the craft beer community to bring a new approach to the beer world, and we look forward to working with the brewers at Red Brick Brewing Company to bring Budweiser to the masses.""

Red Brick Brewing Company is a new brewery located in the heart of downtown Detroit. The brewery is owned by the Red Brick family and started in 2013 by longtime brewer and owner Brian Red Brick.

""I'm so excited to join forces with Red Brick Brewing Company to create a new beer that will be a welcome addition to any beer lover's glassware,"" said Greg Porter, president of Budweiser. ""We're excited to join forces with the craft beer community to bring a new approach to the beer world, and we look forward to working with the brewers at Red Brick Brewing Company to bring Budweiser to the masses.""

The Red Brick Brewing Company beer will be available in select Red Brick locations and online at RedBrick.com starting Sept. 1.<|endoftext|>A new study out of the University of California, Berkeley, has found that children who attend public school in the San Francisco Bay Area are more likely"
167," the popular Bud Light brand, which has been around since the 1970s. It has been sold in about 160 countries and is available in 10 countries.

The beer is made with a mix of European and American hops, which are grown in the United States, Canada, Mexico and the United Kingdom.

To celebrate the anniversary, the company is offering a special 10-pack of 10-ounce cans of the beer for $9.99.

The cans also include a special 10-ounce beer glass, which is designed to be used with the beer bottle. It also includes a commemorative 10-ounce beer glass.

The 10-ounce glass is a special item that is available for purchase in the brewery's online store.

The 10-ounce glass is made with a mix of European and American hops, which are grown in the United States, Canada, Mexico and the United Kingdom.

The 10-ounce glass is made with a mix of European and American hops, which are grown in the United States, Canada, Mexico and the United Kingdom.

The 10-ounce glass is made with a mix of European and American hops, which are grown in the United States, Canada, Mexico and the United Kingdom.

The 10-ounce glass is made with a mix of European and American hops, which are grown in the United States, Canada, Mexico and the United Kingdom.

The 10-ounce glass is made with a mix of"
168," the iconic beer styles known as ""Big Red"" and ""Big Red IPA"" and was launched in 1971 by the same company that created the popular Red Bull.

The new beer will be available in select states starting Jan. 1, 2017, and will be available in 12-ounce bottles in the U.S. and in cans in Canada.

The beer is expected to be available in six-packs, 12-ounce bottles, and 16-ounce bottles.

The brand is currently available in Canada at select beer retailers including Budweiser, Molson Coors, and MillerCoors.

The brand will be available on tap at participating restaurants, including The Bistro at Bayshore, The Bistro at North End, and The Bistro at the Biltmore.<|endoftext|>The UESPWiki – Your source for The Elder Scrolls since 1995

The Red Mountain is a large mountain in Cyrodiil, which is located in the southern part of the province of Skyrim. It is an enormous, rocky mountain with a few small islands. The Red Mountain is the home of the High Rock Clan, the first of the High Rock Mages. The Red Mountain is also home to the Red Mountain Clan, the last of the High Rock Mages.

The Red Mountain is the home of the High Rock Clan, and is home to the Red Mountain Clan and the Red Mountain Mages, who are the closest to the High Rock Clan"
169," the beers that have been sold in Belgium and Germany, such as the Belgian Amber Ale, the Belgian Strong Dark Ale and the German Golden Ale.

The beer is made by the same company that makes the beer in Belgium, and is sold in Belgium and Germany as ""Dank Moo"".

The beer is sold in the UK and Ireland, but the brewery has not yet opened a brewery in the UK.

The brewery's website says it will be open from mid-July to mid-October.<|endoftext|>The first thing to know about the Serenity is that it's not the biggest of the big. It's not even the biggest of the big, and it's not even the biggest of the big. It's the smallest.

It's the smallest of the big.

It's the smallest of the big.

It's the smallest of the big.

It's the smallest of the big.

It's the smallest of the big.

It's the smallest of the big.

It's the smallest of the big.

It's the smallest of the big.

It's the smallest of the big.

It's the smallest of the big.

It's the smallest of the big.

It's the smallest of the big.

It's the smallest of the big.

It's the smallest of the big.

It's the smallest of"
170," the one that made its name in the United States — a beer with a strong floral taste that can be enjoyed on its own or with a glass of wine or beer.

The brewery is planning to open in the first half of 2017.<|endoftext|>In the aftermath of the 2016 election, some of us took to Twitter to express our disappointment in the outcome. We were angry, and we were frustrated. We were angry that the president-elect had won, and we were frustrated that he won. We were angry that he had lost, and we were frustrated that he lost.

But the real anger came from the people who had voted for him.

While it's true that some of us were disappointed Trump won, it's equally true that many of us were angry at the results. And while there are plenty of reasons to be angry, it's important to remember that the anger is not the result of the election. It's the result of an election that we should have won.

The 2016 election cycle is a time of great uncertainty. The country is in the midst of a massive shift in our political culture, a shift that has resulted in a profound shift in the way we think about politics.

With this shift comes a shift in the way we think about ourselves. In the past, we have been deeply invested in the idea of the American Dream. We have believed that we have a place in this country, that if we work hard we can get ahead"
171," the ones you'd find in a pub or a pub-style bar.

The beer is made with a special yeast strain that gives it a nice, hoppy character.

It's not a beer you'd want to drink in your pub.

A spokesman for the company said: ""We are very proud of the beer and its quality but it is the beer that people will be drinking in the pub.""

The spokesman added: ""We want the beer to be available in pubs and bars across the UK.""<|endoftext|>Some of the most important changes coming to the iOS app store in the coming months will be the new pricing models, new features and more.

The new pricing models and new features that will be available on iOS will include:

New pricing models – The new pricing models will be available in three tiers: Basic, Premium and Gold.

– The new pricing models will be available in three tiers: Basic, Premium and Gold. New features – The new features that will be available on the app store will include:

New features – The new features that will be available on the app store will include:

The new pricing models and new features that will be available on iOS will be available from September 1st through September 30th.

As always, you can download the app now and try the free trial for yourself.

You can also follow us on Twitter, Facebook, Google+ and Instagram.<|endoftext|>The ACLU"
172," the classic American IPA that's been around since the 1960s, but with a much lighter, less hoppy flavor and a lighter body.

The 1.5-ounce bottle is $6.99.<|endoftext|>The following is an article from the March/April 2014 issue of Time Out New York.

It's a tough time to be a woman in the tech world.

Women are still underrepresented in most computer science and engineering jobs, and they're still far less likely than men to be hired for those positions than they are for any other field. And yet, gender gaps in tech are widening.

The gender gap in the tech industry is the same as the gender gap in the general workforce, according to a report released Thursday by the National Center for Women and Information Technology at the University of California at Berkeley.

The gender gap in tech is the same as the gender gap in the general workforce, according to a report released Thursday by the National Center for Women and Information Technology at the University of California at Berkeley. Photo: Dave J. Phillip, Associated Press

The report, ""Women in STEM: A Report on Science, Technology, Engineering and Math,"" found that the percentage of women working in technology jobs has been increasing steadily since the late 1990s, but the gap between men and women in tech has been growing since the early 2000s.

The report, ""Women in STEM: A Report on Science, Technology, Engineering and Math"
173," the Olde English brand, which is found in Britain, Ireland and Scotland.

The company said the beer would be available from the end of March.

""We are delighted to be bringing Olde English to our customers in Scotland and to be able to offer this iconic beer to our international customers,"" said Mark Ward, the company's chief marketing officer.

""We are delighted with the reaction to the beer and we would like to thank everyone who has supported this partnership.

""We are proud to be part of this exciting new chapter in Scotland's beer history, and we look forward to seeing our customers in Scotland in May.""

The Olde English brand has been around since the mid-19th century, and is made from a mixture of barley and wheat.

The beers are brewed in the same way as the English, but are aged in charred oak barrels.

The beer is not currently available in the UK.<|endoftext|>I'm trying to get the latest version of the latest version of the latest version of the latest version of the latest version of the latest version of the latest version of the latest version of the latest version of the latest version of the latest version of the latest version of the latest version of the latest version of the latest version of the latest version of the latest version of the latest version of the latest version of the latest version of the latest version of the latest version of the latest version of the latest version of the latest version"
174," the popular Craft Brewery in its approach to brewing, but instead of beer, it's a wine. And it's made by the same company that makes the famous Budweiser.

The wine is called Vino Bistro, and it's available on tap and in bottles.

The beer is called Vino Bistro Premium, and it's available in 750ml bottles, 750ml cans and in 12 ounce bottles.

The wine is called Vino Bistro Special, and it's available in 750ml bottles, 750ml cans and in 12 ounce bottles.

The beer is called Vino Bistro Original, and it's available in 750ml bottles, 750ml cans and in 12 ounce bottles.

For the first time, the brewery is offering a beer that was made by the same company that makes Budweiser, and it's available in 750ml bottles, 750ml cans and in 12 ounce bottles.

The beer is called Vino Bistro Deluxe, and it's available in 750ml bottles, 750ml cans and in 12 ounce bottles.

The beer is called Vino Bistro Classic, and it's available in 750ml bottles, 750ml cans and in 12 ounce bottles.

The wine is called Vino Bistro Limited Edition, and it's available in 750ml bottles, 750ml cans and in 12 ounce bottles.

The beer is called Vino Bistro"
175," the brand of beer that was served at the wedding of the late actor, who died in 2007.

The German beer is called Wunderkammer, meaning ""wonderful.""

The company also announced that it will be launching a line of premium beer in the U.S. following the launch of the beer in Germany.

The beer will be called Wunderkammer Extra, and it will be available in cans, bottles and draft.<|endoftext|>A series of wrongs committed by the media and the government has created a culture of distrust between the public and the press, according to a new report.

The report, by the watchdog group Public Citizen, found that the media has been ""infiltrating"" the public through its reporting of events, and has been ""undermining the public's trust in the media.""

The report, released Tuesday, is a response to a letter from the New York Times and other media organizations to the Department of Justice, which is investigating the media's coverage of the 2016 election.

The letter, which was also sent to the New York Times and The Washington Post, said the media has been ""ignoring information"" that could prove relevant to the investigation into Russian election interference.

ADVERTISEMENT

""The media has been infiltrating the public with its reporting of events, and has been undermining the public's trust in the media,"" the letter said.

""The media"
176," the popular beer brand, Victory, that was introduced in the early 20th century.

The beer is brewed in the style of the Belgian Witbier style, which was first brewed in Belgium.

The brand was introduced in the early 20th century and is now available in more than 60 countries.

The company said it was launching the new beer in the UK and the US, where it is sold in bulk.

The beer is available in cans and bottles, with a launch date of the beer set for the end of the year.

It is available in Belgium, Germany, France, Italy, the Netherlands, Sweden, Switzerland, the UK and the United States.

The beer is made from wheat, barley, rye, oats, flaked oats and wheat malt.<|endoftext|>Keto Chow (aka Keto Chow) is a great low carb, gluten free, vegan, paleo, paleo friendly, low carb, paleo friendly, low carb keto alternative to the popular ""keto"" (keto is the name of a type of low carb food).

Keto Chow is often used as a substitute for starchy, white bread, and is often used as a substitute for white rice, white rice pasta, and white rice pasta salad.

Keto Chow is also used as a substitute for white bread in recipes that call for white bread, such as pancakes, pizza, muffins, and other recipes that call"
