40," its namesake, and is brewed with a blend of malted barley, oats, and wheat. The beer is brewed with a combination of hops, wheat, and malt.

The brand is currently available in 16-ounce bottles, in cans, and in draft. The company also has a limited release of kegs.

The company is also currently working on a limited release of bottles of its signature beer, Höfner Bavarian Kölsch. The beer is currently available only in the U.S. and Canada.

The brewery is currently working on a limited release of bottles of its signature beer, Höfner Bavarian Kölsch. The beer is currently available only in the U.S. and Canada.

The brewery is currently working on a limited release of bottles of its signature beer, Höfner Bavarian Kölsch. The beer is currently available only in the U.S. and Canada.

The brewery is currently working on a limited release of bottles of its signature beer, Höfner Bavarian Kölsch. The beer is currently available only in the U.S. and Canada.

The brewery is currently working on a limited release of bottles of its signature beer, Höfner Bavarian Kölsch. The beer is currently available only in the U.S. and Canada.

The brewery is currently working on a limited release of bottles of"
41," the beer that's served at the brewery, which is brewed by Sam Adams.

The new beer will be available for purchase at select Sam Adams locations throughout the state.

The brewery also recently launched a new product called the Sam Adams Gose, which is a blend of Old Fashioned and Gose, a traditional Irish stout.

The company has been selling its Gose at select Sam Adams locations since December.<|endoftext|>The road to the first round of the World Cup is long. It's been a torturous week for the U.S. Men's National Team as they have lost in the quarterfinals to Brazil and are now in a tough group with a host of large nations in the process of qualifying for the next round.

The U.S. is one of the favorites to win the next World Cup, but they have a lot of work to do to make it happen. Here is a look at the top storylines from the U.S. Men's National Team's loss to Brazil in the quarterfinals of the 2018 World Cup.

The U.S. Men's National Team's loss to Brazil in the quarterfinals of the 2018 World Cup.

The U.S. will miss out on the 2018 World Cup for the second consecutive year. The U.S. has been ranked No. 1 in the world for the last three years of the World Cup, but lost to the hosts in the quarterfinals of the 2018 World Cup"
42," a beer called the ""Pint of Guinness"" and is made from the Guinness brand of beer.

However, the beer doesn't contain any alcohol, and the brewery says it's not a pressurized beer.

The company says they are not using Guinness to produce the beer.

""We are very proud of our beer and we are proud to work with the Guinness family to bring the Guinness brand to the market,"" said John Golding, Chief Executive Officer of Guinness.

The beer was released in December.

It's not the first time Guinness has been caught up in controversy.

The company was sued in 2012 by a woman who claimed she was a victim of a sexual assault after she claimed she was ""frozen in place"" while using the company's ""Irish Strong Ale.""

The lawsuit was settled out of court.

In June, the company was sued by a woman who claimed she was a victim of a sexual assault after she claimed she was ""frozen in place"" while using the company's ""Irish Strong Ale.""

The lawsuit was settled out of court.

The company has been criticized in the past for its lack of transparency.

The company says it's working to change this.

""We have been working with a number of stakeholders to ensure that the company's advertising is more transparent and that the company's advertising is more effective in communicating to consumers the positive impact of our products on their"
43," the iconic Red Bull, but the brand's name is a nod to the Belgian beer style, while its name is derived from the word ""red"".

The company also said it would be releasing a line of beers that are ""balanced"" between its two brands.

""We are committed to creating beers that are as close to the original as possible, without the over-abundance of complex flavours and artificial flavours that are common in today's beer,"" said the company in a statement.

""This will include a line of beers that are balanced between Red Bull and the original, but also include a range of beers that are more balanced between Red Bull and the original, while also including a range of beers that are more balanced between Red Bull and the original and the Red Bull brand itself.""

The new Red Bull branded beers will be available in the UK and Ireland.

Follow Dave Lee on Twitter @DaveLeeBBC<|endoftext|>The first round of the 2016 NBA Draft is right around the corner, and it's time to see who the league's top prospects are.

As we enter the final week of the season, I've compiled a list of the top prospects in the draft, which includes players who have already declared for the draft, players who have yet to announce their intentions to enter the draft, and players who have yet to make a decision.

With that in mind, here is the first round of the 2016 NBA Draft.

1"
44," the American craft beer movement, but is also a fusion of the styles of Belgian beer, French and German ales. The current production is limited to 150,000 bottles, which is a bit less than the 150,000 bottles produced in 2011.

The beer is brewed by the Belgian brewery, La Boulange de Ville.<|endoftext|>The film was a hit at Cannes, and won the audience award for best documentary. It was also nominated for an Oscar for Best Foreign Language Film.

The film, which was directed by Jacques Tati, was made in partnership with the International Film Festival of France and the Ministry of Culture.

Tati, who is also a director of the film, said: ""We are honoured to be nominated for the Best Foreign Language Film at the Cannes Film Festival. The film is an extraordinary film that deals with the history of the people of Palestine, and also with the history of the Israeli occupation of the Palestinian territories.

""It is a film that is representative of the international community's commitment to the cause of human rights and to the fight against racism and apartheid. It is also a film that has been supported by numerous international organizations, including the International Red Cross, the International Committee of the Red Cross and the World Health Organization.

""The film is a testament to the power of cinema to bring about change and to make a difference. It is also a film that represents the right of people to have their voice heard in"
45," the ones that were sold at the festival, but it's not quite as aggressive, and it's not as sour as the other beers, which are all very strong.

The beer, which is named after the National Capital Region, has a strong aroma and taste, which is complemented by the light, refreshing finish.

""It's a classic beer that has been around for generations, and we're excited to be a part of it,"" said Leslie Munro, co-founder and chief executive of The Beer Company, in a release.

""We're very excited to be bringing the beer to Ottawa as part of the Canadian Craft Beer Week celebration.""

The festival will take place from March 22 to 24, and is aimed at showcasing the region's craft beer scene.

The Beer Company will be at the Ottawa Beer Co. on March 22 and 23 from 7 p.m. to 9 p.m.

The event is free and open to the public.

The Beer Company will also be in the Capital Region on March 22 and 23, and will be selling their beer at the Ottawa Beer Co. on March 22 and 23.

The beer will be available at the Ottawa Beer Co. on March 22 and 23, and will be available at The Beer Company on March 22 and 23. (The Beer Company)

The Beer Company is also selling their beer in the Capital Region, and will be selling their beer at the"
46," Budweiser's Bud Light, which is brewed with the same hop varieties.

""We're very excited to be working with the Brewers Association to bring our beer to market at the same time as the Brewers Association-sponsored beer festival in Cincinnati,"" said Dave Miller, director of marketing for Great Lakes Brewing Co.

The beer, which is currently available only in 12-ounce bottles, will be available at the festival, which will take place Sept. 9-11 at the Cincinnati Zoo and Aquarium.

""We're excited to partner with the Brewers Association to bring our beer to the nation's capital,"" Miller said. ""We're excited to introduce the beer to a great crowd of people and to share our enthusiasm for beer with a new generation.""

The festival is sponsored by the National Brewers Association, the American Homebrewers Association and the Greater Cincinnati Food & Drink Festival.

""We're very excited to be working with the Brewers Association to bring our beer to the nation's capital,"" said Dave Miller, director of marketing for Great Lakes Brewing Co.

The beer is brewed using the same hops used in the Bud Light brand. Great Lakes, which is based in Cincinnati, is known for its beer styles such as Belgian Golden Strong Ale, IPA, Red IPA, Pale Ale and Lager.

Miller said the beer will be available in 12-ounce bottles at the festival, which will take place Sept. 9-11 at the Cincinnati Zoo"
47," the popular Belgian-style wheat beer, but it's more spicier, with a bit more body and a more pronounced hop flavor. It's also a bit sweeter than its Belgian counterpart, making it a great alternative to the more hoppy beers that are popular in Germany.

The brand will be sold in bottles, cans and on draft. The brewery also plans to release a limited run of cans of the beer in the spring, which will contain 10 cases.

The brewery has also partnered with the German company Concrete, which is a new brewery in the city of Baden-Württemberg that will make a limited number of cans of the beer. The cans will be distributed to consumers in the area.

The brewery's beer is currently available in select bars and restaurants in Germany. It will be available at the brewery's taproom at the end of June.

The brewery is part of a wave of German breweries that are opening up more breweries in the country. In addition to the German-made beers, there are also several other European breweries that have opened up in the last few years.

The German beer industry has seen a surge in popularity in recent years. Beer sales in Germany rose by more than 20 percent in 2015, according to the European Commission.

The beer industry in the United States is also booming, with the craft beer industry in the United States growing by more than 50 percent over the past decade.<|endoftext|>"
48," the popular Red Bull, which is brewed in Germany and is sold in the U.S.

The company has been working on its own beer for years, and it is expected to begin selling its own beer in the next few months.

The beer is expected to be available in the U.S. in the fall.<|endoftext|>After years of being the poster child of a rapidly aging population, the United States is in the midst of a historic decline in the number of people aged 65 and over. According to the Pew Research Center, the number of people aged 65 and over in the country rose by 7.4 percent between 2006 and 2010, and the number of people aged 65 and over has been declining for decades.

The nation is currently home to roughly 3.3 million people aged 65 and over, and the number is expected to grow to 3.5 million people by 2020. The decline in the number of people aged 65 and over is due to two factors: increased longevity and a declining labor force participation rate.

The Pew Research Center notes that the labor force participation rate, which measures the share of the population that is either employed or looking for work, has fallen from 79.2 percent in 1980 to 75.0 percent in 2010. The labor force participation rate has also declined among women, who are now less likely than men to be in the labor force.

While the labor force participation rate has declined, there has been a strong correlation between the"
49," a more traditional craft beer, but its core is a Belgian style, called ""Belgian IPA.""

The brewery's marketing materials say the beer is ""a Belgian style, brewed with a Belgian yeast strain, that is extremely bitter.""

The beer is available in 750ml bottles and cans, and is available for purchase at select breweries around the country.

The company says it is in the process of developing a new line of beer that will be available at select locations.

The beer will be released in August.

The company said it was inspired by the ""outreach and commitment"" of the people who serve at the church.

""We are also aware of the impact the church has made on our community,"" the company said. ""We want to make sure the beer is a positive, positive impact on the community.""

The company said the beer is being served by the volunteers who serve at the church.

The church's website says it is a non-profit organization that ""provides a safe and warm place for people to worship and serve each other.""

The website says the church can only serve about 100 people at any given time.

The website says the church has been serving alcohol since the 1950s.<|endoftext|>The world's largest digital currency exchange, Bitstamp, has announced that it has raised $2.5 million in Series A funding from a group of investors led by Andreessen Horowitz, with the aim"
50," the label that the company put out with the original ""Big Ass"" beer, which was released in 2010.

The beer was sold in the U.S. and Canada through the brewery's online store.<|endoftext|>WASHINGTON (Reuters) - U.S. Secretary of State John Kerry said on Sunday that the U.S. ""will not accept"" the Syrian government's use of chemical weapons, a day after the United Nations Security Council voted to authorize the use of force against the Syrian government.

U.S. Secretary of State John Kerry (L) and Russian Foreign Minister Sergei Lavrov attend a meeting in the Diplomatic Reception Room at the State Department in Washington, U.S., April 15, 2017. REUTERS/Yuri Gripas

U.S. Ambassador to the United Nations Samantha Power said that the United States would not support a resolution that would authorize the use of force against Syria, and that the United States ""will not accept that.""

The United States is also strongly opposed to a resolution that would allow the use of military force against Syrian President Bashar al-Assad's forces, Power said.

""This is not going to happen,"" Power told ABC's ""This Week."" ""We will not accept a resolution that allows Assad to use chemical weapons.""

The United Nations Security Council has voted unanimously to authorize the use of force against Syria to protect civilians from the use of chemical weapons, but the United States and Russia oppose the resolution"
51," Big Beer, which has been making beer since 1887.

The company has had a few years to adjust, but it's still a big company with a lot of growth potential.

The company has been acquired by a number of large companies, including L.A.-based San Diego-based Anheuser-Busch InBev.

The beer brand has been around for a while now, but is now owned by a new company.<|endoftext|>The Denver Broncos are in the process of making a big change to their defense. The team announced today that the starting defensive tackle, Elvis Dumervil, has been placed on injured reserve.

Dumervil has been dealing with a knee injury for the past two weeks. He was expected to be ready for training camp, but he was unable to participate in practice this week because he was dealing with an injury.

Dumervil started all 14 games for the Denver Broncos in 2014, recording 11.5 sacks and recording eight forced fumbles. He also had nine tackles for loss, two pass breakups, and a forced fumble.

The team also announced that defensive tackle Danny Trevathan is also on injured reserve. Trevathan was the team's starting defensive tackle in 2015, recording 7.5 sacks and recording five forced fumbles.

The Broncos will also be without defensive end Derek Wolfe, who will miss at least the first six games of the season with a concussion."
52," the popular Budweiser, which is also brewed in the Czech Republic.

The brand's name is a nod to the Czech Republic's national beer, Budweiser.

Budweiser is also known for its ""Budweiser"" brand of beer.

The brand is owned by the Czech Republic's state-owned company, Czech Bud, and is also sold in more than 80 countries worldwide.

The Czech Republic is home to some of the world's largest beer brands, including Bud Light, Budweiser, Stella Artois, and Stella Artois Xtra.

The Czech Republic's Budweiser brand is a popular brand for international beer drinkers.

The beer brand is similar to the popular Budweiser, which is also brewed in the Czech Republic.

The name is a nod to the Czech Republic's national beer, Budweiser.

The Czech Republic is home to some of the world's largest beer brands, including Budweiser, Stella Artois, and Stella Artois Xtra.

The Czech Republic is home to some of the world's largest beer brands, including Budweiser, Stella Artois, and Stella Artois Xtra.

The Czech Republic is home to some of the world's largest beer brands, including Budweiser, Stella Artois, and Stella Artois Xtra.

The Czech Republic is home to some"
53," the popular New Belgium brand, but is a bit lighter in color. This beer is actually quite tasty, and I have enjoyed it with a few friends.

It is available in the following states and markets:

Ohio

Indiana

Michigan

Minnesota

Montana

North Dakota

South Dakota

Wisconsin

West Virginia

The beer is also available in select markets in Canada, and the beer will be available in a few other countries as well.

This beer is a collaboration between the brewers of the New Belgium Brewing Company and a local brewery called The New Belgium Brewing Company.

The beer was brewed by The New Belgium Brewing Company and is available in 12oz bottles and cans.

The beer was also released as a collaboration with the National Beer Wholesalers Association.

The beer is available in 12oz bottles and cans.

The beer will be available in select markets in Canada, and the beer will be available in a few other countries as well.

This beer was also released as a collaboration with the National Beer Wholesalers Association.

The beer was brewed by The New Belgium Brewing Company and is available in 12oz bottles and cans.

The beer was also released as a collaboration with the National Beer Wholesalers Association.

The beer was also released as a collaboration with the National Beer Wholesalers Association.

The beer was also released as"
54," Budweiser's Axe and Bud Light, which are popular in the United States.

The beer was first available in Germany in 2011 and is sold in 23 states.

The company said in a statement: ""We are extremely excited to be able to partner with the Brewers Association for this new initiative.

""The partnership will allow us to continue to grow our brand and our distribution footprint in the United States, while also providing a great opportunity to gain access to new markets and new markets for our beer.""

The Brewers Association, which represents the world's largest brewers, is the industry's trade body.

The association said it was working with the beer industry to develop a beer industry-wide agreement to promote craft beer in the United States.

It said it hoped to finalise the agreement by the end of the year.<|endoftext|>The first use of the term ""critical mass"" in the news media was in the late 1970s, when a New York Times article put the term into context. At that time, the term was more commonly used to describe the critical mass of news stories published in a given period of time. In the context of the Times piece, the term had a much broader meaning, referring to the number of people who were willing to read a given piece of media. For example, a critical mass of news articles could be a number of people who are willing to read a story regardless of the context:

A critical mass of news"
55," the popular brew from the same name, but is a much milder, more pungent beer. The name might be a reference to the beer's name, ""West Coast IPA,"" which is a reference to the brewery's location in the Pacific Northwest.

""We're looking forward to providing our customers with a unique, easy-to-drink beer that will satisfy their everyday needs,"" said Rob Godfrey, President, President and CEO of Sierra Nevada Brewing Company. ""We're excited to partner with Sierra Nevada Brewing Company to bring our fans a new beer that will be a favorite among our customers.""

Sierra Nevada Brewing Company was founded in 2005 and is based in San Francisco. The brewery is one of the largest craft brewers in the U.S., with more than 3,000 employees and more than $3 billion in annual sales. The company is also the largest brewery in the world, producing more than 100 million barrels of beer annually.

About Sierra Nevada Brewing Company

Sierra Nevada Brewing Company is a craft brewery based in San Francisco, California. The company is owned by Rob Godfrey and David S. O'Brien, founders of the popular brewery, Sierra Nevada Brewing Company.

Sierra Nevada Brewing Company's flagship beer, West Coast IPA, is brewed with a blend of California-grown, American-grown and Oregon-grown hops. The beer is available in 750ml bottles and on draft at select beer retailers and online at Sierra"
56," the  Keg & Bottle  brewery, which was founded by the late  Arturo Sanchez and  Paul D'Agostino . The  Keg & Bottle  brewery was located in the former location of the  Keg and Bottle  restaurant in San Francisco.
The  Keg & Bottle  brewery is located at 619 North Keck Street, San Francisco, CA 94104. The  Keg & Bottle  restaurant is located at 1101 North Keck Street, San Francisco, CA 94104. The  Keg & Bottle  restaurant is open from 8am to 9pm Monday through Friday, and from 8am to 9pm on Saturday.
The  Keg & Bottle  brewery will be selling a limited number of  Keg & Bottle  tasters  at select events over the next few months.
The  Keg & Bottle  brewery will also be selling  Keg & Bottle  taster packs  at select events over the next few months.
The  Keg & Bottle  brewery has been awarded the  San Francisco Beer Blog's  Best of San Francisco Beer Awards  for the fourth year in a row.
The  Keg & Bottle  brewery is also awarded  San Francisco Beer Blog's  Best of San Francisco Brewery Awards  for the second year in a row.
The"
57," the popular Coors Light brand, and has been selling beer in pubs in the US since it launched in 2002.

Mr Godley said: ""The 'C' beer is a tribute to the great Irish people who have shaped its evolution.

""We have worked with the Irish Government to ensure that it is commercially viable and will offer a positive impact on the communities in which it is sold.""<|endoftext|>The New York Times has an article published yesterday on how the government is actively trying to get the public to pay for your medical bills.

The article is titled ""Medicare's Biggest Secret: It's a Lie.""

The piece is titled ""Medicare's Biggest Secret: It's a Lie.""

The article is titled ""Medicare's Biggest Secret: It's a Lie.""

The article is titled ""Medicare's Biggest Secret: It's a Lie.""

The article is titled ""Medicare's Biggest Secret: It's a Lie.""

The article is titled ""Medicare's Biggest Secret: It's a Lie.""

The article is titled ""Medicare's Biggest Secret: It's a Lie.""

The article is titled ""Medicare's Biggest Secret: It's a Lie.""

The article is titled ""Medicare's Biggest Secret: It's a Lie.""

The article is titled ""Medicare's Biggest Secret: It's a Lie."""
58," Blue Moon in terms of its style, but the beer is made with a different yeast strain and is also made with one of the most popular and highly-regarded hops in the world, Centennial. It is considered to be one of the best American ales.

The beer is made from a combination of Centennial, Centennial IPA, Nugget, Citra and Centennial Nelson Sauvin hops. The beer is also available in a limited-edition, single-barrel format.

The beer is currently available in 12-ounce bottles and 22-ounce cans.

The beer will be available to purchase at the following locations:

• The Blue Moon Taproom

• The Blue Moon Restaurant

• The Blue Moon and Taproom

• The Blue Moon and Restaurant

• The Blue Moon and Taproom

• The Blue Moon and Restaurant

• The Blue Moon and Taproom

• The Blue Moon and Restaurant

• The Blue Moon and Restaurant

• The Blue Moon and Taproom

• The Blue Moon and Restaurant

• The Blue Moon and Restaurant

• The Blue Moon and Taproom

• The Blue Moon and Restaurant

• The Blue Moon and Taproom

• The Blue Moon and Restaurant

• The Blue Moon and Taproom

• The Blue Moon and Restaurant

• The Blue Moon and Taproom

• The Blue Moon and Restaurant"
